mkdir: cannot create directory ‘/scratch/mne_data’: Permission denied

[notice] A new release of pip is available: 24.2 -> 26.1.2
[notice] To update, run: pip install --upgrade pip

[notice] A new release of pip is available: 24.2 -> 26.1.2
[notice] To update, run: pip install --upgrade pip
ERROR: Invalid requirement: 'Binary file requirements.txt matches': Expected end or semicolon (after name and no valid version specifier)
    Binary file requirements.txt matches
           ^ (from line 1 of /home/aleksander.berezowsk/requirements_notorch.txt)

[notice] A new release of pip is available: 24.2 -> 26.1.2
[notice] To update, run: pip install --upgrade pip

[notice] A new release of pip is available: 24.2 -> 26.1.2
[notice] To update, run: pip install --upgrade pip
/home/aleksander.berezowsk/spiking-eegnet/src/main.py:89: ExperimentalWarning: Argument ``multivariate`` is an experimental feature. The interface can change in the future.
  sampler=TPESampler(n_startup_trials=tpe_trails, multivariate=True, group=True)
/home/aleksander.berezowsk/spiking-eegnet/src/main.py:89: ExperimentalWarning: Argument ``group`` is an experimental feature. The interface can change in the future.
  sampler=TPESampler(n_startup_trials=tpe_trails, multivariate=True, group=True)
[I 2026-06-19 14:27:24,116] Using an existing study with name 'snn_eegnet_v2_200_20' instead of creating a new one.
[I 2026-06-19 15:52:28,923] Trial 2 finished with value: 0.36670524691358025 and parameters: {'FLOW': 7.363635770105116, 'FHIGH': 60.4897110433985, 'LR_EXP': -2.099654291154576, 'DROPOUT': 0.23538839552976876, 'BETA': 0.9800114379169783, 'SPIKE_GRAD_SLOPE': 14.903548286427318, 'TEMPORAL_FILTERS': 17, 'DEPTH_MULTIPLIER': 1, 'POINTWISE_FILTERS': 13, 'TEMPORAL_KERNEL_DIV': 6, 'SEPARABLE_KERNEL_SIZE': 11, 'POOL1_SIZE': 3, 'POOL2_SIZE': 7, 'NORM_AXIS': 'no_channel'}. Best is trial 0 with value: 0.3998842592592593.
[I 2026-06-19 18:05:47,455] Trial 6 finished with value: 0.322145061728395 and parameters: {'FLOW': 17.2420171407709, 'FHIGH': 97.58472490005985, 'LR_EXP': -2.4419392902635617, 'DROPOUT': 0.11701060039318595, 'BETA': 0.8830974355010758, 'SPIKE_GRAD_SLOPE': 26.963397950701044, 'TEMPORAL_FILTERS': 23, 'DEPTH_MULTIPLIER': 3, 'POINTWISE_FILTERS': 11, 'TEMPORAL_KERNEL_DIV': 4, 'SEPARABLE_KERNEL_SIZE': 30, 'POOL1_SIZE': 8, 'POOL2_SIZE': 6, 'NORM_AXIS': 'no_channel'}. Best is trial 3 with value: 0.4054783950617284.
[I 2026-06-19 20:30:11,523] Trial 9 finished with value: 0.39737654320987653 and parameters: {'FLOW': 5.659860610893555, 'FHIGH': 118.91556908705928, 'LR_EXP': -3.046217032638422, 'DROPOUT': 0.2595260773105252, 'BETA': 0.6672872537602396, 'SPIKE_GRAD_SLOPE': 11.74324730221448, 'TEMPORAL_FILTERS': 25, 'DEPTH_MULTIPLIER': 4, 'POINTWISE_FILTERS': 56, 'TEMPORAL_KERNEL_DIV': 8, 'SEPARABLE_KERNEL_SIZE': 8, 'POOL1_SIZE': 2, 'POOL2_SIZE': 2, 'NORM_AXIS': 'full'}. Best is trial 3 with value: 0.4054783950617284.
[I 2026-06-19 22:08:00,501] Trial 14 finished with value: 0.3935185185185185 and parameters: {'FLOW': 14.13917102508521, 'FHIGH': 67.03247126495401, 'LR_EXP': -3.40306240554675, 'DROPOUT': 0.3912780688414206, 'BETA': 0.74715261044034, 'SPIKE_GRAD_SLOPE': 1.596097660438967, 'TEMPORAL_FILTERS': 17, 'DEPTH_MULTIPLIER': 3, 'POINTWISE_FILTERS': 57, 'TEMPORAL_KERNEL_DIV': 8, 'SEPARABLE_KERNEL_SIZE': 16, 'POOL1_SIZE': 8, 'POOL2_SIZE': 7, 'NORM_AXIS': 'no_channel'}. Best is trial 10 with value: 0.4241898148148148.
[I 2026-06-19 23:33:21,441] Trial 18 finished with value: 0.3157793209876543 and parameters: {'FLOW': 13.518857554915426, 'FHIGH': 26.585099412285683, 'LR_EXP': -2.65194434435453, 'DROPOUT': 0.6665230683660591, 'BETA': 0.945521231366298, 'SPIKE_GRAD_SLOPE': 27.936123534653763, 'TEMPORAL_FILTERS': 11, 'DEPTH_MULTIPLIER': 3, 'POINTWISE_FILTERS': 43, 'TEMPORAL_KERNEL_DIV': 5, 'SEPARABLE_KERNEL_SIZE': 9, 'POOL1_SIZE': 5, 'POOL2_SIZE': 5, 'NORM_AXIS': 'no_channel'}. Best is trial 10 with value: 0.4241898148148148.
[I 2026-06-20 01:22:21,839] Trial 21 finished with value: 0.45370370370370366 and parameters: {'FLOW': 2.120144961457134, 'FHIGH': 66.92688225109929, 'LR_EXP': -3.6995150242012933, 'DROPOUT': 0.33798487066224525, 'BETA': 0.7764589676591882, 'SPIKE_GRAD_SLOPE': 26.641771924785697, 'TEMPORAL_FILTERS': 18, 'DEPTH_MULTIPLIER': 3, 'POINTWISE_FILTERS': 35, 'TEMPORAL_KERNEL_DIV': 6, 'SEPARABLE_KERNEL_SIZE': 19, 'POOL1_SIZE': 2, 'POOL2_SIZE': 7, 'NORM_AXIS': 'no_channel'}. Best is trial 21 with value: 0.45370370370370366.
[I 2026-06-20 02:49:41,326] Trial 25 finished with value: 0.41030092592592593 and parameters: {'FLOW': 7.166223440682173, 'FHIGH': 31.98732822419325, 'LR_EXP': -2.541207725224286, 'DROPOUT': 0.5122221933425005, 'BETA': 0.7052526954846576, 'SPIKE_GRAD_SLOPE': 17.438850860767513, 'TEMPORAL_FILTERS': 18, 'DEPTH_MULTIPLIER': 1, 'POINTWISE_FILTERS': 21, 'TEMPORAL_KERNEL_DIV': 6, 'SEPARABLE_KERNEL_SIZE': 18, 'POOL1_SIZE': 3, 'POOL2_SIZE': 5, 'NORM_AXIS': 'full'}. Best is trial 21 with value: 0.45370370370370366.
[I 2026-06-20 04:56:33,718] Trial 28 finished with value: 0.44135802469135804 and parameters: {'FLOW': 2.620886924303697, 'FHIGH': 88.83501995700917, 'LR_EXP': -3.5466718981559575, 'DROPOUT': 0.3794312955469843, 'BETA': 0.7258633552327443, 'SPIKE_GRAD_SLOPE': 47.416717273752596, 'TEMPORAL_FILTERS': 24, 'DEPTH_MULTIPLIER': 3, 'POINTWISE_FILTERS': 44, 'TEMPORAL_KERNEL_DIV': 7, 'SEPARABLE_KERNEL_SIZE': 20, 'POOL1_SIZE': 3, 'POOL2_SIZE': 6, 'NORM_AXIS': 'no_channel'}. Best is trial 21 with value: 0.45370370370370366.
[I 2026-06-20 07:29:35,178] Trial 32 finished with value: 0.45293209876543217 and parameters: {'FLOW': 3.7352812269666726, 'FHIGH': 70.21763281789734, 'LR_EXP': -3.3956783055821926, 'DROPOUT': 0.3436918131976089, 'BETA': 0.5370734174985277, 'SPIKE_GRAD_SLOPE': 45.69759102962786, 'TEMPORAL_FILTERS': 28, 'DEPTH_MULTIPLIER': 4, 'POINTWISE_FILTERS': 43, 'TEMPORAL_KERNEL_DIV': 8, 'SEPARABLE_KERNEL_SIZE': 10, 'POOL1_SIZE': 4, 'POOL2_SIZE': 7, 'NORM_AXIS': 'no_channel'}. Best is trial 29 with value: 0.45968364197530864.
[I 2026-06-20 10:16:51,829] Trial 37 finished with value: 0.4097222222222222 and parameters: {'FLOW': 11.65074150853616, 'FHIGH': 84.27359534192568, 'LR_EXP': -3.2626806925941767, 'DROPOUT': 0.23883518247604113, 'BETA': 0.6379992633681408, 'SPIKE_GRAD_SLOPE': 37.34244116993405, 'TEMPORAL_FILTERS': 31, 'DEPTH_MULTIPLIER': 4, 'POINTWISE_FILTERS': 52, 'TEMPORAL_KERNEL_DIV': 7, 'SEPARABLE_KERNEL_SIZE': 9, 'POOL1_SIZE': 5, 'POOL2_SIZE': 7, 'NORM_AXIS': 'no_channel'}. Best is trial 29 with value: 0.45968364197530864.
[I 2026-06-20 12:21:36,243] Trial 43 finished with value: 0.396412037037037 and parameters: {'FLOW': 5.167065915429481, 'FHIGH': 42.797194159323396, 'LR_EXP': -4.201371793137601, 'DROPOUT': 0.47411528637853206, 'BETA': 0.7723609826990736, 'SPIKE_GRAD_SLOPE': 31.1934891780864, 'TEMPORAL_FILTERS': 20, 'DEPTH_MULTIPLIER': 4, 'POINTWISE_FILTERS': 37, 'TEMPORAL_KERNEL_DIV': 7, 'SEPARABLE_KERNEL_SIZE': 19, 'POOL1_SIZE': 2, 'POOL2_SIZE': 7, 'NORM_AXIS': 'no_channel'}. Best is trial 29 with value: 0.45968364197530864.
[W 2026-06-20 13:33:48,724] Trial 45 failed with parameters: {'FLOW': 4.311229942739884, 'FHIGH': 67.6137493195366, 'LR_EXP': -2.7163498643825412, 'DROPOUT': 0.5286289138952487, 'BETA': 0.8403228663333998, 'SPIKE_GRAD_SLOPE': 14.279722613770494, 'TEMPORAL_FILTERS': 16, 'DEPTH_MULTIPLIER': 4, 'POINTWISE_FILTERS': 43, 'TEMPORAL_KERNEL_DIV': 7, 'SEPARABLE_KERNEL_SIZE': 24, 'POOL1_SIZE': 2, 'POOL2_SIZE': 7, 'NORM_AXIS': 'no_channel'} because of the following error: OutOfMemoryError('CUDA out of memory. Tried to allocate 44.00 MiB. GPU 0 has a total capacity of 15.77 GiB of which 40.19 MiB is free. Including non-PyTorch memory, this process has 15.72 GiB memory in use. Of the allocated memory 14.36 GiB is allocated by PyTorch, and 1013.07 MiB is reserved by PyTorch but unallocated. If reserved but unallocated memory is large try setting PYTORCH_CUDA_ALLOC_CONF=expandable_segments:True to avoid fragmentation.  See documentation for Memory Management  (https://pytorch.org/docs/stable/notes/cuda.html#environment-variables)').
Traceback (most recent call last):
  File "/home/aleksander.berezowsk/venv/lib/python3.12/site-packages/optuna/study/_optimize.py", line 206, in _run_trial
    value_or_values = func(trial)
                      ^^^^^^^^^^^
  File "/home/aleksander.berezowsk/spiking-eegnet/src/main.py", line 44, in objective
    return pipeline(**params, **FIXED, trial=trial, save_plots=False)
           ^^^^^^^^^^^^^^^^^^^^^^^^^^^^^^^^^^^^^^^^^^^^^^^^^^^^^^^^^^
  File "/home/aleksander.berezowsk/spiking-eegnet/src/pipeline.py", line 141, in pipeline
    histories, accs, mean_acc = experiment_loso_all(
                                ^^^^^^^^^^^^^^^^^^^^
  File "/home/aleksander.berezowsk/spiking-eegnet/src/experiment_loso.py", line 71, in experiment_loso_all
    history, final_acc, _model = experiment_loso(
                                 ^^^^^^^^^^^^^^^^
  File "/home/aleksander.berezowsk/spiking-eegnet/src/experiment_loso.py", line 30, in experiment_loso
    history = run_training(
              ^^^^^^^^^^^^^
  File "/home/aleksander.berezowsk/spiking-eegnet/src/run_training.py", line 45, in run_training
    loss = train_one_epoch(model, train_loader, optimizer, criterion, device, n_steps_train)
           ^^^^^^^^^^^^^^^^^^^^^^^^^^^^^^^^^^^^^^^^^^^^^^^^^^^^^^^^^^^^^^^^^^^^^^^^^^^^^^^^^
  File "/home/aleksander.berezowsk/spiking-eegnet/src/train_one_epoch.py", line 7, in train_one_epoch
    spk = model(xb, num_steps=n_steps)
          ^^^^^^^^^^^^^^^^^^^^^^^^^^^^
  File "/home/aleksander.berezowsk/venv/lib/python3.12/site-packages/torch/nn/modules/module.py", line 1553, in _wrapped_call_impl
    return self._call_impl(*args, **kwargs)
           ^^^^^^^^^^^^^^^^^^^^^^^^^^^^^^^^
  File "/home/aleksander.berezowsk/venv/lib/python3.12/site-packages/torch/nn/modules/module.py", line 1562, in _call_impl
    return forward_call(*args, **kwargs)
           ^^^^^^^^^^^^^^^^^^^^^^^^^^^^^
  File "/home/aleksander.berezowsk/spiking-eegnet/src/spiking_eegnet.py", line 222, in forward
    spk1, mem1 = self.lif1(cur, mem1)
                 ^^^^^^^^^^^^^^^^^^^^
  File "/home/aleksander.berezowsk/venv/lib/python3.12/site-packages/torch/nn/modules/module.py", line 1553, in _wrapped_call_impl
    return self._call_impl(*args, **kwargs)
           ^^^^^^^^^^^^^^^^^^^^^^^^^^^^^^^^
  File "/home/aleksander.berezowsk/venv/lib/python3.12/site-packages/torch/nn/modules/module.py", line 1562, in _call_impl
    return forward_call(*args, **kwargs)
           ^^^^^^^^^^^^^^^^^^^^^^^^^^^^^
  File "/home/aleksander.berezowsk/venv/lib/python3.12/site-packages/snntorch/_neurons/leaky.py", line 220, in forward
    spk = self.fire(self.mem)
          ^^^^^^^^^^^^^^^^^^^
  File "/home/aleksander.berezowsk/venv/lib/python3.12/site-packages/snntorch/_neurons/neurons.py", line 83, in fire
    spk = spk * self.graded_spikes_factor
          ~~~~^~~~~~~~~~~~~~~~~~~~~~~~~~~
torch.OutOfMemoryError: CUDA out of memory. Tried to allocate 44.00 MiB. GPU 0 has a total capacity of 15.77 GiB of which 40.19 MiB is free. Including non-PyTorch memory, this process has 15.72 GiB memory in use. Of the allocated memory 14.36 GiB is allocated by PyTorch, and 1013.07 MiB is reserved by PyTorch but unallocated. If reserved but unallocated memory is large try setting PYTORCH_CUDA_ALLOC_CONF=expandable_segments:True to avoid fragmentation.  See documentation for Memory Management  (https://pytorch.org/docs/stable/notes/cuda.html#environment-variables)
[W 2026-06-20 13:33:48,753] Trial 45 failed with value None.
Traceback (most recent call last):
  File "/home/aleksander.berezowsk/spiking-eegnet/src/main.py", line 95, in <module>
    study.optimize(objective, n_trials=n_trials, n_jobs=1,
  File "/home/aleksander.berezowsk/venv/lib/python3.12/site-packages/optuna/study/study.py", line 516, in optimize
    _optimize(
  File "/home/aleksander.berezowsk/venv/lib/python3.12/site-packages/optuna/study/_optimize.py", line 68, in _optimize
    _optimize_sequential(
  File "/home/aleksander.berezowsk/venv/lib/python3.12/site-packages/optuna/study/_optimize.py", line 165, in _optimize_sequential
    frozen_trial_id = _run_trial(study, func, catch)
                      ^^^^^^^^^^^^^^^^^^^^^^^^^^^^^^
  File "/home/aleksander.berezowsk/venv/lib/python3.12/site-packages/optuna/study/_optimize.py", line 263, in _run_trial
    raise func_err
  File "/home/aleksander.berezowsk/venv/lib/python3.12/site-packages/optuna/study/_optimize.py", line 206, in _run_trial
    value_or_values = func(trial)
                      ^^^^^^^^^^^
  File "/home/aleksander.berezowsk/spiking-eegnet/src/main.py", line 44, in objective
    return pipeline(**params, **FIXED, trial=trial, save_plots=False)
           ^^^^^^^^^^^^^^^^^^^^^^^^^^^^^^^^^^^^^^^^^^^^^^^^^^^^^^^^^^
  File "/home/aleksander.berezowsk/spiking-eegnet/src/pipeline.py", line 141, in pipeline
    histories, accs, mean_acc = experiment_loso_all(
                                ^^^^^^^^^^^^^^^^^^^^
  File "/home/aleksander.berezowsk/spiking-eegnet/src/experiment_loso.py", line 71, in experiment_loso_all
    history, final_acc, _model = experiment_loso(
                                 ^^^^^^^^^^^^^^^^
  File "/home/aleksander.berezowsk/spiking-eegnet/src/experiment_loso.py", line 30, in experiment_loso
    history = run_training(
              ^^^^^^^^^^^^^
  File "/home/aleksander.berezowsk/spiking-eegnet/src/run_training.py", line 45, in run_training
    loss = train_one_epoch(model, train_loader, optimizer, criterion, device, n_steps_train)
           ^^^^^^^^^^^^^^^^^^^^^^^^^^^^^^^^^^^^^^^^^^^^^^^^^^^^^^^^^^^^^^^^^^^^^^^^^^^^^^^^^
  File "/home/aleksander.berezowsk/spiking-eegnet/src/train_one_epoch.py", line 7, in train_one_epoch
    spk = model(xb, num_steps=n_steps)
          ^^^^^^^^^^^^^^^^^^^^^^^^^^^^
  File "/home/aleksander.berezowsk/venv/lib/python3.12/site-packages/torch/nn/modules/module.py", line 1553, in _wrapped_call_impl
    return self._call_impl(*args, **kwargs)
           ^^^^^^^^^^^^^^^^^^^^^^^^^^^^^^^^
  File "/home/aleksander.berezowsk/venv/lib/python3.12/site-packages/torch/nn/modules/module.py", line 1562, in _call_impl
    return forward_call(*args, **kwargs)
           ^^^^^^^^^^^^^^^^^^^^^^^^^^^^^
  File "/home/aleksander.berezowsk/spiking-eegnet/src/spiking_eegnet.py", line 222, in forward
    spk1, mem1 = self.lif1(cur, mem1)
                 ^^^^^^^^^^^^^^^^^^^^
  File "/home/aleksander.berezowsk/venv/lib/python3.12/site-packages/torch/nn/modules/module.py", line 1553, in _wrapped_call_impl
    return self._call_impl(*args, **kwargs)
           ^^^^^^^^^^^^^^^^^^^^^^^^^^^^^^^^
  File "/home/aleksander.berezowsk/venv/lib/python3.12/site-packages/torch/nn/modules/module.py", line 1562, in _call_impl
    return forward_call(*args, **kwargs)
           ^^^^^^^^^^^^^^^^^^^^^^^^^^^^^
  File "/home/aleksander.berezowsk/venv/lib/python3.12/site-packages/snntorch/_neurons/leaky.py", line 220, in forward
    spk = self.fire(self.mem)
          ^^^^^^^^^^^^^^^^^^^
  File "/home/aleksander.berezowsk/venv/lib/python3.12/site-packages/snntorch/_neurons/neurons.py", line 83, in fire
    spk = spk * self.graded_spikes_factor
          ~~~~^~~~~~~~~~~~~~~~~~~~~~~~~~~
torch.OutOfMemoryError: CUDA out of memory. Tried to allocate 44.00 MiB. GPU 0 has a total capacity of 15.77 GiB of which 40.19 MiB is free. Including non-PyTorch memory, this process has 15.72 GiB memory in use. Of the allocated memory 14.36 GiB is allocated by PyTorch, and 1013.07 MiB is reserved by PyTorch but unallocated. If reserved but unallocated memory is large try setting PYTORCH_CUDA_ALLOC_CONF=expandable_segments:True to avoid fragmentation.  See documentation for Memory Management  (https://pytorch.org/docs/stable/notes/cuda.html#environment-variables)
