
[notice] A new release of pip is available: 24.2 -> 26.1.2
[notice] To update, run: pip install --upgrade pip

[notice] A new release of pip is available: 24.2 -> 26.1.2
[notice] To update, run: pip install --upgrade pip
ERROR: Invalid requirement: 'Binary file requirements.txt matches': Expected end or semicolon (after name and no valid version specifier)
    Binary file requirements.txt matches
           ^ (from line 1 of /home/aleksander.berezowsk/requirements_notorch.txt)

[notice] A new release of pip is available: 24.2 -> 26.1.2
[notice] To update, run: pip install --upgrade pip

[notice] A new release of pip is available: 24.2 -> 26.1.2
[notice] To update, run: pip install --upgrade pip
/home/aleksander.berezowsk/spiking-eegnet/src/main.py:86: ExperimentalWarning: Argument ``multivariate`` is an experimental feature. The interface can change in the future.
  sampler=TPESampler(n_startup_trials=tpe_trails, multivariate=True, group=True)
/home/aleksander.berezowsk/spiking-eegnet/src/main.py:86: ExperimentalWarning: Argument ``group`` is an experimental feature. The interface can change in the future.
  sampler=TPESampler(n_startup_trials=tpe_trails, multivariate=True, group=True)
[I 2026-06-16 15:32:18,272] Using an existing study with name 'snn_eegnet_v2_200_20' instead of creating a new one.
[I 2026-06-16 15:49:55,176] Trial 87 finished with value: 0.5434027777777778 and parameters: {'FLOW': 11.48348213548087, 'FHIGH': 64.08939958746147, 'LR_EXP': -2.086537069533764, 'DROPOUT': 0.47504666773966103, 'BETA': 0.8499393064410102, 'SPIKE_GRAD_SLOPE': 15.660912570684747, 'TEMPORAL_FILTERS': 27, 'DEPTH_MULTIPLIER': 4, 'POINTWISE_FILTERS': 44, 'TEMPORAL_KERNEL_DIV': 6, 'SEPARABLE_KERNEL_SIZE': 23, 'POOL1_SIZE': 5, 'POOL2_SIZE': 4, 'NORM_AXIS': 'full', 'RUN_ZSCORE': False}. Best is trial 21 with value: 0.6302083333333333.
[I 2026-06-16 15:50:25,461] Trial 88 pruned. 
[I 2026-06-16 15:51:09,181] Trial 89 pruned. 
[I 2026-06-16 16:04:14,432] Trial 90 finished with value: 0.5659722222222222 and parameters: {'FLOW': 3.1877184607572446, 'FHIGH': 59.2358642379817, 'LR_EXP': -2.3642602974261964, 'DROPOUT': 0.44070281561357955, 'BETA': 0.773750805432516, 'SPIKE_GRAD_SLOPE': 32.361613558326546, 'TEMPORAL_FILTERS': 19, 'DEPTH_MULTIPLIER': 4, 'POINTWISE_FILTERS': 26, 'TEMPORAL_KERNEL_DIV': 8, 'SEPARABLE_KERNEL_SIZE': 22, 'POOL1_SIZE': 4, 'POOL2_SIZE': 8, 'NORM_AXIS': 'full', 'RUN_ZSCORE': False}. Best is trial 21 with value: 0.6302083333333333.
[I 2026-06-16 16:04:58,451] Trial 91 pruned. 
[I 2026-06-16 16:15:32,853] Trial 92 finished with value: 0.5763888888888888 and parameters: {'FLOW': 9.255677939652502, 'FHIGH': 45.082908561550326, 'LR_EXP': -3.3308698748111114, 'DROPOUT': 0.378933925336074, 'BETA': 0.6141348367297695, 'SPIKE_GRAD_SLOPE': 62.300694042574584, 'TEMPORAL_FILTERS': 13, 'DEPTH_MULTIPLIER': 4, 'POINTWISE_FILTERS': 31, 'TEMPORAL_KERNEL_DIV': 7, 'SEPARABLE_KERNEL_SIZE': 12, 'POOL1_SIZE': 6, 'POOL2_SIZE': 4, 'NORM_AXIS': 'no_channel', 'RUN_ZSCORE': False}. Best is trial 21 with value: 0.6302083333333333.
[I 2026-06-16 16:16:06,038] Trial 93 pruned. 
[I 2026-06-16 16:17:19,777] Trial 94 pruned. 
[I 2026-06-16 16:17:55,330] Trial 95 pruned. 
[I 2026-06-16 16:18:35,988] Trial 96 pruned. 
[I 2026-06-16 16:37:52,563] Trial 97 finished with value: 0.5052083333333333 and parameters: {'FLOW': 5.360659256028948, 'FHIGH': 50.27118428882045, 'LR_EXP': -2.2292396727708814, 'DROPOUT': 0.5200370261065403, 'BETA': 0.5013863110250179, 'SPIKE_GRAD_SLOPE': 31.591294038892585, 'TEMPORAL_FILTERS': 31, 'DEPTH_MULTIPLIER': 4, 'POINTWISE_FILTERS': 41, 'TEMPORAL_KERNEL_DIV': 8, 'SEPARABLE_KERNEL_SIZE': 25, 'POOL1_SIZE': 2, 'POOL2_SIZE': 8, 'NORM_AXIS': 'no_channel', 'RUN_ZSCORE': False}. Best is trial 21 with value: 0.6302083333333333.
[I 2026-06-16 16:57:29,030] Trial 98 finished with value: 0.6111111111111112 and parameters: {'FLOW': 3.298337497590598, 'FHIGH': 75.60790541636177, 'LR_EXP': -3.2440032579757547, 'DROPOUT': 0.43688790216978823, 'BETA': 0.7063428644492067, 'SPIKE_GRAD_SLOPE': 13.150373162315379, 'TEMPORAL_FILTERS': 31, 'DEPTH_MULTIPLIER': 4, 'POINTWISE_FILTERS': 8, 'TEMPORAL_KERNEL_DIV': 5, 'SEPARABLE_KERNEL_SIZE': 18, 'POOL1_SIZE': 6, 'POOL2_SIZE': 6, 'NORM_AXIS': 'full', 'RUN_ZSCORE': False}. Best is trial 21 with value: 0.6302083333333333.
[I 2026-06-16 16:58:06,632] Trial 99 pruned. 
[I 2026-06-16 16:58:50,318] Trial 100 pruned. 
[I 2026-06-16 16:59:32,165] Trial 101 pruned. 
[I 2026-06-16 17:00:10,538] Trial 102 pruned. 
[I 2026-06-16 17:00:42,588] Trial 103 pruned. 
[I 2026-06-16 17:01:21,434] Trial 104 pruned. 
[I 2026-06-16 17:01:54,305] Trial 105 pruned. 
[I 2026-06-16 17:02:31,873] Trial 106 pruned. 
[I 2026-06-16 17:22:46,918] Trial 107 finished with value: 0.5572916666666667 and parameters: {'FLOW': 3.642610815403716, 'FHIGH': 86.00478045184384, 'LR_EXP': -2.8456906507251456, 'DROPOUT': 0.5738499303976331, 'BETA': 0.6827751974744358, 'SPIKE_GRAD_SLOPE': 45.320923646944856, 'TEMPORAL_FILTERS': 31, 'DEPTH_MULTIPLIER': 4, 'POINTWISE_FILTERS': 21, 'TEMPORAL_KERNEL_DIV': 4, 'SEPARABLE_KERNEL_SIZE': 32, 'POOL1_SIZE': 8, 'POOL2_SIZE': 6, 'NORM_AXIS': 'full', 'RUN_ZSCORE': False}. Best is trial 21 with value: 0.6302083333333333.
[I 2026-06-16 17:23:18,395] Trial 108 pruned. 
[I 2026-06-16 17:41:01,923] Trial 109 finished with value: 0.6024305555555556 and parameters: {'FLOW': 3.916545368443445, 'FHIGH': 76.1912567344394, 'LR_EXP': -2.5388823127234943, 'DROPOUT': 0.5109617136115429, 'BETA': 0.5616563601717695, 'SPIKE_GRAD_SLOPE': 12.156486964263792, 'TEMPORAL_FILTERS': 32, 'DEPTH_MULTIPLIER': 3, 'POINTWISE_FILTERS': 10, 'TEMPORAL_KERNEL_DIV': 6, 'SEPARABLE_KERNEL_SIZE': 32, 'POOL1_SIZE': 7, 'POOL2_SIZE': 4, 'NORM_AXIS': 'full', 'RUN_ZSCORE': False}. Best is trial 21 with value: 0.6302083333333333.
[I 2026-06-16 17:58:21,187] Trial 110 finished with value: 0.59375 and parameters: {'FLOW': 8.875307099339977, 'FHIGH': 64.37818467205011, 'LR_EXP': -2.303296856363886, 'DROPOUT': 0.614876526398218, 'BETA': 0.5852159190178204, 'SPIKE_GRAD_SLOPE': 8.235285242321929, 'TEMPORAL_FILTERS': 30, 'DEPTH_MULTIPLIER': 3, 'POINTWISE_FILTERS': 12, 'TEMPORAL_KERNEL_DIV': 5, 'SEPARABLE_KERNEL_SIZE': 26, 'POOL1_SIZE': 8, 'POOL2_SIZE': 6, 'NORM_AXIS': 'full', 'RUN_ZSCORE': False}. Best is trial 21 with value: 0.6302083333333333.
[I 2026-06-16 18:15:08,243] Trial 111 finished with value: 0.576388888888889 and parameters: {'FLOW': 3.939285650905589, 'FHIGH': 63.68731344723905, 'LR_EXP': -2.270624079276082, 'DROPOUT': 0.5343233710952939, 'BETA': 0.6125869278527432, 'SPIKE_GRAD_SLOPE': 11.830712679219344, 'TEMPORAL_FILTERS': 25, 'DEPTH_MULTIPLIER': 4, 'POINTWISE_FILTERS': 24, 'TEMPORAL_KERNEL_DIV': 5, 'SEPARABLE_KERNEL_SIZE': 23, 'POOL1_SIZE': 8, 'POOL2_SIZE': 7, 'NORM_AXIS': 'full', 'RUN_ZSCORE': False}. Best is trial 21 with value: 0.6302083333333333.
[I 2026-06-16 18:25:52,665] Trial 112 finished with value: 0.5642361111111112 and parameters: {'FLOW': 3.386231057666956, 'FHIGH': 69.31989537680224, 'LR_EXP': -2.108482460967437, 'DROPOUT': 0.5866190973619321, 'BETA': 0.7549181081653302, 'SPIKE_GRAD_SLOPE': 10.76624951542965, 'TEMPORAL_FILTERS': 19, 'DEPTH_MULTIPLIER': 2, 'POINTWISE_FILTERS': 9, 'TEMPORAL_KERNEL_DIV': 8, 'SEPARABLE_KERNEL_SIZE': 26, 'POOL1_SIZE': 6, 'POOL2_SIZE': 5, 'NORM_AXIS': 'full', 'RUN_ZSCORE': False}. Best is trial 21 with value: 0.6302083333333333.
[I 2026-06-16 18:26:54,225] Trial 113 pruned. 
[I 2026-06-16 18:44:10,071] Trial 114 finished with value: 0.5763888888888888 and parameters: {'FLOW': 3.9362045841976094, 'FHIGH': 85.94150615821565, 'LR_EXP': -3.1250277803288156, 'DROPOUT': 0.37884283061900736, 'BETA': 0.5477893327867205, 'SPIKE_GRAD_SLOPE': 12.213897901666972, 'TEMPORAL_FILTERS': 31, 'DEPTH_MULTIPLIER': 3, 'POINTWISE_FILTERS': 15, 'TEMPORAL_KERNEL_DIV': 6, 'SEPARABLE_KERNEL_SIZE': 29, 'POOL1_SIZE': 8, 'POOL2_SIZE': 4, 'NORM_AXIS': 'full', 'RUN_ZSCORE': False}. Best is trial 21 with value: 0.6302083333333333.
[I 2026-06-16 18:44:48,654] Trial 115 pruned. 
[I 2026-06-16 18:45:26,693] Trial 116 pruned. 
[I 2026-06-16 18:45:51,940] Trial 117 pruned. 
[I 2026-06-16 18:46:28,361] Trial 118 pruned. 
[I 2026-06-16 19:02:35,306] Trial 119 finished with value: 0.5555555555555556 and parameters: {'FLOW': 3.706275477007427, 'FHIGH': 58.993231697177166, 'LR_EXP': -2.7922120961928574, 'DROPOUT': 0.4624364000831738, 'BETA': 0.5705387938920673, 'SPIKE_GRAD_SLOPE': 15.76888616674985, 'TEMPORAL_FILTERS': 28, 'DEPTH_MULTIPLIER': 3, 'POINTWISE_FILTERS': 18, 'TEMPORAL_KERNEL_DIV': 6, 'SEPARABLE_KERNEL_SIZE': 30, 'POOL1_SIZE': 8, 'POOL2_SIZE': 4, 'NORM_AXIS': 'full', 'RUN_ZSCORE': True}. Best is trial 21 with value: 0.6302083333333333.
[I 2026-06-16 19:03:17,697] Trial 120 pruned. 
[I 2026-06-16 19:19:55,281] Trial 121 finished with value: 0.5798611111111112 and parameters: {'FLOW': 7.299949342407295, 'FHIGH': 65.60349448342525, 'LR_EXP': -2.6211591193638397, 'DROPOUT': 0.49991784126964167, 'BETA': 0.5229082548017948, 'SPIKE_GRAD_SLOPE': 15.262047861293988, 'TEMPORAL_FILTERS': 30, 'DEPTH_MULTIPLIER': 3, 'POINTWISE_FILTERS': 18, 'TEMPORAL_KERNEL_DIV': 7, 'SEPARABLE_KERNEL_SIZE': 30, 'POOL1_SIZE': 6, 'POOL2_SIZE': 5, 'NORM_AXIS': 'full', 'RUN_ZSCORE': False}. Best is trial 21 with value: 0.6302083333333333.
[I 2026-06-16 19:20:35,474] Trial 122 pruned. 
[I 2026-06-16 19:21:10,592] Trial 123 pruned. 
[I 2026-06-16 19:21:51,162] Trial 124 pruned. 
[I 2026-06-16 19:42:03,964] Trial 125 finished with value: 0.5520833333333333 and parameters: {'FLOW': 5.760855387698508, 'FHIGH': 83.28415863113796, 'LR_EXP': -2.8342298098667285, 'DROPOUT': 0.24842449589093352, 'BETA': 0.7689978045489783, 'SPIKE_GRAD_SLOPE': 33.143653392189634, 'TEMPORAL_FILTERS': 27, 'DEPTH_MULTIPLIER': 4, 'POINTWISE_FILTERS': 8, 'TEMPORAL_KERNEL_DIV': 3, 'SEPARABLE_KERNEL_SIZE': 14, 'POOL1_SIZE': 5, 'POOL2_SIZE': 8, 'NORM_AXIS': 'full', 'RUN_ZSCORE': False}. Best is trial 21 with value: 0.6302083333333333.
[I 2026-06-16 19:42:46,587] Trial 126 pruned. 
[I 2026-06-16 19:43:20,746] Trial 127 pruned. 
[I 2026-06-16 19:43:54,395] Trial 128 pruned. 
[I 2026-06-16 20:00:41,109] Trial 129 finished with value: 0.6041666666666666 and parameters: {'FLOW': 10.290610469328854, 'FHIGH': 73.10102172061313, 'LR_EXP': -2.916690449772674, 'DROPOUT': 0.5690519290909701, 'BETA': 0.6897539009691783, 'SPIKE_GRAD_SLOPE': 31.362828062250756, 'TEMPORAL_FILTERS': 27, 'DEPTH_MULTIPLIER': 4, 'POINTWISE_FILTERS': 38, 'TEMPORAL_KERNEL_DIV': 8, 'SEPARABLE_KERNEL_SIZE': 12, 'POOL1_SIZE': 4, 'POOL2_SIZE': 8, 'NORM_AXIS': 'no_channel', 'RUN_ZSCORE': False}. Best is trial 21 with value: 0.6302083333333333.
[I 2026-06-16 20:16:14,163] Trial 130 finished with value: 0.5277777777777778 and parameters: {'FLOW': 6.912609275222254, 'FHIGH': 51.12533661436676, 'LR_EXP': -2.4042604891961465, 'DROPOUT': 0.6793392546185482, 'BETA': 0.670689629764136, 'SPIKE_GRAD_SLOPE': 16.824411748536008, 'TEMPORAL_FILTERS': 30, 'DEPTH_MULTIPLIER': 2, 'POINTWISE_FILTERS': 21, 'TEMPORAL_KERNEL_DIV': 5, 'SEPARABLE_KERNEL_SIZE': 23, 'POOL1_SIZE': 7, 'POOL2_SIZE': 7, 'NORM_AXIS': 'full', 'RUN_ZSCORE': True}. Best is trial 21 with value: 0.6302083333333333.
[I 2026-06-16 20:32:38,770] Trial 131 pruned. 
[I 2026-06-16 20:33:14,536] Trial 132 pruned. 
[I 2026-06-16 20:33:49,464] Trial 133 pruned. 
[I 2026-06-16 20:44:33,485] Trial 134 finished with value: 0.5677083333333333 and parameters: {'FLOW': 7.664297628475802, 'FHIGH': 55.6891850182036, 'LR_EXP': -2.748542188041137, 'DROPOUT': 0.636212271308869, 'BETA': 0.6820176736054592, 'SPIKE_GRAD_SLOPE': 28.968057832262804, 'TEMPORAL_FILTERS': 18, 'DEPTH_MULTIPLIER': 2, 'POINTWISE_FILTERS': 44, 'TEMPORAL_KERNEL_DIV': 7, 'SEPARABLE_KERNEL_SIZE': 15, 'POOL1_SIZE': 6, 'POOL2_SIZE': 6, 'NORM_AXIS': 'no_channel', 'RUN_ZSCORE': True}. Best is trial 21 with value: 0.6302083333333333.
[I 2026-06-16 20:45:07,500] Trial 135 pruned. 
[I 2026-06-16 20:45:29,177] Trial 136 pruned. 
[I 2026-06-16 20:59:13,722] Trial 137 finished with value: 0.5815972222222222 and parameters: {'FLOW': 6.765588373980306, 'FHIGH': 86.36450305032238, 'LR_EXP': -2.545849491431425, 'DROPOUT': 0.5921563319933332, 'BETA': 0.6390632331309807, 'SPIKE_GRAD_SLOPE': 35.12914103968385, 'TEMPORAL_FILTERS': 22, 'DEPTH_MULTIPLIER': 3, 'POINTWISE_FILTERS': 46, 'TEMPORAL_KERNEL_DIV': 6, 'SEPARABLE_KERNEL_SIZE': 14, 'POOL1_SIZE': 5, 'POOL2_SIZE': 7, 'NORM_AXIS': 'no_channel', 'RUN_ZSCORE': False}. Best is trial 21 with value: 0.6302083333333333.
[I 2026-06-16 20:59:47,968] Trial 138 pruned. 
[I 2026-06-16 21:14:05,339] Trial 139 finished with value: 0.5520833333333334 and parameters: {'FLOW': 12.01622940651433, 'FHIGH': 81.54701571627129, 'LR_EXP': -2.5302783545221406, 'DROPOUT': 0.6424268907804471, 'BETA': 0.7092845433822694, 'SPIKE_GRAD_SLOPE': 19.61043332728047, 'TEMPORAL_FILTERS': 24, 'DEPTH_MULTIPLIER': 3, 'POINTWISE_FILTERS': 42, 'TEMPORAL_KERNEL_DIV': 8, 'SEPARABLE_KERNEL_SIZE': 9, 'POOL1_SIZE': 2, 'POOL2_SIZE': 8, 'NORM_AXIS': 'no_channel', 'RUN_ZSCORE': False}. Best is trial 21 with value: 0.6302083333333333.
[I 2026-06-16 21:32:10,547] Trial 140 finished with value: 0.5277777777777778 and parameters: {'FLOW': 2.2492553602937133, 'FHIGH': 44.13244927700772, 'LR_EXP': -2.532794133656398, 'DROPOUT': 0.5501151896546677, 'BETA': 0.7826125513898354, 'SPIKE_GRAD_SLOPE': 16.34782104635598, 'TEMPORAL_FILTERS': 29, 'DEPTH_MULTIPLIER': 4, 'POINTWISE_FILTERS': 24, 'TEMPORAL_KERNEL_DIV': 8, 'SEPARABLE_KERNEL_SIZE': 22, 'POOL1_SIZE': 2, 'POOL2_SIZE': 7, 'NORM_AXIS': 'full', 'RUN_ZSCORE': False}. Best is trial 21 with value: 0.6302083333333333.
[I 2026-06-16 21:32:43,539] Trial 141 pruned. 
[I 2026-06-16 21:33:33,943] Trial 142 pruned. 
[I 2026-06-16 21:52:03,130] Trial 143 finished with value: 0.5989583333333334 and parameters: {'FLOW': 6.43254053346721, 'FHIGH': 78.98863090564635, 'LR_EXP': -2.6596057178353187, 'DROPOUT': 0.46905868550563434, 'BETA': 0.799176945178217, 'SPIKE_GRAD_SLOPE': 28.719841113580323, 'TEMPORAL_FILTERS': 30, 'DEPTH_MULTIPLIER': 4, 'POINTWISE_FILTERS': 35, 'TEMPORAL_KERNEL_DIV': 7, 'SEPARABLE_KERNEL_SIZE': 11, 'POOL1_SIZE': 4, 'POOL2_SIZE': 8, 'NORM_AXIS': 'no_channel', 'RUN_ZSCORE': False}. Best is trial 21 with value: 0.6302083333333333.
[I 2026-06-16 21:52:40,700] Trial 144 pruned. 
[I 2026-06-16 21:53:19,060] Trial 145 pruned. 
[I 2026-06-16 21:53:53,806] Trial 146 pruned. 
[I 2026-06-16 21:54:29,818] Trial 147 pruned. 
[I 2026-06-16 22:11:50,829] Trial 148 finished with value: 0.6163194444444444 and parameters: {'FLOW': 7.348817058000386, 'FHIGH': 72.55333655622063, 'LR_EXP': -3.1314793125267806, 'DROPOUT': 0.4393217501681227, 'BETA': 0.6374988757198424, 'SPIKE_GRAD_SLOPE': 8.060865648140474, 'TEMPORAL_FILTERS': 26, 'DEPTH_MULTIPLIER': 4, 'POINTWISE_FILTERS': 27, 'TEMPORAL_KERNEL_DIV': 5, 'SEPARABLE_KERNEL_SIZE': 14, 'POOL1_SIZE': 6, 'POOL2_SIZE': 8, 'NORM_AXIS': 'full', 'RUN_ZSCORE': True}. Best is trial 21 with value: 0.6302083333333333.
[I 2026-06-16 22:12:21,184] Trial 149 pruned. 
[I 2026-06-16 22:12:55,317] Trial 150 pruned. 
[I 2026-06-16 22:13:35,583] Trial 151 pruned. 
[I 2026-06-16 22:14:01,523] Trial 152 pruned. 
[I 2026-06-16 22:33:44,627] Trial 153 finished with value: 0.5677083333333334 and parameters: {'FLOW': 2.399239395287735, 'FHIGH': 63.342979412506494, 'LR_EXP': -2.542175766346641, 'DROPOUT': 0.2946366424228295, 'BETA': 0.8269879739686268, 'SPIKE_GRAD_SLOPE': 8.204020395487248, 'TEMPORAL_FILTERS': 31, 'DEPTH_MULTIPLIER': 4, 'POINTWISE_FILTERS': 27, 'TEMPORAL_KERNEL_DIV': 5, 'SEPARABLE_KERNEL_SIZE': 21, 'POOL1_SIZE': 4, 'POOL2_SIZE': 5, 'NORM_AXIS': 'full', 'RUN_ZSCORE': False}. Best is trial 21 with value: 0.6302083333333333.
[I 2026-06-16 22:34:22,532] Trial 154 pruned. 
[I 2026-06-16 22:35:13,932] Trial 155 pruned. 
[I 2026-06-16 22:35:53,088] Trial 156 pruned. 
[I 2026-06-16 22:36:37,781] Trial 157 pruned. 
[I 2026-06-16 22:56:04,002] Trial 158 finished with value: 0.5763888888888888 and parameters: {'FLOW': 9.011866458603347, 'FHIGH': 83.48280783119466, 'LR_EXP': -2.993876994989431, 'DROPOUT': 0.46145862440507307, 'BETA': 0.6892214815005981, 'SPIKE_GRAD_SLOPE': 53.0671705463031, 'TEMPORAL_FILTERS': 31, 'DEPTH_MULTIPLIER': 4, 'POINTWISE_FILTERS': 40, 'TEMPORAL_KERNEL_DIV': 6, 'SEPARABLE_KERNEL_SIZE': 9, 'POOL1_SIZE': 3, 'POOL2_SIZE': 8, 'NORM_AXIS': 'no_channel', 'RUN_ZSCORE': False}. Best is trial 21 with value: 0.6302083333333333.
[I 2026-06-16 22:56:44,165] Trial 159 pruned. 
[I 2026-06-16 22:57:18,109] Trial 160 pruned. 
[I 2026-06-16 23:11:07,600] Trial 161 finished with value: 0.579861111111111 and parameters: {'FLOW': 8.855733938580771, 'FHIGH': 56.854179490897124, 'LR_EXP': -2.5007106216296746, 'DROPOUT': 0.7195740069234036, 'BETA': 0.5795660274245136, 'SPIKE_GRAD_SLOPE': 6.665950610877393, 'TEMPORAL_FILTERS': 25, 'DEPTH_MULTIPLIER': 2, 'POINTWISE_FILTERS': 32, 'TEMPORAL_KERNEL_DIV': 5, 'SEPARABLE_KERNEL_SIZE': 31, 'POOL1_SIZE': 8, 'POOL2_SIZE': 7, 'NORM_AXIS': 'full', 'RUN_ZSCORE': False}. Best is trial 21 with value: 0.6302083333333333.
[I 2026-06-16 23:11:46,988] Trial 162 pruned. 
[I 2026-06-16 23:12:24,176] Trial 163 pruned. 
[I 2026-06-16 23:30:59,121] Trial 164 finished with value: 0.5243055555555556 and parameters: {'FLOW': 5.8156031185908885, 'FHIGH': 56.46558162526126, 'LR_EXP': -2.4141192023696147, 'DROPOUT': 0.608504438631686, 'BETA': 0.7089025049560361, 'SPIKE_GRAD_SLOPE': 46.44421877990549, 'TEMPORAL_FILTERS': 29, 'DEPTH_MULTIPLIER': 4, 'POINTWISE_FILTERS': 26, 'TEMPORAL_KERNEL_DIV': 5, 'SEPARABLE_KERNEL_SIZE': 9, 'POOL1_SIZE': 6, 'POOL2_SIZE': 6, 'NORM_AXIS': 'no_channel', 'RUN_ZSCORE': True}. Best is trial 21 with value: 0.6302083333333333.
[I 2026-06-16 23:31:26,761] Trial 165 pruned. 
[I 2026-06-16 23:32:07,232] Trial 166 pruned. 
[I 2026-06-16 23:49:25,443] Trial 167 finished with value: 0.564236111111111 and parameters: {'FLOW': 3.6731599570490596, 'FHIGH': 68.940574704756, 'LR_EXP': -2.0812563182903983, 'DROPOUT': 0.6966777110241337, 'BETA': 0.8168738626302611, 'SPIKE_GRAD_SLOPE': 28.27556798559831, 'TEMPORAL_FILTERS': 32, 'DEPTH_MULTIPLIER': 3, 'POINTWISE_FILTERS': 27, 'TEMPORAL_KERNEL_DIV': 8, 'SEPARABLE_KERNEL_SIZE': 27, 'POOL1_SIZE': 4, 'POOL2_SIZE': 7, 'NORM_AXIS': 'full', 'RUN_ZSCORE': True}. Best is trial 21 with value: 0.6302083333333333.
