
[notice] A new release of pip is available: 24.2 -> 26.1.2
[notice] To update, run: pip install --upgrade pip

[notice] A new release of pip is available: 24.2 -> 26.1.2
[notice] To update, run: pip install --upgrade pip
ERROR: Invalid requirement: 'Binary file requirements.txt matches': Expected end or semicolon (after name and no valid version specifier)
    Binary file requirements.txt matches
           ^ (from line 1 of /home/aleksander.berezowsk/requirements_notorch.txt)

[notice] A new release of pip is available: 24.2 -> 26.1.2
[notice] To update, run: pip install --upgrade pip

[notice] A new release of pip is available: 24.2 -> 26.1.2
[notice] To update, run: pip install --upgrade pip
/home/aleksander.berezowsk/spiking-eegnet/src/main.py:87: ExperimentalWarning: Argument ``multivariate`` is an experimental feature. The interface can change in the future.
  sampler=TPESampler(n_startup_trials=tpe_trails, multivariate=True, group=True)
/home/aleksander.berezowsk/spiking-eegnet/src/main.py:87: ExperimentalWarning: Argument ``group`` is an experimental feature. The interface can change in the future.
  sampler=TPESampler(n_startup_trials=tpe_trails, multivariate=True, group=True)
[I 2026-06-15 02:31:14,378] Using an existing study with name 'snn_eegnet_1000_100' instead of creating a new one.
[I 2026-06-15 02:43:51,007] Trial 40 finished with value: 0.2690972222222222 and parameters: {'FLOW': 27.69787863631946, 'FHIGH': 43.45696281704603, 'LR_EXP': -3.2156217834235123, 'DROPOUT': 0.17995386790177262, 'BETA': 0.9213629920335227, 'SPIKE_GRAD_SLOPE': 13.687265107376824, 'TEMPORAL_FILTERS': 20, 'DEPTH_MULTIPLIER': 3, 'POINTWISE_FILTERS': 12, 'TEMPORAL_KERNEL_DIV': 8, 'SEPARABLE_KERNEL_SIZE': 32, 'POOL1_SIZE': 5, 'POOL2_SIZE': 5, 'NORM_AXIS': 'full', 'RUN_ZSCORE': False, 'RUN_BANDPASS': True}. Best is trial 25 with value: 0.6076388888888888.
[I 2026-06-15 02:52:34,362] Trial 41 finished with value: 0.517361111111111 and parameters: {'FLOW': 5.996599521537557, 'FHIGH': 112.38786087055928, 'LR_EXP': -2.403670362193029, 'DROPOUT': 0.5728311303945667, 'BETA': 0.9804808812508814, 'SPIKE_GRAD_SLOPE': 45.699943524576966, 'TEMPORAL_FILTERS': 11, 'DEPTH_MULTIPLIER': 3, 'POINTWISE_FILTERS': 31, 'TEMPORAL_KERNEL_DIV': 8, 'SEPARABLE_KERNEL_SIZE': 5, 'POOL1_SIZE': 8, 'POOL2_SIZE': 6, 'NORM_AXIS': 'full', 'RUN_ZSCORE': False, 'RUN_BANDPASS': False}. Best is trial 25 with value: 0.6076388888888888.
[I 2026-06-15 03:10:51,552] Trial 42 finished with value: 0.2586805555555556 and parameters: {'FLOW': 31.275591190968715, 'FHIGH': 63.538202086216046, 'LR_EXP': -2.6849389870687532, 'DROPOUT': 0.48678699859828145, 'BETA': 0.6466354777396267, 'SPIKE_GRAD_SLOPE': 34.6995854736392, 'TEMPORAL_FILTERS': 30, 'DEPTH_MULTIPLIER': 2, 'POINTWISE_FILTERS': 23, 'TEMPORAL_KERNEL_DIV': 3, 'SEPARABLE_KERNEL_SIZE': 10, 'POOL1_SIZE': 5, 'POOL2_SIZE': 3, 'NORM_AXIS': 'full', 'RUN_ZSCORE': True, 'RUN_BANDPASS': True}. Best is trial 25 with value: 0.6076388888888888.
[I 2026-06-15 03:18:14,181] Trial 43 finished with value: 0.2725694444444445 and parameters: {'FLOW': 22.28918541517796, 'FHIGH': 78.93175387214033, 'LR_EXP': -2.414294719450834, 'DROPOUT': 0.6122373693542689, 'BETA': 0.802938881898713, 'SPIKE_GRAD_SLOPE': 58.84377774322241, 'TEMPORAL_FILTERS': 6, 'DEPTH_MULTIPLIER': 3, 'POINTWISE_FILTERS': 26, 'TEMPORAL_KERNEL_DIV': 8, 'SEPARABLE_KERNEL_SIZE': 7, 'POOL1_SIZE': 2, 'POOL2_SIZE': 3, 'NORM_AXIS': 'full', 'RUN_ZSCORE': True, 'RUN_BANDPASS': True}. Best is trial 25 with value: 0.6076388888888888.
[I 2026-06-15 03:32:55,029] Trial 44 finished with value: 0.4583333333333333 and parameters: {'FLOW': 30.935844432091297, 'FHIGH': 78.42695783865597, 'LR_EXP': -3.0443169312956124, 'DROPOUT': 0.3514903217509662, 'BETA': 0.5395925078707239, 'SPIKE_GRAD_SLOPE': 53.28284087423372, 'TEMPORAL_FILTERS': 16, 'DEPTH_MULTIPLIER': 2, 'POINTWISE_FILTERS': 41, 'TEMPORAL_KERNEL_DIV': 2, 'SEPARABLE_KERNEL_SIZE': 23, 'POOL1_SIZE': 4, 'POOL2_SIZE': 3, 'NORM_AXIS': 'full', 'RUN_ZSCORE': False, 'RUN_BANDPASS': False}. Best is trial 25 with value: 0.6076388888888888.
[I 2026-06-15 03:46:31,695] Trial 45 finished with value: 0.4652777777777778 and parameters: {'FLOW': 12.219394828359652, 'FHIGH': 94.18111203868281, 'LR_EXP': -2.9961606693466223, 'DROPOUT': 0.43779665037915794, 'BETA': 0.5065830460598992, 'SPIKE_GRAD_SLOPE': 25.36951903347316, 'TEMPORAL_FILTERS': 13, 'DEPTH_MULTIPLIER': 2, 'POINTWISE_FILTERS': 21, 'TEMPORAL_KERNEL_DIV': 2, 'SEPARABLE_KERNEL_SIZE': 7, 'POOL1_SIZE': 4, 'POOL2_SIZE': 6, 'NORM_AXIS': 'full', 'RUN_ZSCORE': False, 'RUN_BANDPASS': True}. Best is trial 25 with value: 0.6076388888888888.
[I 2026-06-15 04:04:42,681] Trial 46 finished with value: 0.6527777777777777 and parameters: {'FLOW': 2.245874872836509, 'FHIGH': 89.28638980772622, 'LR_EXP': -3.3909189868818688, 'DROPOUT': 0.4217506840677838, 'BETA': 0.8186048843419502, 'SPIKE_GRAD_SLOPE': 5.004842822925686, 'TEMPORAL_FILTERS': 27, 'DEPTH_MULTIPLIER': 4, 'POINTWISE_FILTERS': 48, 'TEMPORAL_KERNEL_DIV': 5, 'SEPARABLE_KERNEL_SIZE': 5, 'POOL1_SIZE': 2, 'POOL2_SIZE': 8, 'NORM_AXIS': 'no_channel', 'RUN_ZSCORE': True, 'RUN_BANDPASS': False}. Best is trial 46 with value: 0.6527777777777777.
[I 2026-06-15 04:20:12,540] Trial 47 finished with value: 0.5746527777777778 and parameters: {'FLOW': 18.741992522187903, 'FHIGH': 103.40298080100185, 'LR_EXP': -3.550793156424578, 'DROPOUT': 0.44195489601179705, 'BETA': 0.6568059344121258, 'SPIKE_GRAD_SLOPE': 51.03471188101117, 'TEMPORAL_FILTERS': 30, 'DEPTH_MULTIPLIER': 2, 'POINTWISE_FILTERS': 56, 'TEMPORAL_KERNEL_DIV': 6, 'SEPARABLE_KERNEL_SIZE': 6, 'POOL1_SIZE': 3, 'POOL2_SIZE': 8, 'NORM_AXIS': 'full', 'RUN_ZSCORE': True, 'RUN_BANDPASS': False}. Best is trial 46 with value: 0.6527777777777777.
[I 2026-06-15 04:34:43,648] Trial 48 finished with value: 0.31249999999999994 and parameters: {'FLOW': 14.11174356882818, 'FHIGH': 82.78945744300744, 'LR_EXP': -2.038087320888846, 'DROPOUT': 0.3122088385814633, 'BETA': 0.7669616432568034, 'SPIKE_GRAD_SLOPE': 32.7385235984801, 'TEMPORAL_FILTERS': 25, 'DEPTH_MULTIPLIER': 3, 'POINTWISE_FILTERS': 42, 'TEMPORAL_KERNEL_DIV': 8, 'SEPARABLE_KERNEL_SIZE': 24, 'POOL1_SIZE': 5, 'POOL2_SIZE': 5, 'NORM_AXIS': 'no_channel', 'RUN_ZSCORE': True, 'RUN_BANDPASS': True}. Best is trial 46 with value: 0.6527777777777777.
[I 2026-06-15 04:45:48,679] Trial 49 finished with value: 0.3055555555555555 and parameters: {'FLOW': 28.962701527343697, 'FHIGH': 88.34689461304312, 'LR_EXP': -3.4508992445238063, 'DROPOUT': 0.20458923170556503, 'BETA': 0.7166049327142731, 'SPIKE_GRAD_SLOPE': 83.92756567917307, 'TEMPORAL_FILTERS': 11, 'DEPTH_MULTIPLIER': 4, 'POINTWISE_FILTERS': 32, 'TEMPORAL_KERNEL_DIV': 4, 'SEPARABLE_KERNEL_SIZE': 13, 'POOL1_SIZE': 7, 'POOL2_SIZE': 3, 'NORM_AXIS': 'no_channel', 'RUN_ZSCORE': True, 'RUN_BANDPASS': True}. Best is trial 46 with value: 0.6527777777777777.
[I 2026-06-15 05:00:10,965] Trial 50 finished with value: 0.5086805555555556 and parameters: {'FLOW': 2.9412152212573144, 'FHIGH': 116.08244894785528, 'LR_EXP': -4.048211919634797, 'DROPOUT': 0.4525162812022895, 'BETA': 0.9672096518966983, 'SPIKE_GRAD_SLOPE': 37.54720557029876, 'TEMPORAL_FILTERS': 13, 'DEPTH_MULTIPLIER': 3, 'POINTWISE_FILTERS': 64, 'TEMPORAL_KERNEL_DIV': 2, 'SEPARABLE_KERNEL_SIZE': 31, 'POOL1_SIZE': 7, 'POOL2_SIZE': 7, 'NORM_AXIS': 'full', 'RUN_ZSCORE': True, 'RUN_BANDPASS': False}. Best is trial 46 with value: 0.6527777777777777.
[I 2026-06-15 05:15:51,509] Trial 51 finished with value: 0.2638888888888889 and parameters: {'FLOW': 19.596716083927067, 'FHIGH': 92.58828364005468, 'LR_EXP': -4.359808995289796, 'DROPOUT': 0.31350967770580807, 'BETA': 0.9457670247829697, 'SPIKE_GRAD_SLOPE': 24.659449139411002, 'TEMPORAL_FILTERS': 30, 'DEPTH_MULTIPLIER': 2, 'POINTWISE_FILTERS': 14, 'TEMPORAL_KERNEL_DIV': 5, 'SEPARABLE_KERNEL_SIZE': 26, 'POOL1_SIZE': 7, 'POOL2_SIZE': 7, 'NORM_AXIS': 'full', 'RUN_ZSCORE': True, 'RUN_BANDPASS': True}. Best is trial 46 with value: 0.6527777777777777.
[I 2026-06-15 05:23:35,014] Trial 52 finished with value: 0.3211805555555556 and parameters: {'FLOW': 12.04279699872667, 'FHIGH': 95.68706048530413, 'LR_EXP': -2.7238960805546646, 'DROPOUT': 0.4837646828886, 'BETA': 0.8205537197514028, 'SPIKE_GRAD_SLOPE': 30.319748352176862, 'TEMPORAL_FILTERS': 7, 'DEPTH_MULTIPLIER': 2, 'POINTWISE_FILTERS': 13, 'TEMPORAL_KERNEL_DIV': 5, 'SEPARABLE_KERNEL_SIZE': 25, 'POOL1_SIZE': 6, 'POOL2_SIZE': 6, 'NORM_AXIS': 'full', 'RUN_ZSCORE': False, 'RUN_BANDPASS': True}. Best is trial 46 with value: 0.6527777777777777.
[I 2026-06-15 05:35:20,241] Trial 53 finished with value: 0.2621527777777778 and parameters: {'FLOW': 24.073305930945338, 'FHIGH': 40.63892758533399, 'LR_EXP': -2.408308679461763, 'DROPOUT': 0.3048296840755378, 'BETA': 0.5033369545561075, 'SPIKE_GRAD_SLOPE': 40.39418046902079, 'TEMPORAL_FILTERS': 11, 'DEPTH_MULTIPLIER': 2, 'POINTWISE_FILTERS': 37, 'TEMPORAL_KERNEL_DIV': 3, 'SEPARABLE_KERNEL_SIZE': 32, 'POOL1_SIZE': 4, 'POOL2_SIZE': 5, 'NORM_AXIS': 'full', 'RUN_ZSCORE': True, 'RUN_BANDPASS': True}. Best is trial 46 with value: 0.6527777777777777.
[I 2026-06-15 05:45:34,007] Trial 54 finished with value: 0.25 and parameters: {'FLOW': 30.7819527700168, 'FHIGH': 100.43975620229003, 'LR_EXP': -2.169883869570828, 'DROPOUT': 0.5444415744304232, 'BETA': 0.8312256471527688, 'SPIKE_GRAD_SLOPE': 77.31749468010806, 'TEMPORAL_FILTERS': 15, 'DEPTH_MULTIPLIER': 1, 'POINTWISE_FILTERS': 30, 'TEMPORAL_KERNEL_DIV': 4, 'SEPARABLE_KERNEL_SIZE': 22, 'POOL1_SIZE': 4, 'POOL2_SIZE': 3, 'NORM_AXIS': 'no_channel', 'RUN_ZSCORE': False, 'RUN_BANDPASS': True}. Best is trial 46 with value: 0.6527777777777777.
[I 2026-06-15 05:59:27,260] Trial 55 finished with value: 0.2482638888888889 and parameters: {'FLOW': 31.470330034135443, 'FHIGH': 80.61551819398453, 'LR_EXP': -3.392258010338303, 'DROPOUT': 0.7301718230862925, 'BETA': 0.5049232713493298, 'SPIKE_GRAD_SLOPE': 23.48183981581071, 'TEMPORAL_FILTERS': 10, 'DEPTH_MULTIPLIER': 4, 'POINTWISE_FILTERS': 24, 'TEMPORAL_KERNEL_DIV': 2, 'SEPARABLE_KERNEL_SIZE': 8, 'POOL1_SIZE': 3, 'POOL2_SIZE': 2, 'NORM_AXIS': 'full', 'RUN_ZSCORE': False, 'RUN_BANDPASS': True}. Best is trial 46 with value: 0.6527777777777777.
[I 2026-06-15 06:11:38,504] Trial 56 finished with value: 0.2951388888888889 and parameters: {'FLOW': 21.68824054814455, 'FHIGH': 67.03655945768699, 'LR_EXP': -2.558033794089761, 'DROPOUT': 0.1310392056803583, 'BETA': 0.7797857466576104, 'SPIKE_GRAD_SLOPE': 55.28686735706739, 'TEMPORAL_FILTERS': 15, 'DEPTH_MULTIPLIER': 1, 'POINTWISE_FILTERS': 9, 'TEMPORAL_KERNEL_DIV': 3, 'SEPARABLE_KERNEL_SIZE': 29, 'POOL1_SIZE': 2, 'POOL2_SIZE': 3, 'NORM_AXIS': 'no_channel', 'RUN_ZSCORE': False, 'RUN_BANDPASS': True}. Best is trial 46 with value: 0.6527777777777777.
[I 2026-06-15 06:20:48,207] Trial 57 finished with value: 0.4340277777777778 and parameters: {'FLOW': 9.36621069575063, 'FHIGH': 100.4606617996521, 'LR_EXP': -3.5212950663349956, 'DROPOUT': 0.3895753508206169, 'BETA': 0.8124647247915033, 'SPIKE_GRAD_SLOPE': 95.3541441556416, 'TEMPORAL_FILTERS': 12, 'DEPTH_MULTIPLIER': 3, 'POINTWISE_FILTERS': 49, 'TEMPORAL_KERNEL_DIV': 8, 'SEPARABLE_KERNEL_SIZE': 11, 'POOL1_SIZE': 8, 'POOL2_SIZE': 5, 'NORM_AXIS': 'no_channel', 'RUN_ZSCORE': True, 'RUN_BANDPASS': False}. Best is trial 46 with value: 0.6527777777777777.
[I 2026-06-15 06:33:51,648] Trial 58 finished with value: 0.20833333333333334 and parameters: {'FLOW': 27.990268917317362, 'FHIGH': 69.56366537389485, 'LR_EXP': -2.5884442145419655, 'DROPOUT': 0.6875469301480049, 'BETA': 0.795942643741598, 'SPIKE_GRAD_SLOPE': 94.39558345634504, 'TEMPORAL_FILTERS': 22, 'DEPTH_MULTIPLIER': 2, 'POINTWISE_FILTERS': 16, 'TEMPORAL_KERNEL_DIV': 5, 'SEPARABLE_KERNEL_SIZE': 14, 'POOL1_SIZE': 2, 'POOL2_SIZE': 2, 'NORM_AXIS': 'no_channel', 'RUN_ZSCORE': False, 'RUN_BANDPASS': True}. Best is trial 46 with value: 0.6527777777777777.
[I 2026-06-15 06:50:45,482] Trial 59 finished with value: 0.5052083333333334 and parameters: {'FLOW': 8.804057503076233, 'FHIGH': 54.343259714238854, 'LR_EXP': -2.8223800893683033, 'DROPOUT': 0.1402969559221211, 'BETA': 0.7545297557821717, 'SPIKE_GRAD_SLOPE': 29.323391097554264, 'TEMPORAL_FILTERS': 25, 'DEPTH_MULTIPLIER': 4, 'POINTWISE_FILTERS': 35, 'TEMPORAL_KERNEL_DIV': 6, 'SEPARABLE_KERNEL_SIZE': 15, 'POOL1_SIZE': 2, 'POOL2_SIZE': 6, 'NORM_AXIS': 'full', 'RUN_ZSCORE': False, 'RUN_BANDPASS': True}. Best is trial 46 with value: 0.6527777777777777.
[I 2026-06-15 07:03:17,656] Trial 60 finished with value: 0.5590277777777778 and parameters: {'FLOW': 34.67339110955186, 'FHIGH': 118.75870867108397, 'LR_EXP': -2.7370974178145095, 'DROPOUT': 0.48297408367696093, 'BETA': 0.576089829115538, 'SPIKE_GRAD_SLOPE': 43.256260466997006, 'TEMPORAL_FILTERS': 21, 'DEPTH_MULTIPLIER': 2, 'POINTWISE_FILTERS': 58, 'TEMPORAL_KERNEL_DIV': 5, 'SEPARABLE_KERNEL_SIZE': 26, 'POOL1_SIZE': 7, 'POOL2_SIZE': 3, 'NORM_AXIS': 'no_channel', 'RUN_ZSCORE': False, 'RUN_BANDPASS': False}. Best is trial 46 with value: 0.6527777777777777.
[I 2026-06-15 07:14:12,910] Trial 61 finished with value: 0.5416666666666667 and parameters: {'FLOW': 12.574671979836538, 'FHIGH': 63.64622151065012, 'LR_EXP': -2.6026410221495335, 'DROPOUT': 0.3178908008626218, 'BETA': 0.6940683798028199, 'SPIKE_GRAD_SLOPE': 64.74013897733579, 'TEMPORAL_FILTERS': 12, 'DEPTH_MULTIPLIER': 4, 'POINTWISE_FILTERS': 20, 'TEMPORAL_KERNEL_DIV': 5, 'SEPARABLE_KERNEL_SIZE': 22, 'POOL1_SIZE': 4, 'POOL2_SIZE': 6, 'NORM_AXIS': 'no_channel', 'RUN_ZSCORE': False, 'RUN_BANDPASS': False}. Best is trial 46 with value: 0.6527777777777777.
[I 2026-06-15 07:32:57,592] Trial 62 finished with value: 0.2864583333333333 and parameters: {'FLOW': 23.765060600311468, 'FHIGH': 87.7896399909207, 'LR_EXP': -2.4599514103252833, 'DROPOUT': 0.35057575375075534, 'BETA': 0.5698332697558781, 'SPIKE_GRAD_SLOPE': 48.841996054010046, 'TEMPORAL_FILTERS': 29, 'DEPTH_MULTIPLIER': 4, 'POINTWISE_FILTERS': 33, 'TEMPORAL_KERNEL_DIV': 5, 'SEPARABLE_KERNEL_SIZE': 5, 'POOL1_SIZE': 5, 'POOL2_SIZE': 6, 'NORM_AXIS': 'full', 'RUN_ZSCORE': True, 'RUN_BANDPASS': True}. Best is trial 46 with value: 0.6527777777777777.
[I 2026-06-15 07:43:47,975] Trial 63 finished with value: 0.24479166666666666 and parameters: {'FLOW': 22.980082093939977, 'FHIGH': 113.19616326071785, 'LR_EXP': -4.496666997534483, 'DROPOUT': 0.40574597205438945, 'BETA': 0.8565191924660294, 'SPIKE_GRAD_SLOPE': 56.648357136337296, 'TEMPORAL_FILTERS': 23, 'DEPTH_MULTIPLIER': 1, 'POINTWISE_FILTERS': 10, 'TEMPORAL_KERNEL_DIV': 8, 'SEPARABLE_KERNEL_SIZE': 12, 'POOL1_SIZE': 7, 'POOL2_SIZE': 4, 'NORM_AXIS': 'full', 'RUN_ZSCORE': True, 'RUN_BANDPASS': True}. Best is trial 46 with value: 0.6527777777777777.
[I 2026-06-15 07:53:34,311] Trial 64 finished with value: 0.4340277777777778 and parameters: {'FLOW': 27.389499681847568, 'FHIGH': 77.81618913927278, 'LR_EXP': -4.388780842686776, 'DROPOUT': 0.6676497084785745, 'BETA': 0.5189209861994102, 'SPIKE_GRAD_SLOPE': 64.84424425404087, 'TEMPORAL_FILTERS': 17, 'DEPTH_MULTIPLIER': 1, 'POINTWISE_FILTERS': 35, 'TEMPORAL_KERNEL_DIV': 6, 'SEPARABLE_KERNEL_SIZE': 24, 'POOL1_SIZE': 6, 'POOL2_SIZE': 8, 'NORM_AXIS': 'no_channel', 'RUN_ZSCORE': True, 'RUN_BANDPASS': False}. Best is trial 46 with value: 0.6527777777777777.
[I 2026-06-15 08:02:41,067] Trial 65 finished with value: 0.3229166666666667 and parameters: {'FLOW': 19.156954112349844, 'FHIGH': 99.69718554065895, 'LR_EXP': -4.104112238368344, 'DROPOUT': 0.3778274839759904, 'BETA': 0.6004095199475699, 'SPIKE_GRAD_SLOPE': 42.57404324491324, 'TEMPORAL_FILTERS': 10, 'DEPTH_MULTIPLIER': 3, 'POINTWISE_FILTERS': 55, 'TEMPORAL_KERNEL_DIV': 6, 'SEPARABLE_KERNEL_SIZE': 25, 'POOL1_SIZE': 6, 'POOL2_SIZE': 6, 'NORM_AXIS': 'no_channel', 'RUN_ZSCORE': True, 'RUN_BANDPASS': True}. Best is trial 46 with value: 0.6527777777777777.
[I 2026-06-15 08:12:09,451] Trial 66 finished with value: 0.5729166666666667 and parameters: {'FLOW': 6.965136647827037, 'FHIGH': 70.24362174091324, 'LR_EXP': -3.2943534290938916, 'DROPOUT': 0.16812580514562675, 'BETA': 0.6737478596043296, 'SPIKE_GRAD_SLOPE': 50.67044903061198, 'TEMPORAL_FILTERS': 11, 'DEPTH_MULTIPLIER': 4, 'POINTWISE_FILTERS': 49, 'TEMPORAL_KERNEL_DIV': 8, 'SEPARABLE_KERNEL_SIZE': 21, 'POOL1_SIZE': 5, 'POOL2_SIZE': 6, 'NORM_AXIS': 'no_channel', 'RUN_ZSCORE': False, 'RUN_BANDPASS': False}. Best is trial 46 with value: 0.6527777777777777.
[I 2026-06-15 08:23:36,528] Trial 67 finished with value: 0.3454861111111111 and parameters: {'FLOW': 19.3115268190277, 'FHIGH': 106.93311955037866, 'LR_EXP': -2.6801290413066696, 'DROPOUT': 0.42249914495426055, 'BETA': 0.7805940465813488, 'SPIKE_GRAD_SLOPE': 17.523103061074423, 'TEMPORAL_FILTERS': 16, 'DEPTH_MULTIPLIER': 2, 'POINTWISE_FILTERS': 40, 'TEMPORAL_KERNEL_DIV': 4, 'SEPARABLE_KERNEL_SIZE': 23, 'POOL1_SIZE': 5, 'POOL2_SIZE': 2, 'NORM_AXIS': 'no_channel', 'RUN_ZSCORE': False, 'RUN_BANDPASS': True}. Best is trial 46 with value: 0.6527777777777777.
[I 2026-06-15 08:39:15,147] Trial 68 finished with value: 0.328125 and parameters: {'FLOW': 18.325986769028844, 'FHIGH': 103.73461080878423, 'LR_EXP': -3.833106191756911, 'DROPOUT': 0.47229542388082846, 'BETA': 0.8881408749127147, 'SPIKE_GRAD_SLOPE': 66.3226894574793, 'TEMPORAL_FILTERS': 30, 'DEPTH_MULTIPLIER': 2, 'POINTWISE_FILTERS': 46, 'TEMPORAL_KERNEL_DIV': 5, 'SEPARABLE_KERNEL_SIZE': 15, 'POOL1_SIZE': 8, 'POOL2_SIZE': 2, 'NORM_AXIS': 'full', 'RUN_ZSCORE': False, 'RUN_BANDPASS': True}. Best is trial 46 with value: 0.6527777777777777.
[I 2026-06-15 08:47:33,687] Trial 69 finished with value: 0.2534722222222222 and parameters: {'FLOW': 30.433606097491968, 'FHIGH': 33.76148496775812, 'LR_EXP': -3.610917826842778, 'DROPOUT': 0.18407636022592422, 'BETA': 0.9511492865502023, 'SPIKE_GRAD_SLOPE': 45.33429641439363, 'TEMPORAL_FILTERS': 8, 'DEPTH_MULTIPLIER': 1, 'POINTWISE_FILTERS': 10, 'TEMPORAL_KERNEL_DIV': 4, 'SEPARABLE_KERNEL_SIZE': 30, 'POOL1_SIZE': 2, 'POOL2_SIZE': 8, 'NORM_AXIS': 'no_channel', 'RUN_ZSCORE': True, 'RUN_BANDPASS': True}. Best is trial 46 with value: 0.6527777777777777.
[I 2026-06-15 08:54:53,448] Trial 70 finished with value: 0.4618055555555556 and parameters: {'FLOW': 34.12594238074773, 'FHIGH': 36.85426020116383, 'LR_EXP': -3.81265632220805, 'DROPOUT': 0.12640548915019945, 'BETA': 0.848109506826124, 'SPIKE_GRAD_SLOPE': 65.64492841836255, 'TEMPORAL_FILTERS': 8, 'DEPTH_MULTIPLIER': 1, 'POINTWISE_FILTERS': 33, 'TEMPORAL_KERNEL_DIV': 6, 'SEPARABLE_KERNEL_SIZE': 12, 'POOL1_SIZE': 5, 'POOL2_SIZE': 8, 'NORM_AXIS': 'full', 'RUN_ZSCORE': True, 'RUN_BANDPASS': False}. Best is trial 46 with value: 0.6527777777777777.
[I 2026-06-15 09:02:13,886] Trial 71 finished with value: 0.390625 and parameters: {'FLOW': 27.980586102243457, 'FHIGH': 72.18846280808957, 'LR_EXP': -2.4304516985760785, 'DROPOUT': 0.6877908060037551, 'BETA': 0.839337399129227, 'SPIKE_GRAD_SLOPE': 40.84217077637061, 'TEMPORAL_FILTERS': 5, 'DEPTH_MULTIPLIER': 2, 'POINTWISE_FILTERS': 37, 'TEMPORAL_KERNEL_DIV': 5, 'SEPARABLE_KERNEL_SIZE': 21, 'POOL1_SIZE': 8, 'POOL2_SIZE': 4, 'NORM_AXIS': 'full', 'RUN_ZSCORE': True, 'RUN_BANDPASS': False}. Best is trial 46 with value: 0.6527777777777777.
[I 2026-06-15 09:17:20,670] Trial 72 finished with value: 0.2621527777777778 and parameters: {'FLOW': 36.74654174064412, 'FHIGH': 80.20157860385905, 'LR_EXP': -2.601850994011344, 'DROPOUT': 0.23640408688658648, 'BETA': 0.7786696301028182, 'SPIKE_GRAD_SLOPE': 99.64363617535456, 'TEMPORAL_FILTERS': 31, 'DEPTH_MULTIPLIER': 2, 'POINTWISE_FILTERS': 18, 'TEMPORAL_KERNEL_DIV': 8, 'SEPARABLE_KERNEL_SIZE': 30, 'POOL1_SIZE': 4, 'POOL2_SIZE': 6, 'NORM_AXIS': 'no_channel', 'RUN_ZSCORE': False, 'RUN_BANDPASS': True}. Best is trial 46 with value: 0.6527777777777777.
[I 2026-06-15 09:24:46,059] Trial 73 finished with value: 0.2586805555555556 and parameters: {'FLOW': 27.14365760484967, 'FHIGH': 113.68334784069923, 'LR_EXP': -3.8797761527098107, 'DROPOUT': 0.23860148881061596, 'BETA': 0.9876949658856442, 'SPIKE_GRAD_SLOPE': 5.877124089545212, 'TEMPORAL_FILTERS': 5, 'DEPTH_MULTIPLIER': 2, 'POINTWISE_FILTERS': 44, 'TEMPORAL_KERNEL_DIV': 5, 'SEPARABLE_KERNEL_SIZE': 29, 'POOL1_SIZE': 6, 'POOL2_SIZE': 4, 'NORM_AXIS': 'full', 'RUN_ZSCORE': False, 'RUN_BANDPASS': True}. Best is trial 46 with value: 0.6527777777777777.
slurmstepd: error: *** JOB 43808347 ON fg1 CANCELLED AT 2026-06-15T09:36:32 ***
