mkdir: cannot create directory ‘/scratch/mne_data’: Permission denied

[notice] A new release of pip is available: 24.2 -> 26.1.2
[notice] To update, run: pip install --upgrade pip

[notice] A new release of pip is available: 24.2 -> 26.1.2
[notice] To update, run: pip install --upgrade pip
ERROR: Invalid requirement: 'Binary file requirements.txt matches': Expected end or semicolon (after name and no valid version specifier)
    Binary file requirements.txt matches
           ^ (from line 1 of /home/aleksander.berezowsk/requirements_notorch.txt)

[notice] A new release of pip is available: 24.2 -> 26.1.2
[notice] To update, run: pip install --upgrade pip

[notice] A new release of pip is available: 24.2 -> 26.1.2
[notice] To update, run: pip install --upgrade pip
/home/aleksander.berezowsk/spiking-eegnet/src/main.py:92: ExperimentalWarning: Argument ``multivariate`` is an experimental feature. The interface can change in the future.
  sampler=TPESampler(n_startup_trials=tpe_trails, multivariate=True, group=True)
/home/aleksander.berezowsk/spiking-eegnet/src/main.py:92: ExperimentalWarning: Argument ``group`` is an experimental feature. The interface can change in the future.
  sampler=TPESampler(n_startup_trials=tpe_trails, multivariate=True, group=True)
[I 2026-07-04 05:59:20,961] Using an existing study with name 'snn_eegnet_v4_400_40' instead of creating a new one.
[I 2026-07-04 09:04:54,352] Trial 21 finished with value: 0.5354938271604939 and parameters: {'LR_EXP': -3.8968508594463254, 'DROPOUT': 0.42281563543798456, 'BETA': 0.8511823479612226, 'SPIKE_GRAD_SLOPE': 5.45804747728452, 'TEMPORAL_FILTERS': 31, 'DEPTH_MULTIPLIER': 2, 'POINTWISE_FILTERS': 64, 'TEMPORAL_KERNEL_DIV': 3, 'SEPARABLE_KERNEL_SIZE': 46, 'POOL1_SIZE': 8, 'POOL2_SIZE': 5, 'N_STEPS_TRAIN': 10, 'N_STEPS_EVAL': 24, 'READOUT_MODE': 'spk_mean'}. Best is trial 10 with value: 0.566550925925926.
[I 2026-07-04 14:02:28,366] Trial 24 finished with value: 0.5353009259259259 and parameters: {'LR_EXP': -3.432256006598086, 'DROPOUT': 0.05656310077305972, 'BETA': 0.7886709145233239, 'SPIKE_GRAD_SLOPE': 2.422564774258469, 'TEMPORAL_FILTERS': 63, 'DEPTH_MULTIPLIER': 1, 'POINTWISE_FILTERS': 55, 'TEMPORAL_KERNEL_DIV': 4, 'SEPARABLE_KERNEL_SIZE': 9, 'POOL1_SIZE': 3, 'POOL2_SIZE': 3, 'N_STEPS_TRAIN': 11, 'N_STEPS_EVAL': 23, 'READOUT_MODE': 'spk_mean'}. Best is trial 10 with value: 0.566550925925926.
[I 2026-07-04 16:35:02,119] Trial 27 finished with value: 0.538966049382716 and parameters: {'LR_EXP': -2.200735384206318, 'DROPOUT': 0.4788015831081735, 'BETA': 0.7502436059988096, 'SPIKE_GRAD_SLOPE': 2.5739187106484733, 'TEMPORAL_FILTERS': 58, 'DEPTH_MULTIPLIER': 3, 'POINTWISE_FILTERS': 28, 'TEMPORAL_KERNEL_DIV': 5, 'SEPARABLE_KERNEL_SIZE': 34, 'POOL1_SIZE': 4, 'POOL2_SIZE': 2, 'N_STEPS_TRAIN': 4, 'N_STEPS_EVAL': 28, 'READOUT_MODE': 'spk_sum'}. Best is trial 10 with value: 0.566550925925926.
[I 2026-07-04 17:54:59,236] Trial 32 finished with value: 0.546875 and parameters: {'LR_EXP': -3.0333974340717753, 'DROPOUT': 0.4309480664593468, 'BETA': 0.7584589281300457, 'SPIKE_GRAD_SLOPE': 14.241835490951313, 'TEMPORAL_FILTERS': 11, 'DEPTH_MULTIPLIER': 4, 'POINTWISE_FILTERS': 12, 'TEMPORAL_KERNEL_DIV': 8, 'SEPARABLE_KERNEL_SIZE': 41, 'POOL1_SIZE': 3, 'POOL2_SIZE': 3, 'N_STEPS_TRAIN': 9, 'N_STEPS_EVAL': 8, 'READOUT_MODE': 'spk_mean'}. Best is trial 10 with value: 0.566550925925926.
[I 2026-07-04 19:32:26,739] Trial 34 finished with value: 0.48900462962962965 and parameters: {'LR_EXP': -4.371484752807624, 'DROPOUT': 0.25394801512980925, 'BETA': 0.7993424625307872, 'SPIKE_GRAD_SLOPE': 20.29491595893758, 'TEMPORAL_FILTERS': 24, 'DEPTH_MULTIPLIER': 3, 'POINTWISE_FILTERS': 35, 'TEMPORAL_KERNEL_DIV': 3, 'SEPARABLE_KERNEL_SIZE': 20, 'POOL1_SIZE': 5, 'POOL2_SIZE': 7, 'N_STEPS_TRAIN': 5, 'N_STEPS_EVAL': 26, 'READOUT_MODE': 'spk_mean'}. Best is trial 10 with value: 0.566550925925926.
[I 2026-07-04 22:48:40,483] Trial 36 finished with value: 0.4565972222222222 and parameters: {'LR_EXP': -4.440598188362545, 'DROPOUT': 0.1544825471439463, 'BETA': 0.9786701890398034, 'SPIKE_GRAD_SLOPE': 16.967906158725828, 'TEMPORAL_FILTERS': 11, 'DEPTH_MULTIPLIER': 4, 'POINTWISE_FILTERS': 18, 'TEMPORAL_KERNEL_DIV': 3, 'SEPARABLE_KERNEL_SIZE': 19, 'POOL1_SIZE': 7, 'POOL2_SIZE': 7, 'N_STEPS_TRAIN': 16, 'N_STEPS_EVAL': 24, 'READOUT_MODE': 'spk_mean'}. Best is trial 10 with value: 0.566550925925926.
[W 2026-07-04 22:48:43,946] Trial 39 failed with parameters: {'LR_EXP': -2.97136103931061, 'DROPOUT': 0.35869999170731925, 'BETA': 0.8373993707755565, 'SPIKE_GRAD_SLOPE': 20.218448065407994, 'TEMPORAL_FILTERS': 36, 'DEPTH_MULTIPLIER': 1, 'POINTWISE_FILTERS': 25, 'TEMPORAL_KERNEL_DIV': 4, 'SEPARABLE_KERNEL_SIZE': 30, 'POOL1_SIZE': 4, 'POOL2_SIZE': 2, 'N_STEPS_TRAIN': 11, 'N_STEPS_EVAL': 4, 'READOUT_MODE': 'spk_sum'} because of the following error: OutOfMemoryError('CUDA out of memory. Tried to allocate 98.00 MiB. GPU 0 has a total capacity of 15.77 GiB of which 82.19 MiB is free. Including non-PyTorch memory, this process has 15.68 GiB memory in use. Of the allocated memory 13.51 GiB is allocated by PyTorch, and 1.80 GiB is reserved by PyTorch but unallocated. If reserved but unallocated memory is large try setting PYTORCH_CUDA_ALLOC_CONF=expandable_segments:True to avoid fragmentation.  See documentation for Memory Management  (https://pytorch.org/docs/stable/notes/cuda.html#environment-variables)').
Traceback (most recent call last):
  File "/home/aleksander.berezowsk/venv/lib/python3.12/site-packages/optuna/study/_optimize.py", line 206, in _run_trial
    value_or_values = func(trial)
                      ^^^^^^^^^^^
  File "/home/aleksander.berezowsk/spiking-eegnet/src/main.py", line 47, in objective
    return pipeline(**params, **FIXED, trial=trial, save_plots=False)
           ^^^^^^^^^^^^^^^^^^^^^^^^^^^^^^^^^^^^^^^^^^^^^^^^^^^^^^^^^^
  File "/home/aleksander.berezowsk/spiking-eegnet/src/pipeline.py", line 135, in pipeline
    histories, accs, mean_acc = experiment_loso_all(
                                ^^^^^^^^^^^^^^^^^^^^
  File "/home/aleksander.berezowsk/spiking-eegnet/src/experiment_loso.py", line 71, in experiment_loso_all
    history, final_acc, _model = experiment_loso(
                                 ^^^^^^^^^^^^^^^^
  File "/home/aleksander.berezowsk/spiking-eegnet/src/experiment_loso.py", line 30, in experiment_loso
    history = run_training(
              ^^^^^^^^^^^^^
  File "/home/aleksander.berezowsk/spiking-eegnet/src/run_training.py", line 50, in run_training
    loss = train_one_epoch(model, train_loader, optimizer, criterion, device,
           ^^^^^^^^^^^^^^^^^^^^^^^^^^^^^^^^^^^^^^^^^^^^^^^^^^^^^^^^^^^^^^^^^^
  File "/home/aleksander.berezowsk/spiking-eegnet/src/train_one_epoch.py", line 53, in train_one_epoch
    spk, mem = model(xb, num_steps=n_steps)
               ^^^^^^^^^^^^^^^^^^^^^^^^^^^^
  File "/home/aleksander.berezowsk/venv/lib/python3.12/site-packages/torch/nn/modules/module.py", line 1553, in _wrapped_call_impl
    return self._call_impl(*args, **kwargs)
           ^^^^^^^^^^^^^^^^^^^^^^^^^^^^^^^^
  File "/home/aleksander.berezowsk/venv/lib/python3.12/site-packages/torch/nn/modules/module.py", line 1562, in _call_impl
    return forward_call(*args, **kwargs)
           ^^^^^^^^^^^^^^^^^^^^^^^^^^^^^
  File "/home/aleksander.berezowsk/spiking-eegnet/src/spiking_eegnet.py", line 233, in forward
    spk1, mem1 = self.lif1(cur, mem1)
                 ^^^^^^^^^^^^^^^^^^^^
  File "/home/aleksander.berezowsk/venv/lib/python3.12/site-packages/torch/nn/modules/module.py", line 1553, in _wrapped_call_impl
    return self._call_impl(*args, **kwargs)
           ^^^^^^^^^^^^^^^^^^^^^^^^^^^^^^^^
  File "/home/aleksander.berezowsk/venv/lib/python3.12/site-packages/torch/nn/modules/module.py", line 1562, in _call_impl
    return forward_call(*args, **kwargs)
           ^^^^^^^^^^^^^^^^^^^^^^^^^^^^^
  File "/home/aleksander.berezowsk/venv/lib/python3.12/site-packages/snntorch/_neurons/leaky.py", line 209, in forward
    self.reset = self.mem_reset(self.mem)
                 ^^^^^^^^^^^^^^^^^^^^^^^^
  File "/home/aleksander.berezowsk/venv/lib/python3.12/site-packages/snntorch/_neurons/neurons.py", line 106, in mem_reset
    reset = self.spike_grad(mem_shift).clone().detach()
            ^^^^^^^^^^^^^^^^^^^^^^^^^^^^^^^^^^
torch.OutOfMemoryError: CUDA out of memory. Tried to allocate 98.00 MiB. GPU 0 has a total capacity of 15.77 GiB of which 82.19 MiB is free. Including non-PyTorch memory, this process has 15.68 GiB memory in use. Of the allocated memory 13.51 GiB is allocated by PyTorch, and 1.80 GiB is reserved by PyTorch but unallocated. If reserved but unallocated memory is large try setting PYTORCH_CUDA_ALLOC_CONF=expandable_segments:True to avoid fragmentation.  See documentation for Memory Management  (https://pytorch.org/docs/stable/notes/cuda.html#environment-variables)
[W 2026-07-04 22:48:43,989] Trial 39 failed with value None.
Traceback (most recent call last):
  File "/home/aleksander.berezowsk/spiking-eegnet/src/main.py", line 98, in <module>
    study.optimize(objective, n_trials=n_trials, n_jobs=1,
  File "/home/aleksander.berezowsk/venv/lib/python3.12/site-packages/optuna/study/study.py", line 516, in optimize
    _optimize(
  File "/home/aleksander.berezowsk/venv/lib/python3.12/site-packages/optuna/study/_optimize.py", line 68, in _optimize
    _optimize_sequential(
  File "/home/aleksander.berezowsk/venv/lib/python3.12/site-packages/optuna/study/_optimize.py", line 165, in _optimize_sequential
    frozen_trial_id = _run_trial(study, func, catch)
                      ^^^^^^^^^^^^^^^^^^^^^^^^^^^^^^
  File "/home/aleksander.berezowsk/venv/lib/python3.12/site-packages/optuna/study/_optimize.py", line 263, in _run_trial
    raise func_err
  File "/home/aleksander.berezowsk/venv/lib/python3.12/site-packages/optuna/study/_optimize.py", line 206, in _run_trial
    value_or_values = func(trial)
                      ^^^^^^^^^^^
  File "/home/aleksander.berezowsk/spiking-eegnet/src/main.py", line 47, in objective
    return pipeline(**params, **FIXED, trial=trial, save_plots=False)
           ^^^^^^^^^^^^^^^^^^^^^^^^^^^^^^^^^^^^^^^^^^^^^^^^^^^^^^^^^^
  File "/home/aleksander.berezowsk/spiking-eegnet/src/pipeline.py", line 135, in pipeline
    histories, accs, mean_acc = experiment_loso_all(
                                ^^^^^^^^^^^^^^^^^^^^
  File "/home/aleksander.berezowsk/spiking-eegnet/src/experiment_loso.py", line 71, in experiment_loso_all
    history, final_acc, _model = experiment_loso(
                                 ^^^^^^^^^^^^^^^^
  File "/home/aleksander.berezowsk/spiking-eegnet/src/experiment_loso.py", line 30, in experiment_loso
    history = run_training(
              ^^^^^^^^^^^^^
  File "/home/aleksander.berezowsk/spiking-eegnet/src/run_training.py", line 50, in run_training
    loss = train_one_epoch(model, train_loader, optimizer, criterion, device,
           ^^^^^^^^^^^^^^^^^^^^^^^^^^^^^^^^^^^^^^^^^^^^^^^^^^^^^^^^^^^^^^^^^^
  File "/home/aleksander.berezowsk/spiking-eegnet/src/train_one_epoch.py", line 53, in train_one_epoch
    spk, mem = model(xb, num_steps=n_steps)
               ^^^^^^^^^^^^^^^^^^^^^^^^^^^^
  File "/home/aleksander.berezowsk/venv/lib/python3.12/site-packages/torch/nn/modules/module.py", line 1553, in _wrapped_call_impl
    return self._call_impl(*args, **kwargs)
           ^^^^^^^^^^^^^^^^^^^^^^^^^^^^^^^^
  File "/home/aleksander.berezowsk/venv/lib/python3.12/site-packages/torch/nn/modules/module.py", line 1562, in _call_impl
    return forward_call(*args, **kwargs)
           ^^^^^^^^^^^^^^^^^^^^^^^^^^^^^
  File "/home/aleksander.berezowsk/spiking-eegnet/src/spiking_eegnet.py", line 233, in forward
    spk1, mem1 = self.lif1(cur, mem1)
                 ^^^^^^^^^^^^^^^^^^^^
  File "/home/aleksander.berezowsk/venv/lib/python3.12/site-packages/torch/nn/modules/module.py", line 1553, in _wrapped_call_impl
    return self._call_impl(*args, **kwargs)
           ^^^^^^^^^^^^^^^^^^^^^^^^^^^^^^^^
  File "/home/aleksander.berezowsk/venv/lib/python3.12/site-packages/torch/nn/modules/module.py", line 1562, in _call_impl
    return forward_call(*args, **kwargs)
           ^^^^^^^^^^^^^^^^^^^^^^^^^^^^^
  File "/home/aleksander.berezowsk/venv/lib/python3.12/site-packages/snntorch/_neurons/leaky.py", line 209, in forward
    self.reset = self.mem_reset(self.mem)
                 ^^^^^^^^^^^^^^^^^^^^^^^^
  File "/home/aleksander.berezowsk/venv/lib/python3.12/site-packages/snntorch/_neurons/neurons.py", line 106, in mem_reset
    reset = self.spike_grad(mem_shift).clone().detach()
            ^^^^^^^^^^^^^^^^^^^^^^^^^^^^^^^^^^
torch.OutOfMemoryError: CUDA out of memory. Tried to allocate 98.00 MiB. GPU 0 has a total capacity of 15.77 GiB of which 82.19 MiB is free. Including non-PyTorch memory, this process has 15.68 GiB memory in use. Of the allocated memory 13.51 GiB is allocated by PyTorch, and 1.80 GiB is reserved by PyTorch but unallocated. If reserved but unallocated memory is large try setting PYTORCH_CUDA_ALLOC_CONF=expandable_segments:True to avoid fragmentation.  See documentation for Memory Management  (https://pytorch.org/docs/stable/notes/cuda.html#environment-variables)
