
[notice] A new release of pip is available: 24.2 -> 26.1.2
[notice] To update, run: pip install --upgrade pip

[notice] A new release of pip is available: 24.2 -> 26.1.2
[notice] To update, run: pip install --upgrade pip
ERROR: Invalid requirement: 'Binary file requirements.txt matches': Expected end or semicolon (after name and no valid version specifier)
    Binary file requirements.txt matches
           ^ (from line 1 of /home/aleksander.berezowsk/requirements_notorch.txt)

[notice] A new release of pip is available: 24.2 -> 26.1.2
[notice] To update, run: pip install --upgrade pip

[notice] A new release of pip is available: 24.2 -> 26.1.2
[notice] To update, run: pip install --upgrade pip
/home/aleksander.berezowsk/spiking-eegnet/src/main.py:86: ExperimentalWarning: Argument ``multivariate`` is an experimental feature. The interface can change in the future.
  sampler=TPESampler(n_startup_trials=tpe_trails, multivariate=True, group=True)
/home/aleksander.berezowsk/spiking-eegnet/src/main.py:86: ExperimentalWarning: Argument ``group`` is an experimental feature. The interface can change in the future.
  sampler=TPESampler(n_startup_trials=tpe_trails, multivariate=True, group=True)
[I 2026-06-18 12:28:06,631] Using an existing study with name 'snn_eegnet_v2_200_20' instead of creating a new one.
[I 2026-06-18 12:28:56,436] Trial 528 pruned. 
[I 2026-06-18 12:29:37,340] Trial 529 pruned. 
[I 2026-06-18 12:30:08,314] Trial 530 pruned. 
[I 2026-06-18 12:30:43,497] Trial 531 pruned. 
[I 2026-06-18 12:31:14,366] Trial 532 pruned. 
[I 2026-06-18 12:31:58,951] Trial 533 pruned. 
[I 2026-06-18 12:43:11,388] Trial 534 finished with value: 0.6024305555555556 and parameters: {'FLOW': 5.901723845586294, 'FHIGH': 75.02559255648805, 'LR_EXP': -2.624799781618023, 'DROPOUT': 0.5137133151197756, 'BETA': 0.5533722359235643, 'SPIKE_GRAD_SLOPE': 10.444121210161049, 'TEMPORAL_FILTERS': 16, 'DEPTH_MULTIPLIER': 3, 'POINTWISE_FILTERS': 9, 'TEMPORAL_KERNEL_DIV': 7, 'SEPARABLE_KERNEL_SIZE': 19, 'POOL1_SIZE': 4, 'POOL2_SIZE': 8, 'NORM_AXIS': 'full', 'RUN_ZSCORE': True}. Best is trial 461 with value: 0.6545138888888888.
[I 2026-06-18 12:43:41,453] Trial 535 pruned. 
[I 2026-06-18 12:56:36,131] Trial 536 finished with value: 0.5746527777777778 and parameters: {'FLOW': 8.7816453476768, 'FHIGH': 93.11017529934276, 'LR_EXP': -2.9532718259688453, 'DROPOUT': 0.6634257668227471, 'BETA': 0.8504092946295239, 'SPIKE_GRAD_SLOPE': 15.376215341815895, 'TEMPORAL_FILTERS': 24, 'DEPTH_MULTIPLIER': 2, 'POINTWISE_FILTERS': 32, 'TEMPORAL_KERNEL_DIV': 7, 'SEPARABLE_KERNEL_SIZE': 9, 'POOL1_SIZE': 7, 'POOL2_SIZE': 5, 'NORM_AXIS': 'full', 'RUN_ZSCORE': False}. Best is trial 461 with value: 0.6545138888888888.
[I 2026-06-18 13:09:43,938] Trial 537 finished with value: 0.6302083333333333 and parameters: {'FLOW': 7.99211494958241, 'FHIGH': 53.1586110680621, 'LR_EXP': -2.2299686478601854, 'DROPOUT': 0.5879821590300403, 'BETA': 0.756462385017265, 'SPIKE_GRAD_SLOPE': 6.881365311060446, 'TEMPORAL_FILTERS': 19, 'DEPTH_MULTIPLIER': 4, 'POINTWISE_FILTERS': 28, 'TEMPORAL_KERNEL_DIV': 8, 'SEPARABLE_KERNEL_SIZE': 8, 'POOL1_SIZE': 6, 'POOL2_SIZE': 7, 'NORM_AXIS': 'no_channel', 'RUN_ZSCORE': False}. Best is trial 461 with value: 0.6545138888888888.
[I 2026-06-18 13:10:16,997] Trial 538 pruned. 
[I 2026-06-18 13:10:50,928] Trial 539 pruned. 
[I 2026-06-18 13:25:54,728] Trial 540 finished with value: 0.5399305555555556 and parameters: {'FLOW': 9.838858463483065, 'FHIGH': 62.318700663280744, 'LR_EXP': -2.354230775567716, 'DROPOUT': 0.5776342150128956, 'BETA': 0.8273696834242996, 'SPIKE_GRAD_SLOPE': 15.2866974792592, 'TEMPORAL_FILTERS': 23, 'DEPTH_MULTIPLIER': 4, 'POINTWISE_FILTERS': 25, 'TEMPORAL_KERNEL_DIV': 8, 'SEPARABLE_KERNEL_SIZE': 6, 'POOL1_SIZE': 4, 'POOL2_SIZE': 7, 'NORM_AXIS': 'no_channel', 'RUN_ZSCORE': False}. Best is trial 461 with value: 0.6545138888888888.
[I 2026-06-18 13:26:23,792] Trial 541 pruned. 
[I 2026-06-18 13:40:19,470] Trial 542 finished with value: 0.6041666666666666 and parameters: {'FLOW': 10.495071030007237, 'FHIGH': 54.19478082709955, 'LR_EXP': -2.1461396928354346, 'DROPOUT': 0.6640575186407275, 'BETA': 0.9155803334729056, 'SPIKE_GRAD_SLOPE': 14.6131809947695, 'TEMPORAL_FILTERS': 23, 'DEPTH_MULTIPLIER': 3, 'POINTWISE_FILTERS': 35, 'TEMPORAL_KERNEL_DIV': 7, 'SEPARABLE_KERNEL_SIZE': 11, 'POOL1_SIZE': 7, 'POOL2_SIZE': 5, 'NORM_AXIS': 'no_channel', 'RUN_ZSCORE': False}. Best is trial 461 with value: 0.6545138888888888.
[I 2026-06-18 13:40:45,504] Trial 543 pruned. 
[I 2026-06-18 13:55:29,641] Trial 544 finished with value: 0.5677083333333334 and parameters: {'FLOW': 7.921660969401528, 'FHIGH': 83.14069453945858, 'LR_EXP': -2.2805348653205986, 'DROPOUT': 0.3041779068954154, 'BETA': 0.8209162679240322, 'SPIKE_GRAD_SLOPE': 18.067636924629376, 'TEMPORAL_FILTERS': 24, 'DEPTH_MULTIPLIER': 3, 'POINTWISE_FILTERS': 49, 'TEMPORAL_KERNEL_DIV': 6, 'SEPARABLE_KERNEL_SIZE': 12, 'POOL1_SIZE': 7, 'POOL2_SIZE': 7, 'NORM_AXIS': 'full', 'RUN_ZSCORE': False}. Best is trial 461 with value: 0.6545138888888888.
[I 2026-06-18 13:56:05,227] Trial 545 pruned. 
[I 2026-06-18 13:56:36,698] Trial 546 pruned. 
[I 2026-06-18 14:06:47,709] Trial 547 finished with value: 0.5920138888888888 and parameters: {'FLOW': 2.92052831674002, 'FHIGH': 62.29906446338694, 'LR_EXP': -2.313066078467868, 'DROPOUT': 0.5319332332964773, 'BETA': 0.8883697582577423, 'SPIKE_GRAD_SLOPE': 5.851688020022144, 'TEMPORAL_FILTERS': 17, 'DEPTH_MULTIPLIER': 2, 'POINTWISE_FILTERS': 9, 'TEMPORAL_KERNEL_DIV': 8, 'SEPARABLE_KERNEL_SIZE': 18, 'POOL1_SIZE': 7, 'POOL2_SIZE': 7, 'NORM_AXIS': 'full', 'RUN_ZSCORE': False}. Best is trial 461 with value: 0.6545138888888888.
[I 2026-06-18 14:07:22,765] Trial 548 pruned. 
[I 2026-06-18 14:07:54,531] Trial 549 pruned. 
[I 2026-06-18 14:26:34,026] Trial 550 finished with value: 0.5225694444444444 and parameters: {'FLOW': 10.385509085390208, 'FHIGH': 69.20696892906356, 'LR_EXP': -3.227151038499754, 'DROPOUT': 0.5277054667193609, 'BETA': 0.7118336325910372, 'SPIKE_GRAD_SLOPE': 14.106268698902973, 'TEMPORAL_FILTERS': 29, 'DEPTH_MULTIPLIER': 4, 'POINTWISE_FILTERS': 59, 'TEMPORAL_KERNEL_DIV': 6, 'SEPARABLE_KERNEL_SIZE': 10, 'POOL1_SIZE': 3, 'POOL2_SIZE': 7, 'NORM_AXIS': 'full', 'RUN_ZSCORE': False}. Best is trial 461 with value: 0.6545138888888888.
[I 2026-06-18 14:37:37,491] Trial 551 finished with value: 0.42013888888888895 and parameters: {'FLOW': 5.384710935996869, 'FHIGH': 87.86044279891824, 'LR_EXP': -2.193554865595297, 'DROPOUT': 0.44567324136933495, 'BETA': 0.8738672361336494, 'SPIKE_GRAD_SLOPE': 8.370852340823948, 'TEMPORAL_FILTERS': 15, 'DEPTH_MULTIPLIER': 3, 'POINTWISE_FILTERS': 45, 'TEMPORAL_KERNEL_DIV': 6, 'SEPARABLE_KERNEL_SIZE': 10, 'POOL1_SIZE': 8, 'POOL2_SIZE': 6, 'NORM_AXIS': 'full', 'RUN_ZSCORE': False}. Best is trial 461 with value: 0.6545138888888888.
[I 2026-06-18 14:38:09,062] Trial 552 pruned. 
[I 2026-06-18 14:54:34,961] Trial 553 finished with value: 0.4947916666666667 and parameters: {'FLOW': 9.03636486765599, 'FHIGH': 48.39970234786524, 'LR_EXP': -2.086314790821007, 'DROPOUT': 0.5675110923480686, 'BETA': 0.8025080698957088, 'SPIKE_GRAD_SLOPE': 23.02262574875201, 'TEMPORAL_FILTERS': 26, 'DEPTH_MULTIPLIER': 4, 'POINTWISE_FILTERS': 37, 'TEMPORAL_KERNEL_DIV': 8, 'SEPARABLE_KERNEL_SIZE': 19, 'POOL1_SIZE': 6, 'POOL2_SIZE': 8, 'NORM_AXIS': 'no_channel', 'RUN_ZSCORE': False}. Best is trial 461 with value: 0.6545138888888888.
[I 2026-06-18 14:55:02,292] Trial 554 pruned. 
[I 2026-06-18 15:08:53,365] Trial 555 finished with value: 0.5746527777777778 and parameters: {'FLOW': 3.586161220425587, 'FHIGH': 49.35502370387183, 'LR_EXP': -2.904359155554056, 'DROPOUT': 0.5483666588991748, 'BETA': 0.5913732801546197, 'SPIKE_GRAD_SLOPE': 11.874283904192326, 'TEMPORAL_FILTERS': 20, 'DEPTH_MULTIPLIER': 4, 'POINTWISE_FILTERS': 24, 'TEMPORAL_KERNEL_DIV': 7, 'SEPARABLE_KERNEL_SIZE': 10, 'POOL1_SIZE': 7, 'POOL2_SIZE': 8, 'NORM_AXIS': 'no_channel', 'RUN_ZSCORE': False}. Best is trial 461 with value: 0.6545138888888888.
[I 2026-06-18 15:09:27,765] Trial 556 pruned. 
[I 2026-06-18 15:10:16,394] Trial 557 pruned. 
[I 2026-06-18 15:10:44,590] Trial 558 pruned. 
[I 2026-06-18 15:26:00,544] Trial 559 finished with value: 0.546875 and parameters: {'FLOW': 8.06315794762706, 'FHIGH': 106.96479912826689, 'LR_EXP': -2.194374633907366, 'DROPOUT': 0.6422991463298943, 'BETA': 0.8679266674343237, 'SPIKE_GRAD_SLOPE': 7.738520991487978, 'TEMPORAL_FILTERS': 22, 'DEPTH_MULTIPLIER': 4, 'POINTWISE_FILTERS': 32, 'TEMPORAL_KERNEL_DIV': 6, 'SEPARABLE_KERNEL_SIZE': 19, 'POOL1_SIZE': 4, 'POOL2_SIZE': 4, 'NORM_AXIS': 'full', 'RUN_ZSCORE': False}. Best is trial 461 with value: 0.6545138888888888.
[I 2026-06-18 15:44:49,977] Trial 560 finished with value: 0.6215277777777778 and parameters: {'FLOW': 8.908850480103187, 'FHIGH': 113.46530453349637, 'LR_EXP': -2.137290048909893, 'DROPOUT': 0.6862259039562734, 'BETA': 0.8046397083172323, 'SPIKE_GRAD_SLOPE': 7.629126030411498, 'TEMPORAL_FILTERS': 30, 'DEPTH_MULTIPLIER': 4, 'POINTWISE_FILTERS': 40, 'TEMPORAL_KERNEL_DIV': 6, 'SEPARABLE_KERNEL_SIZE': 13, 'POOL1_SIZE': 8, 'POOL2_SIZE': 7, 'NORM_AXIS': 'full', 'RUN_ZSCORE': True}. Best is trial 461 with value: 0.6545138888888888.
[I 2026-06-18 15:45:29,228] Trial 561 pruned. 
[I 2026-06-18 15:45:59,383] Trial 562 pruned. 
[I 2026-06-18 15:46:37,375] Trial 563 pruned. 
[I 2026-06-18 16:03:45,206] Trial 564 finished with value: 0.6006944444444444 and parameters: {'FLOW': 11.883407939497, 'FHIGH': 114.8514157078522, 'LR_EXP': -2.7786065151576125, 'DROPOUT': 0.6585341412111202, 'BETA': 0.8046364304969512, 'SPIKE_GRAD_SLOPE': 9.542790581595508, 'TEMPORAL_FILTERS': 27, 'DEPTH_MULTIPLIER': 4, 'POINTWISE_FILTERS': 27, 'TEMPORAL_KERNEL_DIV': 7, 'SEPARABLE_KERNEL_SIZE': 16, 'POOL1_SIZE': 6, 'POOL2_SIZE': 8, 'NORM_AXIS': 'full', 'RUN_ZSCORE': True}. Best is trial 461 with value: 0.6545138888888888.
[I 2026-06-18 16:04:04,644] Trial 565 pruned. 
[I 2026-06-18 16:05:03,793] Trial 566 pruned. 
[I 2026-06-18 16:05:41,412] Trial 567 pruned. 
[I 2026-06-18 16:21:46,069] Trial 568 finished with value: 0.5277777777777778 and parameters: {'FLOW': 7.225745210080548, 'FHIGH': 74.72155722485618, 'LR_EXP': -2.5235736765234975, 'DROPOUT': 0.6001155648591835, 'BETA': 0.6638558676027314, 'SPIKE_GRAD_SLOPE': 7.477266198877653, 'TEMPORAL_FILTERS': 25, 'DEPTH_MULTIPLIER': 3, 'POINTWISE_FILTERS': 32, 'TEMPORAL_KERNEL_DIV': 4, 'SEPARABLE_KERNEL_SIZE': 32, 'POOL1_SIZE': 8, 'POOL2_SIZE': 5, 'NORM_AXIS': 'full', 'RUN_ZSCORE': False}. Best is trial 461 with value: 0.6545138888888888.
[I 2026-06-18 16:22:29,202] Trial 569 pruned. 
[I 2026-06-18 16:23:08,233] Trial 570 pruned. 
[I 2026-06-18 16:23:37,874] Trial 571 pruned. 
[I 2026-06-18 16:24:20,339] Trial 572 pruned. 
[I 2026-06-18 16:25:23,546] Trial 573 pruned. 
[I 2026-06-18 16:25:50,201] Trial 574 pruned. 
[I 2026-06-18 16:26:15,297] Trial 575 pruned. 
[I 2026-06-18 16:26:40,375] Trial 576 pruned. 
[I 2026-06-18 16:27:09,832] Trial 577 pruned. 
[I 2026-06-18 16:27:43,020] Trial 578 pruned. 
[I 2026-06-18 16:28:21,678] Trial 579 pruned. 
[I 2026-06-18 16:45:16,332] Trial 580 finished with value: 0.5555555555555556 and parameters: {'FLOW': 5.312469763965609, 'FHIGH': 105.16831856131556, 'LR_EXP': -2.3939563464378373, 'DROPOUT': 0.7052668301776492, 'BETA': 0.8382924956787734, 'SPIKE_GRAD_SLOPE': 12.914925940969272, 'TEMPORAL_FILTERS': 25, 'DEPTH_MULTIPLIER': 4, 'POINTWISE_FILTERS': 45, 'TEMPORAL_KERNEL_DIV': 5, 'SEPARABLE_KERNEL_SIZE': 18, 'POOL1_SIZE': 7, 'POOL2_SIZE': 6, 'NORM_AXIS': 'full', 'RUN_ZSCORE': True}. Best is trial 461 with value: 0.6545138888888888.
[I 2026-06-18 16:45:57,548] Trial 581 pruned. 
[I 2026-06-18 16:46:28,512] Trial 582 pruned. 
[I 2026-06-18 16:46:56,990] Trial 583 pruned. 
[I 2026-06-18 16:47:39,316] Trial 584 pruned. 
[I 2026-06-18 16:48:21,619] Trial 585 pruned. 
[I 2026-06-18 16:49:04,597] Trial 586 pruned. 
[I 2026-06-18 16:49:47,591] Trial 587 pruned. 
[I 2026-06-18 16:50:18,692] Trial 588 pruned. 
[I 2026-06-18 16:50:58,947] Trial 589 pruned. 
[I 2026-06-18 16:51:35,748] Trial 590 pruned. 
[I 2026-06-18 16:52:15,322] Trial 591 pruned. 
[I 2026-06-18 16:52:59,796] Trial 592 pruned. 
[I 2026-06-18 17:08:25,689] Trial 593 finished with value: 0.5815972222222222 and parameters: {'FLOW': 11.045505569466096, 'FHIGH': 102.2756843806812, 'LR_EXP': -2.5916440945578123, 'DROPOUT': 0.46082331587484776, 'BETA': 0.7733746010437847, 'SPIKE_GRAD_SLOPE': 15.90253276580349, 'TEMPORAL_FILTERS': 32, 'DEPTH_MULTIPLIER': 2, 'POINTWISE_FILTERS': 39, 'TEMPORAL_KERNEL_DIV': 8, 'SEPARABLE_KERNEL_SIZE': 4, 'POOL1_SIZE': 5, 'POOL2_SIZE': 4, 'NORM_AXIS': 'no_channel', 'RUN_ZSCORE': False}. Best is trial 461 with value: 0.6545138888888888.
[I 2026-06-18 17:09:06,792] Trial 594 pruned. 
[I 2026-06-18 17:09:33,500] Trial 595 pruned. 
[I 2026-06-18 17:10:11,755] Trial 596 pruned. 
[I 2026-06-18 17:10:41,648] Trial 597 pruned. 
[I 2026-06-18 17:11:14,321] Trial 598 pruned. 
[I 2026-06-18 17:11:49,256] Trial 599 pruned. 
[I 2026-06-18 17:12:18,947] Trial 600 pruned. 
[I 2026-06-18 17:13:02,073] Trial 601 pruned. 
[I 2026-06-18 17:13:39,425] Trial 602 pruned. 
[I 2026-06-18 17:14:14,054] Trial 603 pruned. 
[I 2026-06-18 17:14:58,678] Trial 604 pruned. 
[I 2026-06-18 17:33:49,780] Trial 605 finished with value: 0.5538194444444445 and parameters: {'FLOW': 6.579301731570668, 'FHIGH': 51.12141023499828, 'LR_EXP': -2.8972222007439252, 'DROPOUT': 0.675857494276463, 'BETA': 0.5098643855575458, 'SPIKE_GRAD_SLOPE': 9.07789606718044, 'TEMPORAL_FILTERS': 30, 'DEPTH_MULTIPLIER': 4, 'POINTWISE_FILTERS': 41, 'TEMPORAL_KERNEL_DIV': 6, 'SEPARABLE_KERNEL_SIZE': 20, 'POOL1_SIZE': 8, 'POOL2_SIZE': 4, 'NORM_AXIS': 'no_channel', 'RUN_ZSCORE': False}. Best is trial 461 with value: 0.6545138888888888.
[I 2026-06-18 17:34:17,316] Trial 606 pruned. 
[I 2026-06-18 17:34:48,664] Trial 607 pruned. 
[I 2026-06-18 17:47:06,470] Trial 608 finished with value: 0.5937499999999999 and parameters: {'FLOW': 5.268532105234749, 'FHIGH': 68.21061562716524, 'LR_EXP': -2.0991241136740686, 'DROPOUT': 0.40709661697848243, 'BETA': 0.8047996307096342, 'SPIKE_GRAD_SLOPE': 18.762721485629058, 'TEMPORAL_FILTERS': 17, 'DEPTH_MULTIPLIER': 3, 'POINTWISE_FILTERS': 22, 'TEMPORAL_KERNEL_DIV': 5, 'SEPARABLE_KERNEL_SIZE': 20, 'POOL1_SIZE': 8, 'POOL2_SIZE': 8, 'NORM_AXIS': 'no_channel', 'RUN_ZSCORE': False}. Best is trial 461 with value: 0.6545138888888888.
[I 2026-06-18 17:47:44,613] Trial 609 pruned. 
[I 2026-06-18 18:08:35,955] Trial 610 finished with value: 0.548611111111111 and parameters: {'FLOW': 10.978539126730409, 'FHIGH': 109.74949506400061, 'LR_EXP': -2.4308226117684697, 'DROPOUT': 0.5197023913401417, 'BETA': 0.8173686695114915, 'SPIKE_GRAD_SLOPE': 8.119630005895718, 'TEMPORAL_FILTERS': 28, 'DEPTH_MULTIPLIER': 4, 'POINTWISE_FILTERS': 37, 'TEMPORAL_KERNEL_DIV': 3, 'SEPARABLE_KERNEL_SIZE': 5, 'POOL1_SIZE': 7, 'POOL2_SIZE': 8, 'NORM_AXIS': 'full', 'RUN_ZSCORE': True}. Best is trial 461 with value: 0.6545138888888888.
[I 2026-06-18 18:09:20,268] Trial 611 pruned. 
[I 2026-06-18 18:09:54,869] Trial 612 pruned. 
[I 2026-06-18 18:10:38,281] Trial 613 pruned. 
[I 2026-06-18 18:24:42,447] Trial 614 finished with value: 0.560763888888889 and parameters: {'FLOW': 6.364115352231842, 'FHIGH': 45.63287016386668, 'LR_EXP': -2.4040663620611875, 'DROPOUT': 0.5301706452973757, 'BETA': 0.6161242730783565, 'SPIKE_GRAD_SLOPE': 7.754020595444938, 'TEMPORAL_FILTERS': 21, 'DEPTH_MULTIPLIER': 4, 'POINTWISE_FILTERS': 31, 'TEMPORAL_KERNEL_DIV': 8, 'SEPARABLE_KERNEL_SIZE': 10, 'POOL1_SIZE': 5, 'POOL2_SIZE': 6, 'NORM_AXIS': 'no_channel', 'RUN_ZSCORE': False}. Best is trial 461 with value: 0.6545138888888888.
[I 2026-06-18 18:25:27,075] Trial 615 pruned. 
