mkdir: cannot create directory ‘/scratch/mne_data’: Permission denied

[notice] A new release of pip is available: 24.2 -> 26.1.2
[notice] To update, run: pip install --upgrade pip

[notice] A new release of pip is available: 24.2 -> 26.1.2
[notice] To update, run: pip install --upgrade pip
ERROR: Invalid requirement: 'Binary file requirements.txt matches': Expected end or semicolon (after name and no valid version specifier)
    Binary file requirements.txt matches
           ^ (from line 1 of /home/aleksander.berezowsk/requirements_notorch.txt)

[notice] A new release of pip is available: 24.2 -> 26.1.2
[notice] To update, run: pip install --upgrade pip

[notice] A new release of pip is available: 24.2 -> 26.1.2
[notice] To update, run: pip install --upgrade pip
/home/aleksander.berezowsk/spiking-eegnet/src/main.py:89: ExperimentalWarning: Argument ``multivariate`` is an experimental feature. The interface can change in the future.
  sampler=TPESampler(n_startup_trials=tpe_trails, multivariate=True, group=True)
/home/aleksander.berezowsk/spiking-eegnet/src/main.py:89: ExperimentalWarning: Argument ``group`` is an experimental feature. The interface can change in the future.
  sampler=TPESampler(n_startup_trials=tpe_trails, multivariate=True, group=True)
[I 2026-06-19 15:50:11,036] Using an existing study with name 'snn_eegnet_v2_200_20' instead of creating a new one.
[I 2026-06-19 18:01:21,994] Trial 5 finished with value: 0.39911265432098764 and parameters: {'FLOW': 3.912304980648874, 'FHIGH': 63.85797773049984, 'LR_EXP': -3.5479232831762157, 'DROPOUT': 0.5027708713067213, 'BETA': 0.9431254915835925, 'SPIKE_GRAD_SLOPE': 15.82547047637305, 'TEMPORAL_FILTERS': 17, 'DEPTH_MULTIPLIER': 3, 'POINTWISE_FILTERS': 12, 'TEMPORAL_KERNEL_DIV': 3, 'SEPARABLE_KERNEL_SIZE': 14, 'POOL1_SIZE': 3, 'POOL2_SIZE': 7, 'NORM_AXIS': 'no_channel'}. Best is trial 3 with value: 0.4054783950617284.
[I 2026-06-19 19:51:31,751] Trial 8 finished with value: 0.3188657407407407 and parameters: {'FLOW': 18.66390413816035, 'FHIGH': 40.94882018651407, 'LR_EXP': -4.233701874334873, 'DROPOUT': 0.6514087251171754, 'BETA': 0.5269214889254263, 'SPIKE_GRAD_SLOPE': 20.311173008347442, 'TEMPORAL_FILTERS': 19, 'DEPTH_MULTIPLIER': 2, 'POINTWISE_FILTERS': 11, 'TEMPORAL_KERNEL_DIV': 4, 'SEPARABLE_KERNEL_SIZE': 28, 'POOL1_SIZE': 6, 'POOL2_SIZE': 4, 'NORM_AXIS': 'full'}. Best is trial 3 with value: 0.4054783950617284.
[I 2026-06-19 21:20:02,901] Trial 13 finished with value: 0.36747685185185186 and parameters: {'FLOW': 9.081396020688963, 'FHIGH': 116.32402913383511, 'LR_EXP': -2.723240692809618, 'DROPOUT': 0.6829900395167539, 'BETA': 0.959973264387342, 'SPIKE_GRAD_SLOPE': 33.4064346460999, 'TEMPORAL_FILTERS': 14, 'DEPTH_MULTIPLIER': 1, 'POINTWISE_FILTERS': 22, 'TEMPORAL_KERNEL_DIV': 4, 'SEPARABLE_KERNEL_SIZE': 18, 'POOL1_SIZE': 2, 'POOL2_SIZE': 5, 'NORM_AXIS': 'full'}. Best is trial 10 with value: 0.4241898148148148.
[I 2026-06-19 23:38:45,796] Trial 17 finished with value: 0.38040123456790126 and parameters: {'FLOW': 12.779525018897068, 'FHIGH': 38.01853530681557, 'LR_EXP': -2.834696575342135, 'DROPOUT': 0.308335062078291, 'BETA': 0.6375501241639204, 'SPIKE_GRAD_SLOPE': 10.866846729041026, 'TEMPORAL_FILTERS': 32, 'DEPTH_MULTIPLIER': 2, 'POINTWISE_FILTERS': 42, 'TEMPORAL_KERNEL_DIV': 7, 'SEPARABLE_KERNEL_SIZE': 10, 'POOL1_SIZE': 8, 'POOL2_SIZE': 5, 'NORM_AXIS': 'no_channel'}. Best is trial 10 with value: 0.4241898148148148.
[I 2026-06-20 01:51:27,603] Trial 22 finished with value: 0.43171296296296297 and parameters: {'FLOW': 3.0135853796707885, 'FHIGH': 36.07206635045662, 'LR_EXP': -3.79760911349886, 'DROPOUT': 0.578509771726809, 'BETA': 0.7957531437455173, 'SPIKE_GRAD_SLOPE': 37.96302653463275, 'TEMPORAL_FILTERS': 29, 'DEPTH_MULTIPLIER': 2, 'POINTWISE_FILTERS': 36, 'TEMPORAL_KERNEL_DIV': 6, 'SEPARABLE_KERNEL_SIZE': 28, 'POOL1_SIZE': 6, 'POOL2_SIZE': 6, 'NORM_AXIS': 'full'}. Best is trial 21 with value: 0.45370370370370366.
[I 2026-06-20 04:01:48,727] Trial 26 finished with value: 0.42669753086419754 and parameters: {'FLOW': 3.203507058237359, 'FHIGH': 37.00575274463385, 'LR_EXP': -3.2968462516224553, 'DROPOUT': 0.46178071047028685, 'BETA': 0.8113339678972143, 'SPIKE_GRAD_SLOPE': 29.020227953839616, 'TEMPORAL_FILTERS': 24, 'DEPTH_MULTIPLIER': 3, 'POINTWISE_FILTERS': 48, 'TEMPORAL_KERNEL_DIV': 6, 'SEPARABLE_KERNEL_SIZE': 31, 'POOL1_SIZE': 7, 'POOL2_SIZE': 6, 'NORM_AXIS': 'full'}. Best is trial 21 with value: 0.45370370370370366.
[I 2026-06-20 06:15:05,459] Trial 31 finished with value: 0.4382716049382716 and parameters: {'FLOW': 5.937458543546811, 'FHIGH': 63.86440150290971, 'LR_EXP': -3.4113498072660673, 'DROPOUT': 0.5121135069204958, 'BETA': 0.6378062443709549, 'SPIKE_GRAD_SLOPE': 45.284012525728755, 'TEMPORAL_FILTERS': 21, 'DEPTH_MULTIPLIER': 4, 'POINTWISE_FILTERS': 39, 'TEMPORAL_KERNEL_DIV': 6, 'SEPARABLE_KERNEL_SIZE': 9, 'POOL1_SIZE': 2, 'POOL2_SIZE': 6, 'NORM_AXIS': 'no_channel'}. Best is trial 29 with value: 0.45968364197530864.
[I 2026-06-20 06:59:40,797] Trial 35 pruned. 
[I 2026-06-20 09:27:13,082] Trial 36 finished with value: 0.4313271604938272 and parameters: {'FLOW': 2.865976941414866, 'FHIGH': 55.08264941666704, 'LR_EXP': -3.6219690661967667, 'DROPOUT': 0.10244091865545443, 'BETA': 0.7474652112838936, 'SPIKE_GRAD_SLOPE': 10.822475935337483, 'TEMPORAL_FILTERS': 24, 'DEPTH_MULTIPLIER': 4, 'POINTWISE_FILTERS': 49, 'TEMPORAL_KERNEL_DIV': 6, 'SEPARABLE_KERNEL_SIZE': 23, 'POOL1_SIZE': 2, 'POOL2_SIZE': 8, 'NORM_AXIS': 'no_channel'}. Best is trial 29 with value: 0.45968364197530864.
[I 2026-06-20 12:23:52,307] Trial 40 finished with value: 0.46836419753086417 and parameters: {'FLOW': 2.1394732654635913, 'FHIGH': 96.82612191866534, 'LR_EXP': -3.1504949614478464, 'DROPOUT': 0.24178516006438672, 'BETA': 0.6662068586208345, 'SPIKE_GRAD_SLOPE': 28.141379211137245, 'TEMPORAL_FILTERS': 32, 'DEPTH_MULTIPLIER': 4, 'POINTWISE_FILTERS': 42, 'TEMPORAL_KERNEL_DIV': 6, 'SEPARABLE_KERNEL_SIZE': 6, 'POOL1_SIZE': 4, 'POOL2_SIZE': 8, 'NORM_AXIS': 'no_channel'}. Best is trial 40 with value: 0.46836419753086417.
[W 2026-06-20 14:53:05,981] Trial 46 failed with parameters: {'FLOW': 3.747333838919181, 'FHIGH': 113.7658653923245, 'LR_EXP': -2.7068884477274184, 'DROPOUT': 0.46447228387775674, 'BETA': 0.638429069591353, 'SPIKE_GRAD_SLOPE': 34.71505338033471, 'TEMPORAL_FILTERS': 28, 'DEPTH_MULTIPLIER': 4, 'POINTWISE_FILTERS': 40, 'TEMPORAL_KERNEL_DIV': 4, 'SEPARABLE_KERNEL_SIZE': 9, 'POOL1_SIZE': 5, 'POOL2_SIZE': 8, 'NORM_AXIS': 'no_channel'} because of the following error: OutOfMemoryError('CUDA out of memory. Tried to allocate 76.00 MiB. GPU 0 has a total capacity of 15.77 GiB of which 62.19 MiB is free. Including non-PyTorch memory, this process has 15.70 GiB memory in use. Of the allocated memory 14.66 GiB is allocated by PyTorch, and 677.45 MiB is reserved by PyTorch but unallocated. If reserved but unallocated memory is large try setting PYTORCH_CUDA_ALLOC_CONF=expandable_segments:True to avoid fragmentation.  See documentation for Memory Management  (https://pytorch.org/docs/stable/notes/cuda.html#environment-variables)').
Traceback (most recent call last):
  File "/home/aleksander.berezowsk/venv/lib/python3.12/site-packages/optuna/study/_optimize.py", line 206, in _run_trial
    value_or_values = func(trial)
                      ^^^^^^^^^^^
  File "/home/aleksander.berezowsk/spiking-eegnet/src/main.py", line 44, in objective
    return pipeline(**params, **FIXED, trial=trial, save_plots=False)
           ^^^^^^^^^^^^^^^^^^^^^^^^^^^^^^^^^^^^^^^^^^^^^^^^^^^^^^^^^^
  File "/home/aleksander.berezowsk/spiking-eegnet/src/pipeline.py", line 141, in pipeline
    histories, accs, mean_acc = experiment_loso_all(
                                ^^^^^^^^^^^^^^^^^^^^
  File "/home/aleksander.berezowsk/spiking-eegnet/src/experiment_loso.py", line 71, in experiment_loso_all
    history, final_acc, _model = experiment_loso(
                                 ^^^^^^^^^^^^^^^^
  File "/home/aleksander.berezowsk/spiking-eegnet/src/experiment_loso.py", line 30, in experiment_loso
    history = run_training(
              ^^^^^^^^^^^^^
  File "/home/aleksander.berezowsk/spiking-eegnet/src/run_training.py", line 45, in run_training
    loss = train_one_epoch(model, train_loader, optimizer, criterion, device, n_steps_train)
           ^^^^^^^^^^^^^^^^^^^^^^^^^^^^^^^^^^^^^^^^^^^^^^^^^^^^^^^^^^^^^^^^^^^^^^^^^^^^^^^^^
  File "/home/aleksander.berezowsk/spiking-eegnet/src/train_one_epoch.py", line 7, in train_one_epoch
    spk = model(xb, num_steps=n_steps)
          ^^^^^^^^^^^^^^^^^^^^^^^^^^^^
  File "/home/aleksander.berezowsk/venv/lib/python3.12/site-packages/torch/nn/modules/module.py", line 1553, in _wrapped_call_impl
    return self._call_impl(*args, **kwargs)
           ^^^^^^^^^^^^^^^^^^^^^^^^^^^^^^^^
  File "/home/aleksander.berezowsk/venv/lib/python3.12/site-packages/torch/nn/modules/module.py", line 1562, in _call_impl
    return forward_call(*args, **kwargs)
           ^^^^^^^^^^^^^^^^^^^^^^^^^^^^^
  File "/home/aleksander.berezowsk/spiking-eegnet/src/spiking_eegnet.py", line 222, in forward
    spk1, mem1 = self.lif1(cur, mem1)
                 ^^^^^^^^^^^^^^^^^^^^
  File "/home/aleksander.berezowsk/venv/lib/python3.12/site-packages/torch/nn/modules/module.py", line 1553, in _wrapped_call_impl
    return self._call_impl(*args, **kwargs)
           ^^^^^^^^^^^^^^^^^^^^^^^^^^^^^^^^
  File "/home/aleksander.berezowsk/venv/lib/python3.12/site-packages/torch/nn/modules/module.py", line 1562, in _call_impl
    return forward_call(*args, **kwargs)
           ^^^^^^^^^^^^^^^^^^^^^^^^^^^^^
  File "/home/aleksander.berezowsk/venv/lib/python3.12/site-packages/snntorch/_neurons/leaky.py", line 209, in forward
    self.reset = self.mem_reset(self.mem)
                 ^^^^^^^^^^^^^^^^^^^^^^^^
  File "/home/aleksander.berezowsk/venv/lib/python3.12/site-packages/snntorch/_neurons/neurons.py", line 106, in mem_reset
    reset = self.spike_grad(mem_shift).clone().detach()
            ^^^^^^^^^^^^^^^^^^^^^^^^^^^^^^^^^^
torch.OutOfMemoryError: CUDA out of memory. Tried to allocate 76.00 MiB. GPU 0 has a total capacity of 15.77 GiB of which 62.19 MiB is free. Including non-PyTorch memory, this process has 15.70 GiB memory in use. Of the allocated memory 14.66 GiB is allocated by PyTorch, and 677.45 MiB is reserved by PyTorch but unallocated. If reserved but unallocated memory is large try setting PYTORCH_CUDA_ALLOC_CONF=expandable_segments:True to avoid fragmentation.  See documentation for Memory Management  (https://pytorch.org/docs/stable/notes/cuda.html#environment-variables)
[W 2026-06-20 14:53:06,046] Trial 46 failed with value None.
Traceback (most recent call last):
  File "/home/aleksander.berezowsk/spiking-eegnet/src/main.py", line 95, in <module>
    study.optimize(objective, n_trials=n_trials, n_jobs=1,
  File "/home/aleksander.berezowsk/venv/lib/python3.12/site-packages/optuna/study/study.py", line 516, in optimize
    _optimize(
  File "/home/aleksander.berezowsk/venv/lib/python3.12/site-packages/optuna/study/_optimize.py", line 68, in _optimize
    _optimize_sequential(
  File "/home/aleksander.berezowsk/venv/lib/python3.12/site-packages/optuna/study/_optimize.py", line 165, in _optimize_sequential
    frozen_trial_id = _run_trial(study, func, catch)
                      ^^^^^^^^^^^^^^^^^^^^^^^^^^^^^^
  File "/home/aleksander.berezowsk/venv/lib/python3.12/site-packages/optuna/study/_optimize.py", line 263, in _run_trial
    raise func_err
  File "/home/aleksander.berezowsk/venv/lib/python3.12/site-packages/optuna/study/_optimize.py", line 206, in _run_trial
    value_or_values = func(trial)
                      ^^^^^^^^^^^
  File "/home/aleksander.berezowsk/spiking-eegnet/src/main.py", line 44, in objective
    return pipeline(**params, **FIXED, trial=trial, save_plots=False)
           ^^^^^^^^^^^^^^^^^^^^^^^^^^^^^^^^^^^^^^^^^^^^^^^^^^^^^^^^^^
  File "/home/aleksander.berezowsk/spiking-eegnet/src/pipeline.py", line 141, in pipeline
    histories, accs, mean_acc = experiment_loso_all(
                                ^^^^^^^^^^^^^^^^^^^^
  File "/home/aleksander.berezowsk/spiking-eegnet/src/experiment_loso.py", line 71, in experiment_loso_all
    history, final_acc, _model = experiment_loso(
                                 ^^^^^^^^^^^^^^^^
  File "/home/aleksander.berezowsk/spiking-eegnet/src/experiment_loso.py", line 30, in experiment_loso
    history = run_training(
              ^^^^^^^^^^^^^
  File "/home/aleksander.berezowsk/spiking-eegnet/src/run_training.py", line 45, in run_training
    loss = train_one_epoch(model, train_loader, optimizer, criterion, device, n_steps_train)
           ^^^^^^^^^^^^^^^^^^^^^^^^^^^^^^^^^^^^^^^^^^^^^^^^^^^^^^^^^^^^^^^^^^^^^^^^^^^^^^^^^
  File "/home/aleksander.berezowsk/spiking-eegnet/src/train_one_epoch.py", line 7, in train_one_epoch
    spk = model(xb, num_steps=n_steps)
          ^^^^^^^^^^^^^^^^^^^^^^^^^^^^
  File "/home/aleksander.berezowsk/venv/lib/python3.12/site-packages/torch/nn/modules/module.py", line 1553, in _wrapped_call_impl
    return self._call_impl(*args, **kwargs)
           ^^^^^^^^^^^^^^^^^^^^^^^^^^^^^^^^
  File "/home/aleksander.berezowsk/venv/lib/python3.12/site-packages/torch/nn/modules/module.py", line 1562, in _call_impl
    return forward_call(*args, **kwargs)
           ^^^^^^^^^^^^^^^^^^^^^^^^^^^^^
  File "/home/aleksander.berezowsk/spiking-eegnet/src/spiking_eegnet.py", line 222, in forward
    spk1, mem1 = self.lif1(cur, mem1)
                 ^^^^^^^^^^^^^^^^^^^^
  File "/home/aleksander.berezowsk/venv/lib/python3.12/site-packages/torch/nn/modules/module.py", line 1553, in _wrapped_call_impl
    return self._call_impl(*args, **kwargs)
           ^^^^^^^^^^^^^^^^^^^^^^^^^^^^^^^^
  File "/home/aleksander.berezowsk/venv/lib/python3.12/site-packages/torch/nn/modules/module.py", line 1562, in _call_impl
    return forward_call(*args, **kwargs)
           ^^^^^^^^^^^^^^^^^^^^^^^^^^^^^
  File "/home/aleksander.berezowsk/venv/lib/python3.12/site-packages/snntorch/_neurons/leaky.py", line 209, in forward
    self.reset = self.mem_reset(self.mem)
                 ^^^^^^^^^^^^^^^^^^^^^^^^
  File "/home/aleksander.berezowsk/venv/lib/python3.12/site-packages/snntorch/_neurons/neurons.py", line 106, in mem_reset
    reset = self.spike_grad(mem_shift).clone().detach()
            ^^^^^^^^^^^^^^^^^^^^^^^^^^^^^^^^^^
torch.OutOfMemoryError: CUDA out of memory. Tried to allocate 76.00 MiB. GPU 0 has a total capacity of 15.77 GiB of which 62.19 MiB is free. Including non-PyTorch memory, this process has 15.70 GiB memory in use. Of the allocated memory 14.66 GiB is allocated by PyTorch, and 677.45 MiB is reserved by PyTorch but unallocated. If reserved but unallocated memory is large try setting PYTORCH_CUDA_ALLOC_CONF=expandable_segments:True to avoid fragmentation.  See documentation for Memory Management  (https://pytorch.org/docs/stable/notes/cuda.html#environment-variables)
