mkdir: cannot create directory ‘/scratch/mne_data’: Permission denied

[notice] A new release of pip is available: 24.2 -> 26.1.2
[notice] To update, run: pip install --upgrade pip

[notice] A new release of pip is available: 24.2 -> 26.1.2
[notice] To update, run: pip install --upgrade pip
ERROR: Invalid requirement: 'Binary file requirements.txt matches': Expected end or semicolon (after name and no valid version specifier)
    Binary file requirements.txt matches
           ^ (from line 1 of /home/aleksander.berezowsk/requirements_notorch.txt)

[notice] A new release of pip is available: 24.2 -> 26.1.2
[notice] To update, run: pip install --upgrade pip

[notice] A new release of pip is available: 24.2 -> 26.1.2
[notice] To update, run: pip install --upgrade pip
/home/aleksander.berezowsk/spiking-eegnet/src/main.py:89: ExperimentalWarning: Argument ``multivariate`` is an experimental feature. The interface can change in the future.
  sampler=TPESampler(n_startup_trials=tpe_trails, multivariate=True, group=True)
/home/aleksander.berezowsk/spiking-eegnet/src/main.py:89: ExperimentalWarning: Argument ``group`` is an experimental feature. The interface can change in the future.
  sampler=TPESampler(n_startup_trials=tpe_trails, multivariate=True, group=True)
[I 2026-06-21 12:59:03,155] Using an existing study with name 'snn_eegnet_v2_200_20' instead of creating a new one.
[I 2026-06-21 15:16:08,626] Trial 89 finished with value: 0.435570987654321 and parameters: {'FLOW': 4.979155569342851, 'FHIGH': 107.81262106141995, 'LR_EXP': -2.9927234935555656, 'DROPOUT': 0.7485814646507819, 'BETA': 0.7185025373677638, 'SPIKE_GRAD_SLOPE': 11.825071565801258, 'TEMPORAL_FILTERS': 23, 'DEPTH_MULTIPLIER': 4, 'POINTWISE_FILTERS': 51, 'TEMPORAL_KERNEL_DIV': 8, 'SEPARABLE_KERNEL_SIZE': 12, 'POOL1_SIZE': 2, 'POOL2_SIZE': 3, 'NORM_AXIS': 'full'}. Best is trial 77 with value: 0.4922839506172839.
[I 2026-06-21 17:04:28,347] Trial 95 finished with value: 0.4421296296296296 and parameters: {'FLOW': 5.116228232846366, 'FHIGH': 117.92113976176033, 'LR_EXP': -3.9266930317258217, 'DROPOUT': 0.4950790544487902, 'BETA': 0.5855515151533763, 'SPIKE_GRAD_SLOPE': 20.883908860718584, 'TEMPORAL_FILTERS': 17, 'DEPTH_MULTIPLIER': 4, 'POINTWISE_FILTERS': 56, 'TEMPORAL_KERNEL_DIV': 8, 'SEPARABLE_KERNEL_SIZE': 10, 'POOL1_SIZE': 5, 'POOL2_SIZE': 5, 'NORM_AXIS': 'no_channel'}. Best is trial 77 with value: 0.4922839506172839.
[I 2026-06-21 19:37:34,642] Trial 98 finished with value: 0.4459876543209877 and parameters: {'FLOW': 3.8619512488223577, 'FHIGH': 104.44292079887418, 'LR_EXP': -3.020741612646977, 'DROPOUT': 0.3997978028731384, 'BETA': 0.5021425352401951, 'SPIKE_GRAD_SLOPE': 12.02569304863039, 'TEMPORAL_FILTERS': 27, 'DEPTH_MULTIPLIER': 4, 'POINTWISE_FILTERS': 46, 'TEMPORAL_KERNEL_DIV': 8, 'SEPARABLE_KERNEL_SIZE': 7, 'POOL1_SIZE': 2, 'POOL2_SIZE': 8, 'NORM_AXIS': 'full'}. Best is trial 77 with value: 0.4922839506172839.
[I 2026-06-21 22:21:21,089] Trial 102 finished with value: 0.43094135802469136 and parameters: {'FLOW': 4.0270561856197675, 'FHIGH': 105.58756692216113, 'LR_EXP': -3.2836809633681123, 'DROPOUT': 0.2928839932096486, 'BETA': 0.6977750335655972, 'SPIKE_GRAD_SLOPE': 42.50332159997259, 'TEMPORAL_FILTERS': 30, 'DEPTH_MULTIPLIER': 4, 'POINTWISE_FILTERS': 48, 'TEMPORAL_KERNEL_DIV': 8, 'SEPARABLE_KERNEL_SIZE': 5, 'POOL1_SIZE': 3, 'POOL2_SIZE': 8, 'NORM_AXIS': 'no_channel'}. Best is trial 77 with value: 0.4922839506172839.
[I 2026-06-22 00:08:22,728] Trial 107 finished with value: 0.48148148148148145 and parameters: {'FLOW': 1.1428128634003207, 'FHIGH': 48.57704286043656, 'LR_EXP': -2.7842668605541006, 'DROPOUT': 0.3950047102183442, 'BETA': 0.6816057316654323, 'SPIKE_GRAD_SLOPE': 8.037347126866091, 'TEMPORAL_FILTERS': 21, 'DEPTH_MULTIPLIER': 2, 'POINTWISE_FILTERS': 10, 'TEMPORAL_KERNEL_DIV': 6, 'SEPARABLE_KERNEL_SIZE': 4, 'POOL1_SIZE': 7, 'POOL2_SIZE': 5, 'NORM_AXIS': 'no_channel'}. Best is trial 77 with value: 0.4922839506172839.
[I 2026-06-22 02:07:49,198] Trial 110 finished with value: 0.4538966049382716 and parameters: {'FLOW': 1.4424206184542603, 'FHIGH': 47.397020936391485, 'LR_EXP': -2.087052040675431, 'DROPOUT': 0.4075674431690401, 'BETA': 0.5655096474112287, 'SPIKE_GRAD_SLOPE': 11.345851368860183, 'TEMPORAL_FILTERS': 25, 'DEPTH_MULTIPLIER': 2, 'POINTWISE_FILTERS': 18, 'TEMPORAL_KERNEL_DIV': 6, 'SEPARABLE_KERNEL_SIZE': 9, 'POOL1_SIZE': 6, 'POOL2_SIZE': 5, 'NORM_AXIS': 'no_channel'}. Best is trial 77 with value: 0.4922839506172839.
[I 2026-06-22 03:42:39,061] Trial 114 finished with value: 0.4633487654320988 and parameters: {'FLOW': 3.598913216210873, 'FHIGH': 47.19091405925607, 'LR_EXP': -3.137917892581033, 'DROPOUT': 0.4881654160419031, 'BETA': 0.8602741732829036, 'SPIKE_GRAD_SLOPE': 4.799125535328051, 'TEMPORAL_FILTERS': 19, 'DEPTH_MULTIPLIER': 2, 'POINTWISE_FILTERS': 9, 'TEMPORAL_KERNEL_DIV': 8, 'SEPARABLE_KERNEL_SIZE': 5, 'POOL1_SIZE': 8, 'POOL2_SIZE': 4, 'NORM_AXIS': 'no_channel'}. Best is trial 77 with value: 0.4922839506172839.
[I 2026-06-22 05:25:02,820] Trial 116 finished with value: 0.41242283950617287 and parameters: {'FLOW': 3.652280734005582, 'FHIGH': 25.221526027456974, 'LR_EXP': -2.4781025090860984, 'DROPOUT': 0.26316153615320026, 'BETA': 0.7099668991112417, 'SPIKE_GRAD_SLOPE': 9.461823201897698, 'TEMPORAL_FILTERS': 14, 'DEPTH_MULTIPLIER': 3, 'POINTWISE_FILTERS': 31, 'TEMPORAL_KERNEL_DIV': 4, 'SEPARABLE_KERNEL_SIZE': 6, 'POOL1_SIZE': 6, 'POOL2_SIZE': 6, 'NORM_AXIS': 'no_channel'}. Best is trial 77 with value: 0.4922839506172839.
[I 2026-06-22 08:32:41,993] Trial 120 finished with value: 0.46913580246913583 and parameters: {'FLOW': 1.6123471070510857, 'FHIGH': 57.72567104330484, 'LR_EXP': -3.034405350900956, 'DROPOUT': 0.2112968949908104, 'BETA': 0.6870253752211342, 'SPIKE_GRAD_SLOPE': 10.907305117550989, 'TEMPORAL_FILTERS': 28, 'DEPTH_MULTIPLIER': 4, 'POINTWISE_FILTERS': 52, 'TEMPORAL_KERNEL_DIV': 3, 'SEPARABLE_KERNEL_SIZE': 12, 'POOL1_SIZE': 3, 'POOL2_SIZE': 7, 'NORM_AXIS': 'no_channel'}. Best is trial 77 with value: 0.4922839506172839.
[I 2026-06-22 11:14:27,393] Trial 124 finished with value: 0.44058641975308643 and parameters: {'FLOW': 2.0254210260568097, 'FHIGH': 84.14400778156168, 'LR_EXP': -2.7605063348706964, 'DROPOUT': 0.40866981449957357, 'BETA': 0.6276901280242456, 'SPIKE_GRAD_SLOPE': 21.59909916725785, 'TEMPORAL_FILTERS': 25, 'DEPTH_MULTIPLIER': 3, 'POINTWISE_FILTERS': 58, 'TEMPORAL_KERNEL_DIV': 3, 'SEPARABLE_KERNEL_SIZE': 9, 'POOL1_SIZE': 3, 'POOL2_SIZE': 7, 'NORM_AXIS': 'no_channel'}. Best is trial 77 with value: 0.4922839506172839.
[W 2026-06-22 12:39:06,744] Trial 128 failed with parameters: {'FLOW': 1.714147961790908, 'FHIGH': 109.86287164579208, 'LR_EXP': -3.1908684805923206, 'DROPOUT': 0.2968353127701896, 'BETA': 0.5165993387195774, 'SPIKE_GRAD_SLOPE': 3.5042106420331116, 'TEMPORAL_FILTERS': 30, 'DEPTH_MULTIPLIER': 3, 'POINTWISE_FILTERS': 52, 'TEMPORAL_KERNEL_DIV': 7, 'SEPARABLE_KERNEL_SIZE': 6, 'POOL1_SIZE': 2, 'POOL2_SIZE': 8, 'NORM_AXIS': 'no_channel'} because of the following error: OutOfMemoryError('CUDA out of memory. Tried to allocate 82.00 MiB. GPU 0 has a total capacity of 15.77 GiB of which 38.19 MiB is free. Including non-PyTorch memory, this process has 15.72 GiB memory in use. Of the allocated memory 15.09 GiB is allocated by PyTorch, and 263.89 MiB is reserved by PyTorch but unallocated. If reserved but unallocated memory is large try setting PYTORCH_CUDA_ALLOC_CONF=expandable_segments:True to avoid fragmentation.  See documentation for Memory Management  (https://pytorch.org/docs/stable/notes/cuda.html#environment-variables)').
Traceback (most recent call last):
  File "/home/aleksander.berezowsk/venv/lib/python3.12/site-packages/optuna/study/_optimize.py", line 206, in _run_trial
    value_or_values = func(trial)
                      ^^^^^^^^^^^
  File "/home/aleksander.berezowsk/spiking-eegnet/src/main.py", line 44, in objective
    return pipeline(**params, **FIXED, trial=trial, save_plots=False)
           ^^^^^^^^^^^^^^^^^^^^^^^^^^^^^^^^^^^^^^^^^^^^^^^^^^^^^^^^^^
  File "/home/aleksander.berezowsk/spiking-eegnet/src/pipeline.py", line 141, in pipeline
    histories, accs, mean_acc = experiment_loso_all(
                                ^^^^^^^^^^^^^^^^^^^^
  File "/home/aleksander.berezowsk/spiking-eegnet/src/experiment_loso.py", line 71, in experiment_loso_all
    history, final_acc, _model = experiment_loso(
                                 ^^^^^^^^^^^^^^^^
  File "/home/aleksander.berezowsk/spiking-eegnet/src/experiment_loso.py", line 30, in experiment_loso
    history = run_training(
              ^^^^^^^^^^^^^
  File "/home/aleksander.berezowsk/spiking-eegnet/src/run_training.py", line 45, in run_training
    loss = train_one_epoch(model, train_loader, optimizer, criterion, device, n_steps_train)
           ^^^^^^^^^^^^^^^^^^^^^^^^^^^^^^^^^^^^^^^^^^^^^^^^^^^^^^^^^^^^^^^^^^^^^^^^^^^^^^^^^
  File "/home/aleksander.berezowsk/spiking-eegnet/src/train_one_epoch.py", line 7, in train_one_epoch
    spk = model(xb, num_steps=n_steps)
          ^^^^^^^^^^^^^^^^^^^^^^^^^^^^
  File "/home/aleksander.berezowsk/venv/lib/python3.12/site-packages/torch/nn/modules/module.py", line 1553, in _wrapped_call_impl
    return self._call_impl(*args, **kwargs)
           ^^^^^^^^^^^^^^^^^^^^^^^^^^^^^^^^
  File "/home/aleksander.berezowsk/venv/lib/python3.12/site-packages/torch/nn/modules/module.py", line 1562, in _call_impl
    return forward_call(*args, **kwargs)
           ^^^^^^^^^^^^^^^^^^^^^^^^^^^^^
  File "/home/aleksander.berezowsk/spiking-eegnet/src/spiking_eegnet.py", line 222, in forward
    spk1, mem1 = self.lif1(cur, mem1)
                 ^^^^^^^^^^^^^^^^^^^^
  File "/home/aleksander.berezowsk/venv/lib/python3.12/site-packages/torch/nn/modules/module.py", line 1553, in _wrapped_call_impl
    return self._call_impl(*args, **kwargs)
           ^^^^^^^^^^^^^^^^^^^^^^^^^^^^^^^^
  File "/home/aleksander.berezowsk/venv/lib/python3.12/site-packages/torch/nn/modules/module.py", line 1562, in _call_impl
    return forward_call(*args, **kwargs)
           ^^^^^^^^^^^^^^^^^^^^^^^^^^^^^
  File "/home/aleksander.berezowsk/venv/lib/python3.12/site-packages/snntorch/_neurons/leaky.py", line 209, in forward
    self.reset = self.mem_reset(self.mem)
                 ^^^^^^^^^^^^^^^^^^^^^^^^
  File "/home/aleksander.berezowsk/venv/lib/python3.12/site-packages/snntorch/_neurons/neurons.py", line 106, in mem_reset
    reset = self.spike_grad(mem_shift).clone().detach()
            ^^^^^^^^^^^^^^^^^^^^^^^^^^^^^^^^^^
torch.OutOfMemoryError: CUDA out of memory. Tried to allocate 82.00 MiB. GPU 0 has a total capacity of 15.77 GiB of which 38.19 MiB is free. Including non-PyTorch memory, this process has 15.72 GiB memory in use. Of the allocated memory 15.09 GiB is allocated by PyTorch, and 263.89 MiB is reserved by PyTorch but unallocated. If reserved but unallocated memory is large try setting PYTORCH_CUDA_ALLOC_CONF=expandable_segments:True to avoid fragmentation.  See documentation for Memory Management  (https://pytorch.org/docs/stable/notes/cuda.html#environment-variables)
[W 2026-06-22 12:39:06,780] Trial 128 failed with value None.
Traceback (most recent call last):
  File "/home/aleksander.berezowsk/spiking-eegnet/src/main.py", line 95, in <module>
    study.optimize(objective, n_trials=n_trials, n_jobs=1,
  File "/home/aleksander.berezowsk/venv/lib/python3.12/site-packages/optuna/study/study.py", line 516, in optimize
    _optimize(
  File "/home/aleksander.berezowsk/venv/lib/python3.12/site-packages/optuna/study/_optimize.py", line 68, in _optimize
    _optimize_sequential(
  File "/home/aleksander.berezowsk/venv/lib/python3.12/site-packages/optuna/study/_optimize.py", line 165, in _optimize_sequential
    frozen_trial_id = _run_trial(study, func, catch)
                      ^^^^^^^^^^^^^^^^^^^^^^^^^^^^^^
  File "/home/aleksander.berezowsk/venv/lib/python3.12/site-packages/optuna/study/_optimize.py", line 263, in _run_trial
    raise func_err
  File "/home/aleksander.berezowsk/venv/lib/python3.12/site-packages/optuna/study/_optimize.py", line 206, in _run_trial
    value_or_values = func(trial)
                      ^^^^^^^^^^^
  File "/home/aleksander.berezowsk/spiking-eegnet/src/main.py", line 44, in objective
    return pipeline(**params, **FIXED, trial=trial, save_plots=False)
           ^^^^^^^^^^^^^^^^^^^^^^^^^^^^^^^^^^^^^^^^^^^^^^^^^^^^^^^^^^
  File "/home/aleksander.berezowsk/spiking-eegnet/src/pipeline.py", line 141, in pipeline
    histories, accs, mean_acc = experiment_loso_all(
                                ^^^^^^^^^^^^^^^^^^^^
  File "/home/aleksander.berezowsk/spiking-eegnet/src/experiment_loso.py", line 71, in experiment_loso_all
    history, final_acc, _model = experiment_loso(
                                 ^^^^^^^^^^^^^^^^
  File "/home/aleksander.berezowsk/spiking-eegnet/src/experiment_loso.py", line 30, in experiment_loso
    history = run_training(
              ^^^^^^^^^^^^^
  File "/home/aleksander.berezowsk/spiking-eegnet/src/run_training.py", line 45, in run_training
    loss = train_one_epoch(model, train_loader, optimizer, criterion, device, n_steps_train)
           ^^^^^^^^^^^^^^^^^^^^^^^^^^^^^^^^^^^^^^^^^^^^^^^^^^^^^^^^^^^^^^^^^^^^^^^^^^^^^^^^^
  File "/home/aleksander.berezowsk/spiking-eegnet/src/train_one_epoch.py", line 7, in train_one_epoch
    spk = model(xb, num_steps=n_steps)
          ^^^^^^^^^^^^^^^^^^^^^^^^^^^^
  File "/home/aleksander.berezowsk/venv/lib/python3.12/site-packages/torch/nn/modules/module.py", line 1553, in _wrapped_call_impl
    return self._call_impl(*args, **kwargs)
           ^^^^^^^^^^^^^^^^^^^^^^^^^^^^^^^^
  File "/home/aleksander.berezowsk/venv/lib/python3.12/site-packages/torch/nn/modules/module.py", line 1562, in _call_impl
    return forward_call(*args, **kwargs)
           ^^^^^^^^^^^^^^^^^^^^^^^^^^^^^
  File "/home/aleksander.berezowsk/spiking-eegnet/src/spiking_eegnet.py", line 222, in forward
    spk1, mem1 = self.lif1(cur, mem1)
                 ^^^^^^^^^^^^^^^^^^^^
  File "/home/aleksander.berezowsk/venv/lib/python3.12/site-packages/torch/nn/modules/module.py", line 1553, in _wrapped_call_impl
    return self._call_impl(*args, **kwargs)
           ^^^^^^^^^^^^^^^^^^^^^^^^^^^^^^^^
  File "/home/aleksander.berezowsk/venv/lib/python3.12/site-packages/torch/nn/modules/module.py", line 1562, in _call_impl
    return forward_call(*args, **kwargs)
           ^^^^^^^^^^^^^^^^^^^^^^^^^^^^^
  File "/home/aleksander.berezowsk/venv/lib/python3.12/site-packages/snntorch/_neurons/leaky.py", line 209, in forward
    self.reset = self.mem_reset(self.mem)
                 ^^^^^^^^^^^^^^^^^^^^^^^^
  File "/home/aleksander.berezowsk/venv/lib/python3.12/site-packages/snntorch/_neurons/neurons.py", line 106, in mem_reset
    reset = self.spike_grad(mem_shift).clone().detach()
            ^^^^^^^^^^^^^^^^^^^^^^^^^^^^^^^^^^
torch.OutOfMemoryError: CUDA out of memory. Tried to allocate 82.00 MiB. GPU 0 has a total capacity of 15.77 GiB of which 38.19 MiB is free. Including non-PyTorch memory, this process has 15.72 GiB memory in use. Of the allocated memory 15.09 GiB is allocated by PyTorch, and 263.89 MiB is reserved by PyTorch but unallocated. If reserved but unallocated memory is large try setting PYTORCH_CUDA_ALLOC_CONF=expandable_segments:True to avoid fragmentation.  See documentation for Memory Management  (https://pytorch.org/docs/stable/notes/cuda.html#environment-variables)
