mkdir: cannot create directory ‘/scratch/mne_data’: Permission denied

[notice] A new release of pip is available: 24.2 -> 26.1.2
[notice] To update, run: pip install --upgrade pip

[notice] A new release of pip is available: 24.2 -> 26.1.2
[notice] To update, run: pip install --upgrade pip
ERROR: Invalid requirement: 'Binary file requirements.txt matches': Expected end or semicolon (after name and no valid version specifier)
    Binary file requirements.txt matches
           ^ (from line 1 of /home/aleksander.berezowsk/requirements_notorch.txt)

[notice] A new release of pip is available: 24.2 -> 26.1.2
[notice] To update, run: pip install --upgrade pip

[notice] A new release of pip is available: 24.2 -> 26.1.2
[notice] To update, run: pip install --upgrade pip
/home/aleksander.berezowsk/spiking-eegnet/src/main.py:97: ExperimentalWarning: Argument ``multivariate`` is an experimental feature. The interface can change in the future.
  sampler=TPESampler(n_startup_trials=tpe_trails, multivariate=True, group=True)
/home/aleksander.berezowsk/spiking-eegnet/src/main.py:97: ExperimentalWarning: Argument ``group`` is an experimental feature. The interface can change in the future.
  sampler=TPESampler(n_startup_trials=tpe_trails, multivariate=True, group=True)
[I 2026-06-29 13:58:47,695] Using an existing study with name 'snn_eegnet_v3_200_20' instead of creating a new one.
[I 2026-06-29 16:56:43,646] Trial 96 finished with value: 0.4513888888888889 and parameters: {'FLOW': 2.1873825762633663, 'FHIGH': 88.94581488727844, 'LR_EXP': -3.1699328019185584, 'DROPOUT': 0.17312146276327509, 'BETA': 0.8605267653148234, 'SPIKE_GRAD_SLOPE': 26.6526805291264, 'TEMPORAL_FILTERS': 22, 'DEPTH_MULTIPLIER': 2, 'POINTWISE_FILTERS': 33, 'TEMPORAL_KERNEL_DIV': 6, 'SEPARABLE_KERNEL_SIZE': 27, 'POOL1_SIZE': 6, 'POOL2_SIZE': 8, 'N_STEPS_TRAIN': 15, 'N_STEPS_EVAL': 23, 'READOUT_MODE': 'spk_mean'}. Best is trial 63 with value: 0.4920910493827161.
[I 2026-06-29 19:56:14,849] Trial 99 finished with value: 0.4388503086419753 and parameters: {'FLOW': 3.256601668934584, 'FHIGH': 19.731816200427453, 'LR_EXP': -3.326098403634169, 'DROPOUT': 0.24337955439478634, 'BETA': 0.9081166922370258, 'SPIKE_GRAD_SLOPE': 43.912156548478755, 'TEMPORAL_FILTERS': 29, 'DEPTH_MULTIPLIER': 3, 'POINTWISE_FILTERS': 58, 'TEMPORAL_KERNEL_DIV': 6, 'SEPARABLE_KERNEL_SIZE': 31, 'POOL1_SIZE': 8, 'POOL2_SIZE': 6, 'N_STEPS_TRAIN': 11, 'N_STEPS_EVAL': 21, 'READOUT_MODE': 'spk_mean'}. Best is trial 63 with value: 0.4920910493827161.
[I 2026-06-29 23:26:32,461] Trial 102 finished with value: 0.4756944444444444 and parameters: {'FLOW': 2.059430736775277, 'FHIGH': 65.51844730902708, 'LR_EXP': -3.433016832084476, 'DROPOUT': 0.5047457347041919, 'BETA': 0.8698245445374593, 'SPIKE_GRAD_SLOPE': 28.245562368679742, 'TEMPORAL_FILTERS': 22, 'DEPTH_MULTIPLIER': 2, 'POINTWISE_FILTERS': 38, 'TEMPORAL_KERNEL_DIV': 4, 'SEPARABLE_KERNEL_SIZE': 29, 'POOL1_SIZE': 3, 'POOL2_SIZE': 7, 'N_STEPS_TRAIN': 16, 'N_STEPS_EVAL': 32, 'READOUT_MODE': 'spk_last'}. Best is trial 63 with value: 0.4920910493827161.
[I 2026-06-30 02:03:29,512] Trial 105 finished with value: 0.4764660493827161 and parameters: {'FLOW': 1.026095671073764, 'FHIGH': 60.86927170310102, 'LR_EXP': -2.671977063680226, 'DROPOUT': 0.32551757425143335, 'BETA': 0.945424312818596, 'SPIKE_GRAD_SLOPE': 16.50508771284318, 'TEMPORAL_FILTERS': 24, 'DEPTH_MULTIPLIER': 2, 'POINTWISE_FILTERS': 17, 'TEMPORAL_KERNEL_DIV': 6, 'SEPARABLE_KERNEL_SIZE': 23, 'POOL1_SIZE': 5, 'POOL2_SIZE': 7, 'N_STEPS_TRAIN': 12, 'N_STEPS_EVAL': 31, 'READOUT_MODE': 'spk_last'}. Best is trial 63 with value: 0.4920910493827161.
[I 2026-06-30 05:41:53,615] Trial 107 finished with value: 0.45621141975308643 and parameters: {'FLOW': 1.2984869389807774, 'FHIGH': 94.80748171532855, 'LR_EXP': -2.838776947966912, 'DROPOUT': 0.5883672037181724, 'BETA': 0.6620993023529982, 'SPIKE_GRAD_SLOPE': 50.218393057926036, 'TEMPORAL_FILTERS': 29, 'DEPTH_MULTIPLIER': 2, 'POINTWISE_FILTERS': 21, 'TEMPORAL_KERNEL_DIV': 7, 'SEPARABLE_KERNEL_SIZE': 16, 'POOL1_SIZE': 3, 'POOL2_SIZE': 5, 'N_STEPS_TRAIN': 16, 'N_STEPS_EVAL': 15, 'READOUT_MODE': 'spk_sum'}. Best is trial 63 with value: 0.4920910493827161.
[I 2026-06-30 08:59:29,559] Trial 111 finished with value: 0.45351080246913583 and parameters: {'FLOW': 2.070645320907223, 'FHIGH': 37.30984687905526, 'LR_EXP': -2.6966210567936115, 'DROPOUT': 0.10233345024649318, 'BETA': 0.9326008822296172, 'SPIKE_GRAD_SLOPE': 3.4879324257229025, 'TEMPORAL_FILTERS': 27, 'DEPTH_MULTIPLIER': 3, 'POINTWISE_FILTERS': 16, 'TEMPORAL_KERNEL_DIV': 3, 'SEPARABLE_KERNEL_SIZE': 25, 'POOL1_SIZE': 8, 'POOL2_SIZE': 7, 'N_STEPS_TRAIN': 11, 'N_STEPS_EVAL': 14, 'READOUT_MODE': 'spk_sum'}. Best is trial 63 with value: 0.4920910493827161.
slurmstepd: error: *** JOB 44343368 ON fg2 CANCELLED AT 2026-06-30T09:59:55 ***
