mkdir: cannot create directory ‘/scratch/mne_data’: Permission denied

[notice] A new release of pip is available: 24.2 -> 26.1.2
[notice] To update, run: pip install --upgrade pip

[notice] A new release of pip is available: 24.2 -> 26.1.2
[notice] To update, run: pip install --upgrade pip
ERROR: Invalid requirement: 'Binary file requirements.txt matches': Expected end or semicolon (after name and no valid version specifier)
    Binary file requirements.txt matches
           ^ (from line 1 of /home/aleksander.berezowsk/requirements_notorch.txt)

[notice] A new release of pip is available: 24.2 -> 26.1.2
[notice] To update, run: pip install --upgrade pip

[notice] A new release of pip is available: 24.2 -> 26.1.2
[notice] To update, run: pip install --upgrade pip
/home/aleksander.berezowsk/spiking-eegnet/src/main.py:92: ExperimentalWarning: Argument ``multivariate`` is an experimental feature. The interface can change in the future.
  sampler=TPESampler(n_startup_trials=tpe_trails, multivariate=True, group=True)
/home/aleksander.berezowsk/spiking-eegnet/src/main.py:92: ExperimentalWarning: Argument ``group`` is an experimental feature. The interface can change in the future.
  sampler=TPESampler(n_startup_trials=tpe_trails, multivariate=True, group=True)
[I 2026-07-05 23:23:58,525] Using an existing study with name 'snn_eegnet_v4_400_40' instead of creating a new one.
[I 2026-07-06 03:31:16,233] Trial 75 finished with value: 0.5407021604938271 and parameters: {'LR_EXP': -3.097658324942522, 'DROPOUT': 0.44137971447532526, 'BETA': 0.7949257736949245, 'SPIKE_GRAD_SLOPE': 35.73888106424411, 'TEMPORAL_FILTERS': 37, 'DEPTH_MULTIPLIER': 3, 'POINTWISE_FILTERS': 57, 'TEMPORAL_KERNEL_DIV': 5, 'SEPARABLE_KERNEL_SIZE': 22, 'POOL1_SIZE': 4, 'POOL2_SIZE': 3, 'N_STEPS_TRAIN': 11, 'N_STEPS_EVAL': 18, 'READOUT_MODE': 'spk_sum'}. Best is trial 46 with value: 0.5719521604938271.
[I 2026-07-06 05:40:25,738] Trial 82 finished with value: 0.5623070987654322 and parameters: {'LR_EXP': -2.362533065021189, 'DROPOUT': 0.3169372841393859, 'BETA': 0.7751190010415288, 'SPIKE_GRAD_SLOPE': 2.2406596866059965, 'TEMPORAL_FILTERS': 14, 'DEPTH_MULTIPLIER': 4, 'POINTWISE_FILTERS': 28, 'TEMPORAL_KERNEL_DIV': 8, 'SEPARABLE_KERNEL_SIZE': 9, 'POOL1_SIZE': 8, 'POOL2_SIZE': 3, 'N_STEPS_TRAIN': 13, 'N_STEPS_EVAL': 9, 'READOUT_MODE': 'spk_sum'}. Best is trial 46 with value: 0.5719521604938271.
[I 2026-07-06 08:54:12,785] Trial 84 finished with value: 0.5572916666666666 and parameters: {'LR_EXP': -2.8325655708378314, 'DROPOUT': 0.29508930289658664, 'BETA': 0.7548084698152803, 'SPIKE_GRAD_SLOPE': 6.44037305303153, 'TEMPORAL_FILTERS': 23, 'DEPTH_MULTIPLIER': 4, 'POINTWISE_FILTERS': 24, 'TEMPORAL_KERNEL_DIV': 8, 'SEPARABLE_KERNEL_SIZE': 17, 'POOL1_SIZE': 7, 'POOL2_SIZE': 3, 'N_STEPS_TRAIN': 14, 'N_STEPS_EVAL': 6, 'READOUT_MODE': 'spk_sum'}. Best is trial 46 with value: 0.5719521604938271.
[I 2026-07-06 11:24:43,069] Trial 90 finished with value: 0.5451388888888888 and parameters: {'LR_EXP': -3.9488517150761786, 'DROPOUT': 0.4910504492592422, 'BETA': 0.7741180811905445, 'SPIKE_GRAD_SLOPE': 10.238647998543374, 'TEMPORAL_FILTERS': 46, 'DEPTH_MULTIPLIER': 2, 'POINTWISE_FILTERS': 59, 'TEMPORAL_KERNEL_DIV': 4, 'SEPARABLE_KERNEL_SIZE': 5, 'POOL1_SIZE': 6, 'POOL2_SIZE': 4, 'N_STEPS_TRAIN': 6, 'N_STEPS_EVAL': 14, 'READOUT_MODE': 'spk_sum'}. Best is trial 46 with value: 0.5719521604938271.
[I 2026-07-06 14:11:20,385] Trial 92 finished with value: 0.5455246913580247 and parameters: {'LR_EXP': -2.015453067884828, 'DROPOUT': 0.4015860823254454, 'BETA': 0.7660503683243469, 'SPIKE_GRAD_SLOPE': 2.377728557716539, 'TEMPORAL_FILTERS': 23, 'DEPTH_MULTIPLIER': 3, 'POINTWISE_FILTERS': 16, 'TEMPORAL_KERNEL_DIV': 8, 'SEPARABLE_KERNEL_SIZE': 17, 'POOL1_SIZE': 7, 'POOL2_SIZE': 7, 'N_STEPS_TRAIN': 13, 'N_STEPS_EVAL': 17, 'READOUT_MODE': 'spk_mean'}. Best is trial 46 with value: 0.5719521604938271.
[W 2026-07-06 15:30:22,167] Trial 99 failed with parameters: {'LR_EXP': -2.8827700473860105, 'DROPOUT': 0.39290934777884906, 'BETA': 0.9520211033321572, 'SPIKE_GRAD_SLOPE': 26.129474472759192, 'TEMPORAL_FILTERS': 51, 'DEPTH_MULTIPLIER': 3, 'POINTWISE_FILTERS': 52, 'TEMPORAL_KERNEL_DIV': 7, 'SEPARABLE_KERNEL_SIZE': 34, 'POOL1_SIZE': 4, 'POOL2_SIZE': 6, 'N_STEPS_TRAIN': 13, 'N_STEPS_EVAL': 25, 'READOUT_MODE': 'spk_mean'} because of the following error: OutOfMemoryError('CUDA out of memory. Tried to allocate 138.00 MiB. GPU 0 has a total capacity of 15.77 GiB of which 192.00 KiB is free. Including non-PyTorch memory, this process has 15.76 GiB memory in use. Of the allocated memory 15.13 GiB is allocated by PyTorch, and 264.26 MiB is reserved by PyTorch but unallocated. If reserved but unallocated memory is large try setting PYTORCH_CUDA_ALLOC_CONF=expandable_segments:True to avoid fragmentation.  See documentation for Memory Management  (https://pytorch.org/docs/stable/notes/cuda.html#environment-variables)').
Traceback (most recent call last):
  File "/home/aleksander.berezowsk/venv/lib/python3.12/site-packages/optuna/study/_optimize.py", line 206, in _run_trial
    value_or_values = func(trial)
                      ^^^^^^^^^^^
  File "/home/aleksander.berezowsk/spiking-eegnet/src/main.py", line 47, in objective
    return pipeline(**params, **FIXED, trial=trial, save_plots=False)
           ^^^^^^^^^^^^^^^^^^^^^^^^^^^^^^^^^^^^^^^^^^^^^^^^^^^^^^^^^^
  File "/home/aleksander.berezowsk/spiking-eegnet/src/pipeline.py", line 135, in pipeline
    histories, accs, mean_acc = experiment_loso_all(
                                ^^^^^^^^^^^^^^^^^^^^
  File "/home/aleksander.berezowsk/spiking-eegnet/src/experiment_loso.py", line 71, in experiment_loso_all
    history, final_acc, _model = experiment_loso(
                                 ^^^^^^^^^^^^^^^^
  File "/home/aleksander.berezowsk/spiking-eegnet/src/experiment_loso.py", line 30, in experiment_loso
    history = run_training(
              ^^^^^^^^^^^^^
  File "/home/aleksander.berezowsk/spiking-eegnet/src/run_training.py", line 50, in run_training
    loss = train_one_epoch(model, train_loader, optimizer, criterion, device,
           ^^^^^^^^^^^^^^^^^^^^^^^^^^^^^^^^^^^^^^^^^^^^^^^^^^^^^^^^^^^^^^^^^^
  File "/home/aleksander.berezowsk/spiking-eegnet/src/train_one_epoch.py", line 62, in train_one_epoch
    loss.backward()
  File "/home/aleksander.berezowsk/venv/lib/python3.12/site-packages/torch/_tensor.py", line 521, in backward
    torch.autograd.backward(
  File "/home/aleksander.berezowsk/venv/lib/python3.12/site-packages/torch/autograd/__init__.py", line 289, in backward
    _engine_run_backward(
  File "/home/aleksander.berezowsk/venv/lib/python3.12/site-packages/torch/autograd/graph.py", line 768, in _engine_run_backward
    return Variable._execution_engine.run_backward(  # Calls into the C++ engine to run the backward pass
           ^^^^^^^^^^^^^^^^^^^^^^^^^^^^^^^^^^^^^^^^^^^^^^^^^^^^^^^^^^^^^^^^^^^^^^^^^^^^^^^^^^^^^^^^^^^^^^
  File "/home/aleksander.berezowsk/venv/lib/python3.12/site-packages/torch/autograd/function.py", line 306, in apply
    return user_fn(self, *args)
           ^^^^^^^^^^^^^^^^^^^^
  File "/home/aleksander.berezowsk/venv/lib/python3.12/site-packages/snntorch/surrogate.py", line 142, in backward
    grad = grad_input / (ctx.slope * torch.abs(input_) + 1.0) ** 2
                         ~~~~~~~~~~^~~~~~~~~~~~~~~~~~~
torch.OutOfMemoryError: CUDA out of memory. Tried to allocate 138.00 MiB. GPU 0 has a total capacity of 15.77 GiB of which 192.00 KiB is free. Including non-PyTorch memory, this process has 15.76 GiB memory in use. Of the allocated memory 15.13 GiB is allocated by PyTorch, and 264.26 MiB is reserved by PyTorch but unallocated. If reserved but unallocated memory is large try setting PYTORCH_CUDA_ALLOC_CONF=expandable_segments:True to avoid fragmentation.  See documentation for Memory Management  (https://pytorch.org/docs/stable/notes/cuda.html#environment-variables)
[W 2026-07-06 15:30:22,217] Trial 99 failed with value None.
Traceback (most recent call last):
  File "/home/aleksander.berezowsk/spiking-eegnet/src/main.py", line 98, in <module>
    study.optimize(objective, n_trials=n_trials, n_jobs=1,
  File "/home/aleksander.berezowsk/venv/lib/python3.12/site-packages/optuna/study/study.py", line 516, in optimize
    _optimize(
  File "/home/aleksander.berezowsk/venv/lib/python3.12/site-packages/optuna/study/_optimize.py", line 68, in _optimize
    _optimize_sequential(
  File "/home/aleksander.berezowsk/venv/lib/python3.12/site-packages/optuna/study/_optimize.py", line 165, in _optimize_sequential
    frozen_trial_id = _run_trial(study, func, catch)
                      ^^^^^^^^^^^^^^^^^^^^^^^^^^^^^^
  File "/home/aleksander.berezowsk/venv/lib/python3.12/site-packages/optuna/study/_optimize.py", line 263, in _run_trial
    raise func_err
  File "/home/aleksander.berezowsk/venv/lib/python3.12/site-packages/optuna/study/_optimize.py", line 206, in _run_trial
    value_or_values = func(trial)
                      ^^^^^^^^^^^
  File "/home/aleksander.berezowsk/spiking-eegnet/src/main.py", line 47, in objective
    return pipeline(**params, **FIXED, trial=trial, save_plots=False)
           ^^^^^^^^^^^^^^^^^^^^^^^^^^^^^^^^^^^^^^^^^^^^^^^^^^^^^^^^^^
  File "/home/aleksander.berezowsk/spiking-eegnet/src/pipeline.py", line 135, in pipeline
    histories, accs, mean_acc = experiment_loso_all(
                                ^^^^^^^^^^^^^^^^^^^^
  File "/home/aleksander.berezowsk/spiking-eegnet/src/experiment_loso.py", line 71, in experiment_loso_all
    history, final_acc, _model = experiment_loso(
                                 ^^^^^^^^^^^^^^^^
  File "/home/aleksander.berezowsk/spiking-eegnet/src/experiment_loso.py", line 30, in experiment_loso
    history = run_training(
              ^^^^^^^^^^^^^
  File "/home/aleksander.berezowsk/spiking-eegnet/src/run_training.py", line 50, in run_training
    loss = train_one_epoch(model, train_loader, optimizer, criterion, device,
           ^^^^^^^^^^^^^^^^^^^^^^^^^^^^^^^^^^^^^^^^^^^^^^^^^^^^^^^^^^^^^^^^^^
  File "/home/aleksander.berezowsk/spiking-eegnet/src/train_one_epoch.py", line 62, in train_one_epoch
    loss.backward()
  File "/home/aleksander.berezowsk/venv/lib/python3.12/site-packages/torch/_tensor.py", line 521, in backward
    torch.autograd.backward(
  File "/home/aleksander.berezowsk/venv/lib/python3.12/site-packages/torch/autograd/__init__.py", line 289, in backward
    _engine_run_backward(
  File "/home/aleksander.berezowsk/venv/lib/python3.12/site-packages/torch/autograd/graph.py", line 768, in _engine_run_backward
    return Variable._execution_engine.run_backward(  # Calls into the C++ engine to run the backward pass
           ^^^^^^^^^^^^^^^^^^^^^^^^^^^^^^^^^^^^^^^^^^^^^^^^^^^^^^^^^^^^^^^^^^^^^^^^^^^^^^^^^^^^^^^^^^^^^^
  File "/home/aleksander.berezowsk/venv/lib/python3.12/site-packages/torch/autograd/function.py", line 306, in apply
    return user_fn(self, *args)
           ^^^^^^^^^^^^^^^^^^^^
  File "/home/aleksander.berezowsk/venv/lib/python3.12/site-packages/snntorch/surrogate.py", line 142, in backward
    grad = grad_input / (ctx.slope * torch.abs(input_) + 1.0) ** 2
                         ~~~~~~~~~~^~~~~~~~~~~~~~~~~~~
torch.OutOfMemoryError: CUDA out of memory. Tried to allocate 138.00 MiB. GPU 0 has a total capacity of 15.77 GiB of which 192.00 KiB is free. Including non-PyTorch memory, this process has 15.76 GiB memory in use. Of the allocated memory 15.13 GiB is allocated by PyTorch, and 264.26 MiB is reserved by PyTorch but unallocated. If reserved but unallocated memory is large try setting PYTORCH_CUDA_ALLOC_CONF=expandable_segments:True to avoid fragmentation.  See documentation for Memory Management  (https://pytorch.org/docs/stable/notes/cuda.html#environment-variables)
