mkdir: cannot create directory ‘/scratch/mne_data’: Permission denied

[notice] A new release of pip is available: 24.2 -> 26.1.2
[notice] To update, run: pip install --upgrade pip

[notice] A new release of pip is available: 24.2 -> 26.1.2
[notice] To update, run: pip install --upgrade pip
ERROR: Invalid requirement: 'Binary file requirements.txt matches': Expected end or semicolon (after name and no valid version specifier)
    Binary file requirements.txt matches
           ^ (from line 1 of /home/aleksander.berezowsk/requirements_notorch.txt)

[notice] A new release of pip is available: 24.2 -> 26.1.2
[notice] To update, run: pip install --upgrade pip

[notice] A new release of pip is available: 24.2 -> 26.1.2
[notice] To update, run: pip install --upgrade pip
/home/aleksander.berezowsk/spiking-eegnet/src/main.py:92: ExperimentalWarning: Argument ``multivariate`` is an experimental feature. The interface can change in the future.
  sampler=TPESampler(n_startup_trials=tpe_trails, multivariate=True, group=True)
/home/aleksander.berezowsk/spiking-eegnet/src/main.py:92: ExperimentalWarning: Argument ``group`` is an experimental feature. The interface can change in the future.
  sampler=TPESampler(n_startup_trials=tpe_trails, multivariate=True, group=True)
[I 2026-07-06 13:47:13,223] Using an existing study with name 'snn_eegnet_v4_400_40' instead of creating a new one.
[I 2026-07-06 16:04:59,088] Trial 97 finished with value: 0.5387731481481483 and parameters: {'LR_EXP': -3.2021023101723287, 'DROPOUT': 0.22845391957935313, 'BETA': 0.8314256771511961, 'SPIKE_GRAD_SLOPE': 0.205841375100964, 'TEMPORAL_FILTERS': 22, 'DEPTH_MULTIPLIER': 3, 'POINTWISE_FILTERS': 18, 'TEMPORAL_KERNEL_DIV': 8, 'SEPARABLE_KERNEL_SIZE': 36, 'POOL1_SIZE': 8, 'POOL2_SIZE': 2, 'N_STEPS_TRAIN': 11, 'N_STEPS_EVAL': 12, 'READOUT_MODE': 'spk_sum'}. Best is trial 46 with value: 0.5719521604938271.
[I 2026-07-06 22:21:41,568] Trial 101 finished with value: 0.5489969135802469 and parameters: {'LR_EXP': -2.724534791431492, 'DROPOUT': 0.13180803845026823, 'BETA': 0.9681960472980301, 'SPIKE_GRAD_SLOPE': 28.103168568943893, 'TEMPORAL_FILTERS': 48, 'DEPTH_MULTIPLIER': 4, 'POINTWISE_FILTERS': 47, 'TEMPORAL_KERNEL_DIV': 3, 'SEPARABLE_KERNEL_SIZE': 19, 'POOL1_SIZE': 6, 'POOL2_SIZE': 5, 'N_STEPS_TRAIN': 11, 'N_STEPS_EVAL': 16, 'READOUT_MODE': 'spk_sum'}. Best is trial 46 with value: 0.5719521604938271.
[I 2026-07-07 02:16:59,449] Trial 107 finished with value: 0.5513117283950617 and parameters: {'LR_EXP': -3.5617052761432877, 'DROPOUT': 0.29026426868766175, 'BETA': 0.8398942068379733, 'SPIKE_GRAD_SLOPE': 10.499277479541279, 'TEMPORAL_FILTERS': 33, 'DEPTH_MULTIPLIER': 3, 'POINTWISE_FILTERS': 31, 'TEMPORAL_KERNEL_DIV': 7, 'SEPARABLE_KERNEL_SIZE': 15, 'POOL1_SIZE': 4, 'POOL2_SIZE': 4, 'N_STEPS_TRAIN': 12, 'N_STEPS_EVAL': 22, 'READOUT_MODE': 'spk_mean'}. Best is trial 46 with value: 0.5719521604938271.
[I 2026-07-07 05:20:54,980] Trial 113 finished with value: 0.5428240740740741 and parameters: {'LR_EXP': -3.398506478831053, 'DROPOUT': 0.21140836637462646, 'BETA': 0.7514290188798818, 'SPIKE_GRAD_SLOPE': 7.223251277816221, 'TEMPORAL_FILTERS': 30, 'DEPTH_MULTIPLIER': 3, 'POINTWISE_FILTERS': 14, 'TEMPORAL_KERNEL_DIV': 5, 'SEPARABLE_KERNEL_SIZE': 14, 'POOL1_SIZE': 4, 'POOL2_SIZE': 3, 'N_STEPS_TRAIN': 11, 'N_STEPS_EVAL': 14, 'READOUT_MODE': 'spk_mean'}. Best is trial 111 with value: 0.5725308641975309.
[I 2026-07-07 08:15:13,967] Trial 117 finished with value: 0.548804012345679 and parameters: {'LR_EXP': -2.559448816842219, 'DROPOUT': 0.24276852271085547, 'BETA': 0.9245762664539616, 'SPIKE_GRAD_SLOPE': 14.813473429440894, 'TEMPORAL_FILTERS': 35, 'DEPTH_MULTIPLIER': 3, 'POINTWISE_FILTERS': 62, 'TEMPORAL_KERNEL_DIV': 5, 'SEPARABLE_KERNEL_SIZE': 29, 'POOL1_SIZE': 6, 'POOL2_SIZE': 4, 'N_STEPS_TRAIN': 8, 'N_STEPS_EVAL': 14, 'READOUT_MODE': 'spk_sum'}. Best is trial 111 with value: 0.5725308641975309.
[I 2026-07-07 08:53:15,293] Trial 120 pruned. 
[W 2026-07-07 08:53:20,302] Trial 122 failed with parameters: {'LR_EXP': -3.0724479214074685, 'DROPOUT': 0.4667493773839925, 'BETA': 0.7687422252866365, 'SPIKE_GRAD_SLOPE': 30.471847134012318, 'TEMPORAL_FILTERS': 46, 'DEPTH_MULTIPLIER': 4, 'POINTWISE_FILTERS': 28, 'TEMPORAL_KERNEL_DIV': 8, 'SEPARABLE_KERNEL_SIZE': 37, 'POOL1_SIZE': 4, 'POOL2_SIZE': 3, 'N_STEPS_TRAIN': 12, 'N_STEPS_EVAL': 16, 'READOUT_MODE': 'spk_mean'} because of the following error: OutOfMemoryError('CUDA out of memory. Tried to allocate 124.00 MiB. GPU 0 has a total capacity of 15.77 GiB of which 192.00 KiB is free. Including non-PyTorch memory, this process has 15.76 GiB memory in use. Of the allocated memory 14.78 GiB is allocated by PyTorch, and 617.84 MiB is reserved by PyTorch but unallocated. If reserved but unallocated memory is large try setting PYTORCH_CUDA_ALLOC_CONF=expandable_segments:True to avoid fragmentation.  See documentation for Memory Management  (https://pytorch.org/docs/stable/notes/cuda.html#environment-variables)').
Traceback (most recent call last):
  File "/home/aleksander.berezowsk/venv/lib/python3.12/site-packages/optuna/study/_optimize.py", line 206, in _run_trial
    value_or_values = func(trial)
                      ^^^^^^^^^^^
  File "/home/aleksander.berezowsk/spiking-eegnet/src/main.py", line 47, in objective
    return pipeline(**params, **FIXED, trial=trial, save_plots=False)
           ^^^^^^^^^^^^^^^^^^^^^^^^^^^^^^^^^^^^^^^^^^^^^^^^^^^^^^^^^^
  File "/home/aleksander.berezowsk/spiking-eegnet/src/pipeline.py", line 135, in pipeline
    histories, accs, mean_acc = experiment_loso_all(
                                ^^^^^^^^^^^^^^^^^^^^
  File "/home/aleksander.berezowsk/spiking-eegnet/src/experiment_loso.py", line 71, in experiment_loso_all
    history, final_acc, _model = experiment_loso(
                                 ^^^^^^^^^^^^^^^^
  File "/home/aleksander.berezowsk/spiking-eegnet/src/experiment_loso.py", line 30, in experiment_loso
    history = run_training(
              ^^^^^^^^^^^^^
  File "/home/aleksander.berezowsk/spiking-eegnet/src/run_training.py", line 50, in run_training
    loss = train_one_epoch(model, train_loader, optimizer, criterion, device,
           ^^^^^^^^^^^^^^^^^^^^^^^^^^^^^^^^^^^^^^^^^^^^^^^^^^^^^^^^^^^^^^^^^^
  File "/home/aleksander.berezowsk/spiking-eegnet/src/train_one_epoch.py", line 53, in train_one_epoch
    spk, mem = model(xb, num_steps=n_steps)
               ^^^^^^^^^^^^^^^^^^^^^^^^^^^^
  File "/home/aleksander.berezowsk/venv/lib/python3.12/site-packages/torch/nn/modules/module.py", line 1553, in _wrapped_call_impl
    return self._call_impl(*args, **kwargs)
           ^^^^^^^^^^^^^^^^^^^^^^^^^^^^^^^^
  File "/home/aleksander.berezowsk/venv/lib/python3.12/site-packages/torch/nn/modules/module.py", line 1562, in _call_impl
    return forward_call(*args, **kwargs)
           ^^^^^^^^^^^^^^^^^^^^^^^^^^^^^
  File "/home/aleksander.berezowsk/spiking-eegnet/src/spiking_eegnet.py", line 233, in forward
    spk1, mem1 = self.lif1(cur, mem1)
                 ^^^^^^^^^^^^^^^^^^^^
  File "/home/aleksander.berezowsk/venv/lib/python3.12/site-packages/torch/nn/modules/module.py", line 1553, in _wrapped_call_impl
    return self._call_impl(*args, **kwargs)
           ^^^^^^^^^^^^^^^^^^^^^^^^^^^^^^^^
  File "/home/aleksander.berezowsk/venv/lib/python3.12/site-packages/torch/nn/modules/module.py", line 1562, in _call_impl
    return forward_call(*args, **kwargs)
           ^^^^^^^^^^^^^^^^^^^^^^^^^^^^^
  File "/home/aleksander.berezowsk/venv/lib/python3.12/site-packages/snntorch/_neurons/leaky.py", line 209, in forward
    self.reset = self.mem_reset(self.mem)
                 ^^^^^^^^^^^^^^^^^^^^^^^^
  File "/home/aleksander.berezowsk/venv/lib/python3.12/site-packages/snntorch/_neurons/neurons.py", line 106, in mem_reset
    reset = self.spike_grad(mem_shift).clone().detach()
            ^^^^^^^^^^^^^^^^^^^^^^^^^^
  File "/home/aleksander.berezowsk/venv/lib/python3.12/site-packages/snntorch/surrogate.py", line 151, in inner
    return FastSigmoid.apply(x, slope)
           ^^^^^^^^^^^^^^^^^^^^^^^^^^^
  File "/home/aleksander.berezowsk/venv/lib/python3.12/site-packages/torch/autograd/function.py", line 574, in apply
    return super().apply(*args, **kwargs)  # type: ignore[misc]
           ^^^^^^^^^^^^^^^^^^^^^^^^^^^^^^
  File "/home/aleksander.berezowsk/venv/lib/python3.12/site-packages/snntorch/surrogate.py", line 135, in forward
    out = (input_ > 0).float()
          ^^^^^^^^^^^^^^^^^^^^
torch.OutOfMemoryError: CUDA out of memory. Tried to allocate 124.00 MiB. GPU 0 has a total capacity of 15.77 GiB of which 192.00 KiB is free. Including non-PyTorch memory, this process has 15.76 GiB memory in use. Of the allocated memory 14.78 GiB is allocated by PyTorch, and 617.84 MiB is reserved by PyTorch but unallocated. If reserved but unallocated memory is large try setting PYTORCH_CUDA_ALLOC_CONF=expandable_segments:True to avoid fragmentation.  See documentation for Memory Management  (https://pytorch.org/docs/stable/notes/cuda.html#environment-variables)
[W 2026-07-07 08:53:20,398] Trial 122 failed with value None.
Traceback (most recent call last):
  File "/home/aleksander.berezowsk/spiking-eegnet/src/main.py", line 98, in <module>
    study.optimize(objective, n_trials=n_trials, n_jobs=1,
  File "/home/aleksander.berezowsk/venv/lib/python3.12/site-packages/optuna/study/study.py", line 516, in optimize
    _optimize(
  File "/home/aleksander.berezowsk/venv/lib/python3.12/site-packages/optuna/study/_optimize.py", line 68, in _optimize
    _optimize_sequential(
  File "/home/aleksander.berezowsk/venv/lib/python3.12/site-packages/optuna/study/_optimize.py", line 165, in _optimize_sequential
    frozen_trial_id = _run_trial(study, func, catch)
                      ^^^^^^^^^^^^^^^^^^^^^^^^^^^^^^
  File "/home/aleksander.berezowsk/venv/lib/python3.12/site-packages/optuna/study/_optimize.py", line 263, in _run_trial
    raise func_err
  File "/home/aleksander.berezowsk/venv/lib/python3.12/site-packages/optuna/study/_optimize.py", line 206, in _run_trial
    value_or_values = func(trial)
                      ^^^^^^^^^^^
  File "/home/aleksander.berezowsk/spiking-eegnet/src/main.py", line 47, in objective
    return pipeline(**params, **FIXED, trial=trial, save_plots=False)
           ^^^^^^^^^^^^^^^^^^^^^^^^^^^^^^^^^^^^^^^^^^^^^^^^^^^^^^^^^^
  File "/home/aleksander.berezowsk/spiking-eegnet/src/pipeline.py", line 135, in pipeline
    histories, accs, mean_acc = experiment_loso_all(
                                ^^^^^^^^^^^^^^^^^^^^
  File "/home/aleksander.berezowsk/spiking-eegnet/src/experiment_loso.py", line 71, in experiment_loso_all
    history, final_acc, _model = experiment_loso(
                                 ^^^^^^^^^^^^^^^^
  File "/home/aleksander.berezowsk/spiking-eegnet/src/experiment_loso.py", line 30, in experiment_loso
    history = run_training(
              ^^^^^^^^^^^^^
  File "/home/aleksander.berezowsk/spiking-eegnet/src/run_training.py", line 50, in run_training
    loss = train_one_epoch(model, train_loader, optimizer, criterion, device,
           ^^^^^^^^^^^^^^^^^^^^^^^^^^^^^^^^^^^^^^^^^^^^^^^^^^^^^^^^^^^^^^^^^^
  File "/home/aleksander.berezowsk/spiking-eegnet/src/train_one_epoch.py", line 53, in train_one_epoch
    spk, mem = model(xb, num_steps=n_steps)
               ^^^^^^^^^^^^^^^^^^^^^^^^^^^^
  File "/home/aleksander.berezowsk/venv/lib/python3.12/site-packages/torch/nn/modules/module.py", line 1553, in _wrapped_call_impl
    return self._call_impl(*args, **kwargs)
           ^^^^^^^^^^^^^^^^^^^^^^^^^^^^^^^^
  File "/home/aleksander.berezowsk/venv/lib/python3.12/site-packages/torch/nn/modules/module.py", line 1562, in _call_impl
    return forward_call(*args, **kwargs)
           ^^^^^^^^^^^^^^^^^^^^^^^^^^^^^
  File "/home/aleksander.berezowsk/spiking-eegnet/src/spiking_eegnet.py", line 233, in forward
    spk1, mem1 = self.lif1(cur, mem1)
                 ^^^^^^^^^^^^^^^^^^^^
  File "/home/aleksander.berezowsk/venv/lib/python3.12/site-packages/torch/nn/modules/module.py", line 1553, in _wrapped_call_impl
    return self._call_impl(*args, **kwargs)
           ^^^^^^^^^^^^^^^^^^^^^^^^^^^^^^^^
  File "/home/aleksander.berezowsk/venv/lib/python3.12/site-packages/torch/nn/modules/module.py", line 1562, in _call_impl
    return forward_call(*args, **kwargs)
           ^^^^^^^^^^^^^^^^^^^^^^^^^^^^^
  File "/home/aleksander.berezowsk/venv/lib/python3.12/site-packages/snntorch/_neurons/leaky.py", line 209, in forward
    self.reset = self.mem_reset(self.mem)
                 ^^^^^^^^^^^^^^^^^^^^^^^^
  File "/home/aleksander.berezowsk/venv/lib/python3.12/site-packages/snntorch/_neurons/neurons.py", line 106, in mem_reset
    reset = self.spike_grad(mem_shift).clone().detach()
            ^^^^^^^^^^^^^^^^^^^^^^^^^^
  File "/home/aleksander.berezowsk/venv/lib/python3.12/site-packages/snntorch/surrogate.py", line 151, in inner
    return FastSigmoid.apply(x, slope)
           ^^^^^^^^^^^^^^^^^^^^^^^^^^^
  File "/home/aleksander.berezowsk/venv/lib/python3.12/site-packages/torch/autograd/function.py", line 574, in apply
    return super().apply(*args, **kwargs)  # type: ignore[misc]
           ^^^^^^^^^^^^^^^^^^^^^^^^^^^^^^
  File "/home/aleksander.berezowsk/venv/lib/python3.12/site-packages/snntorch/surrogate.py", line 135, in forward
    out = (input_ > 0).float()
          ^^^^^^^^^^^^^^^^^^^^
torch.OutOfMemoryError: CUDA out of memory. Tried to allocate 124.00 MiB. GPU 0 has a total capacity of 15.77 GiB of which 192.00 KiB is free. Including non-PyTorch memory, this process has 15.76 GiB memory in use. Of the allocated memory 14.78 GiB is allocated by PyTorch, and 617.84 MiB is reserved by PyTorch but unallocated. If reserved but unallocated memory is large try setting PYTORCH_CUDA_ALLOC_CONF=expandable_segments:True to avoid fragmentation.  See documentation for Memory Management  (https://pytorch.org/docs/stable/notes/cuda.html#environment-variables)
