mkdir: cannot create directory ‘/scratch/mne_data’: Permission denied

[notice] A new release of pip is available: 24.2 -> 26.1.2
[notice] To update, run: pip install --upgrade pip

[notice] A new release of pip is available: 24.2 -> 26.1.2
[notice] To update, run: pip install --upgrade pip
ERROR: Invalid requirement: 'Binary file requirements.txt matches': Expected end or semicolon (after name and no valid version specifier)
    Binary file requirements.txt matches
           ^ (from line 1 of /home/aleksander.berezowsk/requirements_notorch.txt)

[notice] A new release of pip is available: 24.2 -> 26.1.2
[notice] To update, run: pip install --upgrade pip

[notice] A new release of pip is available: 24.2 -> 26.1.2
[notice] To update, run: pip install --upgrade pip
/home/aleksander.berezowsk/spiking-eegnet/src/main.py:92: ExperimentalWarning: Argument ``multivariate`` is an experimental feature. The interface can change in the future.
  sampler=TPESampler(n_startup_trials=tpe_trails, multivariate=True, group=True)
/home/aleksander.berezowsk/spiking-eegnet/src/main.py:92: ExperimentalWarning: Argument ``group`` is an experimental feature. The interface can change in the future.
  sampler=TPESampler(n_startup_trials=tpe_trails, multivariate=True, group=True)
[I 2026-07-05 19:57:29,165] Using an existing study with name 'snn_eegnet_v4_400_40' instead of creating a new one.
[I 2026-07-05 22:40:45,503] Trial 68 finished with value: 0.5270061728395061 and parameters: {'LR_EXP': -2.2775762667281447, 'DROPOUT': 0.36193632757720684, 'BETA': 0.7978963769288906, 'SPIKE_GRAD_SLOPE': 7.666113410570389, 'TEMPORAL_FILTERS': 18, 'DEPTH_MULTIPLIER': 3, 'POINTWISE_FILTERS': 17, 'TEMPORAL_KERNEL_DIV': 6, 'SEPARABLE_KERNEL_SIZE': 9, 'POOL1_SIZE': 8, 'POOL2_SIZE': 4, 'N_STEPS_TRAIN': 14, 'N_STEPS_EVAL': 24, 'READOUT_MODE': 'spk_mean'}. Best is trial 46 with value: 0.5719521604938271.
[I 2026-07-05 23:34:47,112] Trial 72 finished with value: 0.5175540123456791 and parameters: {'LR_EXP': -2.3925109248626963, 'DROPOUT': 0.26581161223875055, 'BETA': 0.751153173444214, 'SPIKE_GRAD_SLOPE': 3.1314284597868887, 'TEMPORAL_FILTERS': 13, 'DEPTH_MULTIPLIER': 3, 'POINTWISE_FILTERS': 26, 'TEMPORAL_KERNEL_DIV': 5, 'SEPARABLE_KERNEL_SIZE': 5, 'POOL1_SIZE': 5, 'POOL2_SIZE': 2, 'N_STEPS_TRAIN': 5, 'N_STEPS_EVAL': 16, 'READOUT_MODE': 'spk_mean'}. Best is trial 46 with value: 0.5719521604938271.
[I 2026-07-06 04:03:12,549] Trial 77 finished with value: 0.5148533950617283 and parameters: {'LR_EXP': -2.1754495538376704, 'DROPOUT': 0.22999036904033104, 'BETA': 0.7708619932499498, 'SPIKE_GRAD_SLOPE': 4.791310941795173, 'TEMPORAL_FILTERS': 38, 'DEPTH_MULTIPLIER': 3, 'POINTWISE_FILTERS': 17, 'TEMPORAL_KERNEL_DIV': 5, 'SEPARABLE_KERNEL_SIZE': 14, 'POOL1_SIZE': 5, 'POOL2_SIZE': 2, 'N_STEPS_TRAIN': 12, 'N_STEPS_EVAL': 16, 'READOUT_MODE': 'spk_sum'}. Best is trial 46 with value: 0.5719521604938271.
[I 2026-07-06 06:34:44,106] Trial 83 finished with value: 0.5553626543209877 and parameters: {'LR_EXP': -2.731061761351101, 'DROPOUT': 0.43953894700518764, 'BETA': 0.8201628771882368, 'SPIKE_GRAD_SLOPE': 11.966290545151985, 'TEMPORAL_FILTERS': 33, 'DEPTH_MULTIPLIER': 3, 'POINTWISE_FILTERS': 20, 'TEMPORAL_KERNEL_DIV': 7, 'SEPARABLE_KERNEL_SIZE': 27, 'POOL1_SIZE': 4, 'POOL2_SIZE': 3, 'N_STEPS_TRAIN': 7, 'N_STEPS_EVAL': 31, 'READOUT_MODE': 'spk_mean'}. Best is trial 46 with value: 0.5719521604938271.
