
[notice] A new release of pip is available: 24.2 -> 26.1.2
[notice] To update, run: pip install --upgrade pip

[notice] A new release of pip is available: 24.2 -> 26.1.2
[notice] To update, run: pip install --upgrade pip
ERROR: Invalid requirement: 'Binary file requirements.txt matches': Expected end or semicolon (after name and no valid version specifier)
    Binary file requirements.txt matches
           ^ (from line 1 of /home/aleksander.berezowsk/requirements_notorch.txt)

[notice] A new release of pip is available: 24.2 -> 26.1.2
[notice] To update, run: pip install --upgrade pip

[notice] A new release of pip is available: 24.2 -> 26.1.2
[notice] To update, run: pip install --upgrade pip
[I 2026-06-13 15:57:41,523] Using an existing study with name 'snn_eegnet' instead of creating a new one.
[I 2026-06-13 16:15:02,879] Trial 14 finished with value: 0.5555555555555556 and parameters: {'FLOW': 8.52978492432517, 'FHIGH': 46.288507622269194, 'LR_EXP': -3.4700964192321937, 'DROPOUT': 0.7430233537871975, 'BETA': 0.7601707849345235, 'SPIKE_GRAD_SLOPE': 38.85839312214989, 'TEMPORAL_FILTERS': 24, 'DEPTH_MULTIPLIER': 2, 'POINTWISE_FILTERS': 62, 'TEMPORAL_KERNEL_DIV': 2, 'SEPARABLE_KERNEL_SIZE': 15, 'POOL1_SIZE': 8, 'POOL2_SIZE': 4, 'NORM_AXIS': 'no_channel', 'RUN_ZSCORE': False, 'RUN_BANDPASS': False}. Best is trial 6 with value: 0.5746527777777778.
[I 2026-06-13 16:15:31,756] Trial 15 pruned. 
[I 2026-06-13 16:28:37,513] Trial 16 finished with value: 0.5086805555555556 and parameters: {'FLOW': 8.168071533218427, 'FHIGH': 91.3796511138348, 'LR_EXP': -3.1922046402526982, 'DROPOUT': 0.5497280974398755, 'BETA': 0.7946486949491265, 'SPIKE_GRAD_SLOPE': 40.90804997077835, 'TEMPORAL_FILTERS': 23, 'DEPTH_MULTIPLIER': 2, 'POINTWISE_FILTERS': 57, 'TEMPORAL_KERNEL_DIV': 5, 'SEPARABLE_KERNEL_SIZE': 13, 'POOL1_SIZE': 8, 'POOL2_SIZE': 4, 'NORM_AXIS': 'no_channel', 'RUN_ZSCORE': False, 'RUN_BANDPASS': False}. Best is trial 6 with value: 0.5746527777777778.
[I 2026-06-13 16:28:58,866] Trial 17 pruned. 
[I 2026-06-13 16:40:15,740] Trial 18 finished with value: 0.5416666666666667 and parameters: {'FLOW': 29.546442138762295, 'FHIGH': 35.45511020174895, 'LR_EXP': -2.4448810380609314, 'DROPOUT': 0.5765794032407057, 'BETA': 0.7194777245112566, 'SPIKE_GRAD_SLOPE': 22.424528836164665, 'TEMPORAL_FILTERS': 10, 'DEPTH_MULTIPLIER': 2, 'POINTWISE_FILTERS': 56, 'TEMPORAL_KERNEL_DIV': 3, 'SEPARABLE_KERNEL_SIZE': 4, 'POOL1_SIZE': 6, 'POOL2_SIZE': 8, 'NORM_AXIS': 'no_channel', 'RUN_ZSCORE': False, 'RUN_BANDPASS': False}. Best is trial 6 with value: 0.5746527777777778.
[I 2026-06-13 16:40:54,241] Trial 19 pruned. 
[I 2026-06-13 16:49:12,064] Trial 20 finished with value: 0.5555555555555556 and parameters: {'FLOW': 5.90844843740253, 'FHIGH': 84.76139351733885, 'LR_EXP': -3.0059480763867046, 'DROPOUT': 0.29833621617084605, 'BETA': 0.7072763657007588, 'SPIKE_GRAD_SLOPE': 49.644668276700074, 'TEMPORAL_FILTERS': 9, 'DEPTH_MULTIPLIER': 2, 'POINTWISE_FILTERS': 18, 'TEMPORAL_KERNEL_DIV': 5, 'SEPARABLE_KERNEL_SIZE': 14, 'POOL1_SIZE': 7, 'POOL2_SIZE': 6, 'NORM_AXIS': 'no_channel', 'RUN_ZSCORE': False, 'RUN_BANDPASS': False}. Best is trial 6 with value: 0.5746527777777778.
[I 2026-06-13 16:49:33,912] Trial 21 pruned. 
[I 2026-06-13 16:50:05,017] Trial 22 pruned. 
[I 2026-06-13 16:51:00,336] Trial 23 pruned. 
[I 2026-06-13 16:51:18,317] Trial 24 pruned. 
[I 2026-06-13 16:51:34,337] Trial 25 pruned. 
[I 2026-06-13 17:00:46,175] Trial 26 finished with value: 0.4930555555555556 and parameters: {'FLOW': 16.068508721187428, 'FHIGH': 96.52558688904092, 'LR_EXP': -2.429738371868234, 'DROPOUT': 0.23393134184778847, 'BETA': 0.730299121054184, 'SPIKE_GRAD_SLOPE': 26.41872478121851, 'TEMPORAL_FILTERS': 14, 'DEPTH_MULTIPLIER': 2, 'POINTWISE_FILTERS': 8, 'TEMPORAL_KERNEL_DIV': 7, 'SEPARABLE_KERNEL_SIZE': 16, 'POOL1_SIZE': 7, 'POOL2_SIZE': 7, 'NORM_AXIS': 'no_channel', 'RUN_ZSCORE': False, 'RUN_BANDPASS': False}. Best is trial 6 with value: 0.5746527777777778.
[I 2026-06-13 17:01:20,953] Trial 27 pruned. 
[I 2026-06-13 17:11:53,190] Trial 28 finished with value: 0.5642361111111112 and parameters: {'FLOW': 10.578075482806858, 'FHIGH': 104.41368687338714, 'LR_EXP': -2.3888518937166685, 'DROPOUT': 0.4947695807895224, 'BETA': 0.8252175638458618, 'SPIKE_GRAD_SLOPE': 29.40830918997958, 'TEMPORAL_FILTERS': 20, 'DEPTH_MULTIPLIER': 1, 'POINTWISE_FILTERS': 39, 'TEMPORAL_KERNEL_DIV': 6, 'SEPARABLE_KERNEL_SIZE': 15, 'POOL1_SIZE': 8, 'POOL2_SIZE': 6, 'NORM_AXIS': 'full', 'RUN_ZSCORE': False, 'RUN_BANDPASS': True}. Best is trial 6 with value: 0.5746527777777778.
[I 2026-06-13 17:22:40,633] Trial 29 finished with value: 0.4913194444444444 and parameters: {'FLOW': 11.13462368855687, 'FHIGH': 106.5222857929289, 'LR_EXP': -2.380130604756664, 'DROPOUT': 0.5227073918044118, 'BETA': 0.8879619142126396, 'SPIKE_GRAD_SLOPE': 14.411606796622635, 'TEMPORAL_FILTERS': 21, 'DEPTH_MULTIPLIER': 1, 'POINTWISE_FILTERS': 38, 'TEMPORAL_KERNEL_DIV': 6, 'SEPARABLE_KERNEL_SIZE': 21, 'POOL1_SIZE': 8, 'POOL2_SIZE': 4, 'NORM_AXIS': 'full', 'RUN_ZSCORE': False, 'RUN_BANDPASS': True}. Best is trial 6 with value: 0.5746527777777778.
[I 2026-06-13 17:23:08,873] Trial 30 pruned. 
[I 2026-06-13 17:23:38,751] Trial 31 pruned. 
[I 2026-06-13 17:24:01,218] Trial 32 pruned. 
[I 2026-06-13 17:35:43,352] Trial 33 finished with value: 0.4149305555555555 and parameters: {'FLOW': 3.148427697038027, 'FHIGH': 109.7755541132853, 'LR_EXP': -2.8498667905227357, 'DROPOUT': 0.4076608758693052, 'BETA': 0.8400020667148905, 'SPIKE_GRAD_SLOPE': 52.96820359817561, 'TEMPORAL_FILTERS': 19, 'DEPTH_MULTIPLIER': 2, 'POINTWISE_FILTERS': 15, 'TEMPORAL_KERNEL_DIV': 5, 'SEPARABLE_KERNEL_SIZE': 15, 'POOL1_SIZE': 7, 'POOL2_SIZE': 6, 'NORM_AXIS': 'full', 'RUN_ZSCORE': False, 'RUN_BANDPASS': True}. Best is trial 6 with value: 0.5746527777777778.
[I 2026-06-13 17:46:39,069] Trial 34 finished with value: 0.49826388888888895 and parameters: {'FLOW': 7.60210164138234, 'FHIGH': 100.22299173628156, 'LR_EXP': -2.1806678987251753, 'DROPOUT': 0.29609320494757074, 'BETA': 0.7660262950432082, 'SPIKE_GRAD_SLOPE': 30.4332357004292, 'TEMPORAL_FILTERS': 14, 'DEPTH_MULTIPLIER': 3, 'POINTWISE_FILTERS': 26, 'TEMPORAL_KERNEL_DIV': 5, 'SEPARABLE_KERNEL_SIZE': 11, 'POOL1_SIZE': 8, 'POOL2_SIZE': 7, 'NORM_AXIS': 'no_channel', 'RUN_ZSCORE': False, 'RUN_BANDPASS': True}. Best is trial 6 with value: 0.5746527777777778.
[I 2026-06-13 17:47:07,660] Trial 35 pruned. 
[I 2026-06-13 17:54:41,492] Trial 36 finished with value: 0.5520833333333334 and parameters: {'FLOW': 3.712181756600838, 'FHIGH': 72.84917592237045, 'LR_EXP': -2.5742180681694213, 'DROPOUT': 0.6805610429323194, 'BETA': 0.8075737198403278, 'SPIKE_GRAD_SLOPE': 5.223042094166175, 'TEMPORAL_FILTERS': 6, 'DEPTH_MULTIPLIER': 1, 'POINTWISE_FILTERS': 49, 'TEMPORAL_KERNEL_DIV': 4, 'SEPARABLE_KERNEL_SIZE': 11, 'POOL1_SIZE': 6, 'POOL2_SIZE': 5, 'NORM_AXIS': 'full', 'RUN_ZSCORE': False, 'RUN_BANDPASS': False}. Best is trial 6 with value: 0.5746527777777778.
[I 2026-06-13 17:55:04,324] Trial 37 pruned. 
[I 2026-06-13 18:07:01,400] Trial 38 finished with value: 0.5277777777777778 and parameters: {'FLOW': 8.369898607231443, 'FHIGH': 60.63197652758208, 'LR_EXP': -2.343666951452636, 'DROPOUT': 0.3073177578943769, 'BETA': 0.684043000912259, 'SPIKE_GRAD_SLOPE': 17.848853023727806, 'TEMPORAL_FILTERS': 25, 'DEPTH_MULTIPLIER': 1, 'POINTWISE_FILTERS': 60, 'TEMPORAL_KERNEL_DIV': 6, 'SEPARABLE_KERNEL_SIZE': 18, 'POOL1_SIZE': 5, 'POOL2_SIZE': 4, 'NORM_AXIS': 'full', 'RUN_ZSCORE': False, 'RUN_BANDPASS': False}. Best is trial 6 with value: 0.5746527777777778.
[I 2026-06-13 18:07:27,873] Trial 39 pruned. 
[I 2026-06-13 18:22:53,034] Trial 40 finished with value: 0.5329861111111112 and parameters: {'FLOW': 24.08234326238327, 'FHIGH': 112.7122679590366, 'LR_EXP': -2.9621607849920815, 'DROPOUT': 0.233507418874846, 'BETA': 0.9286329501003663, 'SPIKE_GRAD_SLOPE': 24.718558954956386, 'TEMPORAL_FILTERS': 28, 'DEPTH_MULTIPLIER': 2, 'POINTWISE_FILTERS': 39, 'TEMPORAL_KERNEL_DIV': 4, 'SEPARABLE_KERNEL_SIZE': 22, 'POOL1_SIZE': 8, 'POOL2_SIZE': 2, 'NORM_AXIS': 'full', 'RUN_ZSCORE': False, 'RUN_BANDPASS': False}. Best is trial 6 with value: 0.5746527777777778.
[I 2026-06-13 18:23:16,203] Trial 41 pruned. 
[I 2026-06-13 18:23:38,783] Trial 42 pruned. 
[I 2026-06-13 18:31:18,279] Trial 43 finished with value: 0.5868055555555556 and parameters: {'FLOW': 3.83189576912945, 'FHIGH': 69.06910886885572, 'LR_EXP': -2.5625029934914174, 'DROPOUT': 0.6820594272804766, 'BETA': 0.8134822686428996, 'SPIKE_GRAD_SLOPE': 17.007672752789944, 'TEMPORAL_FILTERS': 6, 'DEPTH_MULTIPLIER': 1, 'POINTWISE_FILTERS': 48, 'TEMPORAL_KERNEL_DIV': 4, 'SEPARABLE_KERNEL_SIZE': 11, 'POOL1_SIZE': 6, 'POOL2_SIZE': 5, 'NORM_AXIS': 'full', 'RUN_ZSCORE': False, 'RUN_BANDPASS': False}. Best is trial 43 with value: 0.5868055555555556.
[I 2026-06-13 18:31:38,098] Trial 44 pruned. 
[I 2026-06-13 18:32:02,723] Trial 45 pruned. 
[I 2026-06-13 18:32:17,724] Trial 46 pruned. 
[I 2026-06-13 18:33:19,853] Trial 47 pruned. 
[I 2026-06-13 18:33:43,641] Trial 48 pruned. 
[I 2026-06-13 18:34:03,074] Trial 49 pruned. 
[I 2026-06-13 18:51:26,094] Trial 50 finished with value: 0.5295138888888888 and parameters: {'FLOW': 32.296561415938804, 'FHIGH': 76.37981070706043, 'LR_EXP': -2.4775418393853825, 'DROPOUT': 0.5631028040872452, 'BETA': 0.8749899522406828, 'SPIKE_GRAD_SLOPE': 25.216240780575685, 'TEMPORAL_FILTERS': 25, 'DEPTH_MULTIPLIER': 4, 'POINTWISE_FILTERS': 58, 'TEMPORAL_KERNEL_DIV': 4, 'SEPARABLE_KERNEL_SIZE': 17, 'POOL1_SIZE': 6, 'POOL2_SIZE': 6, 'NORM_AXIS': 'full', 'RUN_ZSCORE': False, 'RUN_BANDPASS': False}. Best is trial 43 with value: 0.5868055555555556.
[I 2026-06-13 19:04:59,593] Trial 51 finished with value: 0.5694444444444444 and parameters: {'FLOW': 2.8026856778449485, 'FHIGH': 104.07388947589703, 'LR_EXP': -2.914267912000273, 'DROPOUT': 0.14231369378083294, 'BETA': 0.7988217390556858, 'SPIKE_GRAD_SLOPE': 10.251035558602073, 'TEMPORAL_FILTERS': 17, 'DEPTH_MULTIPLIER': 2, 'POINTWISE_FILTERS': 51, 'TEMPORAL_KERNEL_DIV': 3, 'SEPARABLE_KERNEL_SIZE': 19, 'POOL1_SIZE': 8, 'POOL2_SIZE': 5, 'NORM_AXIS': 'no_channel', 'RUN_ZSCORE': False, 'RUN_BANDPASS': False}. Best is trial 43 with value: 0.5868055555555556.
[I 2026-06-13 19:08:40,054] Trial 52 pruned. 
[I 2026-06-13 19:21:57,956] Trial 53 finished with value: 0.5729166666666666 and parameters: {'FLOW': 1.0648265959659433, 'FHIGH': 114.63545254014971, 'LR_EXP': -2.91537069851642, 'DROPOUT': 0.19710812499698993, 'BETA': 0.8319028130033443, 'SPIKE_GRAD_SLOPE': 14.365757898661137, 'TEMPORAL_FILTERS': 16, 'DEPTH_MULTIPLIER': 2, 'POINTWISE_FILTERS': 62, 'TEMPORAL_KERNEL_DIV': 3, 'SEPARABLE_KERNEL_SIZE': 15, 'POOL1_SIZE': 8, 'POOL2_SIZE': 5, 'NORM_AXIS': 'no_channel', 'RUN_ZSCORE': False, 'RUN_BANDPASS': False}. Best is trial 43 with value: 0.5868055555555556.
[I 2026-06-13 19:35:14,930] Trial 54 finished with value: 0.5572916666666666 and parameters: {'FLOW': 1.5257011390780022, 'FHIGH': 113.13328844238511, 'LR_EXP': -2.915723542231197, 'DROPOUT': 0.20337979265319742, 'BETA': 0.8309280355744559, 'SPIKE_GRAD_SLOPE': 14.886254529642514, 'TEMPORAL_FILTERS': 16, 'DEPTH_MULTIPLIER': 2, 'POINTWISE_FILTERS': 62, 'TEMPORAL_KERNEL_DIV': 3, 'SEPARABLE_KERNEL_SIZE': 16, 'POOL1_SIZE': 8, 'POOL2_SIZE': 5, 'NORM_AXIS': 'no_channel', 'RUN_ZSCORE': False, 'RUN_BANDPASS': False}. Best is trial 43 with value: 0.5868055555555556.
[I 2026-06-13 19:48:36,338] Trial 55 finished with value: 0.579861111111111 and parameters: {'FLOW': 1.2181203471231958, 'FHIGH': 114.4694488412282, 'LR_EXP': -2.9120034661768393, 'DROPOUT': 0.1965656994620065, 'BETA': 0.8295030317141728, 'SPIKE_GRAD_SLOPE': 15.51777630836019, 'TEMPORAL_FILTERS': 16, 'DEPTH_MULTIPLIER': 2, 'POINTWISE_FILTERS': 59, 'TEMPORAL_KERNEL_DIV': 3, 'SEPARABLE_KERNEL_SIZE': 24, 'POOL1_SIZE': 8, 'POOL2_SIZE': 5, 'NORM_AXIS': 'no_channel', 'RUN_ZSCORE': False, 'RUN_BANDPASS': False}. Best is trial 43 with value: 0.5868055555555556.
[I 2026-06-13 19:49:22,789] Trial 56 pruned. 
[I 2026-06-13 20:03:39,084] Trial 57 finished with value: 0.532986111111111 and parameters: {'FLOW': 2.559192535081676, 'FHIGH': 112.92163238766815, 'LR_EXP': -3.1172437056356515, 'DROPOUT': 0.10114540345687886, 'BETA': 0.9151792388857994, 'SPIKE_GRAD_SLOPE': 9.39198905244587, 'TEMPORAL_FILTERS': 18, 'DEPTH_MULTIPLIER': 2, 'POINTWISE_FILTERS': 54, 'TEMPORAL_KERNEL_DIV': 3, 'SEPARABLE_KERNEL_SIZE': 23, 'POOL1_SIZE': 3, 'POOL2_SIZE': 5, 'NORM_AXIS': 'no_channel', 'RUN_ZSCORE': False, 'RUN_BANDPASS': False}. Best is trial 43 with value: 0.5868055555555556.
[I 2026-06-13 20:16:38,207] Trial 58 finished with value: 0.5555555555555556 and parameters: {'FLOW': 1.2081861321565215, 'FHIGH': 115.96743425460001, 'LR_EXP': -2.84379169024648, 'DROPOUT': 0.1642141590193653, 'BETA': 0.8431829202837692, 'SPIKE_GRAD_SLOPE': 16.29978408705078, 'TEMPORAL_FILTERS': 15, 'DEPTH_MULTIPLIER': 2, 'POINTWISE_FILTERS': 57, 'TEMPORAL_KERNEL_DIV': 3, 'SEPARABLE_KERNEL_SIZE': 25, 'POOL1_SIZE': 8, 'POOL2_SIZE': 5, 'NORM_AXIS': 'no_channel', 'RUN_ZSCORE': False, 'RUN_BANDPASS': False}. Best is trial 43 with value: 0.5868055555555556.
[I 2026-06-13 20:35:21,621] Trial 59 finished with value: 0.5694444444444445 and parameters: {'FLOW': 37.39818075064261, 'FHIGH': 106.18413222338675, 'LR_EXP': -2.77146682193158, 'DROPOUT': 0.26229723537883887, 'BETA': 0.8138085682753499, 'SPIKE_GRAD_SLOPE': 12.87489243810818, 'TEMPORAL_FILTERS': 21, 'DEPTH_MULTIPLIER': 4, 'POINTWISE_FILTERS': 64, 'TEMPORAL_KERNEL_DIV': 2, 'SEPARABLE_KERNEL_SIZE': 30, 'POOL1_SIZE': 8, 'POOL2_SIZE': 6, 'NORM_AXIS': 'no_channel', 'RUN_ZSCORE': False, 'RUN_BANDPASS': False}. Best is trial 43 with value: 0.5868055555555556.
[I 2026-06-13 20:52:13,038] Trial 60 finished with value: 0.578125 and parameters: {'FLOW': 38.749675071600144, 'FHIGH': 109.70079124645304, 'LR_EXP': -2.7678316855896328, 'DROPOUT': 0.21295837236543752, 'BETA': 0.8098956770468323, 'SPIKE_GRAD_SLOPE': 13.610513188780004, 'TEMPORAL_FILTERS': 17, 'DEPTH_MULTIPLIER': 4, 'POINTWISE_FILTERS': 51, 'TEMPORAL_KERNEL_DIV': 2, 'SEPARABLE_KERNEL_SIZE': 30, 'POOL1_SIZE': 8, 'POOL2_SIZE': 4, 'NORM_AXIS': 'no_channel', 'RUN_ZSCORE': False, 'RUN_BANDPASS': False}. Best is trial 43 with value: 0.5868055555555556.
[I 2026-06-13 21:07:18,075] Trial 61 finished with value: 0.5694444444444444 and parameters: {'FLOW': 39.67011067352637, 'FHIGH': 108.57521915695176, 'LR_EXP': -2.76275380292089, 'DROPOUT': 0.25710828332619884, 'BETA': 0.8671004167266588, 'SPIKE_GRAD_SLOPE': 13.560520117253933, 'TEMPORAL_FILTERS': 13, 'DEPTH_MULTIPLIER': 4, 'POINTWISE_FILTERS': 63, 'TEMPORAL_KERNEL_DIV': 2, 'SEPARABLE_KERNEL_SIZE': 30, 'POOL1_SIZE': 7, 'POOL2_SIZE': 4, 'NORM_AXIS': 'no_channel', 'RUN_ZSCORE': False, 'RUN_BANDPASS': False}. Best is trial 43 with value: 0.5868055555555556.
[I 2026-06-13 21:07:50,012] Trial 62 pruned. 
[I 2026-06-13 21:23:28,547] Trial 63 finished with value: 0.5972222222222222 and parameters: {'FLOW': 37.75643879216595, 'FHIGH': 100.74203984797775, 'LR_EXP': -2.9533272498967005, 'DROPOUT': 0.13197359722925442, 'BETA': 0.7792248177473918, 'SPIKE_GRAD_SLOPE': 7.122083125077436, 'TEMPORAL_FILTERS': 17, 'DEPTH_MULTIPLIER': 4, 'POINTWISE_FILTERS': 50, 'TEMPORAL_KERNEL_DIV': 3, 'SEPARABLE_KERNEL_SIZE': 31, 'POOL1_SIZE': 8, 'POOL2_SIZE': 5, 'NORM_AXIS': 'no_channel', 'RUN_ZSCORE': False, 'RUN_BANDPASS': False}. Best is trial 63 with value: 0.5972222222222222.
[I 2026-06-13 21:40:46,990] Trial 64 finished with value: 0.529513888888889 and parameters: {'FLOW': 36.97825626066232, 'FHIGH': 100.26921428926138, 'LR_EXP': -3.029431149517087, 'DROPOUT': 0.20645207937879553, 'BETA': 0.7886412681198068, 'SPIKE_GRAD_SLOPE': 7.656701069084661, 'TEMPORAL_FILTERS': 18, 'DEPTH_MULTIPLIER': 4, 'POINTWISE_FILTERS': 48, 'TEMPORAL_KERNEL_DIV': 2, 'SEPARABLE_KERNEL_SIZE': 31, 'POOL1_SIZE': 8, 'POOL2_SIZE': 4, 'NORM_AXIS': 'no_channel', 'RUN_ZSCORE': False, 'RUN_BANDPASS': False}. Best is trial 63 with value: 0.5972222222222222.
[I 2026-06-13 21:58:17,205] Trial 65 finished with value: 0.578125 and parameters: {'FLOW': 34.6642466104227, 'FHIGH': 115.97424261449231, 'LR_EXP': -2.604840743771419, 'DROPOUT': 0.12089333796956246, 'BETA': 0.7795870433972651, 'SPIKE_GRAD_SLOPE': 5.522184605665288, 'TEMPORAL_FILTERS': 21, 'DEPTH_MULTIPLIER': 4, 'POINTWISE_FILTERS': 57, 'TEMPORAL_KERNEL_DIV': 3, 'SEPARABLE_KERNEL_SIZE': 31, 'POOL1_SIZE': 8, 'POOL2_SIZE': 4, 'NORM_AXIS': 'no_channel', 'RUN_ZSCORE': False, 'RUN_BANDPASS': False}. Best is trial 63 with value: 0.5972222222222222.
[I 2026-06-13 22:13:32,637] Trial 66 finished with value: 0.5416666666666666 and parameters: {'FLOW': 33.74347784741765, 'FHIGH': 115.80243189477538, 'LR_EXP': -2.618534918351707, 'DROPOUT': 0.11780965562593515, 'BETA': 0.7726362261376469, 'SPIKE_GRAD_SLOPE': 21.501923950053854, 'TEMPORAL_FILTERS': 16, 'DEPTH_MULTIPLIER': 4, 'POINTWISE_FILTERS': 56, 'TEMPORAL_KERNEL_DIV': 3, 'SEPARABLE_KERNEL_SIZE': 31, 'POOL1_SIZE': 7, 'POOL2_SIZE': 4, 'NORM_AXIS': 'no_channel', 'RUN_ZSCORE': False, 'RUN_BANDPASS': False}. Best is trial 63 with value: 0.5972222222222222.
[I 2026-06-13 22:25:49,115] Trial 67 finished with value: 0.578125 and parameters: {'FLOW': 35.47507579115624, 'FHIGH': 115.71927273723503, 'LR_EXP': -2.4914879657691857, 'DROPOUT': 0.16360705946629028, 'BETA': 0.8371854670654939, 'SPIKE_GRAD_SLOPE': 6.046340954723206, 'TEMPORAL_FILTERS': 14, 'DEPTH_MULTIPLIER': 4, 'POINTWISE_FILTERS': 53, 'TEMPORAL_KERNEL_DIV': 4, 'SEPARABLE_KERNEL_SIZE': 29, 'POOL1_SIZE': 8, 'POOL2_SIZE': 4, 'NORM_AXIS': 'no_channel', 'RUN_ZSCORE': False, 'RUN_BANDPASS': False}. Best is trial 63 with value: 0.5972222222222222.
[I 2026-06-13 22:37:39,903] Trial 68 finished with value: 0.5868055555555556 and parameters: {'FLOW': 35.404986697846994, 'FHIGH': 118.82102164744508, 'LR_EXP': -2.4869292318265765, 'DROPOUT': 0.17317109719809454, 'BETA': 0.7457796288642544, 'SPIKE_GRAD_SLOPE': 8.292168538226974, 'TEMPORAL_FILTERS': 13, 'DEPTH_MULTIPLIER': 4, 'POINTWISE_FILTERS': 52, 'TEMPORAL_KERNEL_DIV': 4, 'SEPARABLE_KERNEL_SIZE': 29, 'POOL1_SIZE': 8, 'POOL2_SIZE': 3, 'NORM_AXIS': 'no_channel', 'RUN_ZSCORE': False, 'RUN_BANDPASS': False}. Best is trial 63 with value: 0.5972222222222222.
[I 2026-06-13 22:49:06,231] Trial 69 finished with value: 0.5694444444444444 and parameters: {'FLOW': 35.19407257707331, 'FHIGH': 119.99433917799051, 'LR_EXP': -2.4752565402323685, 'DROPOUT': 0.16292976720769464, 'BETA': 0.7489881695399366, 'SPIKE_GRAD_SLOPE': 6.333569091385479, 'TEMPORAL_FILTERS': 12, 'DEPTH_MULTIPLIER': 4, 'POINTWISE_FILTERS': 52, 'TEMPORAL_KERNEL_DIV': 4, 'SEPARABLE_KERNEL_SIZE': 29, 'POOL1_SIZE': 8, 'POOL2_SIZE': 2, 'NORM_AXIS': 'no_channel', 'RUN_ZSCORE': False, 'RUN_BANDPASS': False}. Best is trial 63 with value: 0.5972222222222222.
[I 2026-06-13 23:01:29,280] Trial 70 finished with value: 0.609375 and parameters: {'FLOW': 38.049614030969906, 'FHIGH': 110.03728074147375, 'LR_EXP': -2.301603336058181, 'DROPOUT': 0.12254361594289792, 'BETA': 0.7867472203609445, 'SPIKE_GRAD_SLOPE': 8.27256141278613, 'TEMPORAL_FILTERS': 14, 'DEPTH_MULTIPLIER': 4, 'POINTWISE_FILTERS': 49, 'TEMPORAL_KERNEL_DIV': 4, 'SEPARABLE_KERNEL_SIZE': 31, 'POOL1_SIZE': 7, 'POOL2_SIZE': 3, 'NORM_AXIS': 'no_channel', 'RUN_ZSCORE': False, 'RUN_BANDPASS': False}. Best is trial 70 with value: 0.609375.
[I 2026-06-13 23:13:22,648] Trial 71 finished with value: 0.4947916666666667 and parameters: {'FLOW': 38.62151747003998, 'FHIGH': 109.27189818667092, 'LR_EXP': -2.094200564846039, 'DROPOUT': 0.12562875151057742, 'BETA': 0.7279303617103994, 'SPIKE_GRAD_SLOPE': 8.786973490051418, 'TEMPORAL_FILTERS': 13, 'DEPTH_MULTIPLIER': 4, 'POINTWISE_FILTERS': 43, 'TEMPORAL_KERNEL_DIV': 4, 'SEPARABLE_KERNEL_SIZE': 32, 'POOL1_SIZE': 7, 'POOL2_SIZE': 3, 'NORM_AXIS': 'no_channel', 'RUN_ZSCORE': False, 'RUN_BANDPASS': False}. Best is trial 70 with value: 0.609375.
[I 2026-06-13 23:24:25,341] Trial 72 finished with value: 0.5295138888888888 and parameters: {'FLOW': 38.4909527890695, 'FHIGH': 107.29743598829495, 'LR_EXP': -2.3032706516298265, 'DROPOUT': 0.10372078070340801, 'BETA': 0.780249623924564, 'SPIKE_GRAD_SLOPE': 5.096237011087682, 'TEMPORAL_FILTERS': 11, 'DEPTH_MULTIPLIER': 4, 'POINTWISE_FILTERS': 46, 'TEMPORAL_KERNEL_DIV': 4, 'SEPARABLE_KERNEL_SIZE': 31, 'POOL1_SIZE': 7, 'POOL2_SIZE': 3, 'NORM_AXIS': 'no_channel', 'RUN_ZSCORE': False, 'RUN_BANDPASS': False}. Best is trial 70 with value: 0.609375.
[I 2026-06-13 23:36:46,601] Trial 73 finished with value: 0.53125 and parameters: {'FLOW': 34.96604287502729, 'FHIGH': 117.53945476283623, 'LR_EXP': -2.523547450427883, 'DROPOUT': 0.14560608950149898, 'BETA': 0.7467174084232981, 'SPIKE_GRAD_SLOPE': 11.905090109357449, 'TEMPORAL_FILTERS': 14, 'DEPTH_MULTIPLIER': 4, 'POINTWISE_FILTERS': 49, 'TEMPORAL_KERNEL_DIV': 4, 'SEPARABLE_KERNEL_SIZE': 26, 'POOL1_SIZE': 8, 'POOL2_SIZE': 2, 'NORM_AXIS': 'no_channel', 'RUN_ZSCORE': False, 'RUN_BANDPASS': False}. Best is trial 70 with value: 0.609375.
[I 2026-06-13 23:49:34,000] Trial 74 finished with value: 0.5815972222222223 and parameters: {'FLOW': 32.206194622963366, 'FHIGH': 115.84177941850481, 'LR_EXP': -2.418994855992324, 'DROPOUT': 0.1736986207223567, 'BETA': 0.7975959954512126, 'SPIKE_GRAD_SLOPE': 16.511478357248244, 'TEMPORAL_FILTERS': 15, 'DEPTH_MULTIPLIER': 4, 'POINTWISE_FILTERS': 50, 'TEMPORAL_KERNEL_DIV': 4, 'SEPARABLE_KERNEL_SIZE': 29, 'POOL1_SIZE': 8, 'POOL2_SIZE': 3, 'NORM_AXIS': 'no_channel', 'RUN_ZSCORE': False, 'RUN_BANDPASS': False}. Best is trial 70 with value: 0.609375.
[I 2026-06-13 23:50:13,115] Trial 75 pruned. 
