
[notice] A new release of pip is available: 24.2 -> 26.1.2
[notice] To update, run: pip install --upgrade pip

[notice] A new release of pip is available: 24.2 -> 26.1.2
[notice] To update, run: pip install --upgrade pip
ERROR: Invalid requirement: 'Binary file requirements.txt matches': Expected end or semicolon (after name and no valid version specifier)
    Binary file requirements.txt matches
           ^ (from line 1 of /home/aleksander.berezowsk/requirements_notorch.txt)

[notice] A new release of pip is available: 24.2 -> 26.1.2
[notice] To update, run: pip install --upgrade pip

[notice] A new release of pip is available: 24.2 -> 26.1.2
[notice] To update, run: pip install --upgrade pip
/home/aleksander.berezowsk/spiking-eegnet/src/main.py:86: ExperimentalWarning: Argument ``multivariate`` is an experimental feature. The interface can change in the future.
  sampler=TPESampler(n_startup_trials=tpe_trails, multivariate=True, group=True)
/home/aleksander.berezowsk/spiking-eegnet/src/main.py:86: ExperimentalWarning: Argument ``group`` is an experimental feature. The interface can change in the future.
  sampler=TPESampler(n_startup_trials=tpe_trails, multivariate=True, group=True)
[I 2026-06-18 18:27:12,040] Using an existing study with name 'snn_eegnet_v2_200_20' instead of creating a new one.
[I 2026-06-18 18:27:54,501] Trial 618 pruned. 
[I 2026-06-18 18:44:00,362] Trial 619 finished with value: 0.5989583333333333 and parameters: {'FLOW': 11.708549263463846, 'FHIGH': 117.12355882551284, 'LR_EXP': -2.049564463436679, 'DROPOUT': 0.5549038948312116, 'BETA': 0.7591702729201383, 'SPIKE_GRAD_SLOPE': 12.291455775345637, 'TEMPORAL_FILTERS': 24, 'DEPTH_MULTIPLIER': 4, 'POINTWISE_FILTERS': 51, 'TEMPORAL_KERNEL_DIV': 6, 'SEPARABLE_KERNEL_SIZE': 14, 'POOL1_SIZE': 8, 'POOL2_SIZE': 7, 'NORM_AXIS': 'full', 'RUN_ZSCORE': True}. Best is trial 461 with value: 0.6545138888888888.
[I 2026-06-18 18:59:03,435] Trial 620 finished with value: 0.5833333333333334 and parameters: {'FLOW': 8.039664723566988, 'FHIGH': 79.15735017802498, 'LR_EXP': -2.849688620940932, 'DROPOUT': 0.4194218190545264, 'BETA': 0.5533398774853024, 'SPIKE_GRAD_SLOPE': 12.346854437427194, 'TEMPORAL_FILTERS': 31, 'DEPTH_MULTIPLIER': 2, 'POINTWISE_FILTERS': 21, 'TEMPORAL_KERNEL_DIV': 8, 'SEPARABLE_KERNEL_SIZE': 16, 'POOL1_SIZE': 6, 'POOL2_SIZE': 8, 'NORM_AXIS': 'full', 'RUN_ZSCORE': False}. Best is trial 461 with value: 0.6545138888888888.
[I 2026-06-18 18:59:40,956] Trial 621 pruned. 
[I 2026-06-18 19:00:08,005] Trial 622 pruned. 
[I 2026-06-18 19:00:46,572] Trial 623 pruned. 
[I 2026-06-18 19:14:22,003] Trial 624 finished with value: 0.501736111111111 and parameters: {'FLOW': 6.561966685101741, 'FHIGH': 51.527455121464875, 'LR_EXP': -2.08410698469439, 'DROPOUT': 0.6952838206881927, 'BETA': 0.8225754915604451, 'SPIKE_GRAD_SLOPE': 21.501244776467146, 'TEMPORAL_FILTERS': 20, 'DEPTH_MULTIPLIER': 4, 'POINTWISE_FILTERS': 43, 'TEMPORAL_KERNEL_DIV': 8, 'SEPARABLE_KERNEL_SIZE': 4, 'POOL1_SIZE': 7, 'POOL2_SIZE': 8, 'NORM_AXIS': 'no_channel', 'RUN_ZSCORE': False}. Best is trial 461 with value: 0.6545138888888888.
[I 2026-06-18 19:15:07,841] Trial 625 pruned. 
[I 2026-06-18 19:27:30,547] Trial 626 finished with value: 0.5677083333333333 and parameters: {'FLOW': 9.032328562605743, 'FHIGH': 93.74454649688198, 'LR_EXP': -2.0526106160934487, 'DROPOUT': 0.61189168991849, 'BETA': 0.8800059172460376, 'SPIKE_GRAD_SLOPE': 9.22399136573184, 'TEMPORAL_FILTERS': 27, 'DEPTH_MULTIPLIER': 1, 'POINTWISE_FILTERS': 55, 'TEMPORAL_KERNEL_DIV': 7, 'SEPARABLE_KERNEL_SIZE': 5, 'POOL1_SIZE': 6, 'POOL2_SIZE': 6, 'NORM_AXIS': 'no_channel', 'RUN_ZSCORE': False}. Best is trial 461 with value: 0.6545138888888888.
[I 2026-06-18 19:28:01,358] Trial 627 pruned. 
[I 2026-06-18 19:28:33,628] Trial 628 pruned. 
[I 2026-06-18 19:41:00,938] Trial 629 finished with value: 0.6024305555555556 and parameters: {'FLOW': 2.811375656903422, 'FHIGH': 98.92554249009049, 'LR_EXP': -2.449216798027065, 'DROPOUT': 0.5561769232393363, 'BETA': 0.8564345763984569, 'SPIKE_GRAD_SLOPE': 15.114135391160971, 'TEMPORAL_FILTERS': 16, 'DEPTH_MULTIPLIER': 4, 'POINTWISE_FILTERS': 41, 'TEMPORAL_KERNEL_DIV': 6, 'SEPARABLE_KERNEL_SIZE': 16, 'POOL1_SIZE': 6, 'POOL2_SIZE': 6, 'NORM_AXIS': 'full', 'RUN_ZSCORE': False}. Best is trial 461 with value: 0.6545138888888888.
[I 2026-06-18 19:41:50,832] Trial 630 pruned. 
[I 2026-06-18 19:42:30,065] Trial 631 pruned. 
[I 2026-06-18 19:57:32,548] Trial 632 finished with value: 0.578125 and parameters: {'FLOW': 7.543489891861399, 'FHIGH': 74.59493562185807, 'LR_EXP': -2.8877869718004123, 'DROPOUT': 0.45154809179485317, 'BETA': 0.5090957860713634, 'SPIKE_GRAD_SLOPE': 14.750332863154116, 'TEMPORAL_FILTERS': 21, 'DEPTH_MULTIPLIER': 4, 'POINTWISE_FILTERS': 15, 'TEMPORAL_KERNEL_DIV': 5, 'SEPARABLE_KERNEL_SIZE': 12, 'POOL1_SIZE': 7, 'POOL2_SIZE': 7, 'NORM_AXIS': 'full', 'RUN_ZSCORE': True}. Best is trial 461 with value: 0.6545138888888888.
[I 2026-06-18 19:58:08,554] Trial 633 pruned. 
[I 2026-06-18 19:58:47,998] Trial 634 pruned. 
[I 2026-06-18 20:10:35,321] Trial 635 finished with value: 0.5954861111111112 and parameters: {'FLOW': 8.11320968199681, 'FHIGH': 86.52390347559553, 'LR_EXP': -2.2537768627636225, 'DROPOUT': 0.5314711142605073, 'BETA': 0.8338548608938637, 'SPIKE_GRAD_SLOPE': 5.755059021391781, 'TEMPORAL_FILTERS': 16, 'DEPTH_MULTIPLIER': 4, 'POINTWISE_FILTERS': 23, 'TEMPORAL_KERNEL_DIV': 8, 'SEPARABLE_KERNEL_SIZE': 6, 'POOL1_SIZE': 7, 'POOL2_SIZE': 3, 'NORM_AXIS': 'full', 'RUN_ZSCORE': False}. Best is trial 461 with value: 0.6545138888888888.
[I 2026-06-18 20:11:02,598] Trial 636 pruned. 
[I 2026-06-18 20:11:42,622] Trial 637 pruned. 
[I 2026-06-18 20:23:01,656] Trial 638 finished with value: 0.642361111111111 and parameters: {'FLOW': 4.960859467732095, 'FHIGH': 73.24153728883877, 'LR_EXP': -3.2702226681783335, 'DROPOUT': 0.6388310716312096, 'BETA': 0.7204787295405436, 'SPIKE_GRAD_SLOPE': 9.270500636385034, 'TEMPORAL_FILTERS': 17, 'DEPTH_MULTIPLIER': 3, 'POINTWISE_FILTERS': 53, 'TEMPORAL_KERNEL_DIV': 8, 'SEPARABLE_KERNEL_SIZE': 18, 'POOL1_SIZE': 5, 'POOL2_SIZE': 6, 'NORM_AXIS': 'full', 'RUN_ZSCORE': False}. Best is trial 461 with value: 0.6545138888888888.
[I 2026-06-18 20:23:50,269] Trial 639 pruned. 
[I 2026-06-18 20:24:16,512] Trial 640 pruned. 
[I 2026-06-18 20:24:40,929] Trial 641 pruned. 
[I 2026-06-18 20:25:21,607] Trial 642 pruned. 
[I 2026-06-18 20:25:49,645] Trial 643 pruned. 
[I 2026-06-18 20:42:47,479] Trial 644 finished with value: 0.6024305555555555 and parameters: {'FLOW': 7.844445910670493, 'FHIGH': 118.15192880688413, 'LR_EXP': -2.484403197516388, 'DROPOUT': 0.7153046727834318, 'BETA': 0.7991589604031283, 'SPIKE_GRAD_SLOPE': 14.722107533429583, 'TEMPORAL_FILTERS': 26, 'DEPTH_MULTIPLIER': 4, 'POINTWISE_FILTERS': 33, 'TEMPORAL_KERNEL_DIV': 6, 'SEPARABLE_KERNEL_SIZE': 12, 'POOL1_SIZE': 8, 'POOL2_SIZE': 8, 'NORM_AXIS': 'full', 'RUN_ZSCORE': True}. Best is trial 461 with value: 0.6545138888888888.
[I 2026-06-18 20:43:12,731] Trial 645 pruned. 
[I 2026-06-18 20:43:56,400] Trial 646 pruned. 
[I 2026-06-18 20:44:23,334] Trial 647 pruned. 
[I 2026-06-18 20:44:48,454] Trial 648 pruned. 
[I 2026-06-18 20:45:12,768] Trial 649 pruned. 
[I 2026-06-18 20:45:51,152] Trial 650 pruned. 
[I 2026-06-18 20:46:23,922] Trial 651 pruned. 
[I 2026-06-18 20:46:48,432] Trial 652 pruned. 
[I 2026-06-18 20:47:22,324] Trial 653 pruned. 
[I 2026-06-18 20:48:03,741] Trial 654 pruned. 
[I 2026-06-18 21:03:12,080] Trial 655 finished with value: 0.5399305555555556 and parameters: {'FLOW': 10.13181268658061, 'FHIGH': 80.18960676518243, 'LR_EXP': -2.5756241004447893, 'DROPOUT': 0.21901389638413782, 'BETA': 0.5326341712832107, 'SPIKE_GRAD_SLOPE': 11.90441182774539, 'TEMPORAL_FILTERS': 26, 'DEPTH_MULTIPLIER': 3, 'POINTWISE_FILTERS': 27, 'TEMPORAL_KERNEL_DIV': 7, 'SEPARABLE_KERNEL_SIZE': 19, 'POOL1_SIZE': 6, 'POOL2_SIZE': 7, 'NORM_AXIS': 'no_channel', 'RUN_ZSCORE': True}. Best is trial 461 with value: 0.6545138888888888.
[I 2026-06-18 21:20:39,691] Trial 656 finished with value: 0.5260416666666666 and parameters: {'FLOW': 10.803050320127946, 'FHIGH': 97.05987689224118, 'LR_EXP': -2.4458435350506713, 'DROPOUT': 0.6364928609964993, 'BETA': 0.8190120430159095, 'SPIKE_GRAD_SLOPE': 20.303331938249254, 'TEMPORAL_FILTERS': 31, 'DEPTH_MULTIPLIER': 3, 'POINTWISE_FILTERS': 31, 'TEMPORAL_KERNEL_DIV': 6, 'SEPARABLE_KERNEL_SIZE': 18, 'POOL1_SIZE': 7, 'POOL2_SIZE': 7, 'NORM_AXIS': 'full', 'RUN_ZSCORE': False}. Best is trial 461 with value: 0.6545138888888888.
[I 2026-06-18 21:21:17,472] Trial 657 pruned. 
[I 2026-06-18 21:21:38,711] Trial 658 pruned. 
[I 2026-06-18 21:22:24,618] Trial 659 pruned. 
[I 2026-06-18 21:22:53,695] Trial 660 pruned. 
[I 2026-06-18 21:36:50,535] Trial 661 finished with value: 0.5711805555555556 and parameters: {'FLOW': 8.796122609982186, 'FHIGH': 69.67382938952667, 'LR_EXP': -2.2363682333822332, 'DROPOUT': 0.5117893064308822, 'BETA': 0.6159311957125239, 'SPIKE_GRAD_SLOPE': 12.612685851000819, 'TEMPORAL_FILTERS': 20, 'DEPTH_MULTIPLIER': 4, 'POINTWISE_FILTERS': 54, 'TEMPORAL_KERNEL_DIV': 7, 'SEPARABLE_KERNEL_SIZE': 11, 'POOL1_SIZE': 5, 'POOL2_SIZE': 5, 'NORM_AXIS': 'full', 'RUN_ZSCORE': False}. Best is trial 461 with value: 0.6545138888888888.
[I 2026-06-18 21:37:24,840] Trial 662 pruned. 
[I 2026-06-18 21:53:45,018] Trial 663 finished with value: 0.546875 and parameters: {'FLOW': 4.75648227848055, 'FHIGH': 68.2625294338688, 'LR_EXP': -3.054644607606697, 'DROPOUT': 0.358009342292983, 'BETA': 0.6223860472165164, 'SPIKE_GRAD_SLOPE': 26.5168990206874, 'TEMPORAL_FILTERS': 28, 'DEPTH_MULTIPLIER': 3, 'POINTWISE_FILTERS': 33, 'TEMPORAL_KERNEL_DIV': 6, 'SEPARABLE_KERNEL_SIZE': 22, 'POOL1_SIZE': 5, 'POOL2_SIZE': 8, 'NORM_AXIS': 'full', 'RUN_ZSCORE': True}. Best is trial 461 with value: 0.6545138888888888.
[I 2026-06-18 21:54:18,845] Trial 664 pruned. 
[I 2026-06-18 22:10:38,098] Trial 665 finished with value: 0.5399305555555556 and parameters: {'FLOW': 4.524977445978866, 'FHIGH': 84.07028483678096, 'LR_EXP': -2.542503853916167, 'DROPOUT': 0.33398428573898875, 'BETA': 0.5206116113345713, 'SPIKE_GRAD_SLOPE': 14.848143871221128, 'TEMPORAL_FILTERS': 30, 'DEPTH_MULTIPLIER': 2, 'POINTWISE_FILTERS': 14, 'TEMPORAL_KERNEL_DIV': 4, 'SEPARABLE_KERNEL_SIZE': 23, 'POOL1_SIZE': 5, 'POOL2_SIZE': 8, 'NORM_AXIS': 'full', 'RUN_ZSCORE': False}. Best is trial 461 with value: 0.6545138888888888.
[I 2026-06-18 22:11:11,248] Trial 666 pruned. 
[I 2026-06-18 22:11:52,831] Trial 667 pruned. 
[I 2026-06-18 22:12:17,739] Trial 668 pruned. 
[I 2026-06-18 22:13:06,344] Trial 669 pruned. 
[I 2026-06-18 22:29:10,469] Trial 670 finished with value: 0.5520833333333334 and parameters: {'FLOW': 9.262703685288136, 'FHIGH': 93.82613647479045, 'LR_EXP': -2.5832949084642793, 'DROPOUT': 0.41732851997917303, 'BETA': 0.8716633833039628, 'SPIKE_GRAD_SLOPE': 32.65934428197246, 'TEMPORAL_FILTERS': 25, 'DEPTH_MULTIPLIER': 3, 'POINTWISE_FILTERS': 35, 'TEMPORAL_KERNEL_DIV': 4, 'SEPARABLE_KERNEL_SIZE': 19, 'POOL1_SIZE': 7, 'POOL2_SIZE': 6, 'NORM_AXIS': 'full', 'RUN_ZSCORE': False}. Best is trial 461 with value: 0.6545138888888888.
[I 2026-06-18 22:29:37,140] Trial 671 pruned. 
[I 2026-06-18 22:30:05,274] Trial 672 pruned. 
[I 2026-06-18 22:30:37,416] Trial 673 pruned. 
[I 2026-06-18 22:44:17,921] Trial 674 finished with value: 0.5763888888888888 and parameters: {'FLOW': 8.79498058961314, 'FHIGH': 73.1945222949565, 'LR_EXP': -2.4803315829481427, 'DROPOUT': 0.6687858323894537, 'BETA': 0.9386938151088619, 'SPIKE_GRAD_SLOPE': 20.398049052708373, 'TEMPORAL_FILTERS': 23, 'DEPTH_MULTIPLIER': 3, 'POINTWISE_FILTERS': 41, 'TEMPORAL_KERNEL_DIV': 8, 'SEPARABLE_KERNEL_SIZE': 23, 'POOL1_SIZE': 6, 'POOL2_SIZE': 5, 'NORM_AXIS': 'no_channel', 'RUN_ZSCORE': False}. Best is trial 461 with value: 0.6545138888888888.
[I 2026-06-18 22:44:57,031] Trial 675 pruned. 
[I 2026-06-18 22:45:44,358] Trial 676 pruned. 
[I 2026-06-18 22:46:14,211] Trial 677 pruned. 
[I 2026-06-18 22:46:48,662] Trial 678 pruned. 
[I 2026-06-18 22:47:19,521] Trial 679 pruned. 
[I 2026-06-18 22:47:52,443] Trial 680 pruned. 
[I 2026-06-18 22:48:35,999] Trial 681 pruned. 
[I 2026-06-18 22:49:15,306] Trial 682 pruned. 
[I 2026-06-18 22:49:51,297] Trial 683 pruned. 
[I 2026-06-18 23:06:31,188] Trial 684 finished with value: 0.49826388888888884 and parameters: {'FLOW': 3.566037676790585, 'FHIGH': 54.099478931599585, 'LR_EXP': -2.9786523598971106, 'DROPOUT': 0.501196805463999, 'BETA': 0.9633456148083082, 'SPIKE_GRAD_SLOPE': 14.277925019797916, 'TEMPORAL_FILTERS': 25, 'DEPTH_MULTIPLIER': 4, 'POINTWISE_FILTERS': 34, 'TEMPORAL_KERNEL_DIV': 6, 'SEPARABLE_KERNEL_SIZE': 21, 'POOL1_SIZE': 7, 'POOL2_SIZE': 4, 'NORM_AXIS': 'no_channel', 'RUN_ZSCORE': True}. Best is trial 461 with value: 0.6545138888888888.
[I 2026-06-18 23:06:57,501] Trial 685 pruned. 
[I 2026-06-18 23:21:57,003] Trial 686 finished with value: 0.5416666666666666 and parameters: {'FLOW': 11.048322340989106, 'FHIGH': 57.625772287461324, 'LR_EXP': -2.4310952180602707, 'DROPOUT': 0.5939125649851095, 'BETA': 0.6521218776426282, 'SPIKE_GRAD_SLOPE': 7.273414575375892, 'TEMPORAL_FILTERS': 22, 'DEPTH_MULTIPLIER': 4, 'POINTWISE_FILTERS': 44, 'TEMPORAL_KERNEL_DIV': 7, 'SEPARABLE_KERNEL_SIZE': 15, 'POOL1_SIZE': 5, 'POOL2_SIZE': 8, 'NORM_AXIS': 'no_channel', 'RUN_ZSCORE': True}. Best is trial 461 with value: 0.6545138888888888.
[I 2026-06-18 23:22:22,711] Trial 687 pruned. 
[I 2026-06-18 23:35:59,302] Trial 688 finished with value: 0.5 and parameters: {'FLOW': 8.08600538020651, 'FHIGH': 49.186645527318746, 'LR_EXP': -2.023460524074878, 'DROPOUT': 0.6135052162169035, 'BETA': 0.9181178935227333, 'SPIKE_GRAD_SLOPE': 8.589292153174553, 'TEMPORAL_FILTERS': 20, 'DEPTH_MULTIPLIER': 4, 'POINTWISE_FILTERS': 15, 'TEMPORAL_KERNEL_DIV': 8, 'SEPARABLE_KERNEL_SIZE': 10, 'POOL1_SIZE': 8, 'POOL2_SIZE': 7, 'NORM_AXIS': 'no_channel', 'RUN_ZSCORE': False}. Best is trial 461 with value: 0.6545138888888888.
[I 2026-06-18 23:36:37,272] Trial 689 pruned. 
[I 2026-06-18 23:37:18,698] Trial 690 pruned. 
[I 2026-06-18 23:37:57,794] Trial 691 pruned. 
[I 2026-06-18 23:38:30,277] Trial 692 pruned. 
[I 2026-06-18 23:40:08,292] Trial 693 pruned. 
[I 2026-06-18 23:40:40,503] Trial 694 pruned. 
[I 2026-06-18 23:41:11,271] Trial 695 pruned. 
[I 2026-06-18 23:55:42,516] Trial 696 finished with value: 0.5989583333333334 and parameters: {'FLOW': 8.948140416784973, 'FHIGH': 56.72606459516469, 'LR_EXP': -2.309687270810866, 'DROPOUT': 0.5940899146641345, 'BETA': 0.7288901752435971, 'SPIKE_GRAD_SLOPE': 10.915353573012851, 'TEMPORAL_FILTERS': 22, 'DEPTH_MULTIPLIER': 4, 'POINTWISE_FILTERS': 19, 'TEMPORAL_KERNEL_DIV': 8, 'SEPARABLE_KERNEL_SIZE': 7, 'POOL1_SIZE': 6, 'POOL2_SIZE': 8, 'NORM_AXIS': 'no_channel', 'RUN_ZSCORE': False}. Best is trial 461 with value: 0.6545138888888888.
[I 2026-06-18 23:56:26,352] Trial 697 pruned. 
[I 2026-06-18 23:56:57,346] Trial 698 pruned. 
[I 2026-06-18 23:57:39,666] Trial 699 pruned. 
[I 2026-06-18 23:58:19,791] Trial 700 pruned. 
[I 2026-06-18 23:58:53,400] Trial 701 pruned. 
[I 2026-06-19 00:13:14,216] Trial 702 finished with value: 0.5850694444444444 and parameters: {'FLOW': 2.864152635348214, 'FHIGH': 82.87719535222742, 'LR_EXP': -2.612312415103758, 'DROPOUT': 0.6168966095234578, 'BETA': 0.5684879570524517, 'SPIKE_GRAD_SLOPE': 8.583723285955758, 'TEMPORAL_FILTERS': 28, 'DEPTH_MULTIPLIER': 2, 'POINTWISE_FILTERS': 27, 'TEMPORAL_KERNEL_DIV': 7, 'SEPARABLE_KERNEL_SIZE': 21, 'POOL1_SIZE': 5, 'POOL2_SIZE': 6, 'NORM_AXIS': 'no_channel', 'RUN_ZSCORE': True}. Best is trial 461 with value: 0.6545138888888888.
[I 2026-06-19 00:13:39,053] Trial 703 pruned. 
[I 2026-06-19 00:14:04,684] Trial 704 pruned. 
[I 2026-06-19 00:26:17,085] Trial 705 finished with value: 0.5052083333333334 and parameters: {'FLOW': 9.933960965278574, 'FHIGH': 63.31620412042023, 'LR_EXP': -2.210466684998171, 'DROPOUT': 0.4678275510023068, 'BETA': 0.8700895103985216, 'SPIKE_GRAD_SLOPE': 44.332056885253614, 'TEMPORAL_FILTERS': 22, 'DEPTH_MULTIPLIER': 1, 'POINTWISE_FILTERS': 41, 'TEMPORAL_KERNEL_DIV': 4, 'SEPARABLE_KERNEL_SIZE': 9, 'POOL1_SIZE': 8, 'POOL2_SIZE': 8, 'NORM_AXIS': 'full', 'RUN_ZSCORE': False}. Best is trial 461 with value: 0.6545138888888888.
[I 2026-06-19 00:26:54,261] Trial 706 pruned. 
[I 2026-06-19 00:27:24,337] Trial 707 pruned. 
[I 2026-06-19 00:27:52,252] Trial 708 pruned. 
[I 2026-06-19 00:28:20,974] Trial 709 pruned. 
[I 2026-06-19 00:28:56,333] Trial 710 pruned. 
[I 2026-06-19 00:29:37,197] Trial 711 pruned. 
[I 2026-06-19 00:49:27,413] Trial 712 finished with value: 0.5833333333333333 and parameters: {'FLOW': 8.242451341800972, 'FHIGH': 61.8904741963521, 'LR_EXP': -2.5685118961536837, 'DROPOUT': 0.7262244535583323, 'BETA': 0.6609697856056639, 'SPIKE_GRAD_SLOPE': 41.047203434959165, 'TEMPORAL_FILTERS': 32, 'DEPTH_MULTIPLIER': 4, 'POINTWISE_FILTERS': 54, 'TEMPORAL_KERNEL_DIV': 6, 'SEPARABLE_KERNEL_SIZE': 20, 'POOL1_SIZE': 6, 'POOL2_SIZE': 4, 'NORM_AXIS': 'no_channel', 'RUN_ZSCORE': True}. Best is trial 461 with value: 0.6545138888888888.
