mkdir: cannot create directory ‘/scratch/mne_data’: Permission denied

[notice] A new release of pip is available: 24.2 -> 26.1.2
[notice] To update, run: pip install --upgrade pip

[notice] A new release of pip is available: 24.2 -> 26.1.2
[notice] To update, run: pip install --upgrade pip
ERROR: Invalid requirement: 'Binary file requirements.txt matches': Expected end or semicolon (after name and no valid version specifier)
    Binary file requirements.txt matches
           ^ (from line 1 of /home/aleksander.berezowsk/requirements_notorch.txt)

[notice] A new release of pip is available: 24.2 -> 26.1.2
[notice] To update, run: pip install --upgrade pip

[notice] A new release of pip is available: 24.2 -> 26.1.2
[notice] To update, run: pip install --upgrade pip
/home/aleksander.berezowsk/spiking-eegnet/src/main.py:92: ExperimentalWarning: Argument ``multivariate`` is an experimental feature. The interface can change in the future.
  sampler=TPESampler(n_startup_trials=tpe_trails, multivariate=True, group=True)
/home/aleksander.berezowsk/spiking-eegnet/src/main.py:92: ExperimentalWarning: Argument ``group`` is an experimental feature. The interface can change in the future.
  sampler=TPESampler(n_startup_trials=tpe_trails, multivariate=True, group=True)
[I 2026-07-04 02:04:11,775] Using an existing study with name 'snn_eegnet_v4_400_40' instead of creating a new one.
[I 2026-07-04 08:17:28,502] Trial 19 finished with value: 0.5368441358024691 and parameters: {'LR_EXP': -2.9385217122876277, 'DROPOUT': 0.461446104381693, 'BETA': 0.7754027565666047, 'SPIKE_GRAD_SLOPE': 55.45353754506503, 'TEMPORAL_FILTERS': 60, 'DEPTH_MULTIPLIER': 1, 'POINTWISE_FILTERS': 40, 'TEMPORAL_KERNEL_DIV': 5, 'SEPARABLE_KERNEL_SIZE': 60, 'POOL1_SIZE': 6, 'POOL2_SIZE': 3, 'N_STEPS_TRAIN': 16, 'N_STEPS_EVAL': 11, 'READOUT_MODE': 'spk_mean'}. Best is trial 10 with value: 0.566550925925926.
[I 2026-07-04 13:14:04,491] Trial 23 finished with value: 0.5410879629629629 and parameters: {'LR_EXP': -4.360437110009854, 'DROPOUT': 0.36987890932932493, 'BETA': 0.7633484920761175, 'SPIKE_GRAD_SLOPE': 7.155139823597466, 'TEMPORAL_FILTERS': 43, 'DEPTH_MULTIPLIER': 2, 'POINTWISE_FILTERS': 44, 'TEMPORAL_KERNEL_DIV': 5, 'SEPARABLE_KERNEL_SIZE': 53, 'POOL1_SIZE': 5, 'POOL2_SIZE': 4, 'N_STEPS_TRAIN': 13, 'N_STEPS_EVAL': 29, 'READOUT_MODE': 'spk_mean'}. Best is trial 10 with value: 0.566550925925926.
[I 2026-07-04 15:12:04,055] Trial 25 finished with value: 0.5152391975308642 and parameters: {'LR_EXP': -2.356597882278736, 'DROPOUT': 0.10507598940327062, 'BETA': 0.981535699380852, 'SPIKE_GRAD_SLOPE': 58.28475638091517, 'TEMPORAL_FILTERS': 31, 'DEPTH_MULTIPLIER': 1, 'POINTWISE_FILTERS': 19, 'TEMPORAL_KERNEL_DIV': 8, 'SEPARABLE_KERNEL_SIZE': 38, 'POOL1_SIZE': 3, 'POOL2_SIZE': 8, 'N_STEPS_TRAIN': 9, 'N_STEPS_EVAL': 23, 'READOUT_MODE': 'spk_mean'}. Best is trial 10 with value: 0.566550925925926.
[I 2026-07-04 17:15:13,041] Trial 29 finished with value: 0.5040509259259259 and parameters: {'LR_EXP': -4.196938969431792, 'DROPOUT': 0.14330584014507708, 'BETA': 0.7889724204624111, 'SPIKE_GRAD_SLOPE': 34.76736674364471, 'TEMPORAL_FILTERS': 49, 'DEPTH_MULTIPLIER': 1, 'POINTWISE_FILTERS': 41, 'TEMPORAL_KERNEL_DIV': 5, 'SEPARABLE_KERNEL_SIZE': 25, 'POOL1_SIZE': 7, 'POOL2_SIZE': 6, 'N_STEPS_TRAIN': 5, 'N_STEPS_EVAL': 25, 'READOUT_MODE': 'spk_mean'}. Best is trial 10 with value: 0.566550925925926.
[I 2026-07-04 19:35:26,642] Trial 33 finished with value: 0.5320216049382717 and parameters: {'LR_EXP': -2.7406740122328626, 'DROPOUT': 0.18602151305431563, 'BETA': 0.9016295182534882, 'SPIKE_GRAD_SLOPE': 23.125473393713303, 'TEMPORAL_FILTERS': 18, 'DEPTH_MULTIPLIER': 3, 'POINTWISE_FILTERS': 56, 'TEMPORAL_KERNEL_DIV': 2, 'SEPARABLE_KERNEL_SIZE': 7, 'POOL1_SIZE': 7, 'POOL2_SIZE': 4, 'N_STEPS_TRAIN': 9, 'N_STEPS_EVAL': 14, 'READOUT_MODE': 'spk_mean'}. Best is trial 10 with value: 0.566550925925926.
[I 2026-07-04 23:46:19,244] Trial 37 finished with value: 0.5050154320987654 and parameters: {'LR_EXP': -2.1413953814003017, 'DROPOUT': 0.19686468824985826, 'BETA': 0.9539232229377671, 'SPIKE_GRAD_SLOPE': 47.93270785590359, 'TEMPORAL_FILTERS': 18, 'DEPTH_MULTIPLIER': 3, 'POINTWISE_FILTERS': 59, 'TEMPORAL_KERNEL_DIV': 2, 'SEPARABLE_KERNEL_SIZE': 7, 'POOL1_SIZE': 7, 'POOL2_SIZE': 4, 'N_STEPS_TRAIN': 16, 'N_STEPS_EVAL': 30, 'READOUT_MODE': 'spk_sum'}. Best is trial 10 with value: 0.566550925925926.
[I 2026-07-05 01:58:10,363] Trial 41 finished with value: 0.5295138888888888 and parameters: {'LR_EXP': -3.3574107289886252, 'DROPOUT': 0.3243787621009377, 'BETA': 0.8221394872264307, 'SPIKE_GRAD_SLOPE': 32.60222685363212, 'TEMPORAL_FILTERS': 13, 'DEPTH_MULTIPLIER': 3, 'POINTWISE_FILTERS': 18, 'TEMPORAL_KERNEL_DIV': 4, 'SEPARABLE_KERNEL_SIZE': 58, 'POOL1_SIZE': 2, 'POOL2_SIZE': 4, 'N_STEPS_TRAIN': 12, 'N_STEPS_EVAL': 21, 'READOUT_MODE': 'spk_sum'}. Best is trial 10 with value: 0.566550925925926.
