mkdir: cannot create directory ‘/scratch/mne_data’: Permission denied

[notice] A new release of pip is available: 24.2 -> 26.1.2
[notice] To update, run: pip install --upgrade pip

[notice] A new release of pip is available: 24.2 -> 26.1.2
[notice] To update, run: pip install --upgrade pip
ERROR: Invalid requirement: 'Binary file requirements.txt matches': Expected end or semicolon (after name and no valid version specifier)
    Binary file requirements.txt matches
           ^ (from line 1 of /home/aleksander.berezowsk/requirements_notorch.txt)

[notice] A new release of pip is available: 24.2 -> 26.1.2
[notice] To update, run: pip install --upgrade pip

[notice] A new release of pip is available: 24.2 -> 26.1.2
[notice] To update, run: pip install --upgrade pip
/home/aleksander.berezowsk/spiking-eegnet/src/main.py:97: ExperimentalWarning: Argument ``multivariate`` is an experimental feature. The interface can change in the future.
  sampler=TPESampler(n_startup_trials=tpe_trails, multivariate=True, group=True)
/home/aleksander.berezowsk/spiking-eegnet/src/main.py:97: ExperimentalWarning: Argument ``group`` is an experimental feature. The interface can change in the future.
  sampler=TPESampler(n_startup_trials=tpe_trails, multivariate=True, group=True)
[I 2026-06-28 13:22:09,067] Using an existing study with name 'snn_eegnet_v3_200_20' instead of creating a new one.
[I 2026-06-28 16:29:38,843] Trial 71 finished with value: 0.4660493827160494 and parameters: {'FLOW': 1.495018994821771, 'FHIGH': 113.94912602781015, 'LR_EXP': -2.393371539868901, 'DROPOUT': 0.16033414503038956, 'BETA': 0.9477839950766017, 'SPIKE_GRAD_SLOPE': 25.443412172271476, 'TEMPORAL_FILTERS': 25, 'DEPTH_MULTIPLIER': 3, 'POINTWISE_FILTERS': 28, 'TEMPORAL_KERNEL_DIV': 7, 'SEPARABLE_KERNEL_SIZE': 30, 'POOL1_SIZE': 6, 'POOL2_SIZE': 6, 'N_STEPS_TRAIN': 13, 'N_STEPS_EVAL': 28, 'READOUT_MODE': 'spk_sum'}. Best is trial 63 with value: 0.4920910493827161.
[I 2026-06-28 20:16:41,051] Trial 75 finished with value: 0.48418209876543217 and parameters: {'FLOW': 1.253904950262966, 'FHIGH': 77.76094615762331, 'LR_EXP': -3.1857411234094517, 'DROPOUT': 0.25790537254591855, 'BETA': 0.927607239336659, 'SPIKE_GRAD_SLOPE': 33.821243415080026, 'TEMPORAL_FILTERS': 26, 'DEPTH_MULTIPLIER': 3, 'POINTWISE_FILTERS': 26, 'TEMPORAL_KERNEL_DIV': 6, 'SEPARABLE_KERNEL_SIZE': 27, 'POOL1_SIZE': 3, 'POOL2_SIZE': 8, 'N_STEPS_TRAIN': 15, 'N_STEPS_EVAL': 27, 'READOUT_MODE': 'spk_mean'}. Best is trial 63 with value: 0.4920910493827161.
[I 2026-06-28 23:31:44,103] Trial 80 finished with value: 0.45023148148148145 and parameters: {'FLOW': 2.7285968510272185, 'FHIGH': 61.140955685303226, 'LR_EXP': -2.892851811548822, 'DROPOUT': 0.5431871068966874, 'BETA': 0.9361870931817438, 'SPIKE_GRAD_SLOPE': 17.58475488310726, 'TEMPORAL_FILTERS': 27, 'DEPTH_MULTIPLIER': 2, 'POINTWISE_FILTERS': 15, 'TEMPORAL_KERNEL_DIV': 5, 'SEPARABLE_KERNEL_SIZE': 19, 'POOL1_SIZE': 4, 'POOL2_SIZE': 8, 'N_STEPS_TRAIN': 14, 'N_STEPS_EVAL': 23, 'READOUT_MODE': 'spk_mean'}. Best is trial 63 with value: 0.4920910493827161.
[I 2026-06-29 03:36:44,582] Trial 83 finished with value: 0.4538966049382716 and parameters: {'FLOW': 1.9251557407544615, 'FHIGH': 107.54909362824903, 'LR_EXP': -3.498621000290684, 'DROPOUT': 0.23219990333711746, 'BETA': 0.8410519081742142, 'SPIKE_GRAD_SLOPE': 33.68693262106777, 'TEMPORAL_FILTERS': 24, 'DEPTH_MULTIPLIER': 4, 'POINTWISE_FILTERS': 18, 'TEMPORAL_KERNEL_DIV': 3, 'SEPARABLE_KERNEL_SIZE': 23, 'POOL1_SIZE': 3, 'POOL2_SIZE': 4, 'N_STEPS_TRAIN': 13, 'N_STEPS_EVAL': 25, 'READOUT_MODE': 'mem_last'}. Best is trial 63 with value: 0.4920910493827161.
[I 2026-06-29 06:28:25,859] Trial 86 finished with value: 0.4645061728395061 and parameters: {'FLOW': 2.186203008048067, 'FHIGH': 67.29604486219135, 'LR_EXP': -3.280175368126848, 'DROPOUT': 0.3196270091072184, 'BETA': 0.9572638996404543, 'SPIKE_GRAD_SLOPE': 42.4340490596104, 'TEMPORAL_FILTERS': 18, 'DEPTH_MULTIPLIER': 3, 'POINTWISE_FILTERS': 27, 'TEMPORAL_KERNEL_DIV': 5, 'SEPARABLE_KERNEL_SIZE': 22, 'POOL1_SIZE': 3, 'POOL2_SIZE': 7, 'N_STEPS_TRAIN': 14, 'N_STEPS_EVAL': 28, 'READOUT_MODE': 'spk_mean'}. Best is trial 63 with value: 0.4920910493827161.
[I 2026-06-29 10:22:44,134] Trial 90 finished with value: 0.4556327160493827 and parameters: {'FLOW': 1.0921093226479335, 'FHIGH': 79.75208473884078, 'LR_EXP': -2.4623508805764724, 'DROPOUT': 0.36962841901355326, 'BETA': 0.8724458618340063, 'SPIKE_GRAD_SLOPE': 35.653831685687656, 'TEMPORAL_FILTERS': 22, 'DEPTH_MULTIPLIER': 4, 'POINTWISE_FILTERS': 23, 'TEMPORAL_KERNEL_DIV': 4, 'SEPARABLE_KERNEL_SIZE': 30, 'POOL1_SIZE': 6, 'POOL2_SIZE': 4, 'N_STEPS_TRAIN': 15, 'N_STEPS_EVAL': 26, 'READOUT_MODE': 'spk_mean'}. Best is trial 63 with value: 0.4920910493827161.
slurmstepd: error: *** JOB 44259653 ON fg3 CANCELLED AT 2026-06-29T11:14:21 ***
