
[notice] A new release of pip is available: 24.2 -> 26.1.2
[notice] To update, run: pip install --upgrade pip

[notice] A new release of pip is available: 24.2 -> 26.1.2
[notice] To update, run: pip install --upgrade pip
ERROR: Invalid requirement: 'Binary file requirements.txt matches': Expected end or semicolon (after name and no valid version specifier)
    Binary file requirements.txt matches
           ^ (from line 1 of /home/aleksander.berezowsk/requirements_notorch.txt)

[notice] A new release of pip is available: 24.2 -> 26.1.2
[notice] To update, run: pip install --upgrade pip

[notice] A new release of pip is available: 24.2 -> 26.1.2
[notice] To update, run: pip install --upgrade pip
/home/aleksander.berezowsk/spiking-eegnet/src/main.py:87: ExperimentalWarning: Argument ``multivariate`` is an experimental feature. The interface can change in the future.
  sampler=TPESampler(n_startup_trials=tpe_trails, multivariate=True, group=True)
/home/aleksander.berezowsk/spiking-eegnet/src/main.py:87: ExperimentalWarning: Argument ``group`` is an experimental feature. The interface can change in the future.
  sampler=TPESampler(n_startup_trials=tpe_trails, multivariate=True, group=True)
[I 2026-06-14 22:08:01,165] Using an existing study with name 'snn_eegnet_1000_100' instead of creating a new one.
[I 2026-06-14 22:19:49,617] Trial 18 finished with value: 0.4461805555555556 and parameters: {'FLOW': 15.427866021528724, 'FHIGH': 38.682298989200625, 'LR_EXP': -3.930316169428374, 'DROPOUT': 0.33351309707256444, 'BETA': 0.8352241941112095, 'SPIKE_GRAD_SLOPE': 90.73744002769513, 'TEMPORAL_FILTERS': 11, 'DEPTH_MULTIPLIER': 2, 'POINTWISE_FILTERS': 33, 'TEMPORAL_KERNEL_DIV': 3, 'SEPARABLE_KERNEL_SIZE': 7, 'POOL1_SIZE': 7, 'POOL2_SIZE': 6, 'NORM_AXIS': 'full', 'RUN_ZSCORE': False, 'RUN_BANDPASS': False}. Best is trial 1 with value: 0.5746527777777778.
[I 2026-06-14 22:31:20,189] Trial 19 finished with value: 0.2621527777777778 and parameters: {'FLOW': 19.543609168575987, 'FHIGH': 93.21097231316702, 'LR_EXP': -3.6490078819867637, 'DROPOUT': 0.1918436681351357, 'BETA': 0.9322114803108468, 'SPIKE_GRAD_SLOPE': 53.30749957748679, 'TEMPORAL_FILTERS': 10, 'DEPTH_MULTIPLIER': 2, 'POINTWISE_FILTERS': 13, 'TEMPORAL_KERNEL_DIV': 3, 'SEPARABLE_KERNEL_SIZE': 25, 'POOL1_SIZE': 6, 'POOL2_SIZE': 3, 'NORM_AXIS': 'no_channel', 'RUN_ZSCORE': True, 'RUN_BANDPASS': True}. Best is trial 1 with value: 0.5746527777777778.
[I 2026-06-14 22:40:51,476] Trial 20 finished with value: 0.513888888888889 and parameters: {'FLOW': 10.11076150305402, 'FHIGH': 73.62878562605131, 'LR_EXP': -2.6921380216736406, 'DROPOUT': 0.49354872335372857, 'BETA': 0.6161901926519874, 'SPIKE_GRAD_SLOPE': 12.52208985065, 'TEMPORAL_FILTERS': 14, 'DEPTH_MULTIPLIER': 1, 'POINTWISE_FILTERS': 39, 'TEMPORAL_KERNEL_DIV': 5, 'SEPARABLE_KERNEL_SIZE': 15, 'POOL1_SIZE': 4, 'POOL2_SIZE': 2, 'NORM_AXIS': 'full', 'RUN_ZSCORE': False, 'RUN_BANDPASS': True}. Best is trial 1 with value: 0.5746527777777778.
[I 2026-06-14 22:48:38,392] Trial 21 finished with value: 0.5642361111111112 and parameters: {'FLOW': 1.2636681375242578, 'FHIGH': 11.136380603414407, 'LR_EXP': -3.5808083824731174, 'DROPOUT': 0.3994911448192481, 'BETA': 0.5853340209134427, 'SPIKE_GRAD_SLOPE': 69.45723716065982, 'TEMPORAL_FILTERS': 4, 'DEPTH_MULTIPLIER': 4, 'POINTWISE_FILTERS': 29, 'TEMPORAL_KERNEL_DIV': 5, 'SEPARABLE_KERNEL_SIZE': 19, 'POOL1_SIZE': 6, 'POOL2_SIZE': 7, 'NORM_AXIS': 'no_channel', 'RUN_ZSCORE': False, 'RUN_BANDPASS': False}. Best is trial 1 with value: 0.5746527777777778.
[I 2026-06-14 22:56:04,276] Trial 22 finished with value: 0.2725694444444444 and parameters: {'FLOW': 25.77701535200163, 'FHIGH': 39.76204905266545, 'LR_EXP': -2.6000230623377947, 'DROPOUT': 0.26245287887721225, 'BETA': 0.8590669608224908, 'SPIKE_GRAD_SLOPE': 38.16074266923401, 'TEMPORAL_FILTERS': 5, 'DEPTH_MULTIPLIER': 2, 'POINTWISE_FILTERS': 27, 'TEMPORAL_KERNEL_DIV': 7, 'SEPARABLE_KERNEL_SIZE': 29, 'POOL1_SIZE': 2, 'POOL2_SIZE': 3, 'NORM_AXIS': 'no_channel', 'RUN_ZSCORE': True, 'RUN_BANDPASS': True}. Best is trial 1 with value: 0.5746527777777778.
[I 2026-06-14 23:07:39,675] Trial 23 finished with value: 0.5347222222222222 and parameters: {'FLOW': 4.077678993779947, 'FHIGH': 38.740617020058686, 'LR_EXP': -2.3441215674331577, 'DROPOUT': 0.4962176924267544, 'BETA': 0.552157592944799, 'SPIKE_GRAD_SLOPE': 20.251146747470013, 'TEMPORAL_FILTERS': 23, 'DEPTH_MULTIPLIER': 1, 'POINTWISE_FILTERS': 12, 'TEMPORAL_KERNEL_DIV': 6, 'SEPARABLE_KERNEL_SIZE': 8, 'POOL1_SIZE': 3, 'POOL2_SIZE': 8, 'NORM_AXIS': 'no_channel', 'RUN_ZSCORE': False, 'RUN_BANDPASS': True}. Best is trial 1 with value: 0.5746527777777778.
[I 2026-06-14 23:20:44,052] Trial 24 finished with value: 0.265625 and parameters: {'FLOW': 38.59019268404202, 'FHIGH': 98.72708272424308, 'LR_EXP': -2.9181380602423204, 'DROPOUT': 0.5491128399204586, 'BETA': 0.5825294757292696, 'SPIKE_GRAD_SLOPE': 26.280706921884313, 'TEMPORAL_FILTERS': 28, 'DEPTH_MULTIPLIER': 1, 'POINTWISE_FILTERS': 60, 'TEMPORAL_KERNEL_DIV': 6, 'SEPARABLE_KERNEL_SIZE': 7, 'POOL1_SIZE': 7, 'POOL2_SIZE': 7, 'NORM_AXIS': 'no_channel', 'RUN_ZSCORE': False, 'RUN_BANDPASS': True}. Best is trial 1 with value: 0.5746527777777778.
[I 2026-06-14 23:38:51,377] Trial 25 finished with value: 0.6076388888888888 and parameters: {'FLOW': 3.532867938658205, 'FHIGH': 89.05406466953491, 'LR_EXP': -2.536406088777759, 'DROPOUT': 0.29430698079582074, 'BETA': 0.6494203343629266, 'SPIKE_GRAD_SLOPE': 14.208198626845244, 'TEMPORAL_FILTERS': 26, 'DEPTH_MULTIPLIER': 4, 'POINTWISE_FILTERS': 34, 'TEMPORAL_KERNEL_DIV': 4, 'SEPARABLE_KERNEL_SIZE': 18, 'POOL1_SIZE': 5, 'POOL2_SIZE': 7, 'NORM_AXIS': 'full', 'RUN_ZSCORE': False, 'RUN_BANDPASS': False}. Best is trial 25 with value: 0.6076388888888888.
[W 2026-06-14 23:38:56,285] Trial 26 failed with parameters: {'FLOW': 39.347158081356255, 'FHIGH': 12.576434908658635, 'LR_EXP': -2.8555439945100547, 'DROPOUT': 0.4859524318822429, 'BETA': 0.9082402024227101, 'SPIKE_GRAD_SLOPE': 96.84797786145636, 'TEMPORAL_FILTERS': 4, 'DEPTH_MULTIPLIER': 3, 'POINTWISE_FILTERS': 35, 'TEMPORAL_KERNEL_DIV': 6, 'SEPARABLE_KERNEL_SIZE': 24, 'POOL1_SIZE': 5, 'POOL2_SIZE': 6, 'NORM_AXIS': 'no_channel', 'RUN_ZSCORE': False, 'RUN_BANDPASS': True} because of the following error: AssertionError('fhigh (12.576434908658635) must be at least 2 Hz above flow (39.347158081356255)').
Traceback (most recent call last):
  File "/home/aleksander.berezowsk/venv/lib/python3.12/site-packages/optuna/study/_optimize.py", line 206, in _run_trial
    value_or_values = func(trial)
                      ^^^^^^^^^^^
  File "/home/aleksander.berezowsk/spiking-eegnet/src/main.py", line 45, in objective
    return pipeline(**params, **FIXED, trial=trial, save_plots=False)
           ^^^^^^^^^^^^^^^^^^^^^^^^^^^^^^^^^^^^^^^^^^^^^^^^^^^^^^^^^^
  File "/home/aleksander.berezowsk/spiking-eegnet/src/pipeline.py", line 120, in pipeline
    X = bandpass_filter(X, sfreq=meta["sfreq"], flow=FLOW, fhigh=FHIGH)
        ^^^^^^^^^^^^^^^^^^^^^^^^^^^^^^^^^^^^^^^^^^^^^^^^^^^^^^^^^^^^^^^
  File "/home/aleksander.berezowsk/spiking-eegnet/src/bandpass_filter.py", line 74, in bandpass_filter
    assert fhigh > flow + 2,    f"fhigh ({fhigh}) must be at least 2 Hz above flow ({flow})"
           ^^^^^^^^^^^^^^^^
AssertionError: fhigh (12.576434908658635) must be at least 2 Hz above flow (39.347158081356255)
[W 2026-06-14 23:38:56,295] Trial 26 failed with value None.
Traceback (most recent call last):
  File "/home/aleksander.berezowsk/spiking-eegnet/src/main.py", line 93, in <module>
    study.optimize(objective, n_trials=n_trials, n_jobs=1,
  File "/home/aleksander.berezowsk/venv/lib/python3.12/site-packages/optuna/study/study.py", line 516, in optimize
    _optimize(
  File "/home/aleksander.berezowsk/venv/lib/python3.12/site-packages/optuna/study/_optimize.py", line 68, in _optimize
    _optimize_sequential(
  File "/home/aleksander.berezowsk/venv/lib/python3.12/site-packages/optuna/study/_optimize.py", line 165, in _optimize_sequential
    frozen_trial_id = _run_trial(study, func, catch)
                      ^^^^^^^^^^^^^^^^^^^^^^^^^^^^^^
  File "/home/aleksander.berezowsk/venv/lib/python3.12/site-packages/optuna/study/_optimize.py", line 263, in _run_trial
    raise func_err
  File "/home/aleksander.berezowsk/venv/lib/python3.12/site-packages/optuna/study/_optimize.py", line 206, in _run_trial
    value_or_values = func(trial)
                      ^^^^^^^^^^^
  File "/home/aleksander.berezowsk/spiking-eegnet/src/main.py", line 45, in objective
    return pipeline(**params, **FIXED, trial=trial, save_plots=False)
           ^^^^^^^^^^^^^^^^^^^^^^^^^^^^^^^^^^^^^^^^^^^^^^^^^^^^^^^^^^
  File "/home/aleksander.berezowsk/spiking-eegnet/src/pipeline.py", line 120, in pipeline
    X = bandpass_filter(X, sfreq=meta["sfreq"], flow=FLOW, fhigh=FHIGH)
        ^^^^^^^^^^^^^^^^^^^^^^^^^^^^^^^^^^^^^^^^^^^^^^^^^^^^^^^^^^^^^^^
  File "/home/aleksander.berezowsk/spiking-eegnet/src/bandpass_filter.py", line 74, in bandpass_filter
    assert fhigh > flow + 2,    f"fhigh ({fhigh}) must be at least 2 Hz above flow ({flow})"
           ^^^^^^^^^^^^^^^^
AssertionError: fhigh (12.576434908658635) must be at least 2 Hz above flow (39.347158081356255)
