[I 2026-06-16 03:27:04,648] Trial 50 finished with value: 0.576388888888889 and parameters: {'FLOW': 8.654628110917747, 'FHIGH': 54.40167590704246, 'LR_EXP': -2.1092706828264514, 'DROPOUT': 0.668173145995385, 'BETA': 0.8244349636958596, 'SPIKE_GRAD_SLOPE': 9.418841355614148, 'TEMPORAL_FILTERS': 24, 'DEPTH_MULTIPLIER': 4, 'POINTWISE_FILTERS': 42, 'TEMPORAL_KERNEL_DIV': 4, 'SEPARABLE_KERNEL_SIZE': 11, 'POOL1_SIZE': 6, 'POOL2_SIZE': 8, 'NORM_AXIS': 'no_channel', 'RUN_ZSCORE': False}. Best is trial 21 with value: 0.6302083333333333.
[I 2026-06-16 03:44:29,334] Trial 51 finished with value: 0.5954861111111112 and parameters: {'FLOW': 4.759528297746897, 'FHIGH': 62.400238191425686, 'LR_EXP': -2.1908320824064735, 'DROPOUT': 0.46724384535104824, 'BETA': 0.7862516169866356, 'SPIKE_GRAD_SLOPE': 18.51465683293398, 'TEMPORAL_FILTERS': 28, 'DEPTH_MULTIPLIER': 4, 'POINTWISE_FILTERS': 27, 'TEMPORAL_KERNEL_DIV': 8, 'SEPARABLE_KERNEL_SIZE': 20, 'POOL1_SIZE': 3, 'POOL2_SIZE': 7, 'NORM_AXIS': 'full', 'RUN_ZSCORE': False}. Best is trial 21 with value: 0.6302083333333333.
[I 2026-06-16 04:03:02,569] Trial 52 finished with value: 0.532986111111111 and parameters: {'FLOW': 3.9653316027242838, 'FHIGH': 73.7672043604608, 'LR_EXP': -3.392000626991952, 'DROPOUT': 0.43325576166551805, 'BETA': 0.5262340329611432, 'SPIKE_GRAD_SLOPE': 10.038726561281498, 'TEMPORAL_FILTERS': 31, 'DEPTH_MULTIPLIER': 2, 'POINTWISE_FILTERS': 11, 'TEMPORAL_KERNEL_DIV': 3, 'SEPARABLE_KERNEL_SIZE': 29, 'POOL1_SIZE': 8, 'POOL2_SIZE': 6, 'NORM_AXIS': 'full', 'RUN_ZSCORE': False}. Best is trial 21 with value: 0.6302083333333333.
[I 2026-06-16 04:03:36,828] Trial 53 pruned. 
[I 2026-06-16 04:23:02,521] Trial 54 finished with value: 0.5868055555555556 and parameters: {'FLOW': 6.042482216877106, 'FHIGH': 63.7503933608361, 'LR_EXP': -2.589378503408861, 'DROPOUT': 0.36826588285528716, 'BETA': 0.8747521216193294, 'SPIKE_GRAD_SLOPE': 10.804622531609166, 'TEMPORAL_FILTERS': 31, 'DEPTH_MULTIPLIER': 4, 'POINTWISE_FILTERS': 33, 'TEMPORAL_KERNEL_DIV': 6, 'SEPARABLE_KERNEL_SIZE': 25, 'POOL1_SIZE': 4, 'POOL2_SIZE': 5, 'NORM_AXIS': 'full', 'RUN_ZSCORE': False}. Best is trial 21 with value: 0.6302083333333333.
[I 2026-06-16 04:41:05,760] Trial 55 finished with value: 0.5486111111111112 and parameters: {'FLOW': 4.151780785827029, 'FHIGH': 66.84720843967027, 'LR_EXP': -3.524600462078467, 'DROPOUT': 0.23830693209350418, 'BETA': 0.928501251782577, 'SPIKE_GRAD_SLOPE': 18.653349059421856, 'TEMPORAL_FILTERS': 30, 'DEPTH_MULTIPLIER': 3, 'POINTWISE_FILTERS': 42, 'TEMPORAL_KERNEL_DIV': 4, 'SEPARABLE_KERNEL_SIZE': 22, 'POOL1_SIZE': 5, 'POOL2_SIZE': 7, 'NORM_AXIS': 'full', 'RUN_ZSCORE': False}. Best is trial 21 with value: 0.6302083333333333.
[I 2026-06-16 05:00:08,601] Trial 56 finished with value: 0.5208333333333334 and parameters: {'FLOW': 9.490814251647784, 'FHIGH': 58.32312453953586, 'LR_EXP': -2.4098501104283616, 'DROPOUT': 0.40019894214041973, 'BETA': 0.8097178420016794, 'SPIKE_GRAD_SLOPE': 10.263979772535572, 'TEMPORAL_FILTERS': 31, 'DEPTH_MULTIPLIER': 4, 'POINTWISE_FILTERS': 23, 'TEMPORAL_KERNEL_DIV': 8, 'SEPARABLE_KERNEL_SIZE': 15, 'POOL1_SIZE': 2, 'POOL2_SIZE': 4, 'NORM_AXIS': 'full', 'RUN_ZSCORE': False}. Best is trial 21 with value: 0.6302083333333333.
[I 2026-06-16 05:16:05,537] Trial 57 finished with value: 0.5138888888888888 and parameters: {'FLOW': 6.960768694856052, 'FHIGH': 45.38825839172034, 'LR_EXP': -2.4631574986517464, 'DROPOUT': 0.4972317662794283, 'BETA': 0.9050260889987084, 'SPIKE_GRAD_SLOPE': 5.499629263962717, 'TEMPORAL_FILTERS': 25, 'DEPTH_MULTIPLIER': 4, 'POINTWISE_FILTERS': 14, 'TEMPORAL_KERNEL_DIV': 8, 'SEPARABLE_KERNEL_SIZE': 18, 'POOL1_SIZE': 3, 'POOL2_SIZE': 8, 'NORM_AXIS': 'full', 'RUN_ZSCORE': True}. Best is trial 21 with value: 0.6302083333333333.
[I 2026-06-16 05:31:53,494] Trial 58 finished with value: 0.5833333333333333 and parameters: {'FLOW': 10.20089517700011, 'FHIGH': 56.96950305363456, 'LR_EXP': -2.775612320412589, 'DROPOUT': 0.44769040656025433, 'BETA': 0.708324161823007, 'SPIKE_GRAD_SLOPE': 24.251916837651933, 'TEMPORAL_FILTERS': 24, 'DEPTH_MULTIPLIER': 4, 'POINTWISE_FILTERS': 36, 'TEMPORAL_KERNEL_DIV': 8, 'SEPARABLE_KERNEL_SIZE': 24, 'POOL1_SIZE': 2, 'POOL2_SIZE': 8, 'NORM_AXIS': 'no_channel', 'RUN_ZSCORE': False}. Best is trial 21 with value: 0.6302083333333333.
[I 2026-06-16 05:50:41,026] Trial 59 finished with value: 0.484375 and parameters: {'FLOW': 5.453626212126117, 'FHIGH': 61.40723473169323, 'LR_EXP': -2.766693003929858, 'DROPOUT': 0.36822410607591416, 'BETA': 0.89660902211296, 'SPIKE_GRAD_SLOPE': 10.766233933331314, 'TEMPORAL_FILTERS': 30, 'DEPTH_MULTIPLIER': 4, 'POINTWISE_FILTERS': 15, 'TEMPORAL_KERNEL_DIV': 6, 'SEPARABLE_KERNEL_SIZE': 29, 'POOL1_SIZE': 5, 'POOL2_SIZE': 4, 'NORM_AXIS': 'full', 'RUN_ZSCORE': False}. Best is trial 21 with value: 0.6302083333333333.
[I 2026-06-16 06:11:17,320] Trial 60 finished with value: 0.5677083333333333 and parameters: {'FLOW': 6.586073716857886, 'FHIGH': 74.96531539570927, 'LR_EXP': -2.3507556419596556, 'DROPOUT': 0.6319138054353505, 'BETA': 0.6738487753738759, 'SPIKE_GRAD_SLOPE': 13.126862203870306, 'TEMPORAL_FILTERS': 29, 'DEPTH_MULTIPLIER': 3, 'POINTWISE_FILTERS': 9, 'TEMPORAL_KERNEL_DIV': 2, 'SEPARABLE_KERNEL_SIZE': 27, 'POOL1_SIZE': 8, 'POOL2_SIZE': 4, 'NORM_AXIS': 'full', 'RUN_ZSCORE': False}. Best is trial 21 with value: 0.6302083333333333.
[I 2026-06-16 06:27:48,982] Trial 61 finished with value: 0.5277777777777778 and parameters: {'FLOW': 10.34448752543304, 'FHIGH': 44.578509465953815, 'LR_EXP': -2.4458962161355378, 'DROPOUT': 0.35283394011962, 'BETA': 0.9715510052806571, 'SPIKE_GRAD_SLOPE': 21.88033745056137, 'TEMPORAL_FILTERS': 29, 'DEPTH_MULTIPLIER': 3, 'POINTWISE_FILTERS': 54, 'TEMPORAL_KERNEL_DIV': 7, 'SEPARABLE_KERNEL_SIZE': 30, 'POOL1_SIZE': 3, 'POOL2_SIZE': 6, 'NORM_AXIS': 'full', 'RUN_ZSCORE': False}. Best is trial 21 with value: 0.6302083333333333.
[I 2026-06-16 06:45:32,561] Trial 62 finished with value: 0.59375 and parameters: {'FLOW': 8.268403787215302, 'FHIGH': 50.34877003318696, 'LR_EXP': -2.2141085917227814, 'DROPOUT': 0.24197258728083235, 'BETA': 0.6873787495832006, 'SPIKE_GRAD_SLOPE': 26.0028297107672, 'TEMPORAL_FILTERS': 27, 'DEPTH_MULTIPLIER': 4, 'POINTWISE_FILTERS': 25, 'TEMPORAL_KERNEL_DIV': 6, 'SEPARABLE_KERNEL_SIZE': 21, 'POOL1_SIZE': 2, 'POOL2_SIZE': 7, 'NORM_AXIS': 'no_channel', 'RUN_ZSCORE': False}. Best is trial 21 with value: 0.6302083333333333.
[I 2026-06-16 07:06:11,477] Trial 63 finished with value: 0.5885416666666666 and parameters: {'FLOW': 10.36649972279141, 'FHIGH': 50.190326969013675, 'LR_EXP': -2.6293527402161168, 'DROPOUT': 0.37927989289750214, 'BETA': 0.5696252534273962, 'SPIKE_GRAD_SLOPE': 23.758281878794484, 'TEMPORAL_FILTERS': 31, 'DEPTH_MULTIPLIER': 4, 'POINTWISE_FILTERS': 11, 'TEMPORAL_KERNEL_DIV': 4, 'SEPARABLE_KERNEL_SIZE': 29, 'POOL1_SIZE': 2, 'POOL2_SIZE': 6, 'NORM_AXIS': 'no_channel', 'RUN_ZSCORE': False}. Best is trial 21 with value: 0.6302083333333333.
[I 2026-06-16 07:06:53,104] Trial 64 pruned. 
[I 2026-06-16 07:26:38,717] Trial 65 finished with value: 0.5607638888888888 and parameters: {'FLOW': 2.9737455251247447, 'FHIGH': 65.2769068169114, 'LR_EXP': -3.032222718190112, 'DROPOUT': 0.41009186872046705, 'BETA': 0.6588108862600484, 'SPIKE_GRAD_SLOPE': 5.1374917245635245, 'TEMPORAL_FILTERS': 31, 'DEPTH_MULTIPLIER': 4, 'POINTWISE_FILTERS': 19, 'TEMPORAL_KERNEL_DIV': 5, 'SEPARABLE_KERNEL_SIZE': 17, 'POOL1_SIZE': 3, 'POOL2_SIZE': 7, 'NORM_AXIS': 'no_channel', 'RUN_ZSCORE': True}. Best is trial 21 with value: 0.6302083333333333.
[I 2026-06-16 07:27:24,989] Trial 66 pruned. 
[I 2026-06-16 07:44:34,309] Trial 67 finished with value: 0.5538194444444444 and parameters: {'FLOW': 9.934633414118665, 'FHIGH': 77.438854071763, 'LR_EXP': -2.3420020790501463, 'DROPOUT': 0.14906980286781296, 'BETA': 0.7717092695020371, 'SPIKE_GRAD_SLOPE': 47.02611783474147, 'TEMPORAL_FILTERS': 30, 'DEPTH_MULTIPLIER': 3, 'POINTWISE_FILTERS': 31, 'TEMPORAL_KERNEL_DIV': 6, 'SEPARABLE_KERNEL_SIZE': 21, 'POOL1_SIZE': 3, 'POOL2_SIZE': 7, 'NORM_AXIS': 'no_channel', 'RUN_ZSCORE': False}. Best is trial 21 with value: 0.6302083333333333.
[I 2026-06-16 07:59:18,405] Trial 68 finished with value: 0.5677083333333333 and parameters: {'FLOW': 7.877952474282406, 'FHIGH': 59.96339527269056, 'LR_EXP': -2.2462552585488225, 'DROPOUT': 0.229555880899488, 'BETA': 0.7003391204313458, 'SPIKE_GRAD_SLOPE': 39.967723047122405, 'TEMPORAL_FILTERS': 20, 'DEPTH_MULTIPLIER': 4, 'POINTWISE_FILTERS': 12, 'TEMPORAL_KERNEL_DIV': 5, 'SEPARABLE_KERNEL_SIZE': 17, 'POOL1_SIZE': 2, 'POOL2_SIZE': 7, 'NORM_AXIS': 'no_channel', 'RUN_ZSCORE': True}. Best is trial 21 with value: 0.6302083333333333.
[I 2026-06-16 08:13:27,178] Trial 69 pruned. 
[I 2026-06-16 08:14:07,347] Trial 70 pruned. 
[I 2026-06-16 08:14:41,684] Trial 71 pruned. 
[I 2026-06-16 08:15:28,914] Trial 72 pruned. 
[I 2026-06-16 08:34:51,782] Trial 73 finished with value: 0.5572916666666666 and parameters: {'FLOW': 3.953288355338228, 'FHIGH': 95.23915845854052, 'LR_EXP': -2.7859493567487346, 'DROPOUT': 0.21389084286697138, 'BETA': 0.7967926450399588, 'SPIKE_GRAD_SLOPE': 25.201304985246693, 'TEMPORAL_FILTERS': 31, 'DEPTH_MULTIPLIER': 4, 'POINTWISE_FILTERS': 50, 'TEMPORAL_KERNEL_DIV': 6, 'SEPARABLE_KERNEL_SIZE': 24, 'POOL1_SIZE': 4, 'POOL2_SIZE': 4, 'NORM_AXIS': 'full', 'RUN_ZSCORE': False}. Best is trial 21 with value: 0.6302083333333333.
[I 2026-06-16 08:49:51,405] Trial 74 finished with value: 0.560763888888889 and parameters: {'FLOW': 12.438933765098184, 'FHIGH': 91.09946844781955, 'LR_EXP': -2.8347302125299776, 'DROPOUT': 0.48071488677421725, 'BETA': 0.5915614636390791, 'SPIKE_GRAD_SLOPE': 43.659619652937565, 'TEMPORAL_FILTERS': 22, 'DEPTH_MULTIPLIER': 4, 'POINTWISE_FILTERS': 18, 'TEMPORAL_KERNEL_DIV': 6, 'SEPARABLE_KERNEL_SIZE': 32, 'POOL1_SIZE': 8, 'POOL2_SIZE': 7, 'NORM_AXIS': 'full', 'RUN_ZSCORE': False}. Best is trial 21 with value: 0.6302083333333333.
[I 2026-06-16 08:50:26,565] Trial 75 pruned. 
[I 2026-06-16 09:08:24,296] Trial 76 finished with value: 0.5364583333333333 and parameters: {'FLOW': 1.8491738442137375, 'FHIGH': 74.37030671303849, 'LR_EXP': -2.5019472114566774, 'DROPOUT': 0.36453759359776133, 'BETA': 0.760682514716697, 'SPIKE_GRAD_SLOPE': 17.234486953511787, 'TEMPORAL_FILTERS': 29, 'DEPTH_MULTIPLIER': 4, 'POINTWISE_FILTERS': 33, 'TEMPORAL_KERNEL_DIV': 7, 'SEPARABLE_KERNEL_SIZE': 31, 'POOL1_SIZE': 5, 'POOL2_SIZE': 8, 'NORM_AXIS': 'full', 'RUN_ZSCORE': False}. Best is trial 21 with value: 0.6302083333333333.
[I 2026-06-16 09:09:57,057] Trial 77 pruned. 
[I 2026-06-16 09:10:40,698] Trial 78 pruned. 
[I 2026-06-16 09:11:26,030] Trial 79 pruned. 
[I 2026-06-16 09:12:05,468] Trial 80 pruned. 
[I 2026-06-16 09:26:28,807] Trial 81 finished with value: 0.546875 and parameters: {'FLOW': 6.423680396217213, 'FHIGH': 64.43451514352444, 'LR_EXP': -3.150173574468415, 'DROPOUT': 0.5482443113918989, 'BETA': 0.7319520243369942, 'SPIKE_GRAD_SLOPE': 26.566629600525644, 'TEMPORAL_FILTERS': 21, 'DEPTH_MULTIPLIER': 4, 'POINTWISE_FILTERS': 25, 'TEMPORAL_KERNEL_DIV': 7, 'SEPARABLE_KERNEL_SIZE': 26, 'POOL1_SIZE': 3, 'POOL2_SIZE': 8, 'NORM_AXIS': 'no_channel', 'RUN_ZSCORE': False}. Best is trial 21 with value: 0.6302083333333333.
[I 2026-06-16 09:42:07,389] Trial 82 finished with value: 0.5381944444444444 and parameters: {'FLOW': 4.203190434974378, 'FHIGH': 66.20370187780178, 'LR_EXP': -2.2736187122685623, 'DROPOUT': 0.1918831425426295, 'BETA': 0.6059170824770531, 'SPIKE_GRAD_SLOPE': 8.63576213444249, 'TEMPORAL_FILTERS': 23, 'DEPTH_MULTIPLIER': 4, 'POINTWISE_FILTERS': 28, 'TEMPORAL_KERNEL_DIV': 6, 'SEPARABLE_KERNEL_SIZE': 22, 'POOL1_SIZE': 3, 'POOL2_SIZE': 8, 'NORM_AXIS': 'no_channel', 'RUN_ZSCORE': False}. Best is trial 21 with value: 0.6302083333333333.
[I 2026-06-16 09:57:09,508] Trial 83 finished with value: 0.5555555555555556 and parameters: {'FLOW': 4.03401762850973, 'FHIGH': 53.85098439685792, 'LR_EXP': -2.6901186335154517, 'DROPOUT': 0.3545199678480433, 'BETA': 0.79441675977979, 'SPIKE_GRAD_SLOPE': 15.626926469531933, 'TEMPORAL_FILTERS': 22, 'DEPTH_MULTIPLIER': 4, 'POINTWISE_FILTERS': 33, 'TEMPORAL_KERNEL_DIV': 7, 'SEPARABLE_KERNEL_SIZE': 17, 'POOL1_SIZE': 2, 'POOL2_SIZE': 8, 'NORM_AXIS': 'no_channel', 'RUN_ZSCORE': False}. Best is trial 21 with value: 0.6302083333333333.
[I 2026-06-16 10:15:14,158] Trial 84 finished with value: 0.4565972222222222 and parameters: {'FLOW': 3.8563621228400944, 'FHIGH': 51.42295794395979, 'LR_EXP': -2.473413038159461, 'DROPOUT': 0.23634253668573058, 'BETA': 0.6879713818851076, 'SPIKE_GRAD_SLOPE': 41.35437408425278, 'TEMPORAL_FILTERS': 27, 'DEPTH_MULTIPLIER': 4, 'POINTWISE_FILTERS': 25, 'TEMPORAL_KERNEL_DIV': 5, 'SEPARABLE_KERNEL_SIZE': 20, 'POOL1_SIZE': 2, 'POOL2_SIZE': 8, 'NORM_AXIS': 'full', 'RUN_ZSCORE': False}. Best is trial 21 with value: 0.6302083333333333.
[I 2026-06-16 10:15:51,623] Trial 85 pruned. 
[W 2026-06-16 10:15:58,293] Trial 86 failed with parameters: {'FLOW': 5.777900945103115, 'FHIGH': 51.112010082167274, 'LR_EXP': -3.0444942297387287, 'DROPOUT': 0.5698795030993673, 'BETA': 0.8578767654510443, 'SPIKE_GRAD_SLOPE': 38.39123722801421, 'TEMPORAL_FILTERS': 30, 'DEPTH_MULTIPLIER': 3, 'POINTWISE_FILTERS': 41, 'TEMPORAL_KERNEL_DIV': 6, 'SEPARABLE_KERNEL_SIZE': 11, 'POOL1_SIZE': 5, 'POOL2_SIZE': 8, 'NORM_AXIS': 'no_channel', 'RUN_ZSCORE': False} because of the following error: OutOfMemoryError('CUDA out of memory. Tried to allocate 82.00 MiB. GPU 0 has a total capacity of 15.77 GiB of which 96.19 MiB is free. Including non-PyTorch memory, this process has 15.67 GiB memory in use. Of the allocated memory 14.42 GiB is allocated by PyTorch, and 887.24 MiB is reserved by PyTorch but unallocated. If reserved but unallocated memory is large try setting PYTORCH_CUDA_ALLOC_CONF=expandable_segments:True to avoid fragmentation.  See documentation for Memory Management  (https://pytorch.org/docs/stable/notes/cuda.html#environment-variables)').
Traceback (most recent call last):
  File "/home/aleksander.berezowsk/venv/lib/python3.12/site-packages/optuna/study/_optimize.py", line 206, in _run_trial
    value_or_values = func(trial)
                      ^^^^^^^^^^^
  File "/home/aleksander.berezowsk/spiking-eegnet/src/main.py", line 44, in objective
    return pipeline(**params, **FIXED, trial=trial, save_plots=False)
           ^^^^^^^^^^^^^^^^^^^^^^^^^^^^^^^^^^^^^^^^^^^^^^^^^^^^^^^^^^
  File "/home/aleksander.berezowsk/spiking-eegnet/src/pipeline.py", line 122, in pipeline
    hist_loso, acc_loso, trained_model = experiment_loso(
                                         ^^^^^^^^^^^^^^^^
  File "/home/aleksander.berezowsk/spiking-eegnet/src/experiment_loso.py", line 27, in experiment_loso
    history = run_training(
              ^^^^^^^^^^^^^
  File "/home/aleksander.berezowsk/spiking-eegnet/src/run_training.py", line 45, in run_training
    loss = train_one_epoch(model, train_loader, optimizer, criterion, device, n_steps_train)
           ^^^^^^^^^^^^^^^^^^^^^^^^^^^^^^^^^^^^^^^^^^^^^^^^^^^^^^^^^^^^^^^^^^^^^^^^^^^^^^^^^
  File "/home/aleksander.berezowsk/spiking-eegnet/src/train_one_epoch.py", line 7, in train_one_epoch
    spk = model(xb, num_steps=n_steps)
          ^^^^^^^^^^^^^^^^^^^^^^^^^^^^
  File "/home/aleksander.berezowsk/venv/lib/python3.12/site-packages/torch/nn/modules/module.py", line 1553, in _wrapped_call_impl
    return self._call_impl(*args, **kwargs)
           ^^^^^^^^^^^^^^^^^^^^^^^^^^^^^^^^
  File "/home/aleksander.berezowsk/venv/lib/python3.12/site-packages/torch/nn/modules/module.py", line 1562, in _call_impl
    return forward_call(*args, **kwargs)
           ^^^^^^^^^^^^^^^^^^^^^^^^^^^^^
  File "/home/aleksander.berezowsk/spiking-eegnet/src/spiking_eegnet.py", line 222, in forward
    spk1, mem1 = self.lif1(cur, mem1)
                 ^^^^^^^^^^^^^^^^^^^^
  File "/home/aleksander.berezowsk/venv/lib/python3.12/site-packages/torch/nn/modules/module.py", line 1553, in _wrapped_call_impl
    return self._call_impl(*args, **kwargs)
           ^^^^^^^^^^^^^^^^^^^^^^^^^^^^^^^^
  File "/home/aleksander.berezowsk/venv/lib/python3.12/site-packages/torch/nn/modules/module.py", line 1562, in _call_impl
    return forward_call(*args, **kwargs)
           ^^^^^^^^^^^^^^^^^^^^^^^^^^^^^
  File "/home/aleksander.berezowsk/venv/lib/python3.12/site-packages/snntorch/_neurons/leaky.py", line 209, in forward
    self.reset = self.mem_reset(self.mem)
                 ^^^^^^^^^^^^^^^^^^^^^^^^
  File "/home/aleksander.berezowsk/venv/lib/python3.12/site-packages/snntorch/_neurons/neurons.py", line 106, in mem_reset
    reset = self.spike_grad(mem_shift).clone().detach()
            ^^^^^^^^^^^^^^^^^^^^^^^^^^^^^^^^^^
torch.OutOfMemoryError: CUDA out of memory. Tried to allocate 82.00 MiB. GPU 0 has a total capacity of 15.77 GiB of which 96.19 MiB is free. Including non-PyTorch memory, this process has 15.67 GiB memory in use. Of the allocated memory 14.42 GiB is allocated by PyTorch, and 887.24 MiB is reserved by PyTorch but unallocated. If reserved but unallocated memory is large try setting PYTORCH_CUDA_ALLOC_CONF=expandable_segments:True to avoid fragmentation.  See documentation for Memory Management  (https://pytorch.org/docs/stable/notes/cuda.html#environment-variables)
[W 2026-06-16 10:15:58,336] Trial 86 failed with value None.
Traceback (most recent call last):
  File "/home/aleksander.berezowsk/spiking-eegnet/src/main.py", line 92, in <module>
    study.optimize(objective, n_trials=n_trials, n_jobs=1,
  File "/home/aleksander.berezowsk/venv/lib/python3.12/site-packages/optuna/study/study.py", line 516, in optimize
    _optimize(
  File "/home/aleksander.berezowsk/venv/lib/python3.12/site-packages/optuna/study/_optimize.py", line 68, in _optimize
    _optimize_sequential(
  File "/home/aleksander.berezowsk/venv/lib/python3.12/site-packages/optuna/study/_optimize.py", line 165, in _optimize_sequential
    frozen_trial_id = _run_trial(study, func, catch)
                      ^^^^^^^^^^^^^^^^^^^^^^^^^^^^^^
  File "/home/aleksander.berezowsk/venv/lib/python3.12/site-packages/optuna/study/_optimize.py", line 263, in _run_trial
    raise func_err
  File "/home/aleksander.berezowsk/venv/lib/python3.12/site-packages/optuna/study/_optimize.py", line 206, in _run_trial
    value_or_values = func(trial)
                      ^^^^^^^^^^^
  File "/home/aleksander.berezowsk/spiking-eegnet/src/main.py", line 44, in objective
    return pipeline(**params, **FIXED, trial=trial, save_plots=False)
           ^^^^^^^^^^^^^^^^^^^^^^^^^^^^^^^^^^^^^^^^^^^^^^^^^^^^^^^^^^
  File "/home/aleksander.berezowsk/spiking-eegnet/src/pipeline.py", line 122, in pipeline
    hist_loso, acc_loso, trained_model = experiment_loso(
                                         ^^^^^^^^^^^^^^^^
  File "/home/aleksander.berezowsk/spiking-eegnet/src/experiment_loso.py", line 27, in experiment_loso
    history = run_training(
              ^^^^^^^^^^^^^
  File "/home/aleksander.berezowsk/spiking-eegnet/src/run_training.py", line 45, in run_training
    loss = train_one_epoch(model, train_loader, optimizer, criterion, device, n_steps_train)
           ^^^^^^^^^^^^^^^^^^^^^^^^^^^^^^^^^^^^^^^^^^^^^^^^^^^^^^^^^^^^^^^^^^^^^^^^^^^^^^^^^
  File "/home/aleksander.berezowsk/spiking-eegnet/src/train_one_epoch.py", line 7, in train_one_epoch
    spk = model(xb, num_steps=n_steps)
          ^^^^^^^^^^^^^^^^^^^^^^^^^^^^
  File "/home/aleksander.berezowsk/venv/lib/python3.12/site-packages/torch/nn/modules/module.py", line 1553, in _wrapped_call_impl
    return self._call_impl(*args, **kwargs)
           ^^^^^^^^^^^^^^^^^^^^^^^^^^^^^^^^
  File "/home/aleksander.berezowsk/venv/lib/python3.12/site-packages/torch/nn/modules/module.py", line 1562, in _call_impl
    return forward_call(*args, **kwargs)
           ^^^^^^^^^^^^^^^^^^^^^^^^^^^^^
  File "/home/aleksander.berezowsk/spiking-eegnet/src/spiking_eegnet.py", line 222, in forward
    spk1, mem1 = self.lif1(cur, mem1)
                 ^^^^^^^^^^^^^^^^^^^^
  File "/home/aleksander.berezowsk/venv/lib/python3.12/site-packages/torch/nn/modules/module.py", line 1553, in _wrapped_call_impl
    return self._call_impl(*args, **kwargs)
           ^^^^^^^^^^^^^^^^^^^^^^^^^^^^^^^^
  File "/home/aleksander.berezowsk/venv/lib/python3.12/site-packages/torch/nn/modules/module.py", line 1562, in _call_impl
    return forward_call(*args, **kwargs)
           ^^^^^^^^^^^^^^^^^^^^^^^^^^^^^
  File "/home/aleksander.berezowsk/venv/lib/python3.12/site-packages/snntorch/_neurons/leaky.py", line 209, in forward
    self.reset = self.mem_reset(self.mem)
                 ^^^^^^^^^^^^^^^^^^^^^^^^
  File "/home/aleksander.berezowsk/venv/lib/python3.12/site-packages/snntorch/_neurons/neurons.py", line 106, in mem_reset
    reset = self.spike_grad(mem_shift).clone().detach()
            ^^^^^^^^^^^^^^^^^^^^^^^^^^^^^^^^^^
torch.OutOfMemoryError: CUDA out of memory. Tried to allocate 82.00 MiB. GPU 0 has a total capacity of 15.77 GiB of which 96.19 MiB is free. Including non-PyTorch memory, this process has 15.67 GiB memory in use. Of the allocated memory 14.42 GiB is allocated by PyTorch, and 887.24 MiB is reserved by PyTorch but unallocated. If reserved but unallocated memory is large try setting PYTORCH_CUDA_ALLOC_CONF=expandable_segments:True to avoid fragmentation.  See documentation for Memory Management  (https://pytorch.org/docs/stable/notes/cuda.html#environment-variables)
