[I 2026-06-14 00:03:56,033] Trial 76 finished with value: 0.5381944444444444 and parameters: {'FLOW': 36.493748898691656, 'FHIGH': 110.07152851530823, 'LR_EXP': -2.240363952894764, 'DROPOUT': 0.1784077297573812, 'BETA': 0.8147440829071375, 'SPIKE_GRAD_SLOPE': 8.736555939366712, 'TEMPORAL_FILTERS': 17, 'DEPTH_MULTIPLIER': 4, 'POINTWISE_FILTERS': 46, 'TEMPORAL_KERNEL_DIV': 4, 'SEPARABLE_KERNEL_SIZE': 30, 'POOL1_SIZE': 8, 'POOL2_SIZE': 2, 'NORM_AXIS': 'no_channel', 'RUN_ZSCORE': False, 'RUN_BANDPASS': False}. Best is trial 70 with value: 0.609375.
[I 2026-06-14 00:04:30,552] Trial 77 pruned. 
[I 2026-06-14 00:05:04,163] Trial 78 pruned. 
[I 2026-06-14 00:05:36,758] Trial 79 pruned. 
[I 2026-06-14 00:06:00,357] Trial 80 pruned. 
[I 2026-06-14 00:20:14,522] Trial 81 finished with value: 0.5833333333333333 and parameters: {'FLOW': 34.57913402606887, 'FHIGH': 119.81407738062519, 'LR_EXP': -2.7875318893566163, 'DROPOUT': 0.2153020116718774, 'BETA': 0.7413232497041968, 'SPIKE_GRAD_SLOPE': 7.784966162564986, 'TEMPORAL_FILTERS': 16, 'DEPTH_MULTIPLIER': 3, 'POINTWISE_FILTERS': 45, 'TEMPORAL_KERNEL_DIV': 3, 'SEPARABLE_KERNEL_SIZE': 28, 'POOL1_SIZE': 7, 'POOL2_SIZE': 3, 'NORM_AXIS': 'no_channel', 'RUN_ZSCORE': False, 'RUN_BANDPASS': False}. Best is trial 70 with value: 0.609375.
[I 2026-06-14 00:20:40,080] Trial 82 pruned. 
[I 2026-06-14 00:37:20,091] Trial 83 finished with value: 0.6006944444444444 and parameters: {'FLOW': 34.786588051966696, 'FHIGH': 114.64012342847829, 'LR_EXP': -2.825545129246654, 'DROPOUT': 0.21793871645726604, 'BETA': 0.7321880772110836, 'SPIKE_GRAD_SLOPE': 7.690342886350036, 'TEMPORAL_FILTERS': 19, 'DEPTH_MULTIPLIER': 4, 'POINTWISE_FILTERS': 44, 'TEMPORAL_KERNEL_DIV': 3, 'SEPARABLE_KERNEL_SIZE': 29, 'POOL1_SIZE': 7, 'POOL2_SIZE': 3, 'NORM_AXIS': 'no_channel', 'RUN_ZSCORE': False, 'RUN_BANDPASS': False}. Best is trial 70 with value: 0.609375.
[I 2026-06-14 00:52:00,104] Trial 84 finished with value: 0.5121527777777778 and parameters: {'FLOW': 27.450738081718075, 'FHIGH': 110.36494127742402, 'LR_EXP': -2.8051730052852606, 'DROPOUT': 0.21838561841428997, 'BETA': 0.7369038943614976, 'SPIKE_GRAD_SLOPE': 11.018821610153578, 'TEMPORAL_FILTERS': 17, 'DEPTH_MULTIPLIER': 3, 'POINTWISE_FILTERS': 44, 'TEMPORAL_KERNEL_DIV': 3, 'SEPARABLE_KERNEL_SIZE': 27, 'POOL1_SIZE': 7, 'POOL2_SIZE': 3, 'NORM_AXIS': 'no_channel', 'RUN_ZSCORE': False, 'RUN_BANDPASS': False}. Best is trial 70 with value: 0.609375.
[I 2026-06-14 01:08:36,659] Trial 85 finished with value: 0.6006944444444444 and parameters: {'FLOW': 37.91225980248219, 'FHIGH': 113.64764772734198, 'LR_EXP': -2.941574758666195, 'DROPOUT': 0.25113794944457324, 'BETA': 0.7194371041548229, 'SPIKE_GRAD_SLOPE': 8.743763653103569, 'TEMPORAL_FILTERS': 19, 'DEPTH_MULTIPLIER': 4, 'POINTWISE_FILTERS': 45, 'TEMPORAL_KERNEL_DIV': 3, 'SEPARABLE_KERNEL_SIZE': 26, 'POOL1_SIZE': 7, 'POOL2_SIZE': 3, 'NORM_AXIS': 'no_channel', 'RUN_ZSCORE': False, 'RUN_BANDPASS': False}. Best is trial 70 with value: 0.609375.
[I 2026-06-14 01:25:13,194] Trial 86 finished with value: 0.59375 and parameters: {'FLOW': 33.01270264103711, 'FHIGH': 113.53601306774644, 'LR_EXP': -3.0700008279441726, 'DROPOUT': 0.25310200266988475, 'BETA': 0.6651107484332159, 'SPIKE_GRAD_SLOPE': 7.714616544886588, 'TEMPORAL_FILTERS': 19, 'DEPTH_MULTIPLIER': 4, 'POINTWISE_FILTERS': 44, 'TEMPORAL_KERNEL_DIV': 3, 'SEPARABLE_KERNEL_SIZE': 24, 'POOL1_SIZE': 7, 'POOL2_SIZE': 3, 'NORM_AXIS': 'no_channel', 'RUN_ZSCORE': False, 'RUN_BANDPASS': False}. Best is trial 70 with value: 0.609375.
[I 2026-06-14 01:25:45,917] Trial 87 pruned. 
[I 2026-06-14 01:42:23,907] Trial 88 finished with value: 0.5815972222222222 and parameters: {'FLOW': 31.102653144867507, 'FHIGH': 112.72789083709436, 'LR_EXP': -2.988840765744373, 'DROPOUT': 0.2880365231386556, 'BETA': 0.6702073311529935, 'SPIKE_GRAD_SLOPE': 8.115696713357046, 'TEMPORAL_FILTERS': 19, 'DEPTH_MULTIPLIER': 4, 'POINTWISE_FILTERS': 37, 'TEMPORAL_KERNEL_DIV': 3, 'SEPARABLE_KERNEL_SIZE': 29, 'POOL1_SIZE': 6, 'POOL2_SIZE': 3, 'NORM_AXIS': 'no_channel', 'RUN_ZSCORE': False, 'RUN_BANDPASS': False}. Best is trial 70 with value: 0.609375.
[I 2026-06-14 01:42:54,275] Trial 89 pruned. 
[I 2026-06-14 01:43:24,845] Trial 90 pruned. 
[I 2026-06-14 01:44:01,029] Trial 91 pruned. 
[I 2026-06-14 02:00:42,876] Trial 92 finished with value: 0.5225694444444444 and parameters: {'FLOW': 35.934687376751846, 'FHIGH': 113.03047308343865, 'LR_EXP': -2.98362071684984, 'DROPOUT': 0.25715891776906524, 'BETA': 0.6974091697332425, 'SPIKE_GRAD_SLOPE': 7.600050943263606, 'TEMPORAL_FILTERS': 22, 'DEPTH_MULTIPLIER': 3, 'POINTWISE_FILTERS': 45, 'TEMPORAL_KERNEL_DIV': 3, 'SEPARABLE_KERNEL_SIZE': 29, 'POOL1_SIZE': 7, 'POOL2_SIZE': 8, 'NORM_AXIS': 'no_channel', 'RUN_ZSCORE': False, 'RUN_BANDPASS': False}. Best is trial 70 with value: 0.609375.
[I 2026-06-14 02:17:20,665] Trial 93 finished with value: 0.5416666666666666 and parameters: {'FLOW': 31.80047878823535, 'FHIGH': 112.4058307797596, 'LR_EXP': -2.965406489000474, 'DROPOUT': 0.24094464826761922, 'BETA': 0.7617621561518113, 'SPIKE_GRAD_SLOPE': 9.160205580437555, 'TEMPORAL_FILTERS': 19, 'DEPTH_MULTIPLIER': 4, 'POINTWISE_FILTERS': 38, 'TEMPORAL_KERNEL_DIV': 3, 'SEPARABLE_KERNEL_SIZE': 29, 'POOL1_SIZE': 6, 'POOL2_SIZE': 3, 'NORM_AXIS': 'no_channel', 'RUN_ZSCORE': False, 'RUN_BANDPASS': False}. Best is trial 70 with value: 0.609375.
[I 2026-06-14 02:32:06,868] Trial 94 finished with value: 0.5972222222222222 and parameters: {'FLOW': 30.4400134724425, 'FHIGH': 107.42715178113012, 'LR_EXP': -3.150848731989693, 'DROPOUT': 0.2773726304789249, 'BETA': 0.6739085447451962, 'SPIKE_GRAD_SLOPE': 7.394928675995776, 'TEMPORAL_FILTERS': 15, 'DEPTH_MULTIPLIER': 4, 'POINTWISE_FILTERS': 44, 'TEMPORAL_KERNEL_DIV': 3, 'SEPARABLE_KERNEL_SIZE': 24, 'POOL1_SIZE': 6, 'POOL2_SIZE': 3, 'NORM_AXIS': 'no_channel', 'RUN_ZSCORE': False, 'RUN_BANDPASS': False}. Best is trial 70 with value: 0.609375.
[I 2026-06-14 02:32:40,938] Trial 95 pruned. 
[I 2026-06-14 02:33:08,073] Trial 96 pruned. 
[I 2026-06-14 02:33:37,800] Trial 97 pruned. 
[I 2026-06-14 02:47:49,941] Trial 98 finished with value: 0.5104166666666666 and parameters: {'FLOW': 37.65398003440648, 'FHIGH': 117.5811599480248, 'LR_EXP': -2.246737782378987, 'DROPOUT': 0.15496460085516997, 'BETA': 0.6141767432924018, 'SPIKE_GRAD_SLOPE': 17.640436504879116, 'TEMPORAL_FILTERS': 18, 'DEPTH_MULTIPLIER': 4, 'POINTWISE_FILTERS': 44, 'TEMPORAL_KERNEL_DIV': 4, 'SEPARABLE_KERNEL_SIZE': 26, 'POOL1_SIZE': 7, 'POOL2_SIZE': 3, 'NORM_AXIS': 'no_channel', 'RUN_ZSCORE': False, 'RUN_BANDPASS': False}. Best is trial 70 with value: 0.609375.
[I 2026-06-14 02:48:14,162] Trial 99 pruned. 
[I 2026-06-14 03:05:42,713] Trial 100 finished with value: 0.5503472222222222 and parameters: {'FLOW': 33.81359047276187, 'FHIGH': 107.96495152616303, 'LR_EXP': -2.3851568582367872, 'DROPOUT': 0.2444915900173634, 'BETA': 0.7369296965068062, 'SPIKE_GRAD_SLOPE': 7.05531843178132, 'TEMPORAL_FILTERS': 21, 'DEPTH_MULTIPLIER': 4, 'POINTWISE_FILTERS': 40, 'TEMPORAL_KERNEL_DIV': 3, 'SEPARABLE_KERNEL_SIZE': 28, 'POOL1_SIZE': 7, 'POOL2_SIZE': 2, 'NORM_AXIS': 'no_channel', 'RUN_ZSCORE': False, 'RUN_BANDPASS': False}. Best is trial 70 with value: 0.609375.
[I 2026-06-14 03:06:22,708] Trial 101 pruned. 
[I 2026-06-14 03:06:47,629] Trial 102 pruned. 
[I 2026-06-14 03:23:26,006] Trial 103 finished with value: 0.5572916666666667 and parameters: {'FLOW': 31.20114738027757, 'FHIGH': 110.73352591881827, 'LR_EXP': -2.9835815424947945, 'DROPOUT': 0.28004797507580564, 'BETA': 0.6849812142222732, 'SPIKE_GRAD_SLOPE': 7.594749026317108, 'TEMPORAL_FILTERS': 19, 'DEPTH_MULTIPLIER': 4, 'POINTWISE_FILTERS': 36, 'TEMPORAL_KERNEL_DIV': 3, 'SEPARABLE_KERNEL_SIZE': 30, 'POOL1_SIZE': 6, 'POOL2_SIZE': 3, 'NORM_AXIS': 'no_channel', 'RUN_ZSCORE': False, 'RUN_BANDPASS': False}. Best is trial 70 with value: 0.609375.
[I 2026-06-14 03:24:00,093] Trial 104 pruned. 
[I 2026-06-14 03:24:42,491] Trial 105 pruned. 
[I 2026-06-14 03:25:14,146] Trial 106 pruned. 
[I 2026-06-14 03:40:55,343] Trial 107 finished with value: 0.5677083333333334 and parameters: {'FLOW': 32.703996138753205, 'FHIGH': 104.81193672354782, 'LR_EXP': -2.948938347846643, 'DROPOUT': 0.2498483502447586, 'BETA': 0.6923408110135929, 'SPIKE_GRAD_SLOPE': 11.5904974858426, 'TEMPORAL_FILTERS': 17, 'DEPTH_MULTIPLIER': 4, 'POINTWISE_FILTERS': 31, 'TEMPORAL_KERNEL_DIV': 3, 'SEPARABLE_KERNEL_SIZE': 32, 'POOL1_SIZE': 6, 'POOL2_SIZE': 3, 'NORM_AXIS': 'no_channel', 'RUN_ZSCORE': False, 'RUN_BANDPASS': False}. Best is trial 70 with value: 0.609375.
[I 2026-06-14 03:55:35,537] Trial 108 finished with value: 0.5451388888888888 and parameters: {'FLOW': 37.91698532104922, 'FHIGH': 114.79709173458052, 'LR_EXP': -3.2556083412855936, 'DROPOUT': 0.1381602143621031, 'BETA': 0.7656836859463497, 'SPIKE_GRAD_SLOPE': 5.14641781410971, 'TEMPORAL_FILTERS': 19, 'DEPTH_MULTIPLIER': 4, 'POINTWISE_FILTERS': 50, 'TEMPORAL_KERNEL_DIV': 4, 'SEPARABLE_KERNEL_SIZE': 29, 'POOL1_SIZE': 6, 'POOL2_SIZE': 2, 'NORM_AXIS': 'no_channel', 'RUN_ZSCORE': False, 'RUN_BANDPASS': False}. Best is trial 70 with value: 0.609375.
[I 2026-06-14 03:56:02,929] Trial 109 pruned. 
[I 2026-06-14 03:56:41,456] Trial 110 pruned. 
[I 2026-06-14 04:01:17,815] Trial 111 pruned. 
[I 2026-06-14 04:01:41,037] Trial 112 pruned. 
[I 2026-06-14 04:02:09,968] Trial 113 pruned. 
