
[notice] A new release of pip is available: 24.2 -> 26.1.2
[notice] To update, run: pip install --upgrade pip

[notice] A new release of pip is available: 24.2 -> 26.1.2
[notice] To update, run: pip install --upgrade pip
ERROR: Invalid requirement: 'Binary file requirements.txt matches': Expected end or semicolon (after name and no valid version specifier)
    Binary file requirements.txt matches
           ^ (from line 1 of /home/aleksander.berezowsk/requirements_notorch.txt)

[notice] A new release of pip is available: 24.2 -> 26.1.2
[notice] To update, run: pip install --upgrade pip

[notice] A new release of pip is available: 24.2 -> 26.1.2
[notice] To update, run: pip install --upgrade pip
[I 2026-06-13 13:21:42,709] Using an existing study with name 'snn_eegnet' instead of creating a new one.
[I 2026-06-13 13:29:36,531] Trial 2 finished with value: 0.2899305555555556 and parameters: {'FLOW': 34.272011697864464, 'FHIGH': 102.14537206373595, 'LR_EXP': -2.9761324998339442, 'DROPOUT': 0.6425283952625263, 'BETA': 0.5681738294277185, 'SPIKE_GRAD_SLOPE': 11.410697005668514, 'TEMPORAL_FILTERS': 5, 'DEPTH_MULTIPLIER': 3, 'POINTWISE_FILTERS': 47, 'TEMPORAL_KERNEL_DIV': 7, 'SEPARABLE_KERNEL_SIZE': 30, 'POOL1_SIZE': 6, 'POOL2_SIZE': 2, 'NORM_AXIS': 'no_channel', 'RUN_QUANTIZATION': True, 'RUN_ZSCORE': True, 'RUN_BANDPASS': True, 'QUANT_BITS': 2}. Best is trial 2 with value: 0.2899305555555556.
[I 2026-06-13 13:37:43,801] Trial 3 finished with value: 0.3454861111111111 and parameters: {'FLOW': 18.904998958683446, 'FHIGH': 63.61483738773496, 'LR_EXP': -2.6469738571105825, 'DROPOUT': 0.632873194595195, 'BETA': 0.6621434485790009, 'SPIKE_GRAD_SLOPE': 59.343005787760326, 'TEMPORAL_FILTERS': 5, 'DEPTH_MULTIPLIER': 3, 'POINTWISE_FILTERS': 36, 'TEMPORAL_KERNEL_DIV': 4, 'SEPARABLE_KERNEL_SIZE': 22, 'POOL1_SIZE': 8, 'POOL2_SIZE': 5, 'NORM_AXIS': 'full', 'RUN_QUANTIZATION': False, 'RUN_ZSCORE': True, 'RUN_BANDPASS': True, 'QUANT_BITS': 4}. Best is trial 3 with value: 0.3454861111111111.
[I 2026-06-13 13:47:25,402] Trial 4 finished with value: 0.24652777777777776 and parameters: {'FLOW': 25.843856323840264, 'FHIGH': 68.68843952909043, 'LR_EXP': -2.1638514757665495, 'DROPOUT': 0.27910425226102265, 'BETA': 0.9117257025887044, 'SPIKE_GRAD_SLOPE': 34.11179979079503, 'TEMPORAL_FILTERS': 12, 'DEPTH_MULTIPLIER': 1, 'POINTWISE_FILTERS': 52, 'TEMPORAL_KERNEL_DIV': 7, 'SEPARABLE_KERNEL_SIZE': 31, 'POOL1_SIZE': 5, 'POOL2_SIZE': 5, 'NORM_AXIS': 'no_channel', 'RUN_QUANTIZATION': True, 'RUN_ZSCORE': True, 'RUN_BANDPASS': True, 'QUANT_BITS': 4}. Best is trial 3 with value: 0.3454861111111111.
[I 2026-06-13 13:59:23,461] Trial 5 finished with value: 0.45138888888888884 and parameters: {'FLOW': 21.28104190010625, 'FHIGH': 72.17264682013261, 'LR_EXP': -2.675626620547985, 'DROPOUT': 0.35446438734415286, 'BETA': 0.6165282501358436, 'SPIKE_GRAD_SLOPE': 85.96023872593013, 'TEMPORAL_FILTERS': 17, 'DEPTH_MULTIPLIER': 2, 'POINTWISE_FILTERS': 46, 'TEMPORAL_KERNEL_DIV': 4, 'SEPARABLE_KERNEL_SIZE': 32, 'POOL1_SIZE': 4, 'POOL2_SIZE': 3, 'NORM_AXIS': 'full', 'RUN_QUANTIZATION': False, 'RUN_ZSCORE': True, 'RUN_BANDPASS': False, 'QUANT_BITS': 4}. Best is trial 5 with value: 0.45138888888888884.
[I 2026-06-13 14:10:36,351] Trial 6 finished with value: 0.5746527777777778 and parameters: {'FLOW': 23.95857437764447, 'FHIGH': 111.05957867971178, 'LR_EXP': -2.6160263260507923, 'DROPOUT': 0.5339507764704741, 'BETA': 0.7979265453870701, 'SPIKE_GRAD_SLOPE': 21.267157269181165, 'TEMPORAL_FILTERS': 14, 'DEPTH_MULTIPLIER': 3, 'POINTWISE_FILTERS': 57, 'TEMPORAL_KERNEL_DIV': 5, 'SEPARABLE_KERNEL_SIZE': 28, 'POOL1_SIZE': 8, 'POOL2_SIZE': 4, 'NORM_AXIS': 'full', 'RUN_QUANTIZATION': False, 'RUN_ZSCORE': False, 'RUN_BANDPASS': False, 'QUANT_BITS': 8}. Best is trial 6 with value: 0.5746527777777778.
[I 2026-06-13 14:21:37,288] Trial 7 finished with value: 0.5 and parameters: {'FLOW': 21.757305363306905, 'FHIGH': 97.63744277830347, 'LR_EXP': -2.701870099743174, 'DROPOUT': 0.448921087315332, 'BETA': 0.9655236230445431, 'SPIKE_GRAD_SLOPE': 22.41556784218241, 'TEMPORAL_FILTERS': 19, 'DEPTH_MULTIPLIER': 1, 'POINTWISE_FILTERS': 46, 'TEMPORAL_KERNEL_DIV': 6, 'SEPARABLE_KERNEL_SIZE': 17, 'POOL1_SIZE': 7, 'POOL2_SIZE': 2, 'NORM_AXIS': 'full', 'RUN_QUANTIZATION': True, 'RUN_ZSCORE': True, 'RUN_BANDPASS': False, 'QUANT_BITS': 16}. Best is trial 6 with value: 0.5746527777777778.
[I 2026-06-13 14:37:03,773] Trial 8 finished with value: 0.3680555555555555 and parameters: {'FLOW': 14.389900243290088, 'FHIGH': 23.59962414187621, 'LR_EXP': -4.029499896096791, 'DROPOUT': 0.5149511582632292, 'BETA': 0.9468999732382815, 'SPIKE_GRAD_SLOPE': 11.64210755838982, 'TEMPORAL_FILTERS': 17, 'DEPTH_MULTIPLIER': 4, 'POINTWISE_FILTERS': 43, 'TEMPORAL_KERNEL_DIV': 4, 'SEPARABLE_KERNEL_SIZE': 18, 'POOL1_SIZE': 5, 'POOL2_SIZE': 3, 'NORM_AXIS': 'no_channel', 'RUN_QUANTIZATION': True, 'RUN_ZSCORE': True, 'RUN_BANDPASS': True, 'QUANT_BITS': 16}. Best is trial 6 with value: 0.5746527777777778.
[I 2026-06-13 14:54:26,190] Trial 9 finished with value: 0.532986111111111 and parameters: {'FLOW': 12.876548892288492, 'FHIGH': 16.93965023341285, 'LR_EXP': -3.3014038638816716, 'DROPOUT': 0.10105757349461843, 'BETA': 0.5251552570747501, 'SPIKE_GRAD_SLOPE': 61.28336224757871, 'TEMPORAL_FILTERS': 27, 'DEPTH_MULTIPLIER': 2, 'POINTWISE_FILTERS': 44, 'TEMPORAL_KERNEL_DIV': 3, 'SEPARABLE_KERNEL_SIZE': 23, 'POOL1_SIZE': 4, 'POOL2_SIZE': 3, 'NORM_AXIS': 'no_channel', 'RUN_QUANTIZATION': False, 'RUN_ZSCORE': False, 'RUN_BANDPASS': False, 'QUANT_BITS': 16}. Best is trial 6 with value: 0.5746527777777778.
[I 2026-06-13 15:09:15,911] Trial 10 finished with value: 0.5104166666666666 and parameters: {'FLOW': 35.741282102280216, 'FHIGH': 79.11217439356736, 'LR_EXP': -2.1757831105667353, 'DROPOUT': 0.4893193154435995, 'BETA': 0.6103327772184514, 'SPIKE_GRAD_SLOPE': 61.29232182169904, 'TEMPORAL_FILTERS': 20, 'DEPTH_MULTIPLIER': 2, 'POINTWISE_FILTERS': 10, 'TEMPORAL_KERNEL_DIV': 3, 'SEPARABLE_KERNEL_SIZE': 29, 'POOL1_SIZE': 7, 'POOL2_SIZE': 2, 'NORM_AXIS': 'full', 'RUN_QUANTIZATION': False, 'RUN_ZSCORE': True, 'RUN_BANDPASS': False, 'QUANT_BITS': 8}. Best is trial 6 with value: 0.5746527777777778.
[I 2026-06-13 15:12:19,021] Trial 11 pruned. 
[I 2026-06-13 15:32:05,233] Trial 12 finished with value: 0.4774305555555556 and parameters: {'FLOW': 9.647308976649274, 'FHIGH': 20.49395496370809, 'LR_EXP': -3.3182149816035014, 'DROPOUT': 0.15133908629431175, 'BETA': 0.5085435164559801, 'SPIKE_GRAD_SLOPE': 65.07707496622743, 'TEMPORAL_FILTERS': 26, 'DEPTH_MULTIPLIER': 3, 'POINTWISE_FILTERS': 28, 'TEMPORAL_KERNEL_DIV': 2, 'SEPARABLE_KERNEL_SIZE': 24, 'POOL1_SIZE': 3, 'POOL2_SIZE': 4, 'NORM_AXIS': 'no_channel', 'RUN_QUANTIZATION': False, 'RUN_ZSCORE': False, 'RUN_BANDPASS': False, 'QUANT_BITS': 8}. Best is trial 6 with value: 0.5746527777777778.
slurmstepd: error: *** JOB 43804833 ON fg2 CANCELLED AT 2026-06-13T15:41:14 ***
