mkdir: cannot create directory ‘/scratch/mne_data’: Permission denied

[notice] A new release of pip is available: 24.2 -> 26.1.2
[notice] To update, run: pip install --upgrade pip

[notice] A new release of pip is available: 24.2 -> 26.1.2
[notice] To update, run: pip install --upgrade pip
ERROR: Invalid requirement: 'Binary file requirements.txt matches': Expected end or semicolon (after name and no valid version specifier)
    Binary file requirements.txt matches
           ^ (from line 1 of /home/aleksander.berezowsk/requirements_notorch.txt)

[notice] A new release of pip is available: 24.2 -> 26.1.2
[notice] To update, run: pip install --upgrade pip

[notice] A new release of pip is available: 24.2 -> 26.1.2
[notice] To update, run: pip install --upgrade pip
/home/aleksander.berezowsk/spiking-eegnet/src/main.py:97: ExperimentalWarning: Argument ``multivariate`` is an experimental feature. The interface can change in the future.
  sampler=TPESampler(n_startup_trials=tpe_trails, multivariate=True, group=True)
/home/aleksander.berezowsk/spiking-eegnet/src/main.py:97: ExperimentalWarning: Argument ``group`` is an experimental feature. The interface can change in the future.
  sampler=TPESampler(n_startup_trials=tpe_trails, multivariate=True, group=True)
[I 2026-06-28 15:12:44,484] Using an existing study with name 'snn_eegnet_v3_200_20' instead of creating a new one.
[I 2026-06-28 18:57:14,914] Trial 72 finished with value: 0.47974537037037035 and parameters: {'FLOW': 1.700708764395464, 'FHIGH': 112.016057156881, 'LR_EXP': -2.9452330509971394, 'DROPOUT': 0.2860605095537202, 'BETA': 0.9813780582833174, 'SPIKE_GRAD_SLOPE': 13.138628348740223, 'TEMPORAL_FILTERS': 30, 'DEPTH_MULTIPLIER': 4, 'POINTWISE_FILTERS': 30, 'TEMPORAL_KERNEL_DIV': 7, 'SEPARABLE_KERNEL_SIZE': 26, 'POOL1_SIZE': 5, 'POOL2_SIZE': 5, 'N_STEPS_TRAIN': 12, 'N_STEPS_EVAL': 29, 'READOUT_MODE': 'spk_mean'}. Best is trial 63 with value: 0.4920910493827161.
[I 2026-06-28 22:01:28,235] Trial 77 finished with value: 0.4728009259259259 and parameters: {'FLOW': 1.3757341674516588, 'FHIGH': 100.47095328096626, 'LR_EXP': -2.710227974662144, 'DROPOUT': 0.37236789560542316, 'BETA': 0.9795969105195809, 'SPIKE_GRAD_SLOPE': 45.820349334473256, 'TEMPORAL_FILTERS': 32, 'DEPTH_MULTIPLIER': 3, 'POINTWISE_FILTERS': 27, 'TEMPORAL_KERNEL_DIV': 8, 'SEPARABLE_KERNEL_SIZE': 32, 'POOL1_SIZE': 8, 'POOL2_SIZE': 4, 'N_STEPS_TRAIN': 11, 'N_STEPS_EVAL': 17, 'READOUT_MODE': 'spk_mean'}. Best is trial 63 with value: 0.4920910493827161.
[I 2026-06-29 01:58:36,426] Trial 81 finished with value: 0.46489197530864196 and parameters: {'FLOW': 1.3501036150347443, 'FHIGH': 51.26876046744268, 'LR_EXP': -3.0910800580439, 'DROPOUT': 0.1691315988715557, 'BETA': 0.9489855986798196, 'SPIKE_GRAD_SLOPE': 16.570505099992292, 'TEMPORAL_FILTERS': 27, 'DEPTH_MULTIPLIER': 3, 'POINTWISE_FILTERS': 10, 'TEMPORAL_KERNEL_DIV': 8, 'SEPARABLE_KERNEL_SIZE': 23, 'POOL1_SIZE': 3, 'POOL2_SIZE': 8, 'N_STEPS_TRAIN': 16, 'N_STEPS_EVAL': 27, 'READOUT_MODE': 'spk_mean'}. Best is trial 63 with value: 0.4920910493827161.
[I 2026-06-29 05:45:21,024] Trial 85 finished with value: 0.4282407407407407 and parameters: {'FLOW': 2.425410383953018, 'FHIGH': 98.64033066941052, 'LR_EXP': -4.200932363317557, 'DROPOUT': 0.17466356205856473, 'BETA': 0.9562332579052945, 'SPIKE_GRAD_SLOPE': 36.86654743648918, 'TEMPORAL_FILTERS': 24, 'DEPTH_MULTIPLIER': 3, 'POINTWISE_FILTERS': 18, 'TEMPORAL_KERNEL_DIV': 3, 'SEPARABLE_KERNEL_SIZE': 29, 'POOL1_SIZE': 3, 'POOL2_SIZE': 6, 'N_STEPS_TRAIN': 13, 'N_STEPS_EVAL': 27, 'READOUT_MODE': 'spk_mean'}. Best is trial 63 with value: 0.4920910493827161.
[I 2026-06-29 08:13:13,588] Trial 89 finished with value: 0.4575617283950617 and parameters: {'FLOW': 1.4039515467954937, 'FHIGH': 111.95985719057781, 'LR_EXP': -2.90930633988057, 'DROPOUT': 0.26109327037492547, 'BETA': 0.7932305480872623, 'SPIKE_GRAD_SLOPE': 35.59329400516255, 'TEMPORAL_FILTERS': 22, 'DEPTH_MULTIPLIER': 1, 'POINTWISE_FILTERS': 20, 'TEMPORAL_KERNEL_DIV': 8, 'SEPARABLE_KERNEL_SIZE': 24, 'POOL1_SIZE': 4, 'POOL2_SIZE': 4, 'N_STEPS_TRAIN': 15, 'N_STEPS_EVAL': 24, 'READOUT_MODE': 'mem_last'}. Best is trial 63 with value: 0.4920910493827161.
slurmstepd: error: *** JOB 44259606 ON fg2 CANCELLED AT 2026-06-29T11:14:21 ***
