mkdir: cannot create directory ‘/scratch/mne_data’: Permission denied

[notice] A new release of pip is available: 24.2 -> 26.1.2
[notice] To update, run: pip install --upgrade pip

[notice] A new release of pip is available: 24.2 -> 26.1.2
[notice] To update, run: pip install --upgrade pip
ERROR: Invalid requirement: 'Binary file requirements.txt matches': Expected end or semicolon (after name and no valid version specifier)
    Binary file requirements.txt matches
           ^ (from line 1 of /home/aleksander.berezowsk/requirements_notorch.txt)

[notice] A new release of pip is available: 24.2 -> 26.1.2
[notice] To update, run: pip install --upgrade pip

[notice] A new release of pip is available: 24.2 -> 26.1.2
[notice] To update, run: pip install --upgrade pip
/home/aleksander.berezowsk/spiking-eegnet/src/main.py:97: ExperimentalWarning: Argument ``multivariate`` is an experimental feature. The interface can change in the future.
  sampler=TPESampler(n_startup_trials=tpe_trails, multivariate=True, group=True)
/home/aleksander.berezowsk/spiking-eegnet/src/main.py:97: ExperimentalWarning: Argument ``group`` is an experimental feature. The interface can change in the future.
  sampler=TPESampler(n_startup_trials=tpe_trails, multivariate=True, group=True)
[I 2026-06-27 16:49:53,173] Using an existing study with name 'snn_eegnet_v3_200_20' instead of creating a new one.
[I 2026-06-27 18:25:32,287] Trial 33 finished with value: 0.42804783950617287 and parameters: {'FLOW': 1.462757676343914, 'FHIGH': 95.28409054358274, 'LR_EXP': -3.8980938002562335, 'DROPOUT': 0.46975126381596, 'BETA': 0.9846125479816732, 'SPIKE_GRAD_SLOPE': 17.7993735229319, 'TEMPORAL_FILTERS': 21, 'DEPTH_MULTIPLIER': 2, 'POINTWISE_FILTERS': 25, 'TEMPORAL_KERNEL_DIV': 8, 'SEPARABLE_KERNEL_SIZE': 22, 'POOL1_SIZE': 6, 'POOL2_SIZE': 4, 'N_STEPS_TRAIN': 8, 'N_STEPS_EVAL': 31, 'READOUT_MODE': 'spk_mean'}. Best is trial 11 with value: 0.4870756172839506.
[I 2026-06-27 20:29:33,709] Trial 37 finished with value: 0.44058641975308643 and parameters: {'FLOW': 3.312161858298192, 'FHIGH': 71.58836738185968, 'LR_EXP': -2.3060479858875245, 'DROPOUT': 0.3812319005748801, 'BETA': 0.8812092666137681, 'SPIKE_GRAD_SLOPE': 4.873063381072528, 'TEMPORAL_FILTERS': 21, 'DEPTH_MULTIPLIER': 2, 'POINTWISE_FILTERS': 17, 'TEMPORAL_KERNEL_DIV': 8, 'SEPARABLE_KERNEL_SIZE': 18, 'POOL1_SIZE': 7, 'POOL2_SIZE': 2, 'N_STEPS_TRAIN': 11, 'N_STEPS_EVAL': 27, 'READOUT_MODE': 'spk_mean'}. Best is trial 11 with value: 0.4870756172839506.
[I 2026-06-28 00:21:45,512] Trial 40 finished with value: 0.46585648148148145 and parameters: {'FLOW': 2.5649754954836697, 'FHIGH': 104.44703699120008, 'LR_EXP': -3.2143399395444074, 'DROPOUT': 0.42526772669491264, 'BETA': 0.5327368329540283, 'SPIKE_GRAD_SLOPE': 38.16516192734662, 'TEMPORAL_FILTERS': 31, 'DEPTH_MULTIPLIER': 3, 'POINTWISE_FILTERS': 26, 'TEMPORAL_KERNEL_DIV': 8, 'SEPARABLE_KERNEL_SIZE': 19, 'POOL1_SIZE': 3, 'POOL2_SIZE': 3, 'N_STEPS_TRAIN': 14, 'N_STEPS_EVAL': 25, 'READOUT_MODE': 'mem_last'}. Best is trial 11 with value: 0.4870756172839506.
[I 2026-06-28 02:12:55,120] Trial 47 finished with value: 0.486304012345679 and parameters: {'FLOW': 1.1668755082416524, 'FHIGH': 67.80633217168186, 'LR_EXP': -2.7166809297897645, 'DROPOUT': 0.3808141321626304, 'BETA': 0.8390863475221886, 'SPIKE_GRAD_SLOPE': 14.425499887564154, 'TEMPORAL_FILTERS': 31, 'DEPTH_MULTIPLIER': 1, 'POINTWISE_FILTERS': 13, 'TEMPORAL_KERNEL_DIV': 7, 'SEPARABLE_KERNEL_SIZE': 27, 'POOL1_SIZE': 8, 'POOL2_SIZE': 3, 'N_STEPS_TRAIN': 8, 'N_STEPS_EVAL': 30, 'READOUT_MODE': 'spk_mean'}. Best is trial 11 with value: 0.4870756172839506.
[I 2026-06-28 04:33:14,688] Trial 49 finished with value: 0.44405864197530864 and parameters: {'FLOW': 1.6847499538352586, 'FHIGH': 76.5274383305365, 'LR_EXP': -2.5301600460326052, 'DROPOUT': 0.5939557512461816, 'BETA': 0.6912123428441553, 'SPIKE_GRAD_SLOPE': 33.21719669770532, 'TEMPORAL_FILTERS': 31, 'DEPTH_MULTIPLIER': 1, 'POINTWISE_FILTERS': 27, 'TEMPORAL_KERNEL_DIV': 5, 'SEPARABLE_KERNEL_SIZE': 24, 'POOL1_SIZE': 6, 'POOL2_SIZE': 3, 'N_STEPS_TRAIN': 10, 'N_STEPS_EVAL': 27, 'READOUT_MODE': 'spk_sum'}. Best is trial 11 with value: 0.4870756172839506.
[I 2026-06-28 07:27:34,310] Trial 55 finished with value: 0.46875 and parameters: {'FLOW': 1.4031133297541583, 'FHIGH': 13.029623971160142, 'LR_EXP': -2.9354518064911432, 'DROPOUT': 0.19635088409314103, 'BETA': 0.8224568245318203, 'SPIKE_GRAD_SLOPE': 7.849472656753283, 'TEMPORAL_FILTERS': 25, 'DEPTH_MULTIPLIER': 3, 'POINTWISE_FILTERS': 25, 'TEMPORAL_KERNEL_DIV': 8, 'SEPARABLE_KERNEL_SIZE': 28, 'POOL1_SIZE': 8, 'POOL2_SIZE': 6, 'N_STEPS_TRAIN': 13, 'N_STEPS_EVAL': 10, 'READOUT_MODE': 'spk_mean'}. Best is trial 53 with value: 0.48900462962962965.
[I 2026-06-28 08:55:55,581] Trial 60 finished with value: 0.4654706790123456 and parameters: {'FLOW': 1.2386847311387188, 'FHIGH': 21.206491412666786, 'LR_EXP': -3.2623365485026996, 'DROPOUT': 0.20396850381184767, 'BETA': 0.9688029333409084, 'SPIKE_GRAD_SLOPE': 13.391486068813476, 'TEMPORAL_FILTERS': 26, 'DEPTH_MULTIPLIER': 2, 'POINTWISE_FILTERS': 34, 'TEMPORAL_KERNEL_DIV': 5, 'SEPARABLE_KERNEL_SIZE': 32, 'POOL1_SIZE': 6, 'POOL2_SIZE': 5, 'N_STEPS_TRAIN': 6, 'N_STEPS_EVAL': 20, 'READOUT_MODE': 'spk_mean'}. Best is trial 53 with value: 0.48900462962962965.
[I 2026-06-28 12:28:49,028] Trial 63 finished with value: 0.4920910493827161 and parameters: {'FLOW': 1.8471709498634592, 'FHIGH': 96.22839364209813, 'LR_EXP': -2.8226295305570566, 'DROPOUT': 0.1564231237950941, 'BETA': 0.9578831723284896, 'SPIKE_GRAD_SLOPE': 26.553831066971522, 'TEMPORAL_FILTERS': 27, 'DEPTH_MULTIPLIER': 3, 'POINTWISE_FILTERS': 32, 'TEMPORAL_KERNEL_DIV': 7, 'SEPARABLE_KERNEL_SIZE': 29, 'POOL1_SIZE': 5, 'POOL2_SIZE': 6, 'N_STEPS_TRAIN': 14, 'N_STEPS_EVAL': 28, 'READOUT_MODE': 'spk_mean'}. Best is trial 63 with value: 0.4920910493827161.
[W 2026-06-28 13:10:27,723] Trial 68 failed with parameters: {'FLOW': 1.365586616420524, 'FHIGH': 114.88550363570234, 'LR_EXP': -3.136430183127266, 'DROPOUT': 0.17087528676516922, 'BETA': 0.9739778183976886, 'SPIKE_GRAD_SLOPE': 39.38726567672072, 'TEMPORAL_FILTERS': 25, 'DEPTH_MULTIPLIER': 3, 'POINTWISE_FILTERS': 21, 'TEMPORAL_KERNEL_DIV': 7, 'SEPARABLE_KERNEL_SIZE': 29, 'POOL1_SIZE': 4, 'POOL2_SIZE': 6, 'N_STEPS_TRAIN': 13, 'N_STEPS_EVAL': 24, 'READOUT_MODE': 'spk_mean'} because of the following error: OutOfMemoryError('CUDA out of memory. Tried to allocate 68.00 MiB. GPU 0 has a total capacity of 15.77 GiB of which 66.19 MiB is free. Including non-PyTorch memory, this process has 15.70 GiB memory in use. Of the allocated memory 14.70 GiB is allocated by PyTorch, and 633.78 MiB is reserved by PyTorch but unallocated. If reserved but unallocated memory is large try setting PYTORCH_CUDA_ALLOC_CONF=expandable_segments:True to avoid fragmentation.  See documentation for Memory Management  (https://pytorch.org/docs/stable/notes/cuda.html#environment-variables)').
Traceback (most recent call last):
  File "/home/aleksander.berezowsk/venv/lib/python3.12/site-packages/optuna/study/_optimize.py", line 206, in _run_trial
    value_or_values = func(trial)
                      ^^^^^^^^^^^
  File "/home/aleksander.berezowsk/spiking-eegnet/src/main.py", line 52, in objective
    return pipeline(**params, **FIXED, trial=trial, save_plots=False)
           ^^^^^^^^^^^^^^^^^^^^^^^^^^^^^^^^^^^^^^^^^^^^^^^^^^^^^^^^^^
  File "/home/aleksander.berezowsk/spiking-eegnet/src/pipeline.py", line 143, in pipeline
    histories, accs, mean_acc = experiment_loso_all(
                                ^^^^^^^^^^^^^^^^^^^^
  File "/home/aleksander.berezowsk/spiking-eegnet/src/experiment_loso.py", line 71, in experiment_loso_all
    history, final_acc, _model = experiment_loso(
                                 ^^^^^^^^^^^^^^^^
  File "/home/aleksander.berezowsk/spiking-eegnet/src/experiment_loso.py", line 30, in experiment_loso
    history = run_training(
              ^^^^^^^^^^^^^
  File "/home/aleksander.berezowsk/spiking-eegnet/src/run_training.py", line 50, in run_training
    loss = train_one_epoch(model, train_loader, optimizer, criterion, device,
           ^^^^^^^^^^^^^^^^^^^^^^^^^^^^^^^^^^^^^^^^^^^^^^^^^^^^^^^^^^^^^^^^^^
  File "/home/aleksander.berezowsk/spiking-eegnet/src/train_one_epoch.py", line 53, in train_one_epoch
    spk, mem = model(xb, num_steps=n_steps)
               ^^^^^^^^^^^^^^^^^^^^^^^^^^^^
  File "/home/aleksander.berezowsk/venv/lib/python3.12/site-packages/torch/nn/modules/module.py", line 1553, in _wrapped_call_impl
    return self._call_impl(*args, **kwargs)
           ^^^^^^^^^^^^^^^^^^^^^^^^^^^^^^^^
  File "/home/aleksander.berezowsk/venv/lib/python3.12/site-packages/torch/nn/modules/module.py", line 1562, in _call_impl
    return forward_call(*args, **kwargs)
           ^^^^^^^^^^^^^^^^^^^^^^^^^^^^^
  File "/home/aleksander.berezowsk/spiking-eegnet/src/spiking_eegnet.py", line 233, in forward
    spk1, mem1 = self.lif1(cur, mem1)
                 ^^^^^^^^^^^^^^^^^^^^
  File "/home/aleksander.berezowsk/venv/lib/python3.12/site-packages/torch/nn/modules/module.py", line 1553, in _wrapped_call_impl
    return self._call_impl(*args, **kwargs)
           ^^^^^^^^^^^^^^^^^^^^^^^^^^^^^^^^
  File "/home/aleksander.berezowsk/venv/lib/python3.12/site-packages/torch/nn/modules/module.py", line 1562, in _call_impl
    return forward_call(*args, **kwargs)
           ^^^^^^^^^^^^^^^^^^^^^^^^^^^^^
  File "/home/aleksander.berezowsk/venv/lib/python3.12/site-packages/snntorch/_neurons/leaky.py", line 220, in forward
    spk = self.fire(self.mem)
          ^^^^^^^^^^^^^^^^^^^
  File "/home/aleksander.berezowsk/venv/lib/python3.12/site-packages/snntorch/_neurons/neurons.py", line 81, in fire
    spk = self.spike_grad(mem_shift)
          ^^^^^^^^^^^^^^^^^^^^^^^^^^
  File "/home/aleksander.berezowsk/venv/lib/python3.12/site-packages/snntorch/surrogate.py", line 151, in inner
    return FastSigmoid.apply(x, slope)
           ^^^^^^^^^^^^^^^^^^^^^^^^^^^
  File "/home/aleksander.berezowsk/venv/lib/python3.12/site-packages/torch/autograd/function.py", line 574, in apply
    return super().apply(*args, **kwargs)  # type: ignore[misc]
           ^^^^^^^^^^^^^^^^^^^^^^^^^^^^^^
  File "/home/aleksander.berezowsk/venv/lib/python3.12/site-packages/snntorch/surrogate.py", line 135, in forward
    out = (input_ > 0).float()
          ^^^^^^^^^^^^^^^^^^^^
torch.OutOfMemoryError: CUDA out of memory. Tried to allocate 68.00 MiB. GPU 0 has a total capacity of 15.77 GiB of which 66.19 MiB is free. Including non-PyTorch memory, this process has 15.70 GiB memory in use. Of the allocated memory 14.70 GiB is allocated by PyTorch, and 633.78 MiB is reserved by PyTorch but unallocated. If reserved but unallocated memory is large try setting PYTORCH_CUDA_ALLOC_CONF=expandable_segments:True to avoid fragmentation.  See documentation for Memory Management  (https://pytorch.org/docs/stable/notes/cuda.html#environment-variables)
[W 2026-06-28 13:10:27,767] Trial 68 failed with value None.
Traceback (most recent call last):
  File "/home/aleksander.berezowsk/spiking-eegnet/src/main.py", line 103, in <module>
    study.optimize(objective, n_trials=n_trials, n_jobs=1,
  File "/home/aleksander.berezowsk/venv/lib/python3.12/site-packages/optuna/study/study.py", line 516, in optimize
    _optimize(
  File "/home/aleksander.berezowsk/venv/lib/python3.12/site-packages/optuna/study/_optimize.py", line 68, in _optimize
    _optimize_sequential(
  File "/home/aleksander.berezowsk/venv/lib/python3.12/site-packages/optuna/study/_optimize.py", line 165, in _optimize_sequential
    frozen_trial_id = _run_trial(study, func, catch)
                      ^^^^^^^^^^^^^^^^^^^^^^^^^^^^^^
  File "/home/aleksander.berezowsk/venv/lib/python3.12/site-packages/optuna/study/_optimize.py", line 263, in _run_trial
    raise func_err
  File "/home/aleksander.berezowsk/venv/lib/python3.12/site-packages/optuna/study/_optimize.py", line 206, in _run_trial
    value_or_values = func(trial)
                      ^^^^^^^^^^^
  File "/home/aleksander.berezowsk/spiking-eegnet/src/main.py", line 52, in objective
    return pipeline(**params, **FIXED, trial=trial, save_plots=False)
           ^^^^^^^^^^^^^^^^^^^^^^^^^^^^^^^^^^^^^^^^^^^^^^^^^^^^^^^^^^
  File "/home/aleksander.berezowsk/spiking-eegnet/src/pipeline.py", line 143, in pipeline
    histories, accs, mean_acc = experiment_loso_all(
                                ^^^^^^^^^^^^^^^^^^^^
  File "/home/aleksander.berezowsk/spiking-eegnet/src/experiment_loso.py", line 71, in experiment_loso_all
    history, final_acc, _model = experiment_loso(
                                 ^^^^^^^^^^^^^^^^
  File "/home/aleksander.berezowsk/spiking-eegnet/src/experiment_loso.py", line 30, in experiment_loso
    history = run_training(
              ^^^^^^^^^^^^^
  File "/home/aleksander.berezowsk/spiking-eegnet/src/run_training.py", line 50, in run_training
    loss = train_one_epoch(model, train_loader, optimizer, criterion, device,
           ^^^^^^^^^^^^^^^^^^^^^^^^^^^^^^^^^^^^^^^^^^^^^^^^^^^^^^^^^^^^^^^^^^
  File "/home/aleksander.berezowsk/spiking-eegnet/src/train_one_epoch.py", line 53, in train_one_epoch
    spk, mem = model(xb, num_steps=n_steps)
               ^^^^^^^^^^^^^^^^^^^^^^^^^^^^
  File "/home/aleksander.berezowsk/venv/lib/python3.12/site-packages/torch/nn/modules/module.py", line 1553, in _wrapped_call_impl
    return self._call_impl(*args, **kwargs)
           ^^^^^^^^^^^^^^^^^^^^^^^^^^^^^^^^
  File "/home/aleksander.berezowsk/venv/lib/python3.12/site-packages/torch/nn/modules/module.py", line 1562, in _call_impl
    return forward_call(*args, **kwargs)
           ^^^^^^^^^^^^^^^^^^^^^^^^^^^^^
  File "/home/aleksander.berezowsk/spiking-eegnet/src/spiking_eegnet.py", line 233, in forward
    spk1, mem1 = self.lif1(cur, mem1)
                 ^^^^^^^^^^^^^^^^^^^^
  File "/home/aleksander.berezowsk/venv/lib/python3.12/site-packages/torch/nn/modules/module.py", line 1553, in _wrapped_call_impl
    return self._call_impl(*args, **kwargs)
           ^^^^^^^^^^^^^^^^^^^^^^^^^^^^^^^^
  File "/home/aleksander.berezowsk/venv/lib/python3.12/site-packages/torch/nn/modules/module.py", line 1562, in _call_impl
    return forward_call(*args, **kwargs)
           ^^^^^^^^^^^^^^^^^^^^^^^^^^^^^
  File "/home/aleksander.berezowsk/venv/lib/python3.12/site-packages/snntorch/_neurons/leaky.py", line 220, in forward
    spk = self.fire(self.mem)
          ^^^^^^^^^^^^^^^^^^^
  File "/home/aleksander.berezowsk/venv/lib/python3.12/site-packages/snntorch/_neurons/neurons.py", line 81, in fire
    spk = self.spike_grad(mem_shift)
          ^^^^^^^^^^^^^^^^^^^^^^^^^^
  File "/home/aleksander.berezowsk/venv/lib/python3.12/site-packages/snntorch/surrogate.py", line 151, in inner
    return FastSigmoid.apply(x, slope)
           ^^^^^^^^^^^^^^^^^^^^^^^^^^^
  File "/home/aleksander.berezowsk/venv/lib/python3.12/site-packages/torch/autograd/function.py", line 574, in apply
    return super().apply(*args, **kwargs)  # type: ignore[misc]
           ^^^^^^^^^^^^^^^^^^^^^^^^^^^^^^
  File "/home/aleksander.berezowsk/venv/lib/python3.12/site-packages/snntorch/surrogate.py", line 135, in forward
    out = (input_ > 0).float()
          ^^^^^^^^^^^^^^^^^^^^
torch.OutOfMemoryError: CUDA out of memory. Tried to allocate 68.00 MiB. GPU 0 has a total capacity of 15.77 GiB of which 66.19 MiB is free. Including non-PyTorch memory, this process has 15.70 GiB memory in use. Of the allocated memory 14.70 GiB is allocated by PyTorch, and 633.78 MiB is reserved by PyTorch but unallocated. If reserved but unallocated memory is large try setting PYTORCH_CUDA_ALLOC_CONF=expandable_segments:True to avoid fragmentation.  See documentation for Memory Management  (https://pytorch.org/docs/stable/notes/cuda.html#environment-variables)
