
[notice] A new release of pip is available: 24.2 -> 26.1.2
[notice] To update, run: pip install --upgrade pip

[notice] A new release of pip is available: 24.2 -> 26.1.2
[notice] To update, run: pip install --upgrade pip
ERROR: Invalid requirement: 'Binary file requirements.txt matches': Expected end or semicolon (after name and no valid version specifier)
    Binary file requirements.txt matches
           ^ (from line 1 of /home/aleksander.berezowsk/requirements_notorch.txt)

[notice] A new release of pip is available: 24.2 -> 26.1.2
[notice] To update, run: pip install --upgrade pip

[notice] A new release of pip is available: 24.2 -> 26.1.2
[notice] To update, run: pip install --upgrade pip
/home/aleksander.berezowsk/spiking-eegnet/src/main.py:86: ExperimentalWarning: Argument ``multivariate`` is an experimental feature. The interface can change in the future.
  sampler=TPESampler(n_startup_trials=tpe_trails, multivariate=True, group=True)
/home/aleksander.berezowsk/spiking-eegnet/src/main.py:86: ExperimentalWarning: Argument ``group`` is an experimental feature. The interface can change in the future.
  sampler=TPESampler(n_startup_trials=tpe_trails, multivariate=True, group=True)
[I 2026-06-15 17:34:58,726] A new study created in RDB with name: snn_eegnet_v2_200_20
[I 2026-06-15 17:42:54,114] Trial 0 finished with value: 0.2899305555555556 and parameters: {'FLOW': 25.578245736360284, 'FHIGH': 69.03188815165612, 'LR_EXP': -3.3643366550933487, 'DROPOUT': 0.26655566379984935, 'BETA': 0.5775223020436834, 'SPIKE_GRAD_SLOPE': 20.971830797427355, 'TEMPORAL_FILTERS': 5, 'DEPTH_MULTIPLIER': 2, 'POINTWISE_FILTERS': 14, 'TEMPORAL_KERNEL_DIV': 4, 'SEPARABLE_KERNEL_SIZE': 23, 'POOL1_SIZE': 6, 'POOL2_SIZE': 4, 'NORM_AXIS': 'no_channel', 'RUN_ZSCORE': True}. Best is trial 0 with value: 0.2899305555555556.
[I 2026-06-15 17:57:42,193] Trial 1 finished with value: 0.5017361111111112 and parameters: {'FLOW': 11.546416384917636, 'FHIGH': 82.85824856986042, 'LR_EXP': -3.8811122311359614, 'DROPOUT': 0.5247645906295955, 'BETA': 0.553758785486743, 'SPIKE_GRAD_SLOPE': 45.998152765867594, 'TEMPORAL_FILTERS': 20, 'DEPTH_MULTIPLIER': 1, 'POINTWISE_FILTERS': 48, 'TEMPORAL_KERNEL_DIV': 2, 'SEPARABLE_KERNEL_SIZE': 19, 'POOL1_SIZE': 5, 'POOL2_SIZE': 6, 'NORM_AXIS': 'no_channel', 'RUN_ZSCORE': True}. Best is trial 1 with value: 0.5017361111111112.
[I 2026-06-15 18:10:06,233] Trial 2 finished with value: 0.28125 and parameters: {'FLOW': 35.67189147125321, 'FHIGH': 73.77939607454903, 'LR_EXP': -2.3015996451540746, 'DROPOUT': 0.6456586271632551, 'BETA': 0.88325787900873, 'SPIKE_GRAD_SLOPE': 31.50152963907311, 'TEMPORAL_FILTERS': 22, 'DEPTH_MULTIPLIER': 2, 'POINTWISE_FILTERS': 43, 'TEMPORAL_KERNEL_DIV': 7, 'SEPARABLE_KERNEL_SIZE': 4, 'POOL1_SIZE': 2, 'POOL2_SIZE': 2, 'NORM_AXIS': 'no_channel', 'RUN_ZSCORE': True}. Best is trial 1 with value: 0.5017361111111112.
[I 2026-06-15 18:22:18,137] Trial 3 finished with value: 0.2777777777777778 and parameters: {'FLOW': 36.95941635562274, 'FHIGH': 93.47721147770505, 'LR_EXP': -2.327498924485927, 'DROPOUT': 0.11459736270236459, 'BETA': 0.636030062672664, 'SPIKE_GRAD_SLOPE': 83.58273367535155, 'TEMPORAL_FILTERS': 20, 'DEPTH_MULTIPLIER': 2, 'POINTWISE_FILTERS': 57, 'TEMPORAL_KERNEL_DIV': 5, 'SEPARABLE_KERNEL_SIZE': 30, 'POOL1_SIZE': 8, 'POOL2_SIZE': 2, 'NORM_AXIS': 'full', 'RUN_ZSCORE': True}. Best is trial 1 with value: 0.5017361111111112.
[I 2026-06-15 18:41:27,361] Trial 4 finished with value: 0.2569444444444445 and parameters: {'FLOW': 33.49663286381956, 'FHIGH': 45.47343782234233, 'LR_EXP': -4.492388289041424, 'DROPOUT': 0.12676857226018629, 'BETA': 0.549187586040933, 'SPIKE_GRAD_SLOPE': 61.81509331295182, 'TEMPORAL_FILTERS': 30, 'DEPTH_MULTIPLIER': 4, 'POINTWISE_FILTERS': 38, 'TEMPORAL_KERNEL_DIV': 5, 'SEPARABLE_KERNEL_SIZE': 30, 'POOL1_SIZE': 7, 'POOL2_SIZE': 6, 'NORM_AXIS': 'full', 'RUN_ZSCORE': False}. Best is trial 1 with value: 0.5017361111111112.
[I 2026-06-15 18:52:12,205] Trial 5 finished with value: 0.4288194444444444 and parameters: {'FLOW': 22.344917671956672, 'FHIGH': 47.526361103493954, 'LR_EXP': -2.242903177191, 'DROPOUT': 0.5342551251203741, 'BETA': 0.8449786162686512, 'SPIKE_GRAD_SLOPE': 7.4062719173121705, 'TEMPORAL_FILTERS': 19, 'DEPTH_MULTIPLIER': 2, 'POINTWISE_FILTERS': 24, 'TEMPORAL_KERNEL_DIV': 8, 'SEPARABLE_KERNEL_SIZE': 32, 'POOL1_SIZE': 6, 'POOL2_SIZE': 8, 'NORM_AXIS': 'no_channel', 'RUN_ZSCORE': False}. Best is trial 1 with value: 0.5017361111111112.
[I 2026-06-15 19:04:16,099] Trial 6 finished with value: 0.5347222222222222 and parameters: {'FLOW': 4.450074478958441, 'FHIGH': 117.4458635138963, 'LR_EXP': -3.5368941397102827, 'DROPOUT': 0.2894840439143542, 'BETA': 0.6821800327003967, 'SPIKE_GRAD_SLOPE': 37.95459613565224, 'TEMPORAL_FILTERS': 21, 'DEPTH_MULTIPLIER': 2, 'POINTWISE_FILTERS': 31, 'TEMPORAL_KERNEL_DIV': 6, 'SEPARABLE_KERNEL_SIZE': 4, 'POOL1_SIZE': 5, 'POOL2_SIZE': 6, 'NORM_AXIS': 'no_channel', 'RUN_ZSCORE': True}. Best is trial 6 with value: 0.5347222222222222.
[I 2026-06-15 19:12:12,655] Trial 7 finished with value: 0.26041666666666663 and parameters: {'FLOW': 38.781611405022076, 'FHIGH': 84.22947319561227, 'LR_EXP': -2.8068230796792952, 'DROPOUT': 0.28699414530988704, 'BETA': 0.7202119984339586, 'SPIKE_GRAD_SLOPE': 44.362099334511626, 'TEMPORAL_FILTERS': 13, 'DEPTH_MULTIPLIER': 1, 'POINTWISE_FILTERS': 9, 'TEMPORAL_KERNEL_DIV': 8, 'SEPARABLE_KERNEL_SIZE': 6, 'POOL1_SIZE': 2, 'POOL2_SIZE': 8, 'NORM_AXIS': 'no_channel', 'RUN_ZSCORE': False}. Best is trial 6 with value: 0.5347222222222222.
[I 2026-06-15 19:20:09,099] Trial 8 finished with value: 0.32291666666666663 and parameters: {'FLOW': 13.852388512925451, 'FHIGH': 47.84313413651416, 'LR_EXP': -4.190098549676735, 'DROPOUT': 0.2648929386744939, 'BETA': 0.920882335740604, 'SPIKE_GRAD_SLOPE': 25.913685033513474, 'TEMPORAL_FILTERS': 6, 'DEPTH_MULTIPLIER': 2, 'POINTWISE_FILTERS': 45, 'TEMPORAL_KERNEL_DIV': 4, 'SEPARABLE_KERNEL_SIZE': 16, 'POOL1_SIZE': 6, 'POOL2_SIZE': 7, 'NORM_AXIS': 'no_channel', 'RUN_ZSCORE': True}. Best is trial 6 with value: 0.5347222222222222.
[I 2026-06-15 19:33:30,281] Trial 9 finished with value: 0.3125 and parameters: {'FLOW': 19.28948336923563, 'FHIGH': 56.97560743229492, 'LR_EXP': -2.6381771026928806, 'DROPOUT': 0.7058428339501146, 'BETA': 0.8738269148767343, 'SPIKE_GRAD_SLOPE': 48.26700224318664, 'TEMPORAL_FILTERS': 31, 'DEPTH_MULTIPLIER': 1, 'POINTWISE_FILTERS': 36, 'TEMPORAL_KERNEL_DIV': 8, 'SEPARABLE_KERNEL_SIZE': 21, 'POOL1_SIZE': 2, 'POOL2_SIZE': 3, 'NORM_AXIS': 'no_channel', 'RUN_ZSCORE': True}. Best is trial 6 with value: 0.5347222222222222.
[I 2026-06-15 19:47:26,156] Trial 10 finished with value: 0.4982638888888889 and parameters: {'FLOW': 9.042792045045749, 'FHIGH': 111.38980371956517, 'LR_EXP': -2.6478291688960622, 'DROPOUT': 0.42581366208509386, 'BETA': 0.8963085531817742, 'SPIKE_GRAD_SLOPE': 99.64607607540016, 'TEMPORAL_FILTERS': 20, 'DEPTH_MULTIPLIER': 3, 'POINTWISE_FILTERS': 58, 'TEMPORAL_KERNEL_DIV': 4, 'SEPARABLE_KERNEL_SIZE': 10, 'POOL1_SIZE': 6, 'POOL2_SIZE': 7, 'NORM_AXIS': 'full', 'RUN_ZSCORE': True}. Best is trial 6 with value: 0.5347222222222222.
[I 2026-06-15 20:09:12,889] Trial 11 finished with value: 0.5729166666666667 and parameters: {'FLOW': 9.37853840174535, 'FHIGH': 91.58183861707666, 'LR_EXP': -3.2993571606439493, 'DROPOUT': 0.5627363982419977, 'BETA': 0.5876709107583702, 'SPIKE_GRAD_SLOPE': 5.429394452786015, 'TEMPORAL_FILTERS': 30, 'DEPTH_MULTIPLIER': 4, 'POINTWISE_FILTERS': 13, 'TEMPORAL_KERNEL_DIV': 3, 'SEPARABLE_KERNEL_SIZE': 6, 'POOL1_SIZE': 3, 'POOL2_SIZE': 5, 'NORM_AXIS': 'full', 'RUN_ZSCORE': False}. Best is trial 11 with value: 0.5729166666666667.
[I 2026-06-15 20:22:16,016] Trial 12 finished with value: 0.4548611111111111 and parameters: {'FLOW': 11.189879237086162, 'FHIGH': 65.43352488030553, 'LR_EXP': -3.1676310932759186, 'DROPOUT': 0.1528059224589708, 'BETA': 0.7603889306879995, 'SPIKE_GRAD_SLOPE': 39.3758921994926, 'TEMPORAL_FILTERS': 10, 'DEPTH_MULTIPLIER': 3, 'POINTWISE_FILTERS': 9, 'TEMPORAL_KERNEL_DIV': 2, 'SEPARABLE_KERNEL_SIZE': 9, 'POOL1_SIZE': 3, 'POOL2_SIZE': 4, 'NORM_AXIS': 'full', 'RUN_ZSCORE': False}. Best is trial 11 with value: 0.5729166666666667.
[I 2026-06-15 20:41:49,083] Trial 13 finished with value: 0.6145833333333334 and parameters: {'FLOW': 2.46143895398857, 'FHIGH': 89.97316502896254, 'LR_EXP': -3.2146234240195657, 'DROPOUT': 0.6688930093198311, 'BETA': 0.6348389216008938, 'SPIKE_GRAD_SLOPE': 30.843998589639344, 'TEMPORAL_FILTERS': 31, 'DEPTH_MULTIPLIER': 4, 'POINTWISE_FILTERS': 20, 'TEMPORAL_KERNEL_DIV': 5, 'SEPARABLE_KERNEL_SIZE': 29, 'POOL1_SIZE': 8, 'POOL2_SIZE': 6, 'NORM_AXIS': 'full', 'RUN_ZSCORE': False}. Best is trial 13 with value: 0.6145833333333334.
[I 2026-06-15 20:53:59,603] Trial 14 finished with value: 0.5815972222222222 and parameters: {'FLOW': 7.389938677710848, 'FHIGH': 49.85981505629638, 'LR_EXP': -3.2376772100453337, 'DROPOUT': 0.4917612736703024, 'BETA': 0.7114499360809549, 'SPIKE_GRAD_SLOPE': 53.65966458501376, 'TEMPORAL_FILTERS': 19, 'DEPTH_MULTIPLIER': 3, 'POINTWISE_FILTERS': 41, 'TEMPORAL_KERNEL_DIV': 7, 'SEPARABLE_KERNEL_SIZE': 10, 'POOL1_SIZE': 5, 'POOL2_SIZE': 6, 'NORM_AXIS': 'no_channel', 'RUN_ZSCORE': False}. Best is trial 13 with value: 0.6145833333333334.
[I 2026-06-15 21:12:25,725] Trial 15 finished with value: 0.3246527777777778 and parameters: {'FLOW': 13.655811328787841, 'FHIGH': 49.57158375242673, 'LR_EXP': -4.37229272008885, 'DROPOUT': 0.12332389773187566, 'BETA': 0.8387399345839781, 'SPIKE_GRAD_SLOPE': 62.88777946032991, 'TEMPORAL_FILTERS': 31, 'DEPTH_MULTIPLIER': 3, 'POINTWISE_FILTERS': 58, 'TEMPORAL_KERNEL_DIV': 4, 'SEPARABLE_KERNEL_SIZE': 27, 'POOL1_SIZE': 6, 'POOL2_SIZE': 4, 'NORM_AXIS': 'no_channel', 'RUN_ZSCORE': True}. Best is trial 13 with value: 0.6145833333333334.
[I 2026-06-15 21:31:14,601] Trial 16 finished with value: 0.3125 and parameters: {'FLOW': 19.45310789604082, 'FHIGH': 67.1856608833925, 'LR_EXP': -3.8946648374814647, 'DROPOUT': 0.15440955268742684, 'BETA': 0.7689489892284809, 'SPIKE_GRAD_SLOPE': 66.30596495737596, 'TEMPORAL_FILTERS': 30, 'DEPTH_MULTIPLIER': 4, 'POINTWISE_FILTERS': 39, 'TEMPORAL_KERNEL_DIV': 6, 'SEPARABLE_KERNEL_SIZE': 32, 'POOL1_SIZE': 6, 'POOL2_SIZE': 2, 'NORM_AXIS': 'no_channel', 'RUN_ZSCORE': True}. Best is trial 13 with value: 0.6145833333333334.
[I 2026-06-15 21:42:10,391] Trial 17 finished with value: 0.4184027777777778 and parameters: {'FLOW': 4.495951125562327, 'FHIGH': 117.68993776026598, 'LR_EXP': -2.29093419064775, 'DROPOUT': 0.2817788393654981, 'BETA': 0.6284673040183025, 'SPIKE_GRAD_SLOPE': 9.457408096513664, 'TEMPORAL_FILTERS': 18, 'DEPTH_MULTIPLIER': 1, 'POINTWISE_FILTERS': 25, 'TEMPORAL_KERNEL_DIV': 4, 'SEPARABLE_KERNEL_SIZE': 6, 'POOL1_SIZE': 8, 'POOL2_SIZE': 2, 'NORM_AXIS': 'full', 'RUN_ZSCORE': False}. Best is trial 13 with value: 0.6145833333333334.
[I 2026-06-15 21:53:13,669] Trial 18 finished with value: 0.2690972222222222 and parameters: {'FLOW': 34.97755624253774, 'FHIGH': 62.71474249920046, 'LR_EXP': -3.2926420032150814, 'DROPOUT': 0.7368233375865244, 'BETA': 0.7429744077307003, 'SPIKE_GRAD_SLOPE': 72.55741706026959, 'TEMPORAL_FILTERS': 18, 'DEPTH_MULTIPLIER': 1, 'POINTWISE_FILTERS': 39, 'TEMPORAL_KERNEL_DIV': 4, 'SEPARABLE_KERNEL_SIZE': 32, 'POOL1_SIZE': 4, 'POOL2_SIZE': 3, 'NORM_AXIS': 'full', 'RUN_ZSCORE': True}. Best is trial 13 with value: 0.6145833333333334.
[I 2026-06-15 22:08:45,721] Trial 19 finished with value: 0.5138888888888888 and parameters: {'FLOW': 11.833123439737292, 'FHIGH': 99.55590096936773, 'LR_EXP': -3.885175701680034, 'DROPOUT': 0.3401084694616425, 'BETA': 0.952701162492845, 'SPIKE_GRAD_SLOPE': 47.290216529473504, 'TEMPORAL_FILTERS': 14, 'DEPTH_MULTIPLIER': 4, 'POINTWISE_FILTERS': 63, 'TEMPORAL_KERNEL_DIV': 2, 'SEPARABLE_KERNEL_SIZE': 19, 'POOL1_SIZE': 7, 'POOL2_SIZE': 8, 'NORM_AXIS': 'full', 'RUN_ZSCORE': True}. Best is trial 13 with value: 0.6145833333333334.
[I 2026-06-15 22:27:27,515] Trial 20 finished with value: 0.595486111111111 and parameters: {'FLOW': 3.5491578213126296, 'FHIGH': 72.89552927786028, 'LR_EXP': -2.7765742839531757, 'DROPOUT': 0.5754208729555617, 'BETA': 0.6064592555038634, 'SPIKE_GRAD_SLOPE': 6.480246602525504, 'TEMPORAL_FILTERS': 32, 'DEPTH_MULTIPLIER': 3, 'POINTWISE_FILTERS': 10, 'TEMPORAL_KERNEL_DIV': 4, 'SEPARABLE_KERNEL_SIZE': 28, 'POOL1_SIZE': 8, 'POOL2_SIZE': 5, 'NORM_AXIS': 'full', 'RUN_ZSCORE': False}. Best is trial 13 with value: 0.6145833333333334.
[I 2026-06-15 22:46:31,172] Trial 21 finished with value: 0.6302083333333333 and parameters: {'FLOW': 3.303781150364832, 'FHIGH': 73.87499151278641, 'LR_EXP': -3.395448919727795, 'DROPOUT': 0.6737681038662021, 'BETA': 0.6398874392844839, 'SPIKE_GRAD_SLOPE': 15.388730374761717, 'TEMPORAL_FILTERS': 30, 'DEPTH_MULTIPLIER': 4, 'POINTWISE_FILTERS': 18, 'TEMPORAL_KERNEL_DIV': 5, 'SEPARABLE_KERNEL_SIZE': 25, 'POOL1_SIZE': 8, 'POOL2_SIZE': 5, 'NORM_AXIS': 'full', 'RUN_ZSCORE': False}. Best is trial 21 with value: 0.6302083333333333.
[I 2026-06-15 23:07:09,395] Trial 22 finished with value: 0.4947916666666667 and parameters: {'FLOW': 5.564046891075991, 'FHIGH': 70.23637629371466, 'LR_EXP': -2.96434309991186, 'DROPOUT': 0.4367273454009507, 'BETA': 0.6198830992088455, 'SPIKE_GRAD_SLOPE': 19.760159342525817, 'TEMPORAL_FILTERS': 32, 'DEPTH_MULTIPLIER': 4, 'POINTWISE_FILTERS': 16, 'TEMPORAL_KERNEL_DIV': 4, 'SEPARABLE_KERNEL_SIZE': 32, 'POOL1_SIZE': 7, 'POOL2_SIZE': 5, 'NORM_AXIS': 'full', 'RUN_ZSCORE': False}. Best is trial 21 with value: 0.6302083333333333.
[I 2026-06-15 23:25:49,167] Trial 23 finished with value: 0.5625 and parameters: {'FLOW': 4.986906417342068, 'FHIGH': 97.4744069336481, 'LR_EXP': -3.0643880315860197, 'DROPOUT': 0.6956531261677815, 'BETA': 0.7204711972467585, 'SPIKE_GRAD_SLOPE': 45.93638299701533, 'TEMPORAL_FILTERS': 29, 'DEPTH_MULTIPLIER': 4, 'POINTWISE_FILTERS': 28, 'TEMPORAL_KERNEL_DIV': 5, 'SEPARABLE_KERNEL_SIZE': 32, 'POOL1_SIZE': 8, 'POOL2_SIZE': 7, 'NORM_AXIS': 'no_channel', 'RUN_ZSCORE': False}. Best is trial 21 with value: 0.6302083333333333.
[I 2026-06-15 23:43:58,877] Trial 24 finished with value: 0.5555555555555555 and parameters: {'FLOW': 8.56775747957093, 'FHIGH': 80.76139848177797, 'LR_EXP': -3.8152498272195077, 'DROPOUT': 0.6566841266656233, 'BETA': 0.5706051446484279, 'SPIKE_GRAD_SLOPE': 8.096690868442387, 'TEMPORAL_FILTERS': 28, 'DEPTH_MULTIPLIER': 4, 'POINTWISE_FILTERS': 29, 'TEMPORAL_KERNEL_DIV': 5, 'SEPARABLE_KERNEL_SIZE': 22, 'POOL1_SIZE': 8, 'POOL2_SIZE': 3, 'NORM_AXIS': 'full', 'RUN_ZSCORE': True}. Best is trial 21 with value: 0.6302083333333333.
[I 2026-06-16 00:00:48,501] Trial 25 finished with value: 0.5034722222222222 and parameters: {'FLOW': 2.57908434483867, 'FHIGH': 66.87049982210564, 'LR_EXP': -2.328440407458929, 'DROPOUT': 0.6940518797269558, 'BETA': 0.5612529874576768, 'SPIKE_GRAD_SLOPE': 14.317792485404457, 'TEMPORAL_FILTERS': 32, 'DEPTH_MULTIPLIER': 2, 'POINTWISE_FILTERS': 23, 'TEMPORAL_KERNEL_DIV': 4, 'SEPARABLE_KERNEL_SIZE': 23, 'POOL1_SIZE': 7, 'POOL2_SIZE': 4, 'NORM_AXIS': 'no_channel', 'RUN_ZSCORE': False}. Best is trial 21 with value: 0.6302083333333333.
[I 2026-06-16 00:01:26,751] Trial 26 pruned. 
[I 2026-06-16 00:02:11,540] Trial 27 pruned. 
[I 2026-06-16 00:03:03,981] Trial 28 pruned. 
[I 2026-06-16 00:03:38,407] Trial 29 pruned. 
[I 2026-06-16 00:23:17,057] Trial 30 finished with value: 0.47916666666666663 and parameters: {'FLOW': 1.0874310770791413, 'FHIGH': 83.05087659356242, 'LR_EXP': -2.7928295507463066, 'DROPOUT': 0.7027241266783668, 'BETA': 0.6658459058585281, 'SPIKE_GRAD_SLOPE': 25.441132079639495, 'TEMPORAL_FILTERS': 32, 'DEPTH_MULTIPLIER': 4, 'POINTWISE_FILTERS': 26, 'TEMPORAL_KERNEL_DIV': 6, 'SEPARABLE_KERNEL_SIZE': 24, 'POOL1_SIZE': 8, 'POOL2_SIZE': 5, 'NORM_AXIS': 'full', 'RUN_ZSCORE': False}. Best is trial 21 with value: 0.6302083333333333.
[I 2026-06-16 00:38:35,189] Trial 31 finished with value: 0.609375 and parameters: {'FLOW': 5.5529170197585715, 'FHIGH': 53.830215454708096, 'LR_EXP': -2.6042093675614737, 'DROPOUT': 0.5919632149138128, 'BETA': 0.7961120704635566, 'SPIKE_GRAD_SLOPE': 37.53465395875358, 'TEMPORAL_FILTERS': 25, 'DEPTH_MULTIPLIER': 3, 'POINTWISE_FILTERS': 41, 'TEMPORAL_KERNEL_DIV': 5, 'SEPARABLE_KERNEL_SIZE': 11, 'POOL1_SIZE': 5, 'POOL2_SIZE': 7, 'NORM_AXIS': 'no_channel', 'RUN_ZSCORE': False}. Best is trial 21 with value: 0.6302083333333333.
[I 2026-06-16 00:53:42,514] Trial 32 finished with value: 0.4913194444444445 and parameters: {'FLOW': 6.712652147267455, 'FHIGH': 54.59966683248548, 'LR_EXP': -2.8051024114455796, 'DROPOUT': 0.7256661674449884, 'BETA': 0.7363775493513366, 'SPIKE_GRAD_SLOPE': 57.22271035942863, 'TEMPORAL_FILTERS': 27, 'DEPTH_MULTIPLIER': 2, 'POINTWISE_FILTERS': 45, 'TEMPORAL_KERNEL_DIV': 4, 'SEPARABLE_KERNEL_SIZE': 4, 'POOL1_SIZE': 6, 'POOL2_SIZE': 7, 'NORM_AXIS': 'no_channel', 'RUN_ZSCORE': False}. Best is trial 21 with value: 0.6302083333333333.
[I 2026-06-16 01:12:24,337] Trial 33 finished with value: 0.5347222222222222 and parameters: {'FLOW': 8.100212909388762, 'FHIGH': 62.28710258281002, 'LR_EXP': -2.5299757018740645, 'DROPOUT': 0.5950466535358457, 'BETA': 0.8611527797862024, 'SPIKE_GRAD_SLOPE': 38.661670231778835, 'TEMPORAL_FILTERS': 30, 'DEPTH_MULTIPLIER': 4, 'POINTWISE_FILTERS': 39, 'TEMPORAL_KERNEL_DIV': 7, 'SEPARABLE_KERNEL_SIZE': 9, 'POOL1_SIZE': 4, 'POOL2_SIZE': 5, 'NORM_AXIS': 'no_channel', 'RUN_ZSCORE': False}. Best is trial 21 with value: 0.6302083333333333.
[I 2026-06-16 01:32:51,409] Trial 34 finished with value: 0.5225694444444444 and parameters: {'FLOW': 10.784738287202122, 'FHIGH': 58.273973505186305, 'LR_EXP': -2.4264779099880585, 'DROPOUT': 0.44071740988319164, 'BETA': 0.8528362262604382, 'SPIKE_GRAD_SLOPE': 45.48934985274991, 'TEMPORAL_FILTERS': 31, 'DEPTH_MULTIPLIER': 3, 'POINTWISE_FILTERS': 30, 'TEMPORAL_KERNEL_DIV': 3, 'SEPARABLE_KERNEL_SIZE': 11, 'POOL1_SIZE': 5, 'POOL2_SIZE': 7, 'NORM_AXIS': 'no_channel', 'RUN_ZSCORE': False}. Best is trial 21 with value: 0.6302083333333333.
[I 2026-06-16 01:34:21,362] Trial 35 pruned. 
[I 2026-06-16 01:35:00,091] Trial 36 pruned. 
[I 2026-06-16 01:49:12,787] Trial 37 finished with value: 0.5607638888888888 and parameters: {'FLOW': 9.878817342323998, 'FHIGH': 80.70313672648537, 'LR_EXP': -2.5507146833397987, 'DROPOUT': 0.5800201135700057, 'BETA': 0.5134263960271536, 'SPIKE_GRAD_SLOPE': 8.969454330638753, 'TEMPORAL_FILTERS': 26, 'DEPTH_MULTIPLIER': 2, 'POINTWISE_FILTERS': 20, 'TEMPORAL_KERNEL_DIV': 5, 'SEPARABLE_KERNEL_SIZE': 22, 'POOL1_SIZE': 8, 'POOL2_SIZE': 5, 'NORM_AXIS': 'full', 'RUN_ZSCORE': True}. Best is trial 21 with value: 0.6302083333333333.
[I 2026-06-16 01:49:55,020] Trial 38 pruned. 
[I 2026-06-16 01:50:36,505] Trial 39 pruned. 
[I 2026-06-16 01:51:24,820] Trial 40 pruned. 
[I 2026-06-16 01:52:00,525] Trial 41 pruned. 
[I 2026-06-16 02:05:16,023] Trial 42 finished with value: 0.5694444444444444 and parameters: {'FLOW': 4.931930407692191, 'FHIGH': 63.335574204739075, 'LR_EXP': -2.8040302312651524, 'DROPOUT': 0.48382406880627454, 'BETA': 0.6740044269569446, 'SPIKE_GRAD_SLOPE': 70.11450509260685, 'TEMPORAL_FILTERS': 18, 'DEPTH_MULTIPLIER': 3, 'POINTWISE_FILTERS': 34, 'TEMPORAL_KERNEL_DIV': 4, 'SEPARABLE_KERNEL_SIZE': 8, 'POOL1_SIZE': 4, 'POOL2_SIZE': 8, 'NORM_AXIS': 'no_channel', 'RUN_ZSCORE': True}. Best is trial 21 with value: 0.6302083333333333.
[I 2026-06-16 02:05:50,675] Trial 43 pruned. 
[I 2026-06-16 02:21:57,760] Trial 44 finished with value: 0.4670138888888889 and parameters: {'FLOW': 1.486476133866029, 'FHIGH': 81.32599338102295, 'LR_EXP': -2.2549208676835146, 'DROPOUT': 0.547843059489912, 'BETA': 0.6688826637625805, 'SPIKE_GRAD_SLOPE': 36.52095421170887, 'TEMPORAL_FILTERS': 24, 'DEPTH_MULTIPLIER': 2, 'POINTWISE_FILTERS': 14, 'TEMPORAL_KERNEL_DIV': 3, 'SEPARABLE_KERNEL_SIZE': 19, 'POOL1_SIZE': 8, 'POOL2_SIZE': 7, 'NORM_AXIS': 'full', 'RUN_ZSCORE': False}. Best is trial 21 with value: 0.6302083333333333.
[I 2026-06-16 02:37:40,785] Trial 45 finished with value: 0.576388888888889 and parameters: {'FLOW': 6.780649299634826, 'FHIGH': 64.4235568585316, 'LR_EXP': -3.316213120954955, 'DROPOUT': 0.7300468375911817, 'BETA': 0.8061763622870427, 'SPIKE_GRAD_SLOPE': 16.743190624834362, 'TEMPORAL_FILTERS': 23, 'DEPTH_MULTIPLIER': 2, 'POINTWISE_FILTERS': 9, 'TEMPORAL_KERNEL_DIV': 3, 'SEPARABLE_KERNEL_SIZE': 29, 'POOL1_SIZE': 8, 'POOL2_SIZE': 5, 'NORM_AXIS': 'full', 'RUN_ZSCORE': False}. Best is trial 21 with value: 0.6302083333333333.
[I 2026-06-16 02:38:04,840] Trial 46 pruned. 
[I 2026-06-16 02:38:37,343] Trial 47 pruned. 
[I 2026-06-16 02:54:34,174] Trial 48 finished with value: 0.5555555555555556 and parameters: {'FLOW': 8.160667513569532, 'FHIGH': 73.67163495633564, 'LR_EXP': -2.5222610548263056, 'DROPOUT': 0.7332552625975128, 'BETA': 0.601225567627697, 'SPIKE_GRAD_SLOPE': 35.76183624418438, 'TEMPORAL_FILTERS': 31, 'DEPTH_MULTIPLIER': 2, 'POINTWISE_FILTERS': 11, 'TEMPORAL_KERNEL_DIV': 5, 'SEPARABLE_KERNEL_SIZE': 31, 'POOL1_SIZE': 8, 'POOL2_SIZE': 6, 'NORM_AXIS': 'full', 'RUN_ZSCORE': False}. Best is trial 21 with value: 0.6302083333333333.
[I 2026-06-16 03:10:07,605] Trial 49 finished with value: 0.5798611111111112 and parameters: {'FLOW': 2.5994277230783926, 'FHIGH': 62.61293819231658, 'LR_EXP': -2.011542546301497, 'DROPOUT': 0.5336939237778597, 'BETA': 0.7688747926307131, 'SPIKE_GRAD_SLOPE': 6.376218613925147, 'TEMPORAL_FILTERS': 27, 'DEPTH_MULTIPLIER': 3, 'POINTWISE_FILTERS': 32, 'TEMPORAL_KERNEL_DIV': 7, 'SEPARABLE_KERNEL_SIZE': 15, 'POOL1_SIZE': 3, 'POOL2_SIZE': 8, 'NORM_AXIS': 'full', 'RUN_ZSCORE': False}. Best is trial 21 with value: 0.6302083333333333.
