mkdir: cannot create directory ‘/scratch/mne_data’: Permission denied

[notice] A new release of pip is available: 24.2 -> 26.1.2
[notice] To update, run: pip install --upgrade pip

[notice] A new release of pip is available: 24.2 -> 26.1.2
[notice] To update, run: pip install --upgrade pip
ERROR: Invalid requirement: 'Binary file requirements.txt matches': Expected end or semicolon (after name and no valid version specifier)
    Binary file requirements.txt matches
           ^ (from line 1 of /home/aleksander.berezowsk/requirements_notorch.txt)

[notice] A new release of pip is available: 24.2 -> 26.1.2
[notice] To update, run: pip install --upgrade pip

[notice] A new release of pip is available: 24.2 -> 26.1.2
[notice] To update, run: pip install --upgrade pip
/home/aleksander.berezowsk/spiking-eegnet/src/main.py:97: ExperimentalWarning: Argument ``multivariate`` is an experimental feature. The interface can change in the future.
  sampler=TPESampler(n_startup_trials=tpe_trails, multivariate=True, group=True)
/home/aleksander.berezowsk/spiking-eegnet/src/main.py:97: ExperimentalWarning: Argument ``group`` is an experimental feature. The interface can change in the future.
  sampler=TPESampler(n_startup_trials=tpe_trails, multivariate=True, group=True)
[I 2026-06-29 14:12:14,716] Using an existing study with name 'snn_eegnet_v3_200_20' instead of creating a new one.
[I 2026-06-29 17:57:52,008] Trial 97 finished with value: 0.4782021604938272 and parameters: {'FLOW': 1.4909743275046043, 'FHIGH': 100.29413099344075, 'LR_EXP': -2.718320668651422, 'DROPOUT': 0.1489818470915517, 'BETA': 0.8382295254797923, 'SPIKE_GRAD_SLOPE': 40.23300522807292, 'TEMPORAL_FILTERS': 28, 'DEPTH_MULTIPLIER': 3, 'POINTWISE_FILTERS': 20, 'TEMPORAL_KERNEL_DIV': 6, 'SEPARABLE_KERNEL_SIZE': 29, 'POOL1_SIZE': 3, 'POOL2_SIZE': 8, 'N_STEPS_TRAIN': 14, 'N_STEPS_EVAL': 28, 'READOUT_MODE': 'spk_mean'}. Best is trial 63 with value: 0.4920910493827161.
[I 2026-06-29 21:14:16,793] Trial 100 finished with value: 0.4367283950617284 and parameters: {'FLOW': 1.4101642987167597, 'FHIGH': 77.34489259202269, 'LR_EXP': -2.3763597342196476, 'DROPOUT': 0.3146944563119617, 'BETA': 0.8856160073132531, 'SPIKE_GRAD_SLOPE': 35.62767194071582, 'TEMPORAL_FILTERS': 27, 'DEPTH_MULTIPLIER': 1, 'POINTWISE_FILTERS': 29, 'TEMPORAL_KERNEL_DIV': 4, 'SEPARABLE_KERNEL_SIZE': 22, 'POOL1_SIZE': 3, 'POOL2_SIZE': 6, 'N_STEPS_TRAIN': 15, 'N_STEPS_EVAL': 32, 'READOUT_MODE': 'spk_last'}. Best is trial 63 with value: 0.4920910493827161.
[I 2026-06-29 23:56:58,614] Trial 103 finished with value: 0.46122685185185186 and parameters: {'FLOW': 1.8723652980385495, 'FHIGH': 107.31150784637644, 'LR_EXP': -3.6227051196653774, 'DROPOUT': 0.335630352055342, 'BETA': 0.8841910925025911, 'SPIKE_GRAD_SLOPE': 22.63938137583211, 'TEMPORAL_FILTERS': 17, 'DEPTH_MULTIPLIER': 3, 'POINTWISE_FILTERS': 25, 'TEMPORAL_KERNEL_DIV': 6, 'SEPARABLE_KERNEL_SIZE': 28, 'POOL1_SIZE': 3, 'POOL2_SIZE': 8, 'N_STEPS_TRAIN': 14, 'N_STEPS_EVAL': 31, 'READOUT_MODE': 'spk_last'}. Best is trial 63 with value: 0.4920910493827161.
[I 2026-06-30 02:08:42,695] Trial 106 finished with value: 0.4697145061728395 and parameters: {'FLOW': 1.912343052039586, 'FHIGH': 90.24588236667934, 'LR_EXP': -2.703804476354936, 'DROPOUT': 0.37930215866078, 'BETA': 0.8174442297053707, 'SPIKE_GRAD_SLOPE': 29.14056944925272, 'TEMPORAL_FILTERS': 25, 'DEPTH_MULTIPLIER': 1, 'POINTWISE_FILTERS': 14, 'TEMPORAL_KERNEL_DIV': 8, 'SEPARABLE_KERNEL_SIZE': 19, 'POOL1_SIZE': 5, 'POOL2_SIZE': 8, 'N_STEPS_TRAIN': 12, 'N_STEPS_EVAL': 28, 'READOUT_MODE': 'spk_last'}. Best is trial 63 with value: 0.4920910493827161.
[I 2026-06-30 05:13:08,870] Trial 108 finished with value: 0.48244598765432095 and parameters: {'FLOW': 1.0474949106132923, 'FHIGH': 84.65301341061766, 'LR_EXP': -2.9438665918241287, 'DROPOUT': 0.514521243226085, 'BETA': 0.6712229532408808, 'SPIKE_GRAD_SLOPE': 39.200084177270654, 'TEMPORAL_FILTERS': 26, 'DEPTH_MULTIPLIER': 3, 'POINTWISE_FILTERS': 17, 'TEMPORAL_KERNEL_DIV': 8, 'SEPARABLE_KERNEL_SIZE': 21, 'POOL1_SIZE': 3, 'POOL2_SIZE': 4, 'N_STEPS_TRAIN': 13, 'N_STEPS_EVAL': 16, 'READOUT_MODE': 'spk_sum'}. Best is trial 63 with value: 0.4920910493827161.
[I 2026-06-30 09:00:21,754] Trial 110 finished with value: 0.4645061728395061 and parameters: {'FLOW': 1.5041352886987622, 'FHIGH': 108.08221008825737, 'LR_EXP': -2.4518420544718706, 'DROPOUT': 0.30568578624745757, 'BETA': 0.8547750636186504, 'SPIKE_GRAD_SLOPE': 3.1109779668643203, 'TEMPORAL_FILTERS': 25, 'DEPTH_MULTIPLIER': 3, 'POINTWISE_FILTERS': 16, 'TEMPORAL_KERNEL_DIV': 7, 'SEPARABLE_KERNEL_SIZE': 23, 'POOL1_SIZE': 4, 'POOL2_SIZE': 8, 'N_STEPS_TRAIN': 16, 'N_STEPS_EVAL': 26, 'READOUT_MODE': 'spk_last'}. Best is trial 63 with value: 0.4920910493827161.
slurmstepd: error: *** JOB 44343374 ON fg3 CANCELLED AT 2026-06-30T09:59:55 ***
