[I 2026-06-17 21:02:28,537] Trial 347 pruned. 
[W 2026-06-17 21:02:35,972] Trial 348 failed with parameters: {'FLOW': 4.6759120272080965, 'FHIGH': 55.6883858919746, 'LR_EXP': -2.8360545203370204, 'DROPOUT': 0.44799471801205004, 'BETA': 0.6259142326973528, 'SPIKE_GRAD_SLOPE': 6.527123685047712, 'TEMPORAL_FILTERS': 30, 'DEPTH_MULTIPLIER': 3, 'POINTWISE_FILTERS': 54, 'TEMPORAL_KERNEL_DIV': 6, 'SEPARABLE_KERNEL_SIZE': 14, 'POOL1_SIZE': 5, 'POOL2_SIZE': 6, 'NORM_AXIS': 'full', 'RUN_ZSCORE': False} because of the following error: OutOfMemoryError('CUDA out of memory. Tried to allocate 82.00 MiB. GPU 0 has a total capacity of 15.77 GiB of which 50.19 MiB is free. Including non-PyTorch memory, this process has 15.71 GiB memory in use. Of the allocated memory 14.60 GiB is allocated by PyTorch, and 750.23 MiB is reserved by PyTorch but unallocated. If reserved but unallocated memory is large try setting PYTORCH_CUDA_ALLOC_CONF=expandable_segments:True to avoid fragmentation.  See documentation for Memory Management  (https://pytorch.org/docs/stable/notes/cuda.html#environment-variables)').
Traceback (most recent call last):
  File "/home/aleksander.berezowsk/venv/lib/python3.12/site-packages/optuna/study/_optimize.py", line 206, in _run_trial
    value_or_values = func(trial)
                      ^^^^^^^^^^^
  File "/home/aleksander.berezowsk/spiking-eegnet/src/main.py", line 44, in objective
    return pipeline(**params, **FIXED, trial=trial, save_plots=False)
           ^^^^^^^^^^^^^^^^^^^^^^^^^^^^^^^^^^^^^^^^^^^^^^^^^^^^^^^^^^
  File "/home/aleksander.berezowsk/spiking-eegnet/src/pipeline.py", line 122, in pipeline
    hist_loso, acc_loso, trained_model = experiment_loso(
                                         ^^^^^^^^^^^^^^^^
  File "/home/aleksander.berezowsk/spiking-eegnet/src/experiment_loso.py", line 27, in experiment_loso
    history = run_training(
              ^^^^^^^^^^^^^
  File "/home/aleksander.berezowsk/spiking-eegnet/src/run_training.py", line 45, in run_training
    loss = train_one_epoch(model, train_loader, optimizer, criterion, device, n_steps_train)
           ^^^^^^^^^^^^^^^^^^^^^^^^^^^^^^^^^^^^^^^^^^^^^^^^^^^^^^^^^^^^^^^^^^^^^^^^^^^^^^^^^
  File "/home/aleksander.berezowsk/spiking-eegnet/src/train_one_epoch.py", line 7, in train_one_epoch
    spk = model(xb, num_steps=n_steps)
          ^^^^^^^^^^^^^^^^^^^^^^^^^^^^
  File "/home/aleksander.berezowsk/venv/lib/python3.12/site-packages/torch/nn/modules/module.py", line 1553, in _wrapped_call_impl
    return self._call_impl(*args, **kwargs)
           ^^^^^^^^^^^^^^^^^^^^^^^^^^^^^^^^
  File "/home/aleksander.berezowsk/venv/lib/python3.12/site-packages/torch/nn/modules/module.py", line 1562, in _call_impl
    return forward_call(*args, **kwargs)
           ^^^^^^^^^^^^^^^^^^^^^^^^^^^^^
  File "/home/aleksander.berezowsk/spiking-eegnet/src/spiking_eegnet.py", line 222, in forward
    spk1, mem1 = self.lif1(cur, mem1)
                 ^^^^^^^^^^^^^^^^^^^^
  File "/home/aleksander.berezowsk/venv/lib/python3.12/site-packages/torch/nn/modules/module.py", line 1553, in _wrapped_call_impl
    return self._call_impl(*args, **kwargs)
           ^^^^^^^^^^^^^^^^^^^^^^^^^^^^^^^^
  File "/home/aleksander.berezowsk/venv/lib/python3.12/site-packages/torch/nn/modules/module.py", line 1562, in _call_impl
    return forward_call(*args, **kwargs)
           ^^^^^^^^^^^^^^^^^^^^^^^^^^^^^
  File "/home/aleksander.berezowsk/venv/lib/python3.12/site-packages/snntorch/_neurons/leaky.py", line 220, in forward
    spk = self.fire(self.mem)
          ^^^^^^^^^^^^^^^^^^^
  File "/home/aleksander.berezowsk/venv/lib/python3.12/site-packages/snntorch/_neurons/neurons.py", line 83, in fire
    spk = spk * self.graded_spikes_factor
          ~~~~^~~~~~~~~~~~~~~~~~~~~~~~~~~
torch.OutOfMemoryError: CUDA out of memory. Tried to allocate 82.00 MiB. GPU 0 has a total capacity of 15.77 GiB of which 50.19 MiB is free. Including non-PyTorch memory, this process has 15.71 GiB memory in use. Of the allocated memory 14.60 GiB is allocated by PyTorch, and 750.23 MiB is reserved by PyTorch but unallocated. If reserved but unallocated memory is large try setting PYTORCH_CUDA_ALLOC_CONF=expandable_segments:True to avoid fragmentation.  See documentation for Memory Management  (https://pytorch.org/docs/stable/notes/cuda.html#environment-variables)
[W 2026-06-17 21:02:36,021] Trial 348 failed with value None.
Traceback (most recent call last):
  File "/home/aleksander.berezowsk/spiking-eegnet/src/main.py", line 92, in <module>
    study.optimize(objective, n_trials=n_trials, n_jobs=1,
  File "/home/aleksander.berezowsk/venv/lib/python3.12/site-packages/optuna/study/study.py", line 516, in optimize
    _optimize(
  File "/home/aleksander.berezowsk/venv/lib/python3.12/site-packages/optuna/study/_optimize.py", line 68, in _optimize
    _optimize_sequential(
  File "/home/aleksander.berezowsk/venv/lib/python3.12/site-packages/optuna/study/_optimize.py", line 165, in _optimize_sequential
    frozen_trial_id = _run_trial(study, func, catch)
                      ^^^^^^^^^^^^^^^^^^^^^^^^^^^^^^
  File "/home/aleksander.berezowsk/venv/lib/python3.12/site-packages/optuna/study/_optimize.py", line 263, in _run_trial
    raise func_err
  File "/home/aleksander.berezowsk/venv/lib/python3.12/site-packages/optuna/study/_optimize.py", line 206, in _run_trial
    value_or_values = func(trial)
                      ^^^^^^^^^^^
  File "/home/aleksander.berezowsk/spiking-eegnet/src/main.py", line 44, in objective
    return pipeline(**params, **FIXED, trial=trial, save_plots=False)
           ^^^^^^^^^^^^^^^^^^^^^^^^^^^^^^^^^^^^^^^^^^^^^^^^^^^^^^^^^^
  File "/home/aleksander.berezowsk/spiking-eegnet/src/pipeline.py", line 122, in pipeline
    hist_loso, acc_loso, trained_model = experiment_loso(
                                         ^^^^^^^^^^^^^^^^
  File "/home/aleksander.berezowsk/spiking-eegnet/src/experiment_loso.py", line 27, in experiment_loso
    history = run_training(
              ^^^^^^^^^^^^^
  File "/home/aleksander.berezowsk/spiking-eegnet/src/run_training.py", line 45, in run_training
    loss = train_one_epoch(model, train_loader, optimizer, criterion, device, n_steps_train)
           ^^^^^^^^^^^^^^^^^^^^^^^^^^^^^^^^^^^^^^^^^^^^^^^^^^^^^^^^^^^^^^^^^^^^^^^^^^^^^^^^^
  File "/home/aleksander.berezowsk/spiking-eegnet/src/train_one_epoch.py", line 7, in train_one_epoch
    spk = model(xb, num_steps=n_steps)
          ^^^^^^^^^^^^^^^^^^^^^^^^^^^^
  File "/home/aleksander.berezowsk/venv/lib/python3.12/site-packages/torch/nn/modules/module.py", line 1553, in _wrapped_call_impl
    return self._call_impl(*args, **kwargs)
           ^^^^^^^^^^^^^^^^^^^^^^^^^^^^^^^^
  File "/home/aleksander.berezowsk/venv/lib/python3.12/site-packages/torch/nn/modules/module.py", line 1562, in _call_impl
    return forward_call(*args, **kwargs)
           ^^^^^^^^^^^^^^^^^^^^^^^^^^^^^
  File "/home/aleksander.berezowsk/spiking-eegnet/src/spiking_eegnet.py", line 222, in forward
    spk1, mem1 = self.lif1(cur, mem1)
                 ^^^^^^^^^^^^^^^^^^^^
  File "/home/aleksander.berezowsk/venv/lib/python3.12/site-packages/torch/nn/modules/module.py", line 1553, in _wrapped_call_impl
    return self._call_impl(*args, **kwargs)
           ^^^^^^^^^^^^^^^^^^^^^^^^^^^^^^^^
  File "/home/aleksander.berezowsk/venv/lib/python3.12/site-packages/torch/nn/modules/module.py", line 1562, in _call_impl
    return forward_call(*args, **kwargs)
           ^^^^^^^^^^^^^^^^^^^^^^^^^^^^^
  File "/home/aleksander.berezowsk/venv/lib/python3.12/site-packages/snntorch/_neurons/leaky.py", line 220, in forward
    spk = self.fire(self.mem)
          ^^^^^^^^^^^^^^^^^^^
  File "/home/aleksander.berezowsk/venv/lib/python3.12/site-packages/snntorch/_neurons/neurons.py", line 83, in fire
    spk = spk * self.graded_spikes_factor
          ~~~~^~~~~~~~~~~~~~~~~~~~~~~~~~~
torch.OutOfMemoryError: CUDA out of memory. Tried to allocate 82.00 MiB. GPU 0 has a total capacity of 15.77 GiB of which 50.19 MiB is free. Including non-PyTorch memory, this process has 15.71 GiB memory in use. Of the allocated memory 14.60 GiB is allocated by PyTorch, and 750.23 MiB is reserved by PyTorch but unallocated. If reserved but unallocated memory is large try setting PYTORCH_CUDA_ALLOC_CONF=expandable_segments:True to avoid fragmentation.  See documentation for Memory Management  (https://pytorch.org/docs/stable/notes/cuda.html#environment-variables)
