
[notice] A new release of pip is available: 24.2 -> 26.1.2
[notice] To update, run: pip install --upgrade pip

[notice] A new release of pip is available: 24.2 -> 26.1.2
[notice] To update, run: pip install --upgrade pip
ERROR: Invalid requirement: 'Binary file requirements.txt matches': Expected end or semicolon (after name and no valid version specifier)
    Binary file requirements.txt matches
           ^ (from line 1 of /home/aleksander.berezowsk/requirements_notorch.txt)

[notice] A new release of pip is available: 24.2 -> 26.1.2
[notice] To update, run: pip install --upgrade pip

[notice] A new release of pip is available: 24.2 -> 26.1.2
[notice] To update, run: pip install --upgrade pip
/home/aleksander.berezowsk/spiking-eegnet/src/main.py:86: ExperimentalWarning: Argument ``multivariate`` is an experimental feature. The interface can change in the future.
  sampler=TPESampler(n_startup_trials=tpe_trails, multivariate=True, group=True)
/home/aleksander.berezowsk/spiking-eegnet/src/main.py:86: ExperimentalWarning: Argument ``group`` is an experimental feature. The interface can change in the future.
  sampler=TPESampler(n_startup_trials=tpe_trails, multivariate=True, group=True)
[I 2026-06-18 04:39:29,785] Using an existing study with name 'snn_eegnet_v2_200_20' instead of creating a new one.
[I 2026-06-18 04:55:52,058] Trial 440 finished with value: 0.5381944444444444 and parameters: {'FLOW': 7.159023751685029, 'FHIGH': 75.81961934643842, 'LR_EXP': -2.5954796440462427, 'DROPOUT': 0.6047792628923297, 'BETA': 0.7889419521864047, 'SPIKE_GRAD_SLOPE': 21.924167284218356, 'TEMPORAL_FILTERS': 30, 'DEPTH_MULTIPLIER': 2, 'POINTWISE_FILTERS': 26, 'TEMPORAL_KERNEL_DIV': 4, 'SEPARABLE_KERNEL_SIZE': 22, 'POOL1_SIZE': 8, 'POOL2_SIZE': 4, 'NORM_AXIS': 'full', 'RUN_ZSCORE': True}. Best is trial 314 with value: 0.6423611111111112.
[I 2026-06-18 04:56:33,396] Trial 441 pruned. 
[I 2026-06-18 04:57:01,545] Trial 442 pruned. 
[I 2026-06-18 04:57:28,482] Trial 443 pruned. 
[I 2026-06-18 04:58:13,367] Trial 444 pruned. 
[I 2026-06-18 04:58:44,596] Trial 445 pruned. 
[I 2026-06-18 05:12:10,653] Trial 446 finished with value: 0.5555555555555556 and parameters: {'FLOW': 4.309772600839535, 'FHIGH': 63.99434927321612, 'LR_EXP': -2.0277130853969787, 'DROPOUT': 0.6280736455637008, 'BETA': 0.8083054951125446, 'SPIKE_GRAD_SLOPE': 8.225729005105663, 'TEMPORAL_FILTERS': 19, 'DEPTH_MULTIPLIER': 4, 'POINTWISE_FILTERS': 38, 'TEMPORAL_KERNEL_DIV': 7, 'SEPARABLE_KERNEL_SIZE': 18, 'POOL1_SIZE': 7, 'POOL2_SIZE': 6, 'NORM_AXIS': 'full', 'RUN_ZSCORE': True}. Best is trial 314 with value: 0.6423611111111112.
[I 2026-06-18 05:25:32,886] Trial 447 finished with value: 0.5920138888888888 and parameters: {'FLOW': 9.184556085913695, 'FHIGH': 100.23573926205873, 'LR_EXP': -2.414797078475176, 'DROPOUT': 0.6566875054014032, 'BETA': 0.8370111805600157, 'SPIKE_GRAD_SLOPE': 18.353840369767166, 'TEMPORAL_FILTERS': 18, 'DEPTH_MULTIPLIER': 4, 'POINTWISE_FILTERS': 63, 'TEMPORAL_KERNEL_DIV': 6, 'SEPARABLE_KERNEL_SIZE': 16, 'POOL1_SIZE': 6, 'POOL2_SIZE': 7, 'NORM_AXIS': 'full', 'RUN_ZSCORE': False}. Best is trial 314 with value: 0.6423611111111112.
[I 2026-06-18 05:26:07,901] Trial 448 pruned. 
[I 2026-06-18 05:26:41,566] Trial 449 pruned. 
[I 2026-06-18 05:41:38,674] Trial 450 finished with value: 0.595486111111111 and parameters: {'FLOW': 6.217421233745898, 'FHIGH': 63.90314870053806, 'LR_EXP': -2.271542453920584, 'DROPOUT': 0.6575452326805676, 'BETA': 0.7942602597121947, 'SPIKE_GRAD_SLOPE': 16.195642448374038, 'TEMPORAL_FILTERS': 28, 'DEPTH_MULTIPLIER': 2, 'POINTWISE_FILTERS': 35, 'TEMPORAL_KERNEL_DIV': 5, 'SEPARABLE_KERNEL_SIZE': 27, 'POOL1_SIZE': 7, 'POOL2_SIZE': 4, 'NORM_AXIS': 'full', 'RUN_ZSCORE': False}. Best is trial 314 with value: 0.6423611111111112.
[I 2026-06-18 05:42:08,594] Trial 451 pruned. 
[I 2026-06-18 05:59:24,809] Trial 452 finished with value: 0.5503472222222222 and parameters: {'FLOW': 12.620217263138017, 'FHIGH': 113.29361950186987, 'LR_EXP': -2.142051269445841, 'DROPOUT': 0.37055805582881507, 'BETA': 0.8390248072009333, 'SPIKE_GRAD_SLOPE': 13.142856488793324, 'TEMPORAL_FILTERS': 26, 'DEPTH_MULTIPLIER': 4, 'POINTWISE_FILTERS': 34, 'TEMPORAL_KERNEL_DIV': 5, 'SEPARABLE_KERNEL_SIZE': 13, 'POOL1_SIZE': 6, 'POOL2_SIZE': 7, 'NORM_AXIS': 'full', 'RUN_ZSCORE': False}. Best is trial 314 with value: 0.6423611111111112.
[I 2026-06-18 06:10:21,536] Trial 453 finished with value: 0.5590277777777778 and parameters: {'FLOW': 7.002602363699181, 'FHIGH': 52.50405812969742, 'LR_EXP': -2.5036237805216235, 'DROPOUT': 0.5244899551139386, 'BETA': 0.9504118666802932, 'SPIKE_GRAD_SLOPE': 32.74247374593436, 'TEMPORAL_FILTERS': 14, 'DEPTH_MULTIPLIER': 3, 'POINTWISE_FILTERS': 29, 'TEMPORAL_KERNEL_DIV': 5, 'SEPARABLE_KERNEL_SIZE': 9, 'POOL1_SIZE': 8, 'POOL2_SIZE': 8, 'NORM_AXIS': 'full', 'RUN_ZSCORE': True}. Best is trial 314 with value: 0.6423611111111112.
[I 2026-06-18 06:28:33,986] Trial 454 finished with value: 0.5729166666666666 and parameters: {'FLOW': 7.461055215908139, 'FHIGH': 47.87103059987206, 'LR_EXP': -2.8373034847726455, 'DROPOUT': 0.4983926579329239, 'BETA': 0.600174980953637, 'SPIKE_GRAD_SLOPE': 39.40433477005182, 'TEMPORAL_FILTERS': 32, 'DEPTH_MULTIPLIER': 3, 'POINTWISE_FILTERS': 12, 'TEMPORAL_KERNEL_DIV': 5, 'SEPARABLE_KERNEL_SIZE': 31, 'POOL1_SIZE': 7, 'POOL2_SIZE': 4, 'NORM_AXIS': 'full', 'RUN_ZSCORE': False}. Best is trial 314 with value: 0.6423611111111112.
[I 2026-06-18 06:29:09,560] Trial 455 pruned. 
[I 2026-06-18 06:29:46,483] Trial 456 pruned. 
[I 2026-06-18 06:30:29,659] Trial 457 pruned. 
[I 2026-06-18 06:31:06,570] Trial 458 pruned. 
[I 2026-06-18 06:49:36,534] Trial 459 finished with value: 0.5329861111111112 and parameters: {'FLOW': 10.052447433548362, 'FHIGH': 76.33100970192682, 'LR_EXP': -2.7609523809316836, 'DROPOUT': 0.6566162874875565, 'BETA': 0.5076122205165396, 'SPIKE_GRAD_SLOPE': 16.351445663708187, 'TEMPORAL_FILTERS': 30, 'DEPTH_MULTIPLIER': 4, 'POINTWISE_FILTERS': 44, 'TEMPORAL_KERNEL_DIV': 7, 'SEPARABLE_KERNEL_SIZE': 28, 'POOL1_SIZE': 7, 'POOL2_SIZE': 7, 'NORM_AXIS': 'full', 'RUN_ZSCORE': True}. Best is trial 314 with value: 0.6423611111111112.
[I 2026-06-18 06:50:10,414] Trial 460 pruned. 
[I 2026-06-18 07:04:04,876] Trial 461 finished with value: 0.6545138888888888 and parameters: {'FLOW': 9.98476295628325, 'FHIGH': 86.53992978790373, 'LR_EXP': -2.687453784676054, 'DROPOUT': 0.6059188094480437, 'BETA': 0.8835924506750911, 'SPIKE_GRAD_SLOPE': 7.29815471781145, 'TEMPORAL_FILTERS': 28, 'DEPTH_MULTIPLIER': 2, 'POINTWISE_FILTERS': 36, 'TEMPORAL_KERNEL_DIV': 8, 'SEPARABLE_KERNEL_SIZE': 4, 'POOL1_SIZE': 6, 'POOL2_SIZE': 4, 'NORM_AXIS': 'no_channel', 'RUN_ZSCORE': False}. Best is trial 461 with value: 0.6545138888888888.
[I 2026-06-18 07:04:45,311] Trial 462 pruned. 
[I 2026-06-18 07:15:53,841] Trial 463 finished with value: 0.5086805555555556 and parameters: {'FLOW': 8.295973982194933, 'FHIGH': 66.57861902138963, 'LR_EXP': -2.0993618976447403, 'DROPOUT': 0.43051857275360544, 'BETA': 0.9287478343974077, 'SPIKE_GRAD_SLOPE': 7.766641874352821, 'TEMPORAL_FILTERS': 17, 'DEPTH_MULTIPLIER': 3, 'POINTWISE_FILTERS': 11, 'TEMPORAL_KERNEL_DIV': 8, 'SEPARABLE_KERNEL_SIZE': 6, 'POOL1_SIZE': 8, 'POOL2_SIZE': 8, 'NORM_AXIS': 'full', 'RUN_ZSCORE': False}. Best is trial 461 with value: 0.6545138888888888.
[I 2026-06-18 07:16:21,528] Trial 464 pruned. 
[I 2026-06-18 07:16:56,021] Trial 465 pruned. 
[I 2026-06-18 07:17:32,575] Trial 466 pruned. 
[I 2026-06-18 07:18:05,459] Trial 467 pruned. 
[I 2026-06-18 07:18:38,189] Trial 468 pruned. 
[I 2026-06-18 07:32:03,858] Trial 469 finished with value: 0.5868055555555556 and parameters: {'FLOW': 10.184872446928631, 'FHIGH': 83.07939667118609, 'LR_EXP': -2.37155371444964, 'DROPOUT': 0.664929399793295, 'BETA': 0.7235324987372621, 'SPIKE_GRAD_SLOPE': 11.256076574978977, 'TEMPORAL_FILTERS': 31, 'DEPTH_MULTIPLIER': 1, 'POINTWISE_FILTERS': 29, 'TEMPORAL_KERNEL_DIV': 7, 'SEPARABLE_KERNEL_SIZE': 7, 'POOL1_SIZE': 7, 'POOL2_SIZE': 3, 'NORM_AXIS': 'no_channel', 'RUN_ZSCORE': False}. Best is trial 461 with value: 0.6545138888888888.
[I 2026-06-18 07:49:53,957] Trial 470 finished with value: 0.6284722222222222 and parameters: {'FLOW': 1.8112024638069129, 'FHIGH': 57.745390559568335, 'LR_EXP': -2.7627842006264607, 'DROPOUT': 0.7220470407124576, 'BETA': 0.5848269695347875, 'SPIKE_GRAD_SLOPE': 5.964734209914203, 'TEMPORAL_FILTERS': 28, 'DEPTH_MULTIPLIER': 4, 'POINTWISE_FILTERS': 40, 'TEMPORAL_KERNEL_DIV': 6, 'SEPARABLE_KERNEL_SIZE': 17, 'POOL1_SIZE': 7, 'POOL2_SIZE': 5, 'NORM_AXIS': 'no_channel', 'RUN_ZSCORE': False}. Best is trial 461 with value: 0.6545138888888888.
[I 2026-06-18 07:51:54,021] Trial 471 pruned. 
[I 2026-06-18 08:08:26,505] Trial 472 finished with value: 0.5381944444444444 and parameters: {'FLOW': 4.748553547919067, 'FHIGH': 69.80888271446614, 'LR_EXP': -2.894663816901159, 'DROPOUT': 0.43776892777524845, 'BETA': 0.7145521404372577, 'SPIKE_GRAD_SLOPE': 7.5464999492767895, 'TEMPORAL_FILTERS': 25, 'DEPTH_MULTIPLIER': 4, 'POINTWISE_FILTERS': 33, 'TEMPORAL_KERNEL_DIV': 6, 'SEPARABLE_KERNEL_SIZE': 14, 'POOL1_SIZE': 4, 'POOL2_SIZE': 8, 'NORM_AXIS': 'full', 'RUN_ZSCORE': True}. Best is trial 461 with value: 0.6545138888888888.
[I 2026-06-18 08:09:00,276] Trial 473 pruned. 
[I 2026-06-18 08:09:37,011] Trial 474 pruned. 
[I 2026-06-18 08:10:16,497] Trial 475 pruned. 
[I 2026-06-18 08:10:45,706] Trial 476 pruned. 
[I 2026-06-18 08:11:18,382] Trial 477 pruned. 
[I 2026-06-18 08:11:47,812] Trial 478 pruned. 
[I 2026-06-18 08:12:17,138] Trial 479 pruned. 
[I 2026-06-18 08:12:48,581] Trial 480 pruned. 
[I 2026-06-18 08:33:07,853] Trial 481 finished with value: 0.5625 and parameters: {'FLOW': 4.16772555203342, 'FHIGH': 65.17732365613138, 'LR_EXP': -2.6282634696234615, 'DROPOUT': 0.7281331643054181, 'BETA': 0.5893148577767143, 'SPIKE_GRAD_SLOPE': 11.823098463011744, 'TEMPORAL_FILTERS': 31, 'DEPTH_MULTIPLIER': 4, 'POINTWISE_FILTERS': 41, 'TEMPORAL_KERNEL_DIV': 4, 'SEPARABLE_KERNEL_SIZE': 26, 'POOL1_SIZE': 7, 'POOL2_SIZE': 5, 'NORM_AXIS': 'no_channel', 'RUN_ZSCORE': False}. Best is trial 461 with value: 0.6545138888888888.
[I 2026-06-18 08:33:40,385] Trial 482 pruned. 
[I 2026-06-18 08:34:22,602] Trial 483 pruned. 
[I 2026-06-18 08:35:00,508] Trial 484 pruned. 
[I 2026-06-18 08:35:35,577] Trial 485 pruned. 
[I 2026-06-18 08:36:10,544] Trial 486 pruned. 
[I 2026-06-18 08:49:22,460] Trial 487 finished with value: 0.6267361111111112 and parameters: {'FLOW': 5.603624405907541, 'FHIGH': 99.73672627322767, 'LR_EXP': -2.486436278655655, 'DROPOUT': 0.6904512788776227, 'BETA': 0.8194710982349638, 'SPIKE_GRAD_SLOPE': 5.941976741901994, 'TEMPORAL_FILTERS': 22, 'DEPTH_MULTIPLIER': 3, 'POINTWISE_FILTERS': 37, 'TEMPORAL_KERNEL_DIV': 8, 'SEPARABLE_KERNEL_SIZE': 5, 'POOL1_SIZE': 6, 'POOL2_SIZE': 4, 'NORM_AXIS': 'full', 'RUN_ZSCORE': False}. Best is trial 461 with value: 0.6545138888888888.
[I 2026-06-18 09:00:28,838] Trial 488 finished with value: 0.5763888888888888 and parameters: {'FLOW': 6.483055320207657, 'FHIGH': 85.56009888333578, 'LR_EXP': -2.341304704753627, 'DROPOUT': 0.6211774648009474, 'BETA': 0.6755753210491049, 'SPIKE_GRAD_SLOPE': 8.932935344330273, 'TEMPORAL_FILTERS': 19, 'DEPTH_MULTIPLIER': 2, 'POINTWISE_FILTERS': 36, 'TEMPORAL_KERNEL_DIV': 7, 'SEPARABLE_KERNEL_SIZE': 5, 'POOL1_SIZE': 6, 'POOL2_SIZE': 3, 'NORM_AXIS': 'full', 'RUN_ZSCORE': False}. Best is trial 461 with value: 0.6545138888888888.
[I 2026-06-18 09:00:59,320] Trial 489 pruned. 
[I 2026-06-18 09:12:52,816] Trial 490 finished with value: 0.48958333333333337 and parameters: {'FLOW': 5.493262082671957, 'FHIGH': 68.11279363520846, 'LR_EXP': -2.63923850167118, 'DROPOUT': 0.4750855434282951, 'BETA': 0.812812300397369, 'SPIKE_GRAD_SLOPE': 9.199420300943713, 'TEMPORAL_FILTERS': 16, 'DEPTH_MULTIPLIER': 4, 'POINTWISE_FILTERS': 43, 'TEMPORAL_KERNEL_DIV': 8, 'SEPARABLE_KERNEL_SIZE': 19, 'POOL1_SIZE': 3, 'POOL2_SIZE': 3, 'NORM_AXIS': 'no_channel', 'RUN_ZSCORE': False}. Best is trial 461 with value: 0.6545138888888888.
[I 2026-06-18 09:13:20,288] Trial 491 pruned. 
[I 2026-06-18 09:13:45,146] Trial 492 pruned. 
[I 2026-06-18 09:14:25,950] Trial 493 pruned. 
[I 2026-06-18 09:14:56,574] Trial 494 pruned. 
[I 2026-06-18 09:15:37,574] Trial 495 pruned. 
[I 2026-06-18 09:15:59,193] Trial 496 pruned. 
[I 2026-06-18 09:16:31,164] Trial 497 pruned. 
[I 2026-06-18 09:17:12,579] Trial 498 pruned. 
[I 2026-06-18 09:17:44,594] Trial 499 pruned. 
[I 2026-06-18 09:18:18,536] Trial 500 pruned. 
[I 2026-06-18 09:31:47,801] Trial 501 finished with value: 0.5694444444444444 and parameters: {'FLOW': 7.602279688253693, 'FHIGH': 102.30858290853214, 'LR_EXP': -2.1877470991012715, 'DROPOUT': 0.5768923485512873, 'BETA': 0.9775475474200153, 'SPIKE_GRAD_SLOPE': 7.325838788265738, 'TEMPORAL_FILTERS': 23, 'DEPTH_MULTIPLIER': 3, 'POINTWISE_FILTERS': 37, 'TEMPORAL_KERNEL_DIV': 8, 'SEPARABLE_KERNEL_SIZE': 4, 'POOL1_SIZE': 5, 'POOL2_SIZE': 6, 'NORM_AXIS': 'no_channel', 'RUN_ZSCORE': False}. Best is trial 461 with value: 0.6545138888888888.
[I 2026-06-18 09:32:12,958] Trial 502 pruned. 
[I 2026-06-18 09:32:47,689] Trial 503 pruned. 
[I 2026-06-18 09:33:32,325] Trial 504 pruned. 
[I 2026-06-18 09:34:05,395] Trial 505 pruned. 
[I 2026-06-18 09:34:41,774] Trial 506 pruned. 
[I 2026-06-18 09:35:24,964] Trial 507 pruned. 
[I 2026-06-18 09:49:25,593] Trial 508 finished with value: 0.5868055555555556 and parameters: {'FLOW': 5.282746069728507, 'FHIGH': 116.94793781795204, 'LR_EXP': -2.7375233023149805, 'DROPOUT': 0.6957372337529631, 'BETA': 0.7968129879780651, 'SPIKE_GRAD_SLOPE': 28.011040406122248, 'TEMPORAL_FILTERS': 21, 'DEPTH_MULTIPLIER': 4, 'POINTWISE_FILTERS': 42, 'TEMPORAL_KERNEL_DIV': 8, 'SEPARABLE_KERNEL_SIZE': 8, 'POOL1_SIZE': 6, 'POOL2_SIZE': 4, 'NORM_AXIS': 'full', 'RUN_ZSCORE': False}. Best is trial 461 with value: 0.6545138888888888.
[I 2026-06-18 10:02:10,907] Trial 509 finished with value: 0.6284722222222222 and parameters: {'FLOW': 10.106612527929236, 'FHIGH': 64.77339755268925, 'LR_EXP': -2.315940655465845, 'DROPOUT': 0.7111287652048208, 'BETA': 0.932408739705785, 'SPIKE_GRAD_SLOPE': 12.096283813174994, 'TEMPORAL_FILTERS': 21, 'DEPTH_MULTIPLIER': 3, 'POINTWISE_FILTERS': 31, 'TEMPORAL_KERNEL_DIV': 8, 'SEPARABLE_KERNEL_SIZE': 11, 'POOL1_SIZE': 6, 'POOL2_SIZE': 5, 'NORM_AXIS': 'no_channel', 'RUN_ZSCORE': False}. Best is trial 461 with value: 0.6545138888888888.
[I 2026-06-18 10:02:49,953] Trial 510 pruned. 
[I 2026-06-18 10:23:00,834] Trial 511 finished with value: 0.5902777777777778 and parameters: {'FLOW': 9.037159626341333, 'FHIGH': 66.58261948779767, 'LR_EXP': -2.807153341764604, 'DROPOUT': 0.46473770611537035, 'BETA': 0.8169818390467112, 'SPIKE_GRAD_SLOPE': 16.781169068759375, 'TEMPORAL_FILTERS': 31, 'DEPTH_MULTIPLIER': 4, 'POINTWISE_FILTERS': 9, 'TEMPORAL_KERNEL_DIV': 4, 'SEPARABLE_KERNEL_SIZE': 13, 'POOL1_SIZE': 7, 'POOL2_SIZE': 7, 'NORM_AXIS': 'full', 'RUN_ZSCORE': False}. Best is trial 461 with value: 0.6545138888888888.
[I 2026-06-18 10:23:45,969] Trial 512 pruned. 
[I 2026-06-18 10:24:08,483] Trial 513 pruned. 
[I 2026-06-18 10:36:21,625] Trial 514 finished with value: 0.5711805555555556 and parameters: {'FLOW': 6.735596211841404, 'FHIGH': 103.6563768124002, 'LR_EXP': -2.8127335194528134, 'DROPOUT': 0.34436882353312254, 'BETA': 0.9193170175990694, 'SPIKE_GRAD_SLOPE': 11.017715846215886, 'TEMPORAL_FILTERS': 23, 'DEPTH_MULTIPLIER': 2, 'POINTWISE_FILTERS': 42, 'TEMPORAL_KERNEL_DIV': 8, 'SEPARABLE_KERNEL_SIZE': 8, 'POOL1_SIZE': 7, 'POOL2_SIZE': 2, 'NORM_AXIS': 'no_channel', 'RUN_ZSCORE': True}. Best is trial 461 with value: 0.6545138888888888.
[I 2026-06-18 10:55:45,955] Trial 515 finished with value: 0.5347222222222222 and parameters: {'FLOW': 6.5397097080713795, 'FHIGH': 68.32354283734448, 'LR_EXP': -2.4969598964165396, 'DROPOUT': 0.4203736148044602, 'BETA': 0.6713401378891647, 'SPIKE_GRAD_SLOPE': 19.434617716315326, 'TEMPORAL_FILTERS': 25, 'DEPTH_MULTIPLIER': 4, 'POINTWISE_FILTERS': 26, 'TEMPORAL_KERNEL_DIV': 3, 'SEPARABLE_KERNEL_SIZE': 14, 'POOL1_SIZE': 8, 'POOL2_SIZE': 8, 'NORM_AXIS': 'full', 'RUN_ZSCORE': True}. Best is trial 461 with value: 0.6545138888888888.
[I 2026-06-18 10:58:41,341] Trial 516 pruned. 
[I 2026-06-18 10:59:13,659] Trial 517 pruned. 
[I 2026-06-18 10:59:56,106] Trial 518 pruned. 
[I 2026-06-18 11:11:40,032] Trial 519 finished with value: 0.6024305555555556 and parameters: {'FLOW': 6.785000484201003, 'FHIGH': 81.18971943774993, 'LR_EXP': -2.91674271716767, 'DROPOUT': 0.47939004469344, 'BETA': 0.7641315099116743, 'SPIKE_GRAD_SLOPE': 19.61048523284896, 'TEMPORAL_FILTERS': 16, 'DEPTH_MULTIPLIER': 4, 'POINTWISE_FILTERS': 41, 'TEMPORAL_KERNEL_DIV': 8, 'SEPARABLE_KERNEL_SIZE': 16, 'POOL1_SIZE': 8, 'POOL2_SIZE': 5, 'NORM_AXIS': 'full', 'RUN_ZSCORE': False}. Best is trial 461 with value: 0.6545138888888888.
[I 2026-06-18 11:12:10,144] Trial 520 pruned. 
[I 2026-06-18 11:12:42,105] Trial 521 pruned. 
[I 2026-06-18 11:30:25,224] Trial 522 finished with value: 0.5121527777777778 and parameters: {'FLOW': 5.938613189905814, 'FHIGH': 64.23306615769692, 'LR_EXP': -2.4113695115086276, 'DROPOUT': 0.73077871703631, 'BETA': 0.6338020916244727, 'SPIKE_GRAD_SLOPE': 9.166757986049202, 'TEMPORAL_FILTERS': 27, 'DEPTH_MULTIPLIER': 4, 'POINTWISE_FILTERS': 41, 'TEMPORAL_KERNEL_DIV': 5, 'SEPARABLE_KERNEL_SIZE': 17, 'POOL1_SIZE': 8, 'POOL2_SIZE': 3, 'NORM_AXIS': 'no_channel', 'RUN_ZSCORE': False}. Best is trial 461 with value: 0.6545138888888888.
[I 2026-06-18 11:31:07,822] Trial 523 pruned. 
[I 2026-06-18 11:31:35,841] Trial 524 pruned. 
[I 2026-06-18 11:32:01,435] Trial 525 pruned. 
