mkdir: cannot create directory ‘/scratch/mne_data’: Permission denied

[notice] A new release of pip is available: 24.2 -> 26.1.2
[notice] To update, run: pip install --upgrade pip

[notice] A new release of pip is available: 24.2 -> 26.1.2
[notice] To update, run: pip install --upgrade pip
ERROR: Invalid requirement: 'Binary file requirements.txt matches': Expected end or semicolon (after name and no valid version specifier)
    Binary file requirements.txt matches
           ^ (from line 1 of /home/aleksander.berezowsk/requirements_notorch.txt)

[notice] A new release of pip is available: 24.2 -> 26.1.2
[notice] To update, run: pip install --upgrade pip

[notice] A new release of pip is available: 24.2 -> 26.1.2
[notice] To update, run: pip install --upgrade pip
/home/aleksander.berezowsk/spiking-eegnet/src/main.py:97: ExperimentalWarning: Argument ``multivariate`` is an experimental feature. The interface can change in the future.
  sampler=TPESampler(n_startup_trials=tpe_trails, multivariate=True, group=True)
/home/aleksander.berezowsk/spiking-eegnet/src/main.py:97: ExperimentalWarning: Argument ``group`` is an experimental feature. The interface can change in the future.
  sampler=TPESampler(n_startup_trials=tpe_trails, multivariate=True, group=True)
[I 2026-06-27 22:02:59,054] Using an existing study with name 'snn_eegnet_v3_200_20' instead of creating a new one.
[I 2026-06-27 23:32:15,497] Trial 43 finished with value: 0.46932870370370366 and parameters: {'FLOW': 2.2821687646264572, 'FHIGH': 27.525920966608492, 'LR_EXP': -2.0621543834501788, 'DROPOUT': 0.45250032041107435, 'BETA': 0.9305830402788517, 'SPIKE_GRAD_SLOPE': 0.23318591311551828, 'TEMPORAL_FILTERS': 23, 'DEPTH_MULTIPLIER': 2, 'POINTWISE_FILTERS': 10, 'TEMPORAL_KERNEL_DIV': 8, 'SEPARABLE_KERNEL_SIZE': 20, 'POOL1_SIZE': 6, 'POOL2_SIZE': 4, 'N_STEPS_TRAIN': 7, 'N_STEPS_EVAL': 28, 'READOUT_MODE': 'spk_last'}. Best is trial 11 with value: 0.4870756172839506.
[I 2026-06-28 02:37:41,392] Trial 46 finished with value: 0.4575617283950617 and parameters: {'FLOW': 1.4404908904916442, 'FHIGH': 117.68818292807693, 'LR_EXP': -3.0953038025026274, 'DROPOUT': 0.5592871606661967, 'BETA': 0.6015457511319238, 'SPIKE_GRAD_SLOPE': 52.5971947841014, 'TEMPORAL_FILTERS': 22, 'DEPTH_MULTIPLIER': 2, 'POINTWISE_FILTERS': 14, 'TEMPORAL_KERNEL_DIV': 7, 'SEPARABLE_KERNEL_SIZE': 22, 'POOL1_SIZE': 6, 'POOL2_SIZE': 4, 'N_STEPS_TRAIN': 16, 'N_STEPS_EVAL': 29, 'READOUT_MODE': 'spk_sum'}. Best is trial 11 with value: 0.4870756172839506.
[I 2026-06-28 04:02:39,671] Trial 51 finished with value: 0.45794753086419754 and parameters: {'FLOW': 1.1913621607092997, 'FHIGH': 92.52395659359513, 'LR_EXP': -2.5855460828984995, 'DROPOUT': 0.47795546543917056, 'BETA': 0.8019290410213175, 'SPIKE_GRAD_SLOPE': 17.57106129471795, 'TEMPORAL_FILTERS': 31, 'DEPTH_MULTIPLIER': 1, 'POINTWISE_FILTERS': 15, 'TEMPORAL_KERNEL_DIV': 6, 'SEPARABLE_KERNEL_SIZE': 29, 'POOL1_SIZE': 7, 'POOL2_SIZE': 2, 'N_STEPS_TRAIN': 6, 'N_STEPS_EVAL': 21, 'READOUT_MODE': 'spk_mean'}. Best is trial 11 with value: 0.4870756172839506.
[I 2026-06-28 05:05:02,315] Trial 54 pruned. 
[I 2026-06-28 07:06:19,992] Trial 56 finished with value: 0.48321759259259256 and parameters: {'FLOW': 1.3352656843825932, 'FHIGH': 36.41751467355253, 'LR_EXP': -2.4999430075692706, 'DROPOUT': 0.11087305134269904, 'BETA': 0.957109981113139, 'SPIKE_GRAD_SLOPE': 7.19460193838484, 'TEMPORAL_FILTERS': 30, 'DEPTH_MULTIPLIER': 2, 'POINTWISE_FILTERS': 29, 'TEMPORAL_KERNEL_DIV': 6, 'SEPARABLE_KERNEL_SIZE': 28, 'POOL1_SIZE': 7, 'POOL2_SIZE': 5, 'N_STEPS_TRAIN': 8, 'N_STEPS_EVAL': 19, 'READOUT_MODE': 'spk_mean'}. Best is trial 53 with value: 0.48900462962962965.
[I 2026-06-28 08:45:21,936] Trial 59 finished with value: 0.4592978395061728 and parameters: {'FLOW': 2.599504984057143, 'FHIGH': 37.165324191336616, 'LR_EXP': -2.962726500967186, 'DROPOUT': 0.17601377823980646, 'BETA': 0.9606779272379216, 'SPIKE_GRAD_SLOPE': 11.975793935278844, 'TEMPORAL_FILTERS': 27, 'DEPTH_MULTIPLIER': 2, 'POINTWISE_FILTERS': 34, 'TEMPORAL_KERNEL_DIV': 5, 'SEPARABLE_KERNEL_SIZE': 32, 'POOL1_SIZE': 6, 'POOL2_SIZE': 5, 'N_STEPS_TRAIN': 7, 'N_STEPS_EVAL': 12, 'READOUT_MODE': 'spk_mean'}. Best is trial 53 with value: 0.48900462962962965.
[I 2026-06-28 11:00:46,449] Trial 62 finished with value: 0.4592978395061728 and parameters: {'FLOW': 1.8293704521113248, 'FHIGH': 12.40093879966015, 'LR_EXP': -2.8490212363917258, 'DROPOUT': 0.1625877308353125, 'BETA': 0.7819979530711175, 'SPIKE_GRAD_SLOPE': 4.317325540647649, 'TEMPORAL_FILTERS': 29, 'DEPTH_MULTIPLIER': 2, 'POINTWISE_FILTERS': 35, 'TEMPORAL_KERNEL_DIV': 6, 'SEPARABLE_KERNEL_SIZE': 27, 'POOL1_SIZE': 7, 'POOL2_SIZE': 7, 'N_STEPS_TRAIN': 9, 'N_STEPS_EVAL': 26, 'READOUT_MODE': 'mem_last'}. Best is trial 53 with value: 0.48900462962962965.
[I 2026-06-28 12:27:59,803] Trial 65 finished with value: 0.46643518518518523 and parameters: {'FLOW': 1.8948269469532297, 'FHIGH': 53.76828580458529, 'LR_EXP': -2.316116175798358, 'DROPOUT': 0.1165558356260708, 'BETA': 0.8468437254057647, 'SPIKE_GRAD_SLOPE': 1.0575701330811693, 'TEMPORAL_FILTERS': 25, 'DEPTH_MULTIPLIER': 2, 'POINTWISE_FILTERS': 22, 'TEMPORAL_KERNEL_DIV': 8, 'SEPARABLE_KERNEL_SIZE': 25, 'POOL1_SIZE': 5, 'POOL2_SIZE': 4, 'N_STEPS_TRAIN': 7, 'N_STEPS_EVAL': 12, 'READOUT_MODE': 'spk_mean'}. Best is trial 61 with value: 0.4911265432098765.
[I 2026-06-28 15:25:40,653] Trial 67 finished with value: 0.45775462962962965 and parameters: {'FLOW': 2.7925961312996495, 'FHIGH': 88.73665456257048, 'LR_EXP': -2.7239273596700775, 'DROPOUT': 0.27830365804313817, 'BETA': 0.7722553736070443, 'SPIKE_GRAD_SLOPE': 54.21074682456219, 'TEMPORAL_FILTERS': 25, 'DEPTH_MULTIPLIER': 4, 'POINTWISE_FILTERS': 33, 'TEMPORAL_KERNEL_DIV': 6, 'SEPARABLE_KERNEL_SIZE': 25, 'POOL1_SIZE': 5, 'POOL2_SIZE': 8, 'N_STEPS_TRAIN': 11, 'N_STEPS_EVAL': 18, 'READOUT_MODE': 'spk_mean'}. Best is trial 63 with value: 0.4920910493827161.
[W 2026-06-28 15:25:47,898] Trial 73 failed with parameters: {'FLOW': 2.517173293672174, 'FHIGH': 115.70096293806404, 'LR_EXP': -2.258846772608238, 'DROPOUT': 0.17023803249764047, 'BETA': 0.9634565547608698, 'SPIKE_GRAD_SLOPE': 14.840635592045329, 'TEMPORAL_FILTERS': 29, 'DEPTH_MULTIPLIER': 3, 'POINTWISE_FILTERS': 29, 'TEMPORAL_KERNEL_DIV': 8, 'SEPARABLE_KERNEL_SIZE': 22, 'POOL1_SIZE': 6, 'POOL2_SIZE': 7, 'N_STEPS_TRAIN': 12, 'N_STEPS_EVAL': 23, 'READOUT_MODE': 'mem_last'} because of the following error: OutOfMemoryError('CUDA out of memory. Tried to allocate 78.00 MiB. GPU 0 has a total capacity of 15.77 GiB of which 52.19 MiB is free. Including non-PyTorch memory, this process has 15.71 GiB memory in use. Of the allocated memory 14.81 GiB is allocated by PyTorch, and 532.06 MiB is reserved by PyTorch but unallocated. If reserved but unallocated memory is large try setting PYTORCH_CUDA_ALLOC_CONF=expandable_segments:True to avoid fragmentation.  See documentation for Memory Management  (https://pytorch.org/docs/stable/notes/cuda.html#environment-variables)').
Traceback (most recent call last):
  File "/home/aleksander.berezowsk/venv/lib/python3.12/site-packages/optuna/study/_optimize.py", line 206, in _run_trial
    value_or_values = func(trial)
                      ^^^^^^^^^^^
  File "/home/aleksander.berezowsk/spiking-eegnet/src/main.py", line 52, in objective
    return pipeline(**params, **FIXED, trial=trial, save_plots=False)
           ^^^^^^^^^^^^^^^^^^^^^^^^^^^^^^^^^^^^^^^^^^^^^^^^^^^^^^^^^^
  File "/home/aleksander.berezowsk/spiking-eegnet/src/pipeline.py", line 143, in pipeline
    histories, accs, mean_acc = experiment_loso_all(
                                ^^^^^^^^^^^^^^^^^^^^
  File "/home/aleksander.berezowsk/spiking-eegnet/src/experiment_loso.py", line 71, in experiment_loso_all
    history, final_acc, _model = experiment_loso(
                                 ^^^^^^^^^^^^^^^^
  File "/home/aleksander.berezowsk/spiking-eegnet/src/experiment_loso.py", line 30, in experiment_loso
    history = run_training(
              ^^^^^^^^^^^^^
  File "/home/aleksander.berezowsk/spiking-eegnet/src/run_training.py", line 50, in run_training
    loss = train_one_epoch(model, train_loader, optimizer, criterion, device,
           ^^^^^^^^^^^^^^^^^^^^^^^^^^^^^^^^^^^^^^^^^^^^^^^^^^^^^^^^^^^^^^^^^^
  File "/home/aleksander.berezowsk/spiking-eegnet/src/train_one_epoch.py", line 53, in train_one_epoch
    spk, mem = model(xb, num_steps=n_steps)
               ^^^^^^^^^^^^^^^^^^^^^^^^^^^^
  File "/home/aleksander.berezowsk/venv/lib/python3.12/site-packages/torch/nn/modules/module.py", line 1553, in _wrapped_call_impl
    return self._call_impl(*args, **kwargs)
           ^^^^^^^^^^^^^^^^^^^^^^^^^^^^^^^^
  File "/home/aleksander.berezowsk/venv/lib/python3.12/site-packages/torch/nn/modules/module.py", line 1562, in _call_impl
    return forward_call(*args, **kwargs)
           ^^^^^^^^^^^^^^^^^^^^^^^^^^^^^
  File "/home/aleksander.berezowsk/spiking-eegnet/src/spiking_eegnet.py", line 233, in forward
    spk1, mem1 = self.lif1(cur, mem1)
                 ^^^^^^^^^^^^^^^^^^^^
  File "/home/aleksander.berezowsk/venv/lib/python3.12/site-packages/torch/nn/modules/module.py", line 1553, in _wrapped_call_impl
    return self._call_impl(*args, **kwargs)
           ^^^^^^^^^^^^^^^^^^^^^^^^^^^^^^^^
  File "/home/aleksander.berezowsk/venv/lib/python3.12/site-packages/torch/nn/modules/module.py", line 1562, in _call_impl
    return forward_call(*args, **kwargs)
           ^^^^^^^^^^^^^^^^^^^^^^^^^^^^^
  File "/home/aleksander.berezowsk/venv/lib/python3.12/site-packages/snntorch/_neurons/leaky.py", line 220, in forward
    spk = self.fire(self.mem)
          ^^^^^^^^^^^^^^^^^^^
  File "/home/aleksander.berezowsk/venv/lib/python3.12/site-packages/snntorch/_neurons/neurons.py", line 83, in fire
    spk = spk * self.graded_spikes_factor
          ~~~~^~~~~~~~~~~~~~~~~~~~~~~~~~~
torch.OutOfMemoryError: CUDA out of memory. Tried to allocate 78.00 MiB. GPU 0 has a total capacity of 15.77 GiB of which 52.19 MiB is free. Including non-PyTorch memory, this process has 15.71 GiB memory in use. Of the allocated memory 14.81 GiB is allocated by PyTorch, and 532.06 MiB is reserved by PyTorch but unallocated. If reserved but unallocated memory is large try setting PYTORCH_CUDA_ALLOC_CONF=expandable_segments:True to avoid fragmentation.  See documentation for Memory Management  (https://pytorch.org/docs/stable/notes/cuda.html#environment-variables)
[W 2026-06-28 15:25:47,931] Trial 73 failed with value None.
Traceback (most recent call last):
  File "/home/aleksander.berezowsk/spiking-eegnet/src/main.py", line 103, in <module>
    study.optimize(objective, n_trials=n_trials, n_jobs=1,
  File "/home/aleksander.berezowsk/venv/lib/python3.12/site-packages/optuna/study/study.py", line 516, in optimize
    _optimize(
  File "/home/aleksander.berezowsk/venv/lib/python3.12/site-packages/optuna/study/_optimize.py", line 68, in _optimize
    _optimize_sequential(
  File "/home/aleksander.berezowsk/venv/lib/python3.12/site-packages/optuna/study/_optimize.py", line 165, in _optimize_sequential
    frozen_trial_id = _run_trial(study, func, catch)
                      ^^^^^^^^^^^^^^^^^^^^^^^^^^^^^^
  File "/home/aleksander.berezowsk/venv/lib/python3.12/site-packages/optuna/study/_optimize.py", line 263, in _run_trial
    raise func_err
  File "/home/aleksander.berezowsk/venv/lib/python3.12/site-packages/optuna/study/_optimize.py", line 206, in _run_trial
    value_or_values = func(trial)
                      ^^^^^^^^^^^
  File "/home/aleksander.berezowsk/spiking-eegnet/src/main.py", line 52, in objective
    return pipeline(**params, **FIXED, trial=trial, save_plots=False)
           ^^^^^^^^^^^^^^^^^^^^^^^^^^^^^^^^^^^^^^^^^^^^^^^^^^^^^^^^^^
  File "/home/aleksander.berezowsk/spiking-eegnet/src/pipeline.py", line 143, in pipeline
    histories, accs, mean_acc = experiment_loso_all(
                                ^^^^^^^^^^^^^^^^^^^^
  File "/home/aleksander.berezowsk/spiking-eegnet/src/experiment_loso.py", line 71, in experiment_loso_all
    history, final_acc, _model = experiment_loso(
                                 ^^^^^^^^^^^^^^^^
  File "/home/aleksander.berezowsk/spiking-eegnet/src/experiment_loso.py", line 30, in experiment_loso
    history = run_training(
              ^^^^^^^^^^^^^
  File "/home/aleksander.berezowsk/spiking-eegnet/src/run_training.py", line 50, in run_training
    loss = train_one_epoch(model, train_loader, optimizer, criterion, device,
           ^^^^^^^^^^^^^^^^^^^^^^^^^^^^^^^^^^^^^^^^^^^^^^^^^^^^^^^^^^^^^^^^^^
  File "/home/aleksander.berezowsk/spiking-eegnet/src/train_one_epoch.py", line 53, in train_one_epoch
    spk, mem = model(xb, num_steps=n_steps)
               ^^^^^^^^^^^^^^^^^^^^^^^^^^^^
  File "/home/aleksander.berezowsk/venv/lib/python3.12/site-packages/torch/nn/modules/module.py", line 1553, in _wrapped_call_impl
    return self._call_impl(*args, **kwargs)
           ^^^^^^^^^^^^^^^^^^^^^^^^^^^^^^^^
  File "/home/aleksander.berezowsk/venv/lib/python3.12/site-packages/torch/nn/modules/module.py", line 1562, in _call_impl
    return forward_call(*args, **kwargs)
           ^^^^^^^^^^^^^^^^^^^^^^^^^^^^^
  File "/home/aleksander.berezowsk/spiking-eegnet/src/spiking_eegnet.py", line 233, in forward
    spk1, mem1 = self.lif1(cur, mem1)
                 ^^^^^^^^^^^^^^^^^^^^
  File "/home/aleksander.berezowsk/venv/lib/python3.12/site-packages/torch/nn/modules/module.py", line 1553, in _wrapped_call_impl
    return self._call_impl(*args, **kwargs)
           ^^^^^^^^^^^^^^^^^^^^^^^^^^^^^^^^
  File "/home/aleksander.berezowsk/venv/lib/python3.12/site-packages/torch/nn/modules/module.py", line 1562, in _call_impl
    return forward_call(*args, **kwargs)
           ^^^^^^^^^^^^^^^^^^^^^^^^^^^^^
  File "/home/aleksander.berezowsk/venv/lib/python3.12/site-packages/snntorch/_neurons/leaky.py", line 220, in forward
    spk = self.fire(self.mem)
          ^^^^^^^^^^^^^^^^^^^
  File "/home/aleksander.berezowsk/venv/lib/python3.12/site-packages/snntorch/_neurons/neurons.py", line 83, in fire
    spk = spk * self.graded_spikes_factor
          ~~~~^~~~~~~~~~~~~~~~~~~~~~~~~~~
torch.OutOfMemoryError: CUDA out of memory. Tried to allocate 78.00 MiB. GPU 0 has a total capacity of 15.77 GiB of which 52.19 MiB is free. Including non-PyTorch memory, this process has 15.71 GiB memory in use. Of the allocated memory 14.81 GiB is allocated by PyTorch, and 532.06 MiB is reserved by PyTorch but unallocated. If reserved but unallocated memory is large try setting PYTORCH_CUDA_ALLOC_CONF=expandable_segments:True to avoid fragmentation.  See documentation for Memory Management  (https://pytorch.org/docs/stable/notes/cuda.html#environment-variables)
