mkdir: cannot create directory ‘/scratch/mne_data’: Permission denied

[notice] A new release of pip is available: 24.2 -> 26.1.2
[notice] To update, run: pip install --upgrade pip

[notice] A new release of pip is available: 24.2 -> 26.1.2
[notice] To update, run: pip install --upgrade pip
ERROR: Invalid requirement: 'Binary file requirements.txt matches': Expected end or semicolon (after name and no valid version specifier)
    Binary file requirements.txt matches
           ^ (from line 1 of /home/aleksander.berezowsk/requirements_notorch.txt)

[notice] A new release of pip is available: 24.2 -> 26.1.2
[notice] To update, run: pip install --upgrade pip

[notice] A new release of pip is available: 24.2 -> 26.1.2
[notice] To update, run: pip install --upgrade pip
/home/aleksander.berezowsk/spiking-eegnet/src/main.py:92: ExperimentalWarning: Argument ``multivariate`` is an experimental feature. The interface can change in the future.
  sampler=TPESampler(n_startup_trials=tpe_trails, multivariate=True, group=True)
/home/aleksander.berezowsk/spiking-eegnet/src/main.py:92: ExperimentalWarning: Argument ``group`` is an experimental feature. The interface can change in the future.
  sampler=TPESampler(n_startup_trials=tpe_trails, multivariate=True, group=True)
[I 2026-07-03 05:53:48,506] Using an existing study with name 'snn_eegnet_v4_400_40' instead of creating a new one.
[I 2026-07-03 07:53:40,946] Trial 1 finished with value: 0.5374228395061729 and parameters: {'LR_EXP': -3.8594621756841883, 'DROPOUT': 0.16159231298709775, 'BETA': 0.9800600323775519, 'SPIKE_GRAD_SLOPE': 37.96701863807679, 'TEMPORAL_FILTERS': 22, 'DEPTH_MULTIPLIER': 4, 'POINTWISE_FILTERS': 12, 'TEMPORAL_KERNEL_DIV': 7, 'SEPARABLE_KERNEL_SIZE': 37, 'POOL1_SIZE': 2, 'POOL2_SIZE': 5, 'N_STEPS_TRAIN': 8, 'N_STEPS_EVAL': 15, 'READOUT_MODE': 'spk_mean'}. Best is trial 1 with value: 0.5374228395061729.
[I 2026-07-03 10:42:05,240] Trial 3 finished with value: 0.4724151234567901 and parameters: {'LR_EXP': -4.310473303264061, 'DROPOUT': 0.4345202434008914, 'BETA': 0.847189282534163, 'SPIKE_GRAD_SLOPE': 3.6180542598526446, 'TEMPORAL_FILTERS': 30, 'DEPTH_MULTIPLIER': 1, 'POINTWISE_FILTERS': 28, 'TEMPORAL_KERNEL_DIV': 6, 'SEPARABLE_KERNEL_SIZE': 60, 'POOL1_SIZE': 7, 'POOL2_SIZE': 5, 'N_STEPS_TRAIN': 14, 'N_STEPS_EVAL': 5, 'READOUT_MODE': 'spk_sum'}. Best is trial 1 with value: 0.5374228395061729.
[I 2026-07-03 12:02:30,318] Trial 6 finished with value: 0.478395061728395 and parameters: {'LR_EXP': -2.1336930717158973, 'DROPOUT': 0.27453901656907714, 'BETA': 0.8796543267518133, 'SPIKE_GRAD_SLOPE': 33.743559089064796, 'TEMPORAL_FILTERS': 4, 'DEPTH_MULTIPLIER': 4, 'POINTWISE_FILTERS': 62, 'TEMPORAL_KERNEL_DIV': 3, 'SEPARABLE_KERNEL_SIZE': 5, 'POOL1_SIZE': 4, 'POOL2_SIZE': 8, 'N_STEPS_TRAIN': 9, 'N_STEPS_EVAL': 5, 'READOUT_MODE': 'spk_sum'}. Best is trial 5 with value: 0.5395447530864197.
[I 2026-07-03 14:31:06,218] Trial 8 finished with value: 0.5532407407407408 and parameters: {'LR_EXP': -2.9190619645107367, 'DROPOUT': 0.4811814480289161, 'BETA': 0.8123550323448128, 'SPIKE_GRAD_SLOPE': 41.64723757066948, 'TEMPORAL_FILTERS': 44, 'DEPTH_MULTIPLIER': 2, 'POINTWISE_FILTERS': 63, 'TEMPORAL_KERNEL_DIV': 5, 'SEPARABLE_KERNEL_SIZE': 5, 'POOL1_SIZE': 4, 'POOL2_SIZE': 7, 'N_STEPS_TRAIN': 6, 'N_STEPS_EVAL': 23, 'READOUT_MODE': 'spk_sum'}. Best is trial 8 with value: 0.5532407407407408.
[I 2026-07-03 18:57:48,402] Trial 11 finished with value: 0.5364583333333334 and parameters: {'LR_EXP': -3.0114096822732956, 'DROPOUT': 0.039215136543264716, 'BETA': 0.9564631791306437, 'SPIKE_GRAD_SLOPE': 44.51318821134521, 'TEMPORAL_FILTERS': 54, 'DEPTH_MULTIPLIER': 2, 'POINTWISE_FILTERS': 44, 'TEMPORAL_KERNEL_DIV': 3, 'SEPARABLE_KERNEL_SIZE': 56, 'POOL1_SIZE': 5, 'POOL2_SIZE': 5, 'N_STEPS_TRAIN': 8, 'N_STEPS_EVAL': 30, 'READOUT_MODE': 'spk_mean'}. Best is trial 10 with value: 0.566550925925926.
[I 2026-07-03 20:39:49,803] Trial 16 finished with value: 0.5264274691358025 and parameters: {'LR_EXP': -3.614892373564361, 'DROPOUT': 0.08239738058592774, 'BETA': 0.8353328336549315, 'SPIKE_GRAD_SLOPE': 48.517447680238796, 'TEMPORAL_FILTERS': 35, 'DEPTH_MULTIPLIER': 4, 'POINTWISE_FILTERS': 24, 'TEMPORAL_KERNEL_DIV': 8, 'SEPARABLE_KERNEL_SIZE': 55, 'POOL1_SIZE': 6, 'POOL2_SIZE': 5, 'N_STEPS_TRAIN': 4, 'N_STEPS_EVAL': 23, 'READOUT_MODE': 'spk_sum'}. Best is trial 10 with value: 0.566550925925926.
[W 2026-07-03 21:06:43,677] Trial 18 failed with parameters: {'LR_EXP': -4.457292370989775, 'DROPOUT': 0.4132076309221071, 'BETA': 0.833582233814484, 'SPIKE_GRAD_SLOPE': 31.955066969983612, 'TEMPORAL_FILTERS': 42, 'DEPTH_MULTIPLIER': 3, 'POINTWISE_FILTERS': 12, 'TEMPORAL_KERNEL_DIV': 6, 'SEPARABLE_KERNEL_SIZE': 6, 'POOL1_SIZE': 7, 'POOL2_SIZE': 5, 'N_STEPS_TRAIN': 10, 'N_STEPS_EVAL': 23, 'READOUT_MODE': 'spk_sum'} because of the following error: OutOfMemoryError('CUDA out of memory. Tried to allocate 114.00 MiB. GPU 0 has a total capacity of 15.77 GiB of which 38.19 MiB is free. Including non-PyTorch memory, this process has 15.72 GiB memory in use. Of the allocated memory 14.53 GiB is allocated by PyTorch, and 835.15 MiB is reserved by PyTorch but unallocated. If reserved but unallocated memory is large try setting PYTORCH_CUDA_ALLOC_CONF=expandable_segments:True to avoid fragmentation.  See documentation for Memory Management  (https://pytorch.org/docs/stable/notes/cuda.html#environment-variables)').
Traceback (most recent call last):
  File "/home/aleksander.berezowsk/venv/lib/python3.12/site-packages/optuna/study/_optimize.py", line 206, in _run_trial
    value_or_values = func(trial)
                      ^^^^^^^^^^^
  File "/home/aleksander.berezowsk/spiking-eegnet/src/main.py", line 47, in objective
    return pipeline(**params, **FIXED, trial=trial, save_plots=False)
           ^^^^^^^^^^^^^^^^^^^^^^^^^^^^^^^^^^^^^^^^^^^^^^^^^^^^^^^^^^
  File "/home/aleksander.berezowsk/spiking-eegnet/src/pipeline.py", line 135, in pipeline
    histories, accs, mean_acc = experiment_loso_all(
                                ^^^^^^^^^^^^^^^^^^^^
  File "/home/aleksander.berezowsk/spiking-eegnet/src/experiment_loso.py", line 71, in experiment_loso_all
    history, final_acc, _model = experiment_loso(
                                 ^^^^^^^^^^^^^^^^
  File "/home/aleksander.berezowsk/spiking-eegnet/src/experiment_loso.py", line 30, in experiment_loso
    history = run_training(
              ^^^^^^^^^^^^^
  File "/home/aleksander.berezowsk/spiking-eegnet/src/run_training.py", line 50, in run_training
    loss = train_one_epoch(model, train_loader, optimizer, criterion, device,
           ^^^^^^^^^^^^^^^^^^^^^^^^^^^^^^^^^^^^^^^^^^^^^^^^^^^^^^^^^^^^^^^^^^
  File "/home/aleksander.berezowsk/spiking-eegnet/src/train_one_epoch.py", line 53, in train_one_epoch
    spk, mem = model(xb, num_steps=n_steps)
               ^^^^^^^^^^^^^^^^^^^^^^^^^^^^
  File "/home/aleksander.berezowsk/venv/lib/python3.12/site-packages/torch/nn/modules/module.py", line 1553, in _wrapped_call_impl
    return self._call_impl(*args, **kwargs)
           ^^^^^^^^^^^^^^^^^^^^^^^^^^^^^^^^
  File "/home/aleksander.berezowsk/venv/lib/python3.12/site-packages/torch/nn/modules/module.py", line 1562, in _call_impl
    return forward_call(*args, **kwargs)
           ^^^^^^^^^^^^^^^^^^^^^^^^^^^^^
  File "/home/aleksander.berezowsk/spiking-eegnet/src/spiking_eegnet.py", line 233, in forward
    spk1, mem1 = self.lif1(cur, mem1)
                 ^^^^^^^^^^^^^^^^^^^^
  File "/home/aleksander.berezowsk/venv/lib/python3.12/site-packages/torch/nn/modules/module.py", line 1553, in _wrapped_call_impl
    return self._call_impl(*args, **kwargs)
           ^^^^^^^^^^^^^^^^^^^^^^^^^^^^^^^^
  File "/home/aleksander.berezowsk/venv/lib/python3.12/site-packages/torch/nn/modules/module.py", line 1562, in _call_impl
    return forward_call(*args, **kwargs)
           ^^^^^^^^^^^^^^^^^^^^^^^^^^^^^
  File "/home/aleksander.berezowsk/venv/lib/python3.12/site-packages/snntorch/_neurons/leaky.py", line 209, in forward
    self.reset = self.mem_reset(self.mem)
                 ^^^^^^^^^^^^^^^^^^^^^^^^
  File "/home/aleksander.berezowsk/venv/lib/python3.12/site-packages/snntorch/_neurons/neurons.py", line 106, in mem_reset
    reset = self.spike_grad(mem_shift).clone().detach()
            ^^^^^^^^^^^^^^^^^^^^^^^^^^^^^^^^^^
torch.OutOfMemoryError: CUDA out of memory. Tried to allocate 114.00 MiB. GPU 0 has a total capacity of 15.77 GiB of which 38.19 MiB is free. Including non-PyTorch memory, this process has 15.72 GiB memory in use. Of the allocated memory 14.53 GiB is allocated by PyTorch, and 835.15 MiB is reserved by PyTorch but unallocated. If reserved but unallocated memory is large try setting PYTORCH_CUDA_ALLOC_CONF=expandable_segments:True to avoid fragmentation.  See documentation for Memory Management  (https://pytorch.org/docs/stable/notes/cuda.html#environment-variables)
[W 2026-07-03 21:06:43,757] Trial 18 failed with value None.
Traceback (most recent call last):
  File "/home/aleksander.berezowsk/spiking-eegnet/src/main.py", line 98, in <module>
    study.optimize(objective, n_trials=n_trials, n_jobs=1,
  File "/home/aleksander.berezowsk/venv/lib/python3.12/site-packages/optuna/study/study.py", line 516, in optimize
    _optimize(
  File "/home/aleksander.berezowsk/venv/lib/python3.12/site-packages/optuna/study/_optimize.py", line 68, in _optimize
    _optimize_sequential(
  File "/home/aleksander.berezowsk/venv/lib/python3.12/site-packages/optuna/study/_optimize.py", line 165, in _optimize_sequential
    frozen_trial_id = _run_trial(study, func, catch)
                      ^^^^^^^^^^^^^^^^^^^^^^^^^^^^^^
  File "/home/aleksander.berezowsk/venv/lib/python3.12/site-packages/optuna/study/_optimize.py", line 263, in _run_trial
    raise func_err
  File "/home/aleksander.berezowsk/venv/lib/python3.12/site-packages/optuna/study/_optimize.py", line 206, in _run_trial
    value_or_values = func(trial)
                      ^^^^^^^^^^^
  File "/home/aleksander.berezowsk/spiking-eegnet/src/main.py", line 47, in objective
    return pipeline(**params, **FIXED, trial=trial, save_plots=False)
           ^^^^^^^^^^^^^^^^^^^^^^^^^^^^^^^^^^^^^^^^^^^^^^^^^^^^^^^^^^
  File "/home/aleksander.berezowsk/spiking-eegnet/src/pipeline.py", line 135, in pipeline
    histories, accs, mean_acc = experiment_loso_all(
                                ^^^^^^^^^^^^^^^^^^^^
  File "/home/aleksander.berezowsk/spiking-eegnet/src/experiment_loso.py", line 71, in experiment_loso_all
    history, final_acc, _model = experiment_loso(
                                 ^^^^^^^^^^^^^^^^
  File "/home/aleksander.berezowsk/spiking-eegnet/src/experiment_loso.py", line 30, in experiment_loso
    history = run_training(
              ^^^^^^^^^^^^^
  File "/home/aleksander.berezowsk/spiking-eegnet/src/run_training.py", line 50, in run_training
    loss = train_one_epoch(model, train_loader, optimizer, criterion, device,
           ^^^^^^^^^^^^^^^^^^^^^^^^^^^^^^^^^^^^^^^^^^^^^^^^^^^^^^^^^^^^^^^^^^
  File "/home/aleksander.berezowsk/spiking-eegnet/src/train_one_epoch.py", line 53, in train_one_epoch
    spk, mem = model(xb, num_steps=n_steps)
               ^^^^^^^^^^^^^^^^^^^^^^^^^^^^
  File "/home/aleksander.berezowsk/venv/lib/python3.12/site-packages/torch/nn/modules/module.py", line 1553, in _wrapped_call_impl
    return self._call_impl(*args, **kwargs)
           ^^^^^^^^^^^^^^^^^^^^^^^^^^^^^^^^
  File "/home/aleksander.berezowsk/venv/lib/python3.12/site-packages/torch/nn/modules/module.py", line 1562, in _call_impl
    return forward_call(*args, **kwargs)
           ^^^^^^^^^^^^^^^^^^^^^^^^^^^^^
  File "/home/aleksander.berezowsk/spiking-eegnet/src/spiking_eegnet.py", line 233, in forward
    spk1, mem1 = self.lif1(cur, mem1)
                 ^^^^^^^^^^^^^^^^^^^^
  File "/home/aleksander.berezowsk/venv/lib/python3.12/site-packages/torch/nn/modules/module.py", line 1553, in _wrapped_call_impl
    return self._call_impl(*args, **kwargs)
           ^^^^^^^^^^^^^^^^^^^^^^^^^^^^^^^^
  File "/home/aleksander.berezowsk/venv/lib/python3.12/site-packages/torch/nn/modules/module.py", line 1562, in _call_impl
    return forward_call(*args, **kwargs)
           ^^^^^^^^^^^^^^^^^^^^^^^^^^^^^
  File "/home/aleksander.berezowsk/venv/lib/python3.12/site-packages/snntorch/_neurons/leaky.py", line 209, in forward
    self.reset = self.mem_reset(self.mem)
                 ^^^^^^^^^^^^^^^^^^^^^^^^
  File "/home/aleksander.berezowsk/venv/lib/python3.12/site-packages/snntorch/_neurons/neurons.py", line 106, in mem_reset
    reset = self.spike_grad(mem_shift).clone().detach()
            ^^^^^^^^^^^^^^^^^^^^^^^^^^^^^^^^^^
torch.OutOfMemoryError: CUDA out of memory. Tried to allocate 114.00 MiB. GPU 0 has a total capacity of 15.77 GiB of which 38.19 MiB is free. Including non-PyTorch memory, this process has 15.72 GiB memory in use. Of the allocated memory 14.53 GiB is allocated by PyTorch, and 835.15 MiB is reserved by PyTorch but unallocated. If reserved but unallocated memory is large try setting PYTORCH_CUDA_ALLOC_CONF=expandable_segments:True to avoid fragmentation.  See documentation for Memory Management  (https://pytorch.org/docs/stable/notes/cuda.html#environment-variables)
