
[notice] A new release of pip is available: 24.2 -> 26.1.2
[notice] To update, run: pip install --upgrade pip

[notice] A new release of pip is available: 24.2 -> 26.1.2
[notice] To update, run: pip install --upgrade pip
ERROR: Invalid requirement: 'Binary file requirements.txt matches': Expected end or semicolon (after name and no valid version specifier)
    Binary file requirements.txt matches
           ^ (from line 1 of /home/aleksander.berezowsk/requirements_notorch.txt)

[notice] A new release of pip is available: 24.2 -> 26.1.2
[notice] To update, run: pip install --upgrade pip

[notice] A new release of pip is available: 24.2 -> 26.1.2
[notice] To update, run: pip install --upgrade pip
/home/aleksander.berezowsk/spiking-eegnet/src/main.py:86: ExperimentalWarning: Argument ``multivariate`` is an experimental feature. The interface can change in the future.
  sampler=TPESampler(n_startup_trials=tpe_trails, multivariate=True, group=True)
/home/aleksander.berezowsk/spiking-eegnet/src/main.py:86: ExperimentalWarning: Argument ``group`` is an experimental feature. The interface can change in the future.
  sampler=TPESampler(n_startup_trials=tpe_trails, multivariate=True, group=True)
[I 2026-06-17 14:30:49,002] Using an existing study with name 'snn_eegnet_v2_200_20' instead of creating a new one.
[I 2026-06-17 14:31:27,698] Trial 255 pruned. 
[I 2026-06-17 14:32:00,476] Trial 256 pruned. 
[I 2026-06-17 14:32:36,140] Trial 257 pruned. 
[I 2026-06-17 14:33:27,852] Trial 258 pruned. 
[I 2026-06-17 14:33:59,033] Trial 259 pruned. 
[I 2026-06-17 14:34:24,441] Trial 260 pruned. 
[I 2026-06-17 14:35:01,316] Trial 261 pruned. 
[I 2026-06-17 14:45:41,569] Trial 262 finished with value: 0.6041666666666666 and parameters: {'FLOW': 10.058167666374109, 'FHIGH': 53.57428120823725, 'LR_EXP': -2.194614063990748, 'DROPOUT': 0.4642966889511584, 'BETA': 0.8042821046714381, 'SPIKE_GRAD_SLOPE': 9.49328266142206, 'TEMPORAL_FILTERS': 16, 'DEPTH_MULTIPLIER': 3, 'POINTWISE_FILTERS': 31, 'TEMPORAL_KERNEL_DIV': 8, 'SEPARABLE_KERNEL_SIZE': 11, 'POOL1_SIZE': 5, 'POOL2_SIZE': 5, 'NORM_AXIS': 'no_channel', 'RUN_ZSCORE': False}. Best is trial 202 with value: 0.640625.
[I 2026-06-17 14:46:21,079] Trial 263 pruned. 
[I 2026-06-17 14:56:22,766] Trial 264 finished with value: 0.5555555555555556 and parameters: {'FLOW': 1.5632890050999162, 'FHIGH': 56.55589699820683, 'LR_EXP': -2.5678729257717325, 'DROPOUT': 0.5021150219523388, 'BETA': 0.7634191964116258, 'SPIKE_GRAD_SLOPE': 5.946962534176521, 'TEMPORAL_FILTERS': 16, 'DEPTH_MULTIPLIER': 2, 'POINTWISE_FILTERS': 26, 'TEMPORAL_KERNEL_DIV': 7, 'SEPARABLE_KERNEL_SIZE': 7, 'POOL1_SIZE': 4, 'POOL2_SIZE': 5, 'NORM_AXIS': 'no_channel', 'RUN_ZSCORE': False}. Best is trial 202 with value: 0.640625.
[I 2026-06-17 14:57:04,691] Trial 265 pruned. 
[I 2026-06-17 14:57:29,608] Trial 266 pruned. 
[I 2026-06-17 14:58:00,922] Trial 267 pruned. 
[I 2026-06-17 14:58:41,592] Trial 268 pruned. 
[I 2026-06-17 14:59:08,032] Trial 269 pruned. 
[I 2026-06-17 14:59:48,003] Trial 270 pruned. 
[I 2026-06-17 15:16:09,266] Trial 271 finished with value: 0.5798611111111112 and parameters: {'FLOW': 9.949392933448122, 'FHIGH': 93.24957900792401, 'LR_EXP': -3.0210283984852597, 'DROPOUT': 0.378505066918694, 'BETA': 0.6036044130140501, 'SPIKE_GRAD_SLOPE': 10.428212957666046, 'TEMPORAL_FILTERS': 24, 'DEPTH_MULTIPLIER': 4, 'POINTWISE_FILTERS': 33, 'TEMPORAL_KERNEL_DIV': 5, 'SEPARABLE_KERNEL_SIZE': 13, 'POOL1_SIZE': 6, 'POOL2_SIZE': 8, 'NORM_AXIS': 'full', 'RUN_ZSCORE': True}. Best is trial 202 with value: 0.640625.
[I 2026-06-17 15:16:53,780] Trial 272 pruned. 
[I 2026-06-17 15:17:14,046] Trial 273 pruned. 
[I 2026-06-17 15:29:31,941] Trial 274 finished with value: 0.4913194444444444 and parameters: {'FLOW': 10.161101628618303, 'FHIGH': 53.53242229472117, 'LR_EXP': -2.518488036371937, 'DROPOUT': 0.42052299752760663, 'BETA': 0.8739900727554536, 'SPIKE_GRAD_SLOPE': 12.283439147488927, 'TEMPORAL_FILTERS': 20, 'DEPTH_MULTIPLIER': 3, 'POINTWISE_FILTERS': 28, 'TEMPORAL_KERNEL_DIV': 8, 'SEPARABLE_KERNEL_SIZE': 15, 'POOL1_SIZE': 5, 'POOL2_SIZE': 6, 'NORM_AXIS': 'no_channel', 'RUN_ZSCORE': False}. Best is trial 202 with value: 0.640625.
[I 2026-06-17 15:44:23,613] Trial 275 finished with value: 0.6319444444444444 and parameters: {'FLOW': 2.8066744703866, 'FHIGH': 71.91328063262057, 'LR_EXP': -2.4933900165992, 'DROPOUT': 0.42289056854092905, 'BETA': 0.5715449821256612, 'SPIKE_GRAD_SLOPE': 5.267805778775678, 'TEMPORAL_FILTERS': 25, 'DEPTH_MULTIPLIER': 3, 'POINTWISE_FILTERS': 20, 'TEMPORAL_KERNEL_DIV': 6, 'SEPARABLE_KERNEL_SIZE': 19, 'POOL1_SIZE': 6, 'POOL2_SIZE': 8, 'NORM_AXIS': 'full', 'RUN_ZSCORE': True}. Best is trial 202 with value: 0.640625.
[I 2026-06-17 15:45:02,949] Trial 276 pruned. 
[I 2026-06-17 15:55:56,353] Trial 277 finished with value: 0.529513888888889 and parameters: {'FLOW': 1.5368512340039442, 'FHIGH': 85.29201688259077, 'LR_EXP': -2.426764177908035, 'DROPOUT': 0.3288576326655332, 'BETA': 0.9787739714817938, 'SPIKE_GRAD_SLOPE': 15.329168292937087, 'TEMPORAL_FILTERS': 12, 'DEPTH_MULTIPLIER': 4, 'POINTWISE_FILTERS': 37, 'TEMPORAL_KERNEL_DIV': 5, 'SEPARABLE_KERNEL_SIZE': 17, 'POOL1_SIZE': 7, 'POOL2_SIZE': 8, 'NORM_AXIS': 'full', 'RUN_ZSCORE': False}. Best is trial 202 with value: 0.640625.
[I 2026-06-17 15:56:28,915] Trial 278 pruned. 
[I 2026-06-17 15:57:05,583] Trial 279 pruned. 
[I 2026-06-17 15:57:33,865] Trial 280 pruned. 
[I 2026-06-17 15:58:16,595] Trial 281 pruned. 
[I 2026-06-17 15:59:00,653] Trial 282 pruned. 
[I 2026-06-17 15:59:43,993] Trial 283 pruned. 
[I 2026-06-17 16:00:23,607] Trial 284 pruned. 
[I 2026-06-17 16:00:54,934] Trial 285 pruned. 
[I 2026-06-17 16:15:23,374] Trial 286 finished with value: 0.5885416666666666 and parameters: {'FLOW': 4.337837030546825, 'FHIGH': 77.96661303822792, 'LR_EXP': -2.655259973854943, 'DROPOUT': 0.5044422372220205, 'BETA': 0.6185666338463864, 'SPIKE_GRAD_SLOPE': 10.971032633470768, 'TEMPORAL_FILTERS': 23, 'DEPTH_MULTIPLIER': 3, 'POINTWISE_FILTERS': 8, 'TEMPORAL_KERNEL_DIV': 5, 'SEPARABLE_KERNEL_SIZE': 22, 'POOL1_SIZE': 5, 'POOL2_SIZE': 5, 'NORM_AXIS': 'full', 'RUN_ZSCORE': False}. Best is trial 202 with value: 0.640625.
[I 2026-06-17 16:31:56,404] Trial 287 finished with value: 0.4791666666666667 and parameters: {'FLOW': 5.49166161050864, 'FHIGH': 61.30320178904961, 'LR_EXP': -2.0378136503875837, 'DROPOUT': 0.32949240478905223, 'BETA': 0.5500794021383023, 'SPIKE_GRAD_SLOPE': 14.990133802783307, 'TEMPORAL_FILTERS': 26, 'DEPTH_MULTIPLIER': 4, 'POINTWISE_FILTERS': 23, 'TEMPORAL_KERNEL_DIV': 7, 'SEPARABLE_KERNEL_SIZE': 28, 'POOL1_SIZE': 6, 'POOL2_SIZE': 7, 'NORM_AXIS': 'full', 'RUN_ZSCORE': True}. Best is trial 202 with value: 0.640625.
[I 2026-06-17 16:32:29,803] Trial 288 pruned. 
[I 2026-06-17 16:33:05,902] Trial 289 pruned. 
[I 2026-06-17 16:33:35,018] Trial 290 pruned. 
[I 2026-06-17 16:53:15,053] Trial 291 finished with value: 0.5746527777777777 and parameters: {'FLOW': 9.388186639367852, 'FHIGH': 81.683749196706, 'LR_EXP': -2.806416282830135, 'DROPOUT': 0.35973255458985287, 'BETA': 0.6655789704727018, 'SPIKE_GRAD_SLOPE': 23.202185564050545, 'TEMPORAL_FILTERS': 30, 'DEPTH_MULTIPLIER': 4, 'POINTWISE_FILTERS': 9, 'TEMPORAL_KERNEL_DIV': 4, 'SEPARABLE_KERNEL_SIZE': 12, 'POOL1_SIZE': 6, 'POOL2_SIZE': 5, 'NORM_AXIS': 'full', 'RUN_ZSCORE': False}. Best is trial 202 with value: 0.640625.
[I 2026-06-17 17:02:19,871] Trial 292 finished with value: 0.5677083333333334 and parameters: {'FLOW': 11.238916513512475, 'FHIGH': 53.78496852634333, 'LR_EXP': -2.0177920897788577, 'DROPOUT': 0.4857305262666016, 'BETA': 0.7696803779862451, 'SPIKE_GRAD_SLOPE': 10.643244467301162, 'TEMPORAL_FILTERS': 12, 'DEPTH_MULTIPLIER': 3, 'POINTWISE_FILTERS': 19, 'TEMPORAL_KERNEL_DIV': 8, 'SEPARABLE_KERNEL_SIZE': 14, 'POOL1_SIZE': 5, 'POOL2_SIZE': 3, 'NORM_AXIS': 'no_channel', 'RUN_ZSCORE': False}. Best is trial 202 with value: 0.640625.
[I 2026-06-17 17:03:08,770] Trial 293 pruned. 
[I 2026-06-17 17:03:34,717] Trial 294 pruned. 
[I 2026-06-17 17:18:26,814] Trial 295 finished with value: 0.5364583333333333 and parameters: {'FLOW': 8.348854851522631, 'FHIGH': 53.93699276612011, 'LR_EXP': -2.3048788654049526, 'DROPOUT': 0.3145097546639768, 'BETA': 0.5622228080397932, 'SPIKE_GRAD_SLOPE': 18.573620561458732, 'TEMPORAL_FILTERS': 28, 'DEPTH_MULTIPLIER': 2, 'POINTWISE_FILTERS': 20, 'TEMPORAL_KERNEL_DIV': 5, 'SEPARABLE_KERNEL_SIZE': 18, 'POOL1_SIZE': 7, 'POOL2_SIZE': 8, 'NORM_AXIS': 'full', 'RUN_ZSCORE': True}. Best is trial 202 with value: 0.640625.
[I 2026-06-17 17:34:12,756] Trial 296 finished with value: 0.5538194444444444 and parameters: {'FLOW': 4.782506851026952, 'FHIGH': 88.54806016894052, 'LR_EXP': -2.1424718183667237, 'DROPOUT': 0.31072756092776876, 'BETA': 0.6061870954836043, 'SPIKE_GRAD_SLOPE': 26.792261917429585, 'TEMPORAL_FILTERS': 26, 'DEPTH_MULTIPLIER': 3, 'POINTWISE_FILTERS': 17, 'TEMPORAL_KERNEL_DIV': 5, 'SEPARABLE_KERNEL_SIZE': 17, 'POOL1_SIZE': 4, 'POOL2_SIZE': 7, 'NORM_AXIS': 'full', 'RUN_ZSCORE': True}. Best is trial 202 with value: 0.640625.
[I 2026-06-17 17:47:39,980] Trial 297 finished with value: 0.5850694444444444 and parameters: {'FLOW': 6.04119650253272, 'FHIGH': 66.86080709167895, 'LR_EXP': -2.2469527607545525, 'DROPOUT': 0.7345085093633961, 'BETA': 0.6195792871811188, 'SPIKE_GRAD_SLOPE': 7.11800350589349, 'TEMPORAL_FILTERS': 22, 'DEPTH_MULTIPLIER': 3, 'POINTWISE_FILTERS': 50, 'TEMPORAL_KERNEL_DIV': 7, 'SEPARABLE_KERNEL_SIZE': 14, 'POOL1_SIZE': 6, 'POOL2_SIZE': 8, 'NORM_AXIS': 'full', 'RUN_ZSCORE': False}. Best is trial 202 with value: 0.640625.
[I 2026-06-17 17:48:47,633] Trial 298 pruned. 
[I 2026-06-17 17:49:23,779] Trial 299 pruned. 
[I 2026-06-17 17:50:04,954] Trial 300 pruned. 
[I 2026-06-17 17:50:32,866] Trial 301 pruned. 
[I 2026-06-17 17:51:07,757] Trial 302 pruned. 
[I 2026-06-17 17:51:38,372] Trial 303 pruned. 
[I 2026-06-17 17:52:18,603] Trial 304 pruned. 
[I 2026-06-17 17:52:49,435] Trial 305 pruned. 
[I 2026-06-17 18:11:56,301] Trial 306 finished with value: 0.548611111111111 and parameters: {'FLOW': 8.08818882194216, 'FHIGH': 72.52765507298055, 'LR_EXP': -2.161307331575951, 'DROPOUT': 0.34281368884267277, 'BETA': 0.6459802938089533, 'SPIKE_GRAD_SLOPE': 7.718612626570963, 'TEMPORAL_FILTERS': 31, 'DEPTH_MULTIPLIER': 4, 'POINTWISE_FILTERS': 17, 'TEMPORAL_KERNEL_DIV': 6, 'SEPARABLE_KERNEL_SIZE': 17, 'POOL1_SIZE': 7, 'POOL2_SIZE': 8, 'NORM_AXIS': 'full', 'RUN_ZSCORE': True}. Best is trial 202 with value: 0.640625.
[I 2026-06-17 18:12:37,073] Trial 307 pruned. 
[I 2026-06-17 18:13:01,897] Trial 308 pruned. 
[I 2026-06-17 18:13:29,337] Trial 309 pruned. 
[I 2026-06-17 18:13:58,049] Trial 310 pruned. 
[I 2026-06-17 18:14:36,555] Trial 311 pruned. 
[I 2026-06-17 18:15:19,645] Trial 312 pruned. 
[I 2026-06-17 18:15:52,322] Trial 313 pruned. 
[I 2026-06-17 18:26:28,881] Trial 314 finished with value: 0.6423611111111112 and parameters: {'FLOW': 5.3971469185157535, 'FHIGH': 60.35567638675221, 'LR_EXP': -2.042295514661619, 'DROPOUT': 0.5524151905919512, 'BETA': 0.9635553006247648, 'SPIKE_GRAD_SLOPE': 9.159486530256453, 'TEMPORAL_FILTERS': 16, 'DEPTH_MULTIPLIER': 3, 'POINTWISE_FILTERS': 16, 'TEMPORAL_KERNEL_DIV': 8, 'SEPARABLE_KERNEL_SIZE': 16, 'POOL1_SIZE': 8, 'POOL2_SIZE': 8, 'NORM_AXIS': 'full', 'RUN_ZSCORE': False}. Best is trial 314 with value: 0.6423611111111112.
[I 2026-06-17 18:38:14,415] Trial 315 finished with value: 0.6180555555555556 and parameters: {'FLOW': 8.661967339961883, 'FHIGH': 53.027405146586304, 'LR_EXP': -2.2135456511548144, 'DROPOUT': 0.6995902480091221, 'BETA': 0.9768791895140354, 'SPIKE_GRAD_SLOPE': 28.105742315460596, 'TEMPORAL_FILTERS': 18, 'DEPTH_MULTIPLIER': 3, 'POINTWISE_FILTERS': 15, 'TEMPORAL_KERNEL_DIV': 7, 'SEPARABLE_KERNEL_SIZE': 18, 'POOL1_SIZE': 7, 'POOL2_SIZE': 7, 'NORM_AXIS': 'full', 'RUN_ZSCORE': False}. Best is trial 314 with value: 0.6423611111111112.
[I 2026-06-17 18:50:20,836] Trial 316 finished with value: 0.48958333333333337 and parameters: {'FLOW': 8.480257977632343, 'FHIGH': 58.78542895420654, 'LR_EXP': -2.5146327430865085, 'DROPOUT': 0.7283038951360192, 'BETA': 0.9368846894110733, 'SPIKE_GRAD_SLOPE': 34.84292086023513, 'TEMPORAL_FILTERS': 18, 'DEPTH_MULTIPLIER': 3, 'POINTWISE_FILTERS': 11, 'TEMPORAL_KERNEL_DIV': 6, 'SEPARABLE_KERNEL_SIZE': 27, 'POOL1_SIZE': 8, 'POOL2_SIZE': 6, 'NORM_AXIS': 'full', 'RUN_ZSCORE': False}. Best is trial 314 with value: 0.6423611111111112.
[I 2026-06-17 18:50:46,552] Trial 317 pruned. 
[I 2026-06-17 18:51:11,088] Trial 318 pruned. 
[I 2026-06-17 18:51:36,894] Trial 319 pruned. 
[I 2026-06-17 18:52:19,540] Trial 320 pruned. 
[I 2026-06-17 18:53:00,949] Trial 321 pruned. 
[I 2026-06-17 19:06:37,796] Trial 322 finished with value: 0.59375 and parameters: {'FLOW': 5.063302450513741, 'FHIGH': 62.355591916466885, 'LR_EXP': -2.2602279108448804, 'DROPOUT': 0.5807825218910604, 'BETA': 0.9650467233232632, 'SPIKE_GRAD_SLOPE': 19.754391305755462, 'TEMPORAL_FILTERS': 21, 'DEPTH_MULTIPLIER': 3, 'POINTWISE_FILTERS': 28, 'TEMPORAL_KERNEL_DIV': 5, 'SEPARABLE_KERNEL_SIZE': 7, 'POOL1_SIZE': 8, 'POOL2_SIZE': 6, 'NORM_AXIS': 'no_channel', 'RUN_ZSCORE': False}. Best is trial 314 with value: 0.6423611111111112.
[I 2026-06-17 19:07:14,800] Trial 323 pruned. 
[I 2026-06-17 19:07:39,028] Trial 324 pruned. 
[I 2026-06-17 19:26:34,955] Trial 325 finished with value: 0.5138888888888888 and parameters: {'FLOW': 8.568445122960226, 'FHIGH': 74.52280693986772, 'LR_EXP': -2.2958172746276073, 'DROPOUT': 0.45277309814159483, 'BETA': 0.8848511332429332, 'SPIKE_GRAD_SLOPE': 20.01091914767823, 'TEMPORAL_FILTERS': 32, 'DEPTH_MULTIPLIER': 3, 'POINTWISE_FILTERS': 32, 'TEMPORAL_KERNEL_DIV': 4, 'SEPARABLE_KERNEL_SIZE': 17, 'POOL1_SIZE': 3, 'POOL2_SIZE': 7, 'NORM_AXIS': 'no_channel', 'RUN_ZSCORE': False}. Best is trial 314 with value: 0.6423611111111112.
[I 2026-06-17 19:45:42,644] Trial 326 finished with value: 0.5677083333333334 and parameters: {'FLOW': 6.43008357550757, 'FHIGH': 64.66476682461548, 'LR_EXP': -2.961790054002477, 'DROPOUT': 0.5621078745227128, 'BETA': 0.6012985315681803, 'SPIKE_GRAD_SLOPE': 28.80326421439156, 'TEMPORAL_FILTERS': 30, 'DEPTH_MULTIPLIER': 4, 'POINTWISE_FILTERS': 23, 'TEMPORAL_KERNEL_DIV': 5, 'SEPARABLE_KERNEL_SIZE': 27, 'POOL1_SIZE': 8, 'POOL2_SIZE': 8, 'NORM_AXIS': 'no_channel', 'RUN_ZSCORE': True}. Best is trial 314 with value: 0.6423611111111112.
[I 2026-06-17 19:46:14,581] Trial 327 pruned. 
[I 2026-06-17 19:59:05,529] Trial 328 finished with value: 0.5746527777777778 and parameters: {'FLOW': 2.7606977795643, 'FHIGH': 71.19050509896081, 'LR_EXP': -2.1338280410707227, 'DROPOUT': 0.44255860841666894, 'BETA': 0.9363682052579136, 'SPIKE_GRAD_SLOPE': 12.473022190971355, 'TEMPORAL_FILTERS': 18, 'DEPTH_MULTIPLIER': 4, 'POINTWISE_FILTERS': 25, 'TEMPORAL_KERNEL_DIV': 7, 'SEPARABLE_KERNEL_SIZE': 23, 'POOL1_SIZE': 7, 'POOL2_SIZE': 7, 'NORM_AXIS': 'full', 'RUN_ZSCORE': False}. Best is trial 314 with value: 0.6423611111111112.
[I 2026-06-17 19:59:37,428] Trial 329 pruned. 
[I 2026-06-17 20:00:16,574] Trial 330 pruned. 
[I 2026-06-17 20:15:48,520] Trial 331 finished with value: 0.5 and parameters: {'FLOW': 5.51139716003577, 'FHIGH': 69.93685122694454, 'LR_EXP': -2.6703547620647754, 'DROPOUT': 0.6222594240229599, 'BETA': 0.854108677780028, 'SPIKE_GRAD_SLOPE': 13.876342736135102, 'TEMPORAL_FILTERS': 28, 'DEPTH_MULTIPLIER': 3, 'POINTWISE_FILTERS': 24, 'TEMPORAL_KERNEL_DIV': 8, 'SEPARABLE_KERNEL_SIZE': 20, 'POOL1_SIZE': 5, 'POOL2_SIZE': 6, 'NORM_AXIS': 'no_channel', 'RUN_ZSCORE': False}. Best is trial 314 with value: 0.6423611111111112.
[I 2026-06-17 20:16:13,732] Trial 332 pruned. 
[I 2026-06-17 20:16:47,161] Trial 333 pruned. 
[I 2026-06-17 20:17:26,664] Trial 334 pruned. 
[I 2026-06-17 20:18:09,594] Trial 335 pruned. 
[I 2026-06-17 20:18:48,257] Trial 336 pruned. 
[I 2026-06-17 20:30:57,811] Trial 337 finished with value: 0.6024305555555556 and parameters: {'FLOW': 10.520867671468173, 'FHIGH': 88.36018316793528, 'LR_EXP': -2.358017519364049, 'DROPOUT': 0.7219764640053563, 'BETA': 0.8133313452225428, 'SPIKE_GRAD_SLOPE': 24.606832540918752, 'TEMPORAL_FILTERS': 18, 'DEPTH_MULTIPLIER': 3, 'POINTWISE_FILTERS': 58, 'TEMPORAL_KERNEL_DIV': 6, 'SEPARABLE_KERNEL_SIZE': 18, 'POOL1_SIZE': 6, 'POOL2_SIZE': 7, 'NORM_AXIS': 'full', 'RUN_ZSCORE': False}. Best is trial 314 with value: 0.6423611111111112.
[I 2026-06-17 20:31:39,444] Trial 338 pruned. 
[I 2026-06-17 20:32:04,906] Trial 339 pruned. 
[I 2026-06-17 20:33:10,218] Trial 340 pruned. 
[I 2026-06-17 20:33:39,521] Trial 341 pruned. 
[I 2026-06-17 20:34:10,685] Trial 342 pruned. 
[I 2026-06-17 20:47:33,888] Trial 343 finished with value: 0.4809027777777778 and parameters: {'FLOW': 8.247523902915482, 'FHIGH': 56.18603970724607, 'LR_EXP': -2.165804304963037, 'DROPOUT': 0.6893300156564186, 'BETA': 0.9706192003324913, 'SPIKE_GRAD_SLOPE': 35.80574354580996, 'TEMPORAL_FILTERS': 22, 'DEPTH_MULTIPLIER': 3, 'POINTWISE_FILTERS': 12, 'TEMPORAL_KERNEL_DIV': 7, 'SEPARABLE_KERNEL_SIZE': 23, 'POOL1_SIZE': 7, 'POOL2_SIZE': 7, 'NORM_AXIS': 'full', 'RUN_ZSCORE': True}. Best is trial 314 with value: 0.6423611111111112.
[I 2026-06-17 20:48:00,653] Trial 344 pruned. 
[I 2026-06-17 20:48:32,449] Trial 345 pruned. 
[I 2026-06-17 21:01:55,649] Trial 346 finished with value: 0.6076388888888888 and parameters: {'FLOW': 6.341648121342432, 'FHIGH': 84.68168022273844, 'LR_EXP': -2.394148001069631, 'DROPOUT': 0.514355109075355, 'BETA': 0.8746159088785939, 'SPIKE_GRAD_SLOPE': 27.943085773149733, 'TEMPORAL_FILTERS': 21, 'DEPTH_MULTIPLIER': 3, 'POINTWISE_FILTERS': 43, 'TEMPORAL_KERNEL_DIV': 6, 'SEPARABLE_KERNEL_SIZE': 15, 'POOL1_SIZE': 7, 'POOL2_SIZE': 6, 'NORM_AXIS': 'full', 'RUN_ZSCORE': False}. Best is trial 314 with value: 0.6423611111111112.
