mkdir: cannot create directory ‘/scratch/mne_data’: Permission denied

[notice] A new release of pip is available: 24.2 -> 26.1.2
[notice] To update, run: pip install --upgrade pip

[notice] A new release of pip is available: 24.2 -> 26.1.2
[notice] To update, run: pip install --upgrade pip
ERROR: Invalid requirement: 'Binary file requirements.txt matches': Expected end or semicolon (after name and no valid version specifier)
    Binary file requirements.txt matches
           ^ (from line 1 of /home/aleksander.berezowsk/requirements_notorch.txt)

[notice] A new release of pip is available: 24.2 -> 26.1.2
[notice] To update, run: pip install --upgrade pip

[notice] A new release of pip is available: 24.2 -> 26.1.2
[notice] To update, run: pip install --upgrade pip
/home/aleksander.berezowsk/spiking-eegnet/src/main.py:97: ExperimentalWarning: Argument ``multivariate`` is an experimental feature. The interface can change in the future.
  sampler=TPESampler(n_startup_trials=tpe_trails, multivariate=True, group=True)
/home/aleksander.berezowsk/spiking-eegnet/src/main.py:97: ExperimentalWarning: Argument ``group`` is an experimental feature. The interface can change in the future.
  sampler=TPESampler(n_startup_trials=tpe_trails, multivariate=True, group=True)
[I 2026-06-25 00:37:45,986] A new study created in RDB with name: snn_eegnet_v3_200_20
[I 2026-06-25 02:26:29,064] Trial 0 finished with value: 0.41165123456790126 and parameters: {'FLOW': 4.33888648536778, 'FHIGH': 79.46686582908733, 'LR_EXP': -3.8026175466297905, 'DROPOUT': 0.522970886827774, 'BETA': 0.7266007884584733, 'SPIKE_GRAD_SLOPE': 52.557414327126665, 'TEMPORAL_FILTERS': 29, 'DEPTH_MULTIPLIER': 3, 'POINTWISE_FILTERS': 10, 'TEMPORAL_KERNEL_DIV': 4, 'SEPARABLE_KERNEL_SIZE': 30, 'POOL1_SIZE': 2, 'POOL2_SIZE': 5, 'N_STEPS_TRAIN': 6, 'N_STEPS_EVAL': 14, 'READOUT_MODE': 'spk_last'}. Best is trial 0 with value: 0.41165123456790126.
[I 2026-06-25 03:38:17,444] Trial 1 finished with value: 0.4434799382716049 and parameters: {'FLOW': 2.5661665601658443, 'FHIGH': 111.95871313413983, 'LR_EXP': -3.8106511963380396, 'DROPOUT': 0.11457167412933789, 'BETA': 0.6396454423626327, 'SPIKE_GRAD_SLOPE': 3.4409905005593915, 'TEMPORAL_FILTERS': 6, 'DEPTH_MULTIPLIER': 3, 'POINTWISE_FILTERS': 48, 'TEMPORAL_KERNEL_DIV': 6, 'SEPARABLE_KERNEL_SIZE': 29, 'POOL1_SIZE': 2, 'POOL2_SIZE': 8, 'N_STEPS_TRAIN': 10, 'N_STEPS_EVAL': 13, 'READOUT_MODE': 'mem_last'}. Best is trial 1 with value: 0.4434799382716049.
[I 2026-06-25 05:34:54,606] Trial 2 finished with value: 0.40991512345679015 and parameters: {'FLOW': 4.230536396478805, 'FHIGH': 89.64773582861243, 'LR_EXP': -3.023411021680051, 'DROPOUT': 0.14059963014355195, 'BETA': 0.9742909466403237, 'SPIKE_GRAD_SLOPE': 4.9224549245581235, 'TEMPORAL_FILTERS': 19, 'DEPTH_MULTIPLIER': 4, 'POINTWISE_FILTERS': 24, 'TEMPORAL_KERNEL_DIV': 7, 'SEPARABLE_KERNEL_SIZE': 11, 'POOL1_SIZE': 7, 'POOL2_SIZE': 7, 'N_STEPS_TRAIN': 9, 'N_STEPS_EVAL': 13, 'READOUT_MODE': 'spk_mean'}. Best is trial 1 with value: 0.4434799382716049.
[I 2026-06-25 06:15:28,038] Trial 3 finished with value: 0.4064429012345679 and parameters: {'FLOW': 4.707862992863212, 'FHIGH': 41.33011875611366, 'LR_EXP': -2.1699817146942877, 'DROPOUT': 0.44504000576525315, 'BETA': 0.6719815152143229, 'SPIKE_GRAD_SLOPE': 31.80337483263386, 'TEMPORAL_FILTERS': 11, 'DEPTH_MULTIPLIER': 4, 'POINTWISE_FILTERS': 40, 'TEMPORAL_KERNEL_DIV': 8, 'SEPARABLE_KERNEL_SIZE': 26, 'POOL1_SIZE': 6, 'POOL2_SIZE': 7, 'N_STEPS_TRAIN': 4, 'N_STEPS_EVAL': 14, 'READOUT_MODE': 'mem_last'}. Best is trial 1 with value: 0.4434799382716049.
[I 2026-06-25 07:50:44,714] Trial 4 finished with value: 0.4774305555555556 and parameters: {'FLOW': 2.4735644741688634, 'FHIGH': 77.61183990786581, 'LR_EXP': -2.7941287526052805, 'DROPOUT': 0.3644742854601941, 'BETA': 0.9276153147796563, 'SPIKE_GRAD_SLOPE': 11.53170045972808, 'TEMPORAL_FILTERS': 30, 'DEPTH_MULTIPLIER': 1, 'POINTWISE_FILTERS': 25, 'TEMPORAL_KERNEL_DIV': 8, 'SEPARABLE_KERNEL_SIZE': 19, 'POOL1_SIZE': 6, 'POOL2_SIZE': 4, 'N_STEPS_TRAIN': 7, 'N_STEPS_EVAL': 28, 'READOUT_MODE': 'spk_mean'}. Best is trial 4 with value: 0.4774305555555556.
[I 2026-06-25 11:19:51,267] Trial 5 finished with value: 0.41358024691358025 and parameters: {'FLOW': 2.069856433827971, 'FHIGH': 75.27512692227936, 'LR_EXP': -3.6450158816487384, 'DROPOUT': 0.6366220620331282, 'BETA': 0.700974462269877, 'SPIKE_GRAD_SLOPE': 20.878748528196713, 'TEMPORAL_FILTERS': 21, 'DEPTH_MULTIPLIER': 2, 'POINTWISE_FILTERS': 22, 'TEMPORAL_KERNEL_DIV': 3, 'SEPARABLE_KERNEL_SIZE': 30, 'POOL1_SIZE': 7, 'POOL2_SIZE': 7, 'N_STEPS_TRAIN': 15, 'N_STEPS_EVAL': 10, 'READOUT_MODE': 'mem_last'}. Best is trial 4 with value: 0.4774305555555556.
[I 2026-06-25 13:51:43,145] Trial 6 finished with value: 0.4677854938271605 and parameters: {'FLOW': 1.6701603635924558, 'FHIGH': 67.3475908494515, 'LR_EXP': -2.4845736698673555, 'DROPOUT': 0.6884604621470769, 'BETA': 0.9479947395734827, 'SPIKE_GRAD_SLOPE': 20.29950054589022, 'TEMPORAL_FILTERS': 28, 'DEPTH_MULTIPLIER': 4, 'POINTWISE_FILTERS': 18, 'TEMPORAL_KERNEL_DIV': 8, 'SEPARABLE_KERNEL_SIZE': 14, 'POOL1_SIZE': 6, 'POOL2_SIZE': 5, 'N_STEPS_TRAIN': 9, 'N_STEPS_EVAL': 13, 'READOUT_MODE': 'spk_sum'}. Best is trial 4 with value: 0.4774305555555556.
[I 2026-06-25 16:23:31,412] Trial 8 finished with value: 0.3107638888888889 and parameters: {'FLOW': 1.3930266113759897, 'FHIGH': 10.001778405130498, 'LR_EXP': -4.438767257155038, 'DROPOUT': 0.4584355900227082, 'BETA': 0.8890315223793366, 'SPIKE_GRAD_SLOPE': 33.785691212851255, 'TEMPORAL_FILTERS': 15, 'DEPTH_MULTIPLIER': 2, 'POINTWISE_FILTERS': 9, 'TEMPORAL_KERNEL_DIV': 6, 'SEPARABLE_KERNEL_SIZE': 12, 'POOL1_SIZE': 3, 'POOL2_SIZE': 7, 'N_STEPS_TRAIN': 16, 'N_STEPS_EVAL': 25, 'READOUT_MODE': 'mem_last'}. Best is trial 4 with value: 0.4774305555555556.
[I 2026-06-25 19:00:01,200] Trial 10 finished with value: 0.4349922839506173 and parameters: {'FLOW': 4.310253887876284, 'FHIGH': 107.12890967444378, 'LR_EXP': -2.7693399560866663, 'DROPOUT': 0.22528400492027895, 'BETA': 0.9417246689519811, 'SPIKE_GRAD_SLOPE': 32.327566713855234, 'TEMPORAL_FILTERS': 24, 'DEPTH_MULTIPLIER': 3, 'POINTWISE_FILTERS': 28, 'TEMPORAL_KERNEL_DIV': 6, 'SEPARABLE_KERNEL_SIZE': 21, 'POOL1_SIZE': 6, 'POOL2_SIZE': 2, 'N_STEPS_TRAIN': 11, 'N_STEPS_EVAL': 18, 'READOUT_MODE': 'spk_mean'}. Best is trial 4 with value: 0.4774305555555556.
[I 2026-06-25 21:47:00,231] Trial 12 finished with value: 0.34934413580246915 and parameters: {'FLOW': 2.895463026519025, 'FHIGH': 93.16944701663778, 'LR_EXP': -4.318566733208252, 'DROPOUT': 0.37777913870335933, 'BETA': 0.5235192921806072, 'SPIKE_GRAD_SLOPE': 52.930910140373285, 'TEMPORAL_FILTERS': 23, 'DEPTH_MULTIPLIER': 1, 'POINTWISE_FILTERS': 39, 'TEMPORAL_KERNEL_DIV': 7, 'SEPARABLE_KERNEL_SIZE': 18, 'POOL1_SIZE': 8, 'POOL2_SIZE': 7, 'N_STEPS_TRAIN': 16, 'N_STEPS_EVAL': 26, 'READOUT_MODE': 'spk_mean'}. Best is trial 11 with value: 0.4870756172839506.
[I 2026-06-25 22:19:44,763] Trial 14 finished with value: 0.4041280864197531 and parameters: {'FLOW': 2.5835763714507776, 'FHIGH': 41.00950933021567, 'LR_EXP': -2.669487121020114, 'DROPOUT': 0.17837454494799213, 'BETA': 0.9248186972134449, 'SPIKE_GRAD_SLOPE': 14.544341693956905, 'TEMPORAL_FILTERS': 7, 'DEPTH_MULTIPLIER': 3, 'POINTWISE_FILTERS': 44, 'TEMPORAL_KERNEL_DIV': 6, 'SEPARABLE_KERNEL_SIZE': 28, 'POOL1_SIZE': 5, 'POOL2_SIZE': 6, 'N_STEPS_TRAIN': 4, 'N_STEPS_EVAL': 12, 'READOUT_MODE': 'mem_last'}. Best is trial 11 with value: 0.4870756172839506.
[W 2026-06-25 22:19:52,268] Trial 16 failed with parameters: {'FLOW': 1.7604028934782217, 'FHIGH': 108.2591627546415, 'LR_EXP': -3.768722206606646, 'DROPOUT': 0.7134112918514629, 'BETA': 0.5492455667853331, 'SPIKE_GRAD_SLOPE': 3.799274750226961, 'TEMPORAL_FILTERS': 24, 'DEPTH_MULTIPLIER': 4, 'POINTWISE_FILTERS': 34, 'TEMPORAL_KERNEL_DIV': 4, 'SEPARABLE_KERNEL_SIZE': 9, 'POOL1_SIZE': 3, 'POOL2_SIZE': 3, 'N_STEPS_TRAIN': 16, 'N_STEPS_EVAL': 12, 'READOUT_MODE': 'spk_mean'} because of the following error: OutOfMemoryError('CUDA out of memory. Tried to allocate 66.00 MiB. GPU 0 has a total capacity of 15.77 GiB of which 62.19 MiB is free. Including non-PyTorch memory, this process has 15.70 GiB memory in use. Of the allocated memory 14.99 GiB is allocated by PyTorch, and 339.80 MiB is reserved by PyTorch but unallocated. If reserved but unallocated memory is large try setting PYTORCH_CUDA_ALLOC_CONF=expandable_segments:True to avoid fragmentation.  See documentation for Memory Management  (https://pytorch.org/docs/stable/notes/cuda.html#environment-variables)').
Traceback (most recent call last):
  File "/home/aleksander.berezowsk/venv/lib/python3.12/site-packages/optuna/study/_optimize.py", line 206, in _run_trial
    value_or_values = func(trial)
                      ^^^^^^^^^^^
  File "/home/aleksander.berezowsk/spiking-eegnet/src/main.py", line 52, in objective
    return pipeline(**params, **FIXED, trial=trial, save_plots=False)
           ^^^^^^^^^^^^^^^^^^^^^^^^^^^^^^^^^^^^^^^^^^^^^^^^^^^^^^^^^^
  File "/home/aleksander.berezowsk/spiking-eegnet/src/pipeline.py", line 143, in pipeline
    histories, accs, mean_acc = experiment_loso_all(
                                ^^^^^^^^^^^^^^^^^^^^
  File "/home/aleksander.berezowsk/spiking-eegnet/src/experiment_loso.py", line 71, in experiment_loso_all
    history, final_acc, _model = experiment_loso(
                                 ^^^^^^^^^^^^^^^^
  File "/home/aleksander.berezowsk/spiking-eegnet/src/experiment_loso.py", line 30, in experiment_loso
    history = run_training(
              ^^^^^^^^^^^^^
  File "/home/aleksander.berezowsk/spiking-eegnet/src/run_training.py", line 50, in run_training
    loss = train_one_epoch(model, train_loader, optimizer, criterion, device,
           ^^^^^^^^^^^^^^^^^^^^^^^^^^^^^^^^^^^^^^^^^^^^^^^^^^^^^^^^^^^^^^^^^^
  File "/home/aleksander.berezowsk/spiking-eegnet/src/train_one_epoch.py", line 53, in train_one_epoch
    spk, mem = model(xb, num_steps=n_steps)
               ^^^^^^^^^^^^^^^^^^^^^^^^^^^^
  File "/home/aleksander.berezowsk/venv/lib/python3.12/site-packages/torch/nn/modules/module.py", line 1553, in _wrapped_call_impl
    return self._call_impl(*args, **kwargs)
           ^^^^^^^^^^^^^^^^^^^^^^^^^^^^^^^^
  File "/home/aleksander.berezowsk/venv/lib/python3.12/site-packages/torch/nn/modules/module.py", line 1562, in _call_impl
    return forward_call(*args, **kwargs)
           ^^^^^^^^^^^^^^^^^^^^^^^^^^^^^
  File "/home/aleksander.berezowsk/spiking-eegnet/src/spiking_eegnet.py", line 233, in forward
    spk1, mem1 = self.lif1(cur, mem1)
                 ^^^^^^^^^^^^^^^^^^^^
  File "/home/aleksander.berezowsk/venv/lib/python3.12/site-packages/torch/nn/modules/module.py", line 1553, in _wrapped_call_impl
    return self._call_impl(*args, **kwargs)
           ^^^^^^^^^^^^^^^^^^^^^^^^^^^^^^^^
  File "/home/aleksander.berezowsk/venv/lib/python3.12/site-packages/torch/nn/modules/module.py", line 1562, in _call_impl
    return forward_call(*args, **kwargs)
           ^^^^^^^^^^^^^^^^^^^^^^^^^^^^^
  File "/home/aleksander.berezowsk/venv/lib/python3.12/site-packages/snntorch/_neurons/leaky.py", line 209, in forward
    self.reset = self.mem_reset(self.mem)
                 ^^^^^^^^^^^^^^^^^^^^^^^^
  File "/home/aleksander.berezowsk/venv/lib/python3.12/site-packages/snntorch/_neurons/neurons.py", line 106, in mem_reset
    reset = self.spike_grad(mem_shift).clone().detach()
            ^^^^^^^^^^^^^^^^^^^^^^^^^^^^^^^^^^
torch.OutOfMemoryError: CUDA out of memory. Tried to allocate 66.00 MiB. GPU 0 has a total capacity of 15.77 GiB of which 62.19 MiB is free. Including non-PyTorch memory, this process has 15.70 GiB memory in use. Of the allocated memory 14.99 GiB is allocated by PyTorch, and 339.80 MiB is reserved by PyTorch but unallocated. If reserved but unallocated memory is large try setting PYTORCH_CUDA_ALLOC_CONF=expandable_segments:True to avoid fragmentation.  See documentation for Memory Management  (https://pytorch.org/docs/stable/notes/cuda.html#environment-variables)
[W 2026-06-25 22:19:52,369] Trial 16 failed with value None.
Traceback (most recent call last):
  File "/home/aleksander.berezowsk/spiking-eegnet/src/main.py", line 103, in <module>
    study.optimize(objective, n_trials=n_trials, n_jobs=1,
  File "/home/aleksander.berezowsk/venv/lib/python3.12/site-packages/optuna/study/study.py", line 516, in optimize
    _optimize(
  File "/home/aleksander.berezowsk/venv/lib/python3.12/site-packages/optuna/study/_optimize.py", line 68, in _optimize
    _optimize_sequential(
  File "/home/aleksander.berezowsk/venv/lib/python3.12/site-packages/optuna/study/_optimize.py", line 165, in _optimize_sequential
    frozen_trial_id = _run_trial(study, func, catch)
                      ^^^^^^^^^^^^^^^^^^^^^^^^^^^^^^
  File "/home/aleksander.berezowsk/venv/lib/python3.12/site-packages/optuna/study/_optimize.py", line 263, in _run_trial
    raise func_err
  File "/home/aleksander.berezowsk/venv/lib/python3.12/site-packages/optuna/study/_optimize.py", line 206, in _run_trial
    value_or_values = func(trial)
                      ^^^^^^^^^^^
  File "/home/aleksander.berezowsk/spiking-eegnet/src/main.py", line 52, in objective
    return pipeline(**params, **FIXED, trial=trial, save_plots=False)
           ^^^^^^^^^^^^^^^^^^^^^^^^^^^^^^^^^^^^^^^^^^^^^^^^^^^^^^^^^^
  File "/home/aleksander.berezowsk/spiking-eegnet/src/pipeline.py", line 143, in pipeline
    histories, accs, mean_acc = experiment_loso_all(
                                ^^^^^^^^^^^^^^^^^^^^
  File "/home/aleksander.berezowsk/spiking-eegnet/src/experiment_loso.py", line 71, in experiment_loso_all
    history, final_acc, _model = experiment_loso(
                                 ^^^^^^^^^^^^^^^^
  File "/home/aleksander.berezowsk/spiking-eegnet/src/experiment_loso.py", line 30, in experiment_loso
    history = run_training(
              ^^^^^^^^^^^^^
  File "/home/aleksander.berezowsk/spiking-eegnet/src/run_training.py", line 50, in run_training
    loss = train_one_epoch(model, train_loader, optimizer, criterion, device,
           ^^^^^^^^^^^^^^^^^^^^^^^^^^^^^^^^^^^^^^^^^^^^^^^^^^^^^^^^^^^^^^^^^^
  File "/home/aleksander.berezowsk/spiking-eegnet/src/train_one_epoch.py", line 53, in train_one_epoch
    spk, mem = model(xb, num_steps=n_steps)
               ^^^^^^^^^^^^^^^^^^^^^^^^^^^^
  File "/home/aleksander.berezowsk/venv/lib/python3.12/site-packages/torch/nn/modules/module.py", line 1553, in _wrapped_call_impl
    return self._call_impl(*args, **kwargs)
           ^^^^^^^^^^^^^^^^^^^^^^^^^^^^^^^^
  File "/home/aleksander.berezowsk/venv/lib/python3.12/site-packages/torch/nn/modules/module.py", line 1562, in _call_impl
    return forward_call(*args, **kwargs)
           ^^^^^^^^^^^^^^^^^^^^^^^^^^^^^
  File "/home/aleksander.berezowsk/spiking-eegnet/src/spiking_eegnet.py", line 233, in forward
    spk1, mem1 = self.lif1(cur, mem1)
                 ^^^^^^^^^^^^^^^^^^^^
  File "/home/aleksander.berezowsk/venv/lib/python3.12/site-packages/torch/nn/modules/module.py", line 1553, in _wrapped_call_impl
    return self._call_impl(*args, **kwargs)
           ^^^^^^^^^^^^^^^^^^^^^^^^^^^^^^^^
  File "/home/aleksander.berezowsk/venv/lib/python3.12/site-packages/torch/nn/modules/module.py", line 1562, in _call_impl
    return forward_call(*args, **kwargs)
           ^^^^^^^^^^^^^^^^^^^^^^^^^^^^^
  File "/home/aleksander.berezowsk/venv/lib/python3.12/site-packages/snntorch/_neurons/leaky.py", line 209, in forward
    self.reset = self.mem_reset(self.mem)
                 ^^^^^^^^^^^^^^^^^^^^^^^^
  File "/home/aleksander.berezowsk/venv/lib/python3.12/site-packages/snntorch/_neurons/neurons.py", line 106, in mem_reset
    reset = self.spike_grad(mem_shift).clone().detach()
            ^^^^^^^^^^^^^^^^^^^^^^^^^^^^^^^^^^
torch.OutOfMemoryError: CUDA out of memory. Tried to allocate 66.00 MiB. GPU 0 has a total capacity of 15.77 GiB of which 62.19 MiB is free. Including non-PyTorch memory, this process has 15.70 GiB memory in use. Of the allocated memory 14.99 GiB is allocated by PyTorch, and 339.80 MiB is reserved by PyTorch but unallocated. If reserved but unallocated memory is large try setting PYTORCH_CUDA_ALLOC_CONF=expandable_segments:True to avoid fragmentation.  See documentation for Memory Management  (https://pytorch.org/docs/stable/notes/cuda.html#environment-variables)
